Date,author,content,number_of_likes,number_of_shares,sentiment_score,heuristic_score
2015-06-24,BarackObama,"Aloha, Oahu: http://t.co/nLJEkK3ohA http://t.co/ULswTs3tnZ",1162,370,0.0,0.0
2015-06-24,BarackObama,More Americans don't have to worry about medical bills breaking the bank—thanks to #Obamacare. http://t.co/JCBYV4DV7N,1564,582,0.3412,0.3412
2015-06-24,BarackObama,Repealing #Obamacare: still a bad idea. http://t.co/xV5QdL22nZ,2268,1354,-0.5423,-0.5423
2015-06-24,BarackObama,Hawaii is leading the way on some of the most important issues. Enter for the chance to see that progress firsthand: http://t.co/BR2MLmGfvG,1170,427,0.7089,0.7089
2015-06-25,BarackObama,Tune in to hear the President give a statement about today's #Obamacare ruling at 11:30 a.m. ET: http://t.co/PM30Wg8UsX,906,411,0.0,0.0
2015-06-25,BarackObama,LIVE: President Obama is speaking about today's #Obamacare ruling. http://t.co/SyXOeus6Ws,973,367,0.0,0.0
2015-06-25,BarackObama,"""In America, health care is not a privilege for the few but a right for all."" —President Obama",3192,2059,0.1393,0.1393
2015-06-25,BarackObama,"""When the dust has settled, there can be no doubt that this law is working."" —President Obama #ACAWorks",1417,620,-0.5719,-0.5719
2015-06-25,BarackObama,"""The Affordable Care Act is here to stay."" —President Obama #ACAWorks",2388,1278,0.4939,0.4939
2015-06-25,BarackObama,"""America would have gone backwards. That's not what we do. We move forward."" —President Obama",1767,804,0.0,0.0
2015-06-25,BarackObama,"""As the law's provisions have gradually taken effect, more than 16 million Americans have gained coverage so far."" —President Obama",1121,446,0.3818,0.3818
2015-06-25,BarackObama,"""This is not a set of political talking points. This is reality. This law is working."" —President Obama #ACAWorks",1275,537,0.0,0.0
2015-06-25,BarackObama,"""This law is now helping tens of millions of Americans."" —President Obama #ACAWorks",1226,446,0.29600000000000004,0.29600000000000004
2015-06-25,BarackObama,"""Five years in, this is no longer about a law ... This is health care in America."" —President Obama #ACAworks",1635,688,0.25,0.25
2015-06-25,BarackObama,"""Across the country, there are people who are directly benefiting from the law and don't even know it."" —President Obama",1456,599,0.0,0.0
2015-06-25,BarackObama,"""This reform remains what it's always been: a set of fair rules and tougher protections."" —President Obama #ACAWorks",1104,388,0.4588,0.4588
2015-06-25,BarackObama,"""With this case behind us, let's be clear: We've got more work to do."" —President Obama #ACAWorks",1254,460,0.3818,0.3818
2015-06-25,BarackObama,"""We're making progress. We're going to keep working to get more people covered."" —President Obama #ACAWorks",1359,455,0.4215,0.4215
2015-06-25,BarackObama,"""What we're not going to do is unravel what we've woven into the fabric of America."" —President Obama #ACAWorks",1307,476,0.0,0.0
2015-06-25,BarackObama,"""That's when America soars—when we look out for one another."" —President Obama #ACAWorks",1933,814,0.0,0.0
2015-06-25,BarackObama,"""This was a good day for America. Let's get back to work."" —President Obama #ACAWorks",3511,1463,0.4404,0.4404
2015-06-25,BarackObama,"Affordable health care is a right for all, not a privilege for a few. http://t.co/OjCC8OD6g1",5272,2685,0.2709,0.2709
2015-06-26,BarackObama,LIVE: President Obama is speaking on today's historical decision on marriage equality. http://t.co/BlWUaqluOD #LoveWins,6612,3737,0.0,0.0
2015-06-26,BarackObama,"""We are all created equal."" —President Obama #LoveWins",52818,49597,0.25,0.25
2015-06-26,BarackObama,"""This morning the Supreme Court recognized the Constitution guarantees marriage equality."" —President Obama #LoveWins",17781,14548,0.5574,0.5574
2015-06-26,BarackObama,"""All people should be treated equally, regardless of who they are or who they love."" —President Obama #LoveWins",72298,73315,0.0,0.0
2015-06-26,BarackObama,"""This ruling is a victory for America."" —President Obama #LoveWins",17203,12249,0.0,0.0
2015-06-26,BarackObama,"""When all Americans are treated as equal, we are all more free."" —President Obama #LoveWins",70085,58853,0.0,0.0
2015-06-26,BarackObama,"""For all our differences, we are one people—stronger together than we could ever be alone."" —President Obama #LoveWins",17717,14491,0.0,0.0
2015-06-26,BarackObama,"""America is a place where you can write your own destiny."" —President Obama #LoveWins",21667,17955,0.0,0.0
2015-06-26,BarackObama,"""Today we can say in no uncertain terms that we've made our union a little more perfect."" —President Obama #LoveWins",34589,28111,-0.5267,-0.5267
2015-06-26,BarackObama,"""What a vindication of the belief that ordinary people can do extraordinary things."" —President Obama #LoveWins",13977,9647,0.0,0.0
2015-06-26,BarackObama,"""Those countless, often anonymous heroes—they deserve our thanks."" —President Obama #LoveWins",14162,8819,0.0,0.0
2015-06-26,BarackObama,"""America should be very proud."" —President Obama #LoveWins",33883,26081,0.0,0.0
2015-06-26,BarackObama,"This ruling is a victory for friends, families, and organizers who fought tirelessly for years for marriage equality. #LoveWins",37198,31130,0.2023,0.2023
2015-06-26,BarackObama,Retweet to spread the word. #LoveWins http://t.co/JJ5iCP4ZWn,148581,200747,0.0,0.0
2015-06-26,BarackObama,History. #LoveWins http://t.co/5B3C2pBEXA,33395,25680,0.0,0.0
2015-06-26,BarackObama,Watch the President's full statement on the Supreme Court's ruling on marriage equality. #LoveWins http://t.co/nRBI49pQT5,61852,44081,0.5574,0.5574
2015-06-26,BarackObama,LIVE: President Obama is speaking in Charleston honoring the life of Reverend Clementa Pinckney. http://t.co/nTe0jAzOld,3819,1558,0.5106,0.5106
2015-06-26,BarackObama,"In the weekly address, the President reaffirms how the Supreme Court ruling on #Obamacare is a victory for America: http://t.co/7YSXvqG6VC",2102,703,0.5574,0.5574
2015-06-26,BarackObama,"""The Affordable Care Act still stands. It is working, and it is here to stay."" —President Obama http://t.co/cx3VHdpaf1 #ACAWorks",2700,879,0.4939,0.4939
2015-06-26,BarackObama,"Two years ago today, the Senate passed a bill to fix our broken immigration system with a bipartisan majority. #ImmigrationAction",2392,824,-0.4767,-0.4767
2015-06-26,BarackObama,The bill would have put millions of people on a path to citizenship and grown the economy by a cumulative $1.2 trillion. #ImmigrationAction,3051,1310,0.0,0.0
2015-06-26,BarackObama,"Over the past two years, the House’s failure to take #ImmigrationAction has cost the country $26.8 billion.",3009,1552,-0.5106,-0.5106
2015-06-26,BarackObama,"The President is acting where he can, but we need Congress to pass a comprehensive solution to fix our broken system. #ImmigrationAction",3512,1464,0.0772,0.0772
2015-06-26,BarackObama,You could be organizing in paradise: http://t.co/eGdh54dKvD http://t.co/02a29XTEbT,1910,589,0.6369,0.6369
2015-06-26,BarackObama,Better hurry—the deadline to chip in is right around the corner: http://t.co/F464WKR1jH http://t.co/261B8rX8ks,4582,1114,0.4404,0.4404
2015-06-26,BarackObama,Sign up for your chance to see firsthand how organizing is making a difference in Hawaii: http://t.co/LWqT05mUn6 http://t.co/MuoyB9HgMy,1143,384,0.25,0.25
2015-06-29,BarackObama,"""For too long, we’ve been blind to the unique mayhem that gun violence inflicts upon this nation."" —President Obama",5353,2380,-0.8481,-0.8481
2015-06-29,BarackObama,Add your name if you agree that it's time to stand up and do something about gun violence in America: http://t.co/SasWr4rQ7K,5663,2731,-0.6124,-0.6124
2015-06-29,BarackObama,Organizing in paradise—the only thing missing is you: http://t.co/lK2k5bvys4 http://t.co/jI3VtkNiJR,1121,376,-0.29600000000000004,-0.29600000000000004
2015-06-29,BarackObama,Chip in—the deadline is quickly approaching: http://t.co/DwqB9iMdD7 http://t.co/o8FyZYYo5s,1773,514,0.0,0.0
2015-06-29,BarackObama,You've never seen greens like this. Enter now for your chance to win a trip to Hawaii: http://t.co/5xu1velsHQ http://t.co/yTD0j0UplR,1790,579,0.5705,0.5705
2015-06-29,BarackObama,Help break the silence on gun violence in America. Join the fight for common-sense reform: http://t.co/4CZJQzPkVE,2633,1364,-0.6369,-0.6369
2015-06-30,BarackObama,Don't miss your shot to chip in before tonight's deadline: http://t.co/UpRlqXpAvA http://t.co/8BhUWA0apv,2083,632,0.1139,0.1139
2015-06-30,BarackObama,"""Too many Americans are working long days for less pay than they deserve."" —President Obama on overtime pay http://t.co/Y4yThJ1K2g",2509,1259,-0.0552,-0.0552
2015-06-30,BarackObama,TONIGHT: Don't miss your chance to see Hawaii. Enter before the deadline. http://t.co/rBwNcVI05c http://t.co/B2SF6XLc4g,1081,367,-0.0762,-0.0762
2015-06-30,BarackObama,BUZZER BEATER: There's not a lot of time left on the clock. Chip in $5 now. http://t.co/glkmuDAMmY http://t.co/u4zDyut8li,2023,850,0.0,0.0
2015-06-30,BarackObama,Say you'll keep up the fight—show your support and chip in before midnight: http://t.co/ETrnnXfVwF http://t.co/YChVFtnzib,6312,1849,0.4019,0.4019
2015-06-30,BarackObama,LAST CALL: Enter for your chance to fly to Hawaii and relax in paradise. http://t.co/PFoMloBIeE http://t.co/cgmVDjMdfe,1122,403,0.8442,0.8442
2015-07-01,BarackObama,Having health care is a big deal. Check out your options today: http://t.co/AWge8ONMEc #GetCovered,872,388,0.4939,0.4939
2015-07-01,BarackObama,Tune in at 3:45 p.m. ET to watch President Obama speak from Michigan about the resurgent American auto industry: http://t.co/pulmupK8pw,716,334,0.0,0.0
2015-07-01,BarackObama,LIVE: The President is speaking about his decision to save the American auto industry and over 1 million jobs. http://t.co/w9DcbxkqM4,864,414,0.4939,0.4939
2015-07-01,BarackObama,"""Detroit always comes back."" —President Obama",7598,7490,0.0,0.0
2015-07-01,BarackObama,"""Last year was the strongest year for job growth since the 1990s."" —President Obama #MadeInAmerica",1553,896,0.6705,0.6705
2015-07-01,BarackObama,"""We've now had a 57-month streak of private-sector job creation."" —President Obama #MadeInAmerica",1157,667,0.0,0.0
2015-07-01,BarackObama,"""America's resurgence is real. Don't let anybody tell you otherwise."" —President Obama #MadeInAmerica",1126,659,0.0,0.0
2015-07-01,BarackObama,"""We can help every American get the education they need to get ahead in this country."" —President Obama",1548,799,0.4019,0.4019
2015-07-01,BarackObama,"""No matter how tough times get, Americans are tougher."" —President Obama #MadeInAmerica",1730,954,-0.3818,-0.3818
2015-07-01,BarackObama,"""Saving the American auto industry was the right thing to do."" —President Obama #MadeInAmerica",1360,630,0.0,0.0
2015-07-01,BarackObama,"""We may not all be rooting for the Lions, but America is rooting for Detroit."" —President Obama",4695,3539,0.0,0.0
2015-07-01,BarackObama,"""America's coming back. And I'm going to be on your side every step of the way."" —President Obama #MadeInAmerica",2308,1098,0.0,0.0
2015-07-01,BarackObama,Great news: The uninsured rate in the U.S. has dropped to 12.9 percent. http://t.co/NN9hlDz4lU #Obamacare,1909,1179,0.6249,0.6249
2015-07-02,BarackObama,"Watch: In the weekly address, President Obama highlights the country's economic progress. http://t.co/r7fV6DJL2p",1288,580,0.4215,0.4215
2015-07-03,BarackObama,WATCH: President Obama discusses the need to encourage the education of girls around the globe. http://t.co/vtisyocnkt #LetGirlsLearn,1908,1166,0.5106,0.5106
2015-07-03,BarackObama,"Tune in at 2:35 p.m. ET to watch President Obama speak in Selma, Alabama: http://t.co/wF2J5vKpRY #MarchOn http://t.co/COHzBaUleZ",2435,1848,0.0,0.0
2015-07-03,BarackObama,LIVE: President Obama is speaking at the Edmund Pettus Bridge on the 50th anniversary of the Selma marches. http://t.co/8JypQTMQFo #Selma50,1223,937,0.0,0.0
2015-07-03,BarackObama,"""There are places and moments in America where this nation’s destiny has been decided ... Selma is such a place."" —President Obama #MarchOn",1642,1210,0.0,0.0
2015-07-03,BarackObama,"""It was not a clash of armies, but a clash of wills; a contest to determine the true meaning of America."" —President Obama #Selma50",1276,837,0.5719,0.5719
2015-07-03,BarackObama,"""What enormous faith these men and women had—faith in God, but also faith in America."" —President Obama #Selma50",1672,1002,0.7311,0.7311
2015-07-03,BarackObama,"""They proved that nonviolent change is possible. That love and hope can conquer hate."" —President Obama #Selma50",2345,2055,0.7964,0.7964
2015-07-03,BarackObama,"""What could be more American than what happened in this place?"" —President Obama #Selma50 #MarchOn",1415,802,0.0,0.0
2015-07-03,BarackObama,"""What greater form of patriotism is there than the belief that America is not yet finished."" —President Obama #Selma50 #MarchOn",2575,1901,0.3612,0.3612
2015-07-03,BarackObama,"""That’s what this movement was all about—one leg in our long journey toward freedom."" —President Obama #Selma50 #MarchOn",1359,812,0.0,0.0
2015-07-03,BarackObama,"""Young people can draw strength from this place, where the powerless could change the world’s greatest power."" —President Obama #Selma50",2214,1967,0.6369,0.6369
2015-07-03,BarackObama,"""If Selma taught us anything, it’s that our work is never done."" —President Obama #Selma50 #MarchOn",2953,2578,0.0,0.0
2015-07-03,BarackObama,"""Selma teaches us, too, that action requires that we shed our cynicism."" —President Obama #Selma50 #MarchOn",1875,1286,0.0,0.0
2015-07-03,BarackObama,"""This is work for all Americans, and not just some. Not just whites. Not just blacks."" —President Obama #Selma50 #MarchOn",2127,1438,0.0,0.0
2015-07-03,BarackObama,"""With effort, we can roll back poverty and the roadblocks to opportunity."" —President Obama #Selma50 #MarchOn",1672,936,-0.5106,-0.5106
2015-07-03,BarackObama,"""We can make sure every person willing to work has the dignity of a job, and a fair wage, and a real voice."" —President Obama #Selma50",2431,1555,0.743,0.743
2015-07-03,BarackObama,"""We know America is what we make of it."" —President Obama #Selma50 #MarchOn",2225,1261,0.0,0.0
2015-07-03,BarackObama,"""We respect the past, but we don’t pine for the past. We don’t fear the future."" —President Obama #Selma50 #MarchOn",3054,2262,-0.5023,-0.5023
2015-07-03,BarackObama,"""What a glorious task we are given, to continually try to improve this great nation of ours."" —President Obama #Selma50 #MarchOn",2833,1799,0.9182,0.9182
2015-07-03,BarackObama,"""We honor those who walked so we could run. We must run so our children soar."" —President Obama #Selma50 #MarchOn",6615,6186,0.4939,0.4939
2015-07-03,BarackObama,The House's budget is based on trickle-down economics that have failed working families. See how it could affect you: http://t.co/2xy4ix5djd,1117,596,-0.5106,-0.5106
2015-07-03,BarackObama,Read how President Obama is working to minimize public health risks from climate change: http://t.co/BoQnDZybWS #ActOnClimate,1207,614,-0.2732,-0.2732
2015-07-03,BarackObama,Now is the time to #ActOnClimate. http://t.co/drhUfpXrZN,2435,1576,0.0,0.0
2015-07-03,BarackObama,That time President Obama didn't need an anger translator to show how much we need to #ActOnClimate: http://t.co/gI2YPGJ15B #TBT,3046,1799,0.4585,0.4585
2015-07-03,BarackObama,"Carbon pollution in the atmosphere has hit a dangerous milestone. It's time for action, not denial. http://t.co/PbTnZNaFTi #ActOnClimate",1972,1511,-0.4767,-0.4767
2015-07-03,BarackObama,Too many elected officials are still in denial about climate change. Join the team holding them accountable: http://t.co/UEGDqi8UQd,2071,1062,0.29600000000000004,0.29600000000000004
2015-07-07,BarackObama,Add your name if you think it's time to #FixOvertime protections for hard-working Americans: http://t.co/YBynYdNqwa,1478,627,0.0,0.0
2015-07-07,BarackObama,Read how the Obama administration plans to help renters and low-income homeowners gain easier access to solar energy: http://t.co/ZmVniqyeFt,1301,624,0.875,0.875
2015-07-07,BarackObama,Expanding overtime protections will improve the lives of middle-class families. Read more: http://t.co/wrzwXklnSk #FixOvertime,1394,587,0.4404,0.4404
2015-07-08,BarackObama,"The economy added 215,000 jobs in July—marking a record-breaking 65 consecutive months of private-sector job growth.",3136,1498,0.3818,0.3818
2015-07-08,BarackObama,The economy is still improving—but there's more work to do. Read more about the latest jobs report: http://t.co/0Xn8GMXLbd,1250,494,0.0,0.0
2015-07-08,BarackObama,Cleaner air is safer air. #ActOnClimate http://t.co/tC52FUN8kx,2140,1018,0.5423,0.5423
2015-07-08,BarackObama,ICYMI: Read President Obama's thoughts on the 50th anniversary of the Voting Rights Act. http://t.co/mIRART1a0O #VRA50,1538,663,0.0,0.0
2015-07-09,BarackObama,LIVE: President Obama is speaking at the Greater Boston Labor Council #LaborDay Breakfast. http://t.co/a1JvqHrazW,1066,398,0.3612,0.3612
2015-07-09,BarackObama,"Today President Obama is expanding access to paid sick leave for about 300,000 federal workers. http://t.co/SMDmrDJElJ #LeadOnLeave",2596,1034,-0.5423,-0.5423
2015-07-09,BarackObama,"Today, America celebrates the grit and resilience of working families. Happy #LaborDay. http://t.co/WUEQreifAe",4355,1738,0.8126,0.8126
2015-07-10,BarackObama,An @OFA volunteer reflects on the trainings she received—that helped her land her dream job. http://t.co/YABvrFllkR,632,228,0.25,0.25
2015-07-10,BarackObama,LIVE: President Obama is speaking at the @WhiteHouse Summit on Worker Voice. http://t.co/Fnr99d1D7q,751,270,0.0,0.0
2015-07-10,BarackObama,Add your name if you agree it's time for Congress to #DoSomething about gun violence in America. http://t.co/ttnwvksW10,2892,1645,-0.6124,-0.6124
2015-07-10,BarackObama,Take a look at some of the most important recent stories on gun violence prevention: http://t.co/02cXehbVvi #DoSomething,904,471,-0.6605,-0.6605
2015-07-10,BarackObama,"""This will not change until the politics change."" —President Obama on gun violence #DoSomething http://t.co/kqz7WIShnh",3022,1676,-0.7579,-0.7579
2015-07-10,BarackObama,"In the weekly address, President Obama discusses why it's so important to #GetCovered: https://t.co/tx19WZPV6u",1084,325,0.3327,0.3327
2015-07-10,BarackObama,"""For the first time, more than 90% of Americans are covered."" —President Obama https://t.co/oEk3RYamsm #GetCovered",2912,1140,0.0,0.0
2015-07-10,BarackObama,Tune in at 8 p.m. ET to watch President Obama address the nation on keeping the American people safe: https://t.co/eYAoPgkacI,1369,595,0.4404,0.4404
2015-07-10,BarackObama,LIVE: President Obama is addressing the nation on the threat of terrorism and keeping the American people safe. https://t.co/6RzqPFT6or,2423,1258,-0.7269,-0.7269
2015-07-10,BarackObama,Congress can #DoSomething about this. https://t.co/0dhwrGu7wf,5119,2652,0.0,0.0
2015-07-10,BarackObama,Congress needs to close the No-Fly List loophole—add your name if you agree: https://t.co/FiKawWdQhQ #DoSomething,1931,722,0.3612,0.3612
2015-07-13,BarackObama,Tune in at 11:15 a.m. ET to watch the President deliver remarks at the @WhiteHouse Conference on Aging: http://t.co/gk6UKi6Nti #WHCOA,912,440,0.0,0.0
2015-07-13,BarackObama,LIVE: President Obama is speaking at the 2015 White House Conference on Aging. http://t.co/xXecgFFE51 #WHCOA,833,359,0.0,0.0
2015-07-13,BarackObama,Read the President's op-ed in @AARP on the importance of protecting Americans’ retirement savings: http://t.co/x3WUlMLiBw,844,353,0.3612,0.3612
2015-07-13,BarackObama,WATCH: Get the facts on why it's time to #FixOvertime protections for millions of workers. http://t.co/lkzOv8CrpR,995,451,0.0,0.0
2015-07-14,BarackObama,Congratulations to @NASANewHorizons on completing a three-billion-mile journey. #PlutoFlyby http://t.co/cRaz9aSe7K,9042,5272,0.5994,0.5994
2015-07-14,BarackObama,Tune in at 4:05 p.m. ET to watch President Obama deliver remarks at the @NAACP's National Convention: http://t.co/RD2DOysaor #NAACP106,725,367,0.0,0.0
2015-07-14,BarackObama,LIVE: The President is speaking about criminal justice reform at the @NAACP National Convention. http://t.co/vLXYuipYK5 #NAACP106,763,440,0.0,0.0
2015-07-14,BarackObama,"""Let's get something out of the way up front: I am not singing today."" —President Obama",1795,676,0.0,0.0
2015-07-14,BarackObama,"""I would not be here and so many others would not be here without the NAACP."" —President Obama",1131,499,0.0,0.0
2015-07-14,BarackObama,"""We made progress, but our work is not done."" —President Obama #NAACP106",1110,513,0.2263,0.2263
2015-07-14,BarackObama,"""Health care is not a privilege for the few, but a right for all of us."" —President Obama",2352,1446,0.1393,0.1393
2015-07-14,BarackObama,"""We can't be satisfied—are not satisfied—until the opportunity gap is closed for everybody in America."" —President Obama #NAACP106",1239,711,-0.3252,-0.3252
2015-07-14,BarackObama,"""There is a long history of inequity in the criminal justice system in America."" —President Obama",1421,1133,0.0,0.0
2015-07-14,BarackObama,"""In too many cases our criminal justice system becomes a pipeline from underfunded schools to overcrowded jails."" —President Obama",2103,1879,0.0,0.0
2015-07-14,BarackObama,"""The United States is home to 5 percent of the world's population, but 25 percent of the world's prisoners."" —President Obama",2067,2301,0.2263,0.2263
2015-07-14,BarackObama,"""In 1980, there were 500,000 people behind bars in America ... Today, there are 2.2 million."" —President Obama",1473,1505,0.0,0.0
2015-07-14,BarackObama,"""Our prison population has doubled in the last two decades alone."" —President Obama",1249,869,-0.5106,-0.5106
2015-07-14,BarackObama,"""If we're going to deal with this problem, and the inequities involved, we're going to have to speak honestly."" —President Obama",1326,801,-0.48100000000000004,-0.48100000000000004
2015-07-14,BarackObama,"""Over the last few decades, we've locked up more and more nonviolent drug offenders for longer than ever before."" —President Obama",1700,1545,-0.4144,-0.4144
2015-07-14,BarackObama,"""In far too many cases the punishment does not fit the crime."" —President Obama",2117,1740,-0.6497,-0.6497
2015-07-14,BarackObama,"""Every year, we spend $80 billion to keep those folks incarcerated."" —President Obama",1714,1953,0.0,0.0
2015-07-14,BarackObama,"""For $80 billion we could double the salary of every high school teacher in America."" —President Obama",3300,2783,0.0,0.0
2015-07-14,BarackObama,"""Roughly one-third of the Justice Department's budget now goes toward incarceration."" —President Obama",1191,1050,0.5267,0.5267
2015-07-14,BarackObama,"""African Americans and Latinos make up 30 percent of our population. They make up 60 percent of our inmates."" —President Obama",2761,3362,0.0,0.0
2015-07-14,BarackObama,"""A growing body of research shows that people of color are more likely to be frisked, stopped, questioned, detained."" —President Obama",2192,2123,-0.1531,-0.1531
2015-07-14,BarackObama,"""African Americans are more likely to be arrested. They are more likely to be sentenced to more time for the same crime."" —President Obama",2593,2894,-0.4939,-0.4939
2015-07-14,BarackObama,"""Around one million fathers are behind bars. Around one in nine African-American kids has a parent in prison."" —President Obama",1795,1775,0.0,0.0
2015-07-14,BarackObama,"""Our nation is being robbed of men and women who could be workers and taxpayers."" —President Obama",1666,1094,0.0,0.0
2015-07-14,BarackObama,"""Our criminal justice system isn't as smart as it should be."" —President Obama",1961,1512,-0.3089,-0.3089
2015-07-14,BarackObama,"""Mass incarceration makes our country worse off—and we need to do something about it."" —President Obama",1912,1320,-0.4767,-0.4767
2015-07-14,BarackObama,"""This is a cause that is bringing people in both houses of Congress together."" —President Obama",844,374,0.0,0.0
2015-07-14,BarackObama,"""For the first time in 40 years, America's crime rate and incarceration rate went down at the same time."" —President Obama",1743,978,-0.5423,-0.5423
2015-07-14,BarackObama,"""I believe crime is like any other epidemic—we need to stop it before it starts."" —President Obama",1777,1015,-0.4939,-0.4939
2015-07-14,BarackObama,"""If we make investments early in our children, we will reduce the need to incarcerate those kids."" —President Obama",2421,1976,0.0,0.0
2015-07-14,BarackObama,"""One study found that for every dollar we invest in Pre-K, we save at least twice that in reduced crime."" —President Obama",2462,1726,0.4939,0.4939
2015-07-14,BarackObama,"""We recognize that every child deserves opportunity. Not just some. Not just our own."" —President Obama",2300,1548,0.4215,0.4215
2015-07-14,BarackObama,"""What doesn't make sense is treating entire neighborhoods as danger zones."" —President Obama",2015,1295,-0.5267,-0.5267
2015-07-14,BarackObama,"""We gotta make sure boys and girls in those communities are loved and cherished and nurtured and invested in."" —President Obama",1912,1045,0.9081,0.9081
2015-07-14,BarackObama,"""We have to restore trust between our police and some of the communities where they serve."" —President Obama",1733,943,0.6705,0.6705
2015-07-14,BarackObama,"""Don't just tag them as future criminals. Reach out to them as future citizens."" —President Obama",2523,1447,-0.5574,-0.5574
2015-07-14,BarackObama,"""For nonviolent drug crimes, we need to lower long mandatory minimum sentences—or get rid of them entirely."" —President Obama",4150,3030,-0.2263,-0.2263
