Date,author,content,number_of_likes,number_of_shares
2011-12-24 17:32:00,shakira,Happy Holidays! ¡Felices Fiestas! -Shakx http://t.co/1Ool5LTp,938,1411
2012-01-01 00:43:00,shakira,Que en este 2012 se realicen todos los deseos del corazon! Feliz año nuevo! Shak,832,1975
2012-01-01 06:15:00,shakira,http://t.co/1i4GAHqo - Happy New Year!,471,698
2012-01-01 06:21:00,shakira,http://t.co/RlQf5AVu - Feliz Año Nuevo!,673,1033
2012-01-03 20:26:00,shakira,I'm crazy about Skrillex! Shak http://t.co/FZ89NoVL,427,782
2012-01-05 16:28:00,shakira,Are you ready for tomorrow's #AddictedToYou video premiere? RSVP to our Facebook event now! http://t.co/vX09aln3 http://t.co/ugoYFqcQ,225,420
2012-01-05 16:29:00,shakira,"¿Están preparados para el estreno de mañana de #AddictedToYou""? Aquí podrán hacer su RESERVA  http://t.co/vX09aln3  http://t.co/ugoYFqcQ",263,539
2012-01-06 15:59:00,shakira,Gracias a Nico Tovar! Se siente Barranquilla!! Shak http://t.co/Q6rQBkKK,236,428
2012-01-07 07:52:00,shakira,"En Portugal donde estuve filmando ayer mi nuevo vídeo.
Obrigada gente! Shak",493,1003
2012-01-07 19:24:00,shakira,El partido toma lugar en el estadio de Kiev que inauguré en Diciembre pasado! Qué  ilusión y qué nevios! Shak,329,954
2012-01-07 19:27:00,shakira,Today's game takes place at the stadium in Kiev that I helped inaugurate last December! So excited and nervous all at once! Shak,336,662
2012-01-07 20:42:00,shakira,"Felicidades España! Hoy han hecho historia!!
Y a mi 3...18 títulos, 8 a tu lado. Qué orgullosa estoy de tí! Shak",2689,11418
2012-01-08 16:53:00,shakira,"""Get It Started"" http://t.co/tlCNh7xZ",250,444
2012-01-08 21:37:00,shakira,"Wondering what time the Get It Started video premiere is tomorrow
where you are? Click http://t.co/789qN83l ShakHQ http://t.co/nVVKW6NC",311,317
2012-01-08 21:39:00,shakira,"Si se están preguntando la hora del estreno de #GetItStarted mañana, este link http://t.co/789qN83l les ayudará http://t.co/nVVKW6NC SHQ",303,521
2012-01-09 00:06:00,shakira,Falcao sensacional! Una y otra vez!! Shak,558,2130
2012-01-09 23:36:00,shakira,Felicidades a los niños de @fpiesdescalzos por haber ocupado el 2o lugar en el festival de danza intercolegial.En Barranquilla se baila así!,479,926
2012-01-10 19:38:00,shakira,"Shak now has a @Pinterest page to share the things that inspire her (books, places, fashion, philanthropy etc) - http://t.co/sCyNLy6o ShakHQ",168,240
2012-01-10 19:45:00,shakira,Sabían que Shak tiene una página en @Pinterest en la que compartirá todas las cosas que la inspiran? http://t.co/sCyNLy6o ShakiraHQ,260,389
2012-01-12 23:44:00,shakira,... Pero cuántas alegrías más me vas a dar? Shak http://t.co/0yuqMBth,1433,3031
2012-01-13 20:11:00,shakira,Check out Shakira's wonderful performance of Nothing Else Matters/Despedida Medley from the Live From Paris DVD http://t.co/RVYVa6SQ ShakHQ,217,294
2012-01-13 20:17:00,shakira,"No se pierdan la maravillosa interpretación de ""Nothing Else Matters""&""Despedida"" del último DVD de Shakira  http://t.co/RVYVa6SQ ShakiraHQ",349,584
2012-01-19 23:04:00,shakira,Another tour blooper / Otro vídeo con tomas falsas del tour http://t.co/iJSyTBlp ShakiraHQ,330,362
2012-01-23 18:56:00,shakira,Shakira & Ivete Sangalo - País Tropical (Live at Rock In Rio) http://t.co/IRHmKAib ShakiraHQ,318,620
2012-01-23 19:20:00,shakira,@PerezHilton You are the rock star!!,156,249
2012-01-28 16:45:00,shakira,Shakira becomes the first Colombian to be honored with France's Chevalier De L’Ordre des Arts et des Lettres medal! http://t.co/TiUSP8xR SHQ,211,588
2012-01-28 17:07:00,shakira,"Shakira fue condecorada hoy en Francia ""Caballero de las Artes y las Letras"". Para más información: http://t.co/F8FlJm4l   ShakiraHQ",275,637
2012-01-28 23:39:00,shakira,Merci a tous pour votre soutien et votre amour. J'aime La France!!  Shak,703,2245
2012-01-30 15:06:00,shakira,Photos of Shak at the NRJ Awards & Ordre des Arts et des Lettres in France at the weekend... http://t.co/P5CcOuLM  ShakiraHQ,229,283
2012-01-30 23:06:00,shakira,"Check out Shakira opening the NRJ Music Awards this weekend with her #1 hit single ""Je L'Aime à Mourir""  http://t.co/6UePyjUC ShakiraHQ",174,261
2012-01-30 23:07:00,shakira,"No se pierdan el vídeo de Shakira interpretando su hit ""Je L'Aime à Mourir"" en los premios NRJ http://t.co/6UePyjUC  ShakiraHQ",417,653
2012-02-01 19:27:00,shakira,"No se pierdan el vídeo de Shakira interpretando en vivo el hit de Francis Cabrel, ""Je l'aime à mourir"" http://t.co/vKWmWpnT ShakiraHQ",524,823
2012-02-03 18:06:00,shakira,Happy bday Chris Martin! Shak,254,653
2012-02-03 19:16:00,shakira,Shakira has been nominated for the 2012 Prince of Asturias Awards for her huminatarian work - http://t.co/m0epkHTN @barefootfound ShakiraHQ,202,462
2012-02-03 19:48:00,shakira,Shakira ha sido nominada al Premio Príncipe de Asturias de la Concordia por su labor humanitaria http://t.co/hmxyWNuC @fpiesdescalzos SHQ,327,640
2012-02-04 16:43:00,shakira,It costs around $100 to save a child from chronic #malnutrition. Want to learn about ways to help? http://t.co/GPml4wk3 #SahelNOW,257,725
2012-02-05 14:03:00,shakira,Here it is! Shakira's brand new #AddictedToYou video. Let us know what you think.... http://t.co/O4SQqDhc ShakiraHQ,229,686
2012-02-05 14:06:00,shakira,¡Ya está aquí! El nuevo vídeo de Shakira #AddictedToYou. Esperamos sus comentarios... http://t.co/O4SQqDhc ShakiraHQ,376,1470
2012-02-05 14:33:00,shakira,"Germany, you can watch the brand new #AddictedToYou video at http://t.co/O8d8nhNQ (everywhere else, it's at http://t.co/O4SQqDhc ) ShakiraHQ",142,316
2012-02-05 15:28:00,shakira,"Great to see #AddictedToYou trending all over the world. Press RT to
help it do the same where you are! http://t.co/O4SQqDhc
ShakiraHQ",125,595
2012-02-05 15:29:00,shakira,"Increíble ver #AddictedToYou como twitter trend. RT si nos quieres ayudar y hacer lo mismo en donde estés! http://t.co/O4SQqDhc 
ShakiraHQ",162,852
2012-02-05 16:20:00,shakira,"Obrigada! Shak RT @ShakiraOrkut Yeees! Vamos twittar, galera! :D Addicted to You twitter trend in Brazil right now",89,200
2012-02-05 16:20:00,shakira,Muchas Gracias! Se lo digo a @AnthonyMandler Shak RT  @SandyPamanes @Shakirafansclub Wow! Hermoso video #AddictedToYou qué buena producción,84,150
2012-02-05 16:21:00,shakira,Ya no puedo dormir ni comer... Shak RT @luis_yanguas Por el puro placer de flotar ahora si me llevó la corriente #AddictedToYou @shakira,98,188
2012-02-05 16:22:00,shakira,Es @AnthonyMandler! Shak RT @DannEpp_¿Quién es el director? Quiero ser su fan. #AddictedToYou,86,142
2012-02-05 16:23:00,shakira,Thank you! So happy you guys are liking it! Shak RT @amy_BSR @shakira #addictedtoyou video is beautiful BELLISSIMO I love you Shakira,103,195
2012-02-05 16:24:00,shakira,Muchas gracias mi México. Shak RT  @Shakira_Mexico Tenemos que lograr un TT para #AddictedToYou... ¡@shakira se sentirá muy orgullosa,196,470
2012-02-05 16:25:00,shakira,"RT  @shakitati
http://t.co/zeDW0FNt #AddictedToYou",269,727
2012-02-06 14:08:00,shakira,:-) Shak  http://t.co/8KJWoctt,357,487
2012-02-08 12:30:00,shakira,Just 30 minutes until you can #GetItStarted... ShakHQ,156,280
2012-02-08 12:44:00,shakira,En 15 minutos... #GetItStarted ShakHQ,141,343
2012-02-08 13:00:00,shakira,"Here it is! The @Vevo premiere of the video for #GetItStarted by
@Pitbull feat Shakira!  http://t.co/O63HQ7oN ShakHQ",175,529
2012-02-08 13:01:00,shakira,Aquí lo tienen! El estreno en @VEVO del vídeo #GetItStarted de @Pitbull feat. Shakira http://t.co/O63HQ7oN ShakHQ,503,1590
2012-02-08 17:55:00,shakira,Oh! 5 more times? :) Shak RT @D.O.G  @shakira just watched the #getitstarted vid like 5 times is sickk!! I love it!! http://t.co/CbDMc9XD,114,180
2012-02-08 17:56:00,shakira,Obrigada! Shak RT @Shakira_Brasil @Shakira_Brasil é Top TT com a tag #GetItStarted http://t.co/grvsL5Br,145,194
2012-02-08 17:56:00,shakira,Gracias por su apoyo #Shakifans Shak RT @Shakirafansclub #Shakifans están esperando Get it started? http://t.co/CbDMc9XD,119,217
2012-02-08 17:57:00,shakira,"Qué lindo! Un beso! Shak RT @Guga87 Genial, esa frescura de shakira, te amo Shaki! @Shakirafansclub",94,160
2012-02-08 17:57:00,shakira,Muchas gracias y Feliz Cumpleaños! Shak RT @ClubShakSpain @shakira Por fin lo tenemos aquí! #ClubShakSpain10años http://t.co/CbDMc9XD,185,297
2012-02-08 17:57:00,shakira,Thanks for the pic! Shak RT @OMGaggia @shakira Looks great on this video http://t.co/8BQV6kEw  #GetItStarted,314,352
2012-02-11 19:24:00,shakira,A little message from Shak...  http://t.co/zImB25tU ShakiraHQ,296,390
2012-02-11 19:24:00,shakira,Un mensaje de Shakira https://t.co/jxtbRk1x ShakiraHQ,327,541
2012-02-11 21:46:00,shakira,El voto es una herramienta muy poderosa para el cambio. Latinos de EEUU=16% de la población-pueden decidir el próximo Pres de EEUU. Shak,238,609
2012-02-11 21:46:00,shakira,Voting is one of most powerful ways 2 bring change 2 the world. US Latinos=16% of US population-will decide next Pres. Make it count! Shak,197,541
2012-02-13 03:37:00,shakira,"A baboon on our car! The animal kingdom is revolutionized today! Un babuino en el carro. El mundo animal, revolucionado http://t.co/FIRkkUIY",306,424
2012-02-13 16:33:00,shakira,"""The human eye can encompass the beauty of the universe"" Leonardo Davinci http://t.co/WkXo7QYb",331,616
2012-02-13 18:07:00,shakira,"Aquí se unen el Océano Atlántico y el Océano Índico, el punto más austral de África. Shak http://t.co/tdAOGCjc",401,598
2012-02-13 21:30:00,shakira,Porqué esto es África. Shak http://t.co/rxytQjfY,453,742
2012-02-14 15:27:00,shakira,View from my hotel room. There's a wounded dolphin stuck on the beach. I hope they can get him back in the ocean soon http://t.co/3iaR24mH,328,500
2012-02-16 15:47:00,shakira,"After 1 day of tourism, and 2 of work in South Africa, I'm back in sweet Barcelona! Shak http://t.co/fs6sAeVa",242,361
2012-02-16 15:58:00,shakira,"Después de hacer un día de turismo, y dos de trabajo en Sudáfrica, ya estoy de vuelta a la maravillosa Barcelona! Shak  http://t.co/fs6sAeVa",281,404
2012-02-16 18:28:00,shakira,Today I start my new English album. Hoy empiezo a trabajar en mi nuevo disco en inglés. Shak,584,1291
2012-02-17 04:08:00,shakira,!Gracias a todos ustedes por estas 6 nominaciones @Univision Premios Lo Nuestro y por premiarme esta noche! Los quiero mucho! Shak,392,613
2012-02-17 13:36:00,shakira,"Qué ganas de estar en el carnaval de Barranquilla!, difruten por mi quilleros!! Shak",450,1445
2012-02-17 19:05:00,shakira,White House announced a $500 million investment in Early Childhood Dev. Amazing news for all children in America & for our latino community!,444,708
2012-02-22 14:59:00,shakira,"Bill Gates is tackling some of the world greatest problems, guided by the belief that all lives have equal value. Shak http://t.co/VFy39e4L",591,851
2012-02-28 21:21:00,shakira,Feliz por los avances de @MovimientoALAS: 3 nuevos centros en México y 13 en Colombia. Shak http://t.co/0rxbsgCL,194,337
2012-02-28 22:50:00,shakira,"Hanging out with Red Foo (LMFAO), Akon and Red One in my studio in Barcelona! -Shak http://t.co/VPDeXcpU",626,1580
2012-02-29 02:44:00,shakira,It didn't take us long before we started dancing! Shak http://t.co/vKgskyB9,470,890
2012-02-29 03:25:00,shakira,Watching @djafrojack! A 360 fun day! Shak http://t.co/vDUYiRmE,234,413
2012-02-29 21:01:00,shakira,Shak is about to be interviewed on the @BBCWorldService's Newshour - listen live (wherever you are) at http://t.co/zf8Q8Jrg now! ShakiraHQ,108,181
2012-02-29 21:55:00,shakira,Shak has been nominated for 10 (ten!) Billboard Latin Music Awards - http://t.co/aAGe0SlN ShakiraHQ,181,360
2012-02-29 21:55:00,shakira,Shak ha sido nominada a 10 (diez!) Premios Latin Billboard - http://t.co/2nkXbipM ShakiraHQ,159,362
2012-03-02 02:58:00,shakira,Gracias a todos por tantos mensajes tan cariñosos y sinceros que me han hecho llegar en este dia!¡ Los quiero! Shak,552,1039
2012-03-02 02:59:00,shakira,Thank you for all of the sweet and sincere birthday messages you've sent me today!! Love you guys! Shak,416,699
2012-03-02 04:14:00,shakira,Este mosaico me ha emocionado. !Qué lindos son! !Cómo les quiero! Shak http://t.co/2Z9bQL3i,834,1316
2012-03-05 15:09:00,shakira,Muchas Gracias Querido! Un beso a las Palmas de Gran Canaria! RT @Dancewithmysoul @shakira Im #AddictedToYou Siempre!!!!!,105,152
2012-03-05 15:10:00,shakira,J'aime la France. Shak RT @Lola_The_Kook J'ai aimé une vidéo @YouTube http://t.co/4GU7NqKS Shakira - Addicted To You,104,198
2012-03-05 15:10:00,shakira,Grazie! Shak RT @kia_shiver Yeeeeeeh Addicted to You TT in Italia!! Grande @shakira !,116,159
2012-03-05 15:14:00,shakira,"Guys! Thanks so much for all your nice comments about #AddictedToYou. I had a great time shooting it! (It shows, no?) http://t.co/O4SQqDhc",163,310
2012-03-05 15:17:00,shakira,"Qué lindos! Muchas gracias por sus comentarios sobre #AddictedToYou. Me lo pasé muy bien grabándolo (se nota, no?) http://t.co/zeDW0FNt Shak",354,686
2012-03-07 16:44:00,shakira,"Shakira's up against Britney in MTV's Princess of Pop - vote Shak at
http://t.co/ZE4nOtAY (it's just a simple
click to vote). Thx! ShakiraHQ",200,512
2012-03-07 16:49:00,shakira,"Shak continua en ""La Batalla de las Princesas del POP"" de MTVLA. Para votar: http://t.co/ZE4nOtAY ¡Muchas Gracias! ShakiraHQ",264,675
2012-03-08 15:18:00,shakira,"PHOTO: In the south of France, writing more songs for the new album, and looking very proper!! Shak http://t.co/HWDvbcVQ",267,368
2012-03-08 15:19:00,shakira,"FOTO: En el sur de Francia, donde me encuentro escribiendo para el nuevo álbum, y muy niña buena!! http://t.co/HWDvbcVQ
Shak",443,719
2012-03-10 12:41:00,shakira,Yo me sumo a construir 1.800 aulas para 45.000 niños y niñas en Sudamérica y tú? #elretodelcole  http://t.co/eveO0MTB - Shak,480,1003
2012-03-11 00:35:00,shakira,@BlakeShelton Congrats on your 3 CMAs! Shak,73,126
2012-03-11 15:47:00,shakira,The Latino vote is a driving force in the US election. Vote early! http://t.co/EWZ4ZaMJ Shak,182,408
2012-03-11 15:49:00,shakira,El voto Latino es una fuerza vital en las elecciones de los EEUU. http://t.co/EWZ4ZaMJ Shak,261,565
2012-03-14 20:21:00,shakira,Addicted To You is Shakira's new single. Get it from iTunes at http://t.co/J6UZKTBI - and here's the artwork... ShakHQ http://t.co/Jz8yQba0,327,745
2012-03-14 20:29:00,shakira,Addicted To You es el nuevo sencillo de Shakira. Ya disponible en iTunes http://t.co/J6UZKTBI. Aquí la portada: http://t.co/Jz8yQba0 SHQ,402,832
2012-03-17 16:44:00,shakira,Mi suegrito!! Shak http://t.co/ybYmlmw0,441,626
2012-03-20 16:09:00,shakira,Con mi conejita!! Shak http://t.co/rE1Vhxlx,599,907
2012-03-20 16:49:00,shakira,With my little bunny. Shak http://t.co/gEopSqJr,619,761
2012-03-21 15:23:00,shakira,Ahora es mi revancha! Estoy poniendo a alguien en su lugar en el Scrabble! Shak http://t.co/K86htlU2,516,1095
2012-03-21 15:24:00,shakira,Today it's revenge day! I'm making someone suffer at scrabble! Shak http://t.co/kw4FwMHg,649,993
2012-03-22 15:19:00,shakira,"Wow, 15m followers! Thanks guys! / Wow! 15m de seguidores! Gracias chic@s! Shak",424,779
2012-03-24 04:36:00,shakira,PHOTO: Sobrevolando el Gran Cañón del Colorado / Flying over the Great Canyon Shak http://t.co/VaKEp1hY,352,418
2012-03-24 19:11:00,shakira,Gooooooooooooooooooooooool de mi Piqué!!! Shak,1559,4412
2012-03-25 06:01:00,shakira,VIDEO:  http://t.co/dFWTtcsY,356,486
2012-03-26 01:33:00,shakira,Taking a small break from the studio to get my nails done with @EsterDean on a Sunday afternoon / Un pequeño descanso … http://t.co/zAvx1MQJ,233,332
2012-03-26 01:42:00,shakira,"And this is the final outcome - Y este es el resultado. Shak
 http://t.co/ibfBbVVT",338,508
2012-03-30 19:19:00,shakira,"A picture of my new music video #AddictedToYou shot yesterday in LA. Thanks @anthonymandler, I had a lot of fun! 
 http://t.co/egK48ERl",222,429
2012-03-30 19:20:00,shakira,"Una foto de mi nuevo vídeo #AddictedToYou grabado ayer en LA. Gracias @anthonymandler, me lo pasé muy bien!  http://t.co/egK48ERl",458,815
2012-04-01 21:33:00,shakira,Viendo el Barça Osasuna en el Camp Nou / Watching Barça Osasuna at Camp Nou. Shak http://t.co/Jj6Px5H9,669,1039
2012-04-04 16:15:00,shakira,Shakira is nominated for the TIME100 list of influential people. Vote for her inclusion (without registering) at http://t.co/BbHvsvKC ShakHQ,242,523
2012-04-04 20:01:00,shakira,Shakira ha sido nominada por la revista TIME como una de las 100 personas más influyentes del mundo. Para votar http://t.co/BbHvsvKC ShakHQ,287,626
2012-04-05 18:05:00,shakira,"Hahaha!! That's too funny. U guys have eagle's eyes! Next time I'll be more careful with the camera man http://t.co/O4SQqDhc (1'53"") Shak",186,291
2012-04-05 18:05:00,shakira,"jajaja! Algunos de ustedes tienen ojos de águila! La próxima vez tendré más cuidado con el de la cámara.  http://t.co/O4SQqDhc (1'53"") Shak",416,933
2012-04-07 19:04:00,shakira,"Have you checked out #GetItStarted, the new single by @Pitbull feat
Shakira yet? Hear it now at http://t.co/FaJDq9fU ShakiraHQ",283,506
2012-04-07 19:05:00,shakira,"Ya han escuchado #GetItStarted, el nuevo sencillo de @Pitbull feat Shakira? Para escucharlo - http://t.co/FaJDq9fU ShakiraHQ",538,1058
2012-04-08 15:29:00,shakira,Wow! One million views for the #GetItStarted video already! Thanks guys. Shak http://t.co/g6xZ3Dhi,207,416
2012-04-08 15:29:00,shakira,#GetItStarted ya tiene más de un millón de reproducciones! Muchas gracias chic@s. Shak http://t.co/g6xZ3Dhi,304,566
2012-04-08 22:00:00,shakira,"Happy Birthday Mr President Obama!
Shak",611,1667
2012-04-10 15:41:00,shakira,"Behind-the-scenes at the shoot for Shak's new fragrance, Elixir... ShakiraHQ http://t.co/uwLpQo8e",791,580
2012-04-10 15:59:00,shakira,"Vean como se hizo el nuevo anuncio de Elixir, la nueva fragancia de Shakira. ShakiraHQ http://t.co/uwLpQo8e",485,628
2012-04-11 02:34:00,shakira,Every child deserves to live up to his/her potential. I commend Pres Obama for prioritizing early childhood development http://t.co/mcDI0e2o,270,604
2012-04-11 02:34:00,shakira,Cada niño merece desarollar su potencial al máximo. Bien Pres Obama por priorizar el desarrollo infantil temprano. http://t.co/mcDI0e2o Shak,373,913
2012-04-13 00:51:00,shakira,La entrega de los Premios ALAS BID en Cartagena ha sido muy emotiva y espero que sea la primera de muchas. Shak,234,369
2012-04-13 16:25:00,shakira,"Another photo from the #AddictedToYou shoot / Otra foto del vídeo de #AddictedToYou -Shak 

 http://t.co/bHfTFcrM",192,392
2012-04-13 17:46:00,shakira,"Conozcan todos los detalles de la participación de Shakira en la
Cumbre de las Américas de ayer
http://t.co/XFxiLf0I ShakiraHQ",129,242
2012-04-13 17:48:00,shakira,The winners of the first ALAS-IDB Awards - for excellence in early childhood development - are announced http://t.co/6jgBS695 ShakiraHQ,104,180
2012-04-13 18:19:00,shakira,Primero lo Primero - an unprecedented alliance to support early childhood in Colombia - launches http://t.co/JBQBn7fq ShakiraHQ,167,299
2012-04-14 02:11:00,shakira,Shakira habló de inversión en educación temprana en Cumbre Empresarial Américas ante líderes económicos región http://t.co/jwBmNmYs SHQ,269,578
2012-04-14 22:38:00,shakira,Shakira's speech from Friday's conference to promote Early Childhood Development policies with the private sector  http://t.co/jwBmNmYs SHQ,187,357
2012-04-15 15:07:00,shakira,Here's Shakira singing the national anthem of Colombia at the opening of the Summit of the Americas yesterday!  http://t.co/6M3mgVil SHQ,164,258
2012-04-15 15:07:00,shakira,Aquí un vídeo en el que Shakira interpreta el himno de Colombia en la ceremonia inaugural de la Cumbre http://t.co/6M3mgVil ShakiraHQ,231,518
2012-04-15 20:01:00,shakira,Presidents applaud Shakira's performance of Colombia's national anthem at the Summit of the Americas yesterday. ShakHQ http://t.co/3GL2LBMB,168,313
2012-04-16 00:58:00,shakira,I was touched to see @BarackObama today and witness how he embraced the Afro-Colombian communities with so much affect… http://t.co/jMkYUxss,156,289
2012-04-16 00:59:00,shakira,Me conmovió ver a Obama hoy y presenciar como abrazó a las comunidades Afro-Colombianas con tanto cariño y defender el… http://t.co/u4ydGX4a,202,469
2012-04-16 02:35:00,shakira,Gracias Presidente Santos por ser tan buen anfitrión en esta cumbre y por su compromiso con la educación temprana en m… http://t.co/BN2HywAY,264,552
2012-04-16 04:26:00,shakira,Estoy leyendo sus tweets y me han emocionado mucho! Gracias por todo el cariño q me dan! Shak,532,988
2012-04-16 18:07:00,shakira,Presidents Obama and Santos and Shakira speak at the Summit of the Americas: http://t.co/DJQihCqA  ShakiraHQ,128,190
2012-04-16 18:07:00,shakira,Presidentes Obama y Santos y Shakira hablaron en la Cumbre de las Américas ayer http://t.co/DJQihCqA ShakiraHQ,196,342
2012-04-17 17:42:00,shakira,"Watch Shakira's speech from the launch of the ""First Things First"" early childhood development initiative http://t.co/QIfgXZL4 ShakiraHQ",123,185
2012-04-17 17:43:00,shakira,"Vean el discurso de Shakira, en el lanzamiento de ""Primero es lo Primero"" en pro de la 1a infancia colombiana   http://t.co/QIfgXZL4 SHQ",175,390
2012-04-17 23:24:00,shakira,"Feliz de verlos entusiasmados por el vídeo de ""Addicted To You"". Yo lo estoy también! Ya falta poco... Shak http://t.co/swJuD1MI",411,885
2012-04-17 23:25:00,shakira,"Glad you're all excited about the ""Addicted To You"" video...me too! Can't wait for you to see it. Not long now... http://t.co/swJuD1MI",389,551
2012-04-20 14:34:00,shakira,Shakira ha sido nominada en dos categorías de los Premios @Billboard: Top Artista Social y Top Artista Latina http://t.co/gGcmIykN ShakiraHQ,136,315
2012-04-20 14:35:00,shakira,Shakira has been nominated for Top Social Artist and Top Latin Artist at this year's @Billboard Music Awards. http://t.co/gGcmIykN ShakiraHQ,174,401
2012-04-20 18:51:00,shakira,Help us pick Shakira's new Facebook cover photo from a selection of new pics from the #AddictedToYou video shoot http://t.co/zDEvKrJl ShakHQ,122,200
2012-04-20 19:10:00,shakira,Ayúdennos a seleccionar la nueva foto del Facebook de Shakira eligiendo su foto favorita del vídeo #AddictedToYou http://t.co/iithYrrR SHQ,238,366
2012-04-23 16:21:00,shakira,Feliz día de Sant Jordi! Feliç diada de Sant Jordi. Shak,228,582
2012-04-23 17:37:00,shakira,Thank you guys! You are the best! RT @RocNation @LAWeekly names @Shakira Sexiest Female Musician of All Time: http://t.co/MXeSEqbf,227,506
2012-04-25 18:42:00,shakira,Ya falta poco! Un beso! #AddictedToYou Shak RT @ClubShakSpain #WeWantAddictedToYouVideo,147,358
2012-04-25 18:51:00,shakira,I miss it too! Great memories! Shak RT @Shakira_NYC I just had a flashback with @Shakira #TheSunComesOutWorldTour!!!  i miss it so much =(,119,175
2012-04-25 18:53:00,shakira,"Eres #loquemas RT @EliSaib Que soy una mujer en el mundo que hizo todo lo que pudo, no lo dudes ni un segundo",161,287
2012-04-25 18:54:00,shakira,Muchas Gracias! RT @AguilaHalcon A pocos días del estreno de Live From Paris en los cines de Argentina http://t.co/R1VvJrkT,221,279
2012-04-27 03:22:00,shakira,Thanks to all my people for so much support with the 2012 @LatinBillboards Awards. Love you all! Shak,194,314
2012-04-27 03:23:00,shakira,Gracias a toda mi gente por apoyarme tanto en esta entrega de premios @LatinBillboards. Los quiero! Shak,376,770
2012-04-27 15:33:00,shakira,Shakira wins four Billboard Latin Music Awards! http://t.co/GFIMbQLV / Shakira ganó 4 Premios Latin Billboard http://t.co/jSGAjivG ShakiraHQ,207,449
2012-04-28 16:03:00,shakira,Only a few more days until... #AddictedToYou / En pocos días... #AddictedToYou  http://t.co/d83IEgxH,270,583
2012-04-29 22:47:00,shakira,"PHOTO: Here's another sneak preview from the #AddictedToYou video (coming
very soon!) - Aquí un adelanto del vídeo … http://t.co/L5JV9SCU",204,364
2012-04-29 23:29:00,shakira,Want to be among the first to see a sneak preview of #AddictedToYou? Subscribe to Shakira's Youtube Channel http://t.co/2pbwO89D ShakiraHQ,114,195
2012-04-29 23:30:00,shakira,"¿Quieren ser los primeros en ver un adelanto de #AddictedToYou? Suscríbanse al canal de Shakira en Youtube http://t.co/2pbwO89D 
ShakiraHQ",177,393
2012-04-30 18:10:00,shakira,El vídeo de #AddictedToYou llega este MIÉRCOLES! Aquí les dejamos con un adelanto en exclusiva ... http://t.co/UBQXbTSq ShakiraHQ,204,540
2012-04-30 18:11:00,shakira,The #AddictedToYou video is coming WEDNESDAY! Check out an exclusive preview now... http://t.co/UBQXbTSq ShakiraHQ,213,513
2012-05-03 21:19:00,shakira,"""I can’t get away from football!"" - Shakira chats soccer/football in a great new interview on @FIFAcom at http://t.co/f5SSdPhX ShakHQ",135,226
2012-05-03 22:00:00,shakira,"""El fútbol me ha conquistado"" dice Shakira en una entrevista que publica hoy @FIFAcom y que pueden leer aqui: http://t.co/bwHKh2ni ShakiraHQ",150,346
2012-05-05 17:47:00,shakira,Casi 4M de reproducciones de #AddictedToYou. Increíble. Muchas gracias por su apoyo http://t.co/O4SQqDhc ShakiraHQ,190,473
2012-05-05 17:48:00,shakira,"Almost 4m views of #AddictedToYou in 3 days! That's amazing. Thanks
for the support guys. http://t.co/O4SQqDhc ShakiraHQ",243,411
2012-05-08 21:36:00,shakira,Felicidades a Caterine Ibargüen por conseguir nuestra cuarta medalla! / Congratulations to Caterine for obtaining our fourth medal! Shak,479,1185
2012-05-09 21:19:00,shakira,Ciao Milano! Shak  http://t.co/mAZvjWn1,396,594
2012-05-11 15:51:00,shakira,"Obama doubles Pell Grants - 700,000 more Latinos get help to go to college. Meet Johanny Adames http://t.co/J47XVahy Shak",194,415
2012-05-11 15:53:00,shakira,"Obama duplica la inversión en subvenciones para la educación- Grant Pell 700,000 latinos mas podrán ir a la universidad http://t.co/J47XVahy",231,633
