Date,author,content,number_of_likes,number_of_shares
2015-02-24 18:52:00,shakira,Shak's written an exclusive blog about her @UNICEF #WorldBabyShower for @BabyCenter - read it at http://t.co/uY3Dz3tFYZ ShakHQ,1016,889
2015-02-24 18:54:00,shakira,"Shak ha escrito un texto sobre su #WorldBabyShower de @unicef_es para @BCLatino - pueden leerlo aquí: http://t.co/SkUdQJzjNV
ShakHQ",1086,937
2015-02-24 20:34:00,shakira,"Check this out! Hilarious!! 
 https://t.co/rAV1R43Et0",2160,1846
2015-02-25 18:41:00,shakira,"♫ Tú eres mi amor mi alegría
la verdad de mi vida
mi bebé que me salta
a los brazos de prisa ♫
#miverdad http://t.co/eiL32qCkzE",4104,2530
2015-02-26 19:10:00,shakira,"A year ago this week, Empire had its first play. Here's Shak at the video shoot…  #TBT ShakHQ http://t.co/GL06FCbxzs",1797,1000
2015-02-26 19:10:00,shakira,Esta semana hace un año del lanzamiento de Empire. Aquí Shak en el set del video... #TBT ShakHQ http://t.co/q8n8X9ldd5,2165,1176
2015-02-27 19:12:00,shakira,"Remember, you can now add @UNICEF #WorldBabyShower gifts to your @baby_list registry at http://t.co/wgNMLQdwdS ShakHQ http://t.co/ZR2MsjTOCo",1577,654
2015-03-02 16:58:00,shakira,Purchase a #WorldBabyShower thank-you card from Shak &amp; @3gerardpique &amp; unlock funds for vital measles vaccines http://t.co/2KC9BeMNRQ ShakHQ,1087,432
2015-03-02 17:03:00,shakira,Participen en el #WorldBabyShower de Shak y @3gerardpique y regalen vacunas contra el sarampión. http://t.co/2KC9BeMNRQ … ShakHQ,1235,517
2015-03-03 17:38:00,shakira,Thank you all so much for your @UNICEF #WorldBabyShower gifts &amp; lovely messages. Shak http://t.co/gNr4teW2XM,1228,468
2015-03-03 17:40:00,shakira,Muchas gracias por todos sus regalos y lindos mensajes sobre el #WorldBabyShower de @unicef_es. Shak http://t.co/7R15Dhm43T,1543,548
2015-03-03 17:42:00,shakira,"Please keep spreading the word http://t.co/K3k1vuTj0k 
Sigan compartiéndolo! http://t.co/bPxBmSuA0X http://t.co/MKKDNhJkhc",1532,856
2015-03-07 16:02:00,shakira,"With the opening of these 2 centers, @MovimientoALAS and @fpiesdescalzos's cooperation, and the help of our strategic partners (1/2)",1661,518
2015-03-07 16:02:00,shakira,"... today we have 17 centers in colombia serving more than 9,000 children (2/2) Shak",2213,639
2015-03-07 16:04:00,shakira,"Con la apertura de estos 2 centros, la colaboración de @MovimientoALAS, @fpiesdescalzos y nuestros socios estratégicos (1/2)",2029,614
2015-03-07 16:05:00,shakira,"... hoy son 17 centros en Colombia sirviendo mas de 9,000 niños y niñas. Shak",3639,1121
2015-03-11 19:22:00,shakira,Rock on! #loverocks 👏🏻 https://t.co/NcTp8z0Fzf,759,243
2015-03-11 19:25:00,shakira,One of the many magical myths of Colombia ;-)  https://t.co/N5PQ5gDeen,867,316
2015-03-11 19:31:00,shakira,Amazing!  https://t.co/W1bmb5VLhd,952,310
2015-03-12 15:13:00,shakira,Feliz con la entrega del nuevo centro para la 1a infancia en Cartagena! 425 niñ@s con atención de calidad gracias a  Primero lo Primero!,2181,603
2015-03-12 22:18:00,shakira,Check out Shak's new @TMobile  TV spot ft #LoveRocks game…  Nuevo anuncio de T-mobile con Shak y #LoveRocks! https://t.co/VfY8xuqQlS ShakHQ,1192,401
2015-03-17 17:34:00,shakira,The #MiVerdad video just hit 20m views! #MiVerdad: 20 millones de reproducciones! https://t.co/yhpikUUGL1  ShakHQ http://t.co/f8UhBHUsl8,2505,1063
2015-03-19 22:29:00,shakira,"Padre e hijo
Feliz día del padre!
Shak http://t.co/Tmna42FQvt",7531,8557
2015-03-22 23:39:00,shakira,Gerard Pique is THE Defender! Shak,6522,7248
2015-03-23 17:26:00,shakira,"Wow, Shak's Can't Remember To Forget You video ft @Rihanna has reached HALF A BILLION views! https://t.co/Y4YiLCeznh ShakHQ",1525,734
2015-03-23 17:30:00,shakira,"Wow! Can't Remember to Forget You de Shakira con @rihanna ya tiene más de 500 MILLONES de reproducciones!
https://t.co/Y4YiLCeznh ShakHQ",1538,657
2015-03-24 16:26:00,shakira,"Conozcan los logros de @MovimientoALAS en el 2014! http://t.co/2drsC6VSL1
ShakHQ http://t.co/iXLLb77PlT",1228,451
2015-03-24 19:26:00,shakira,"Wow, great version of Eyes Like Yours! / Nos encanta esta versión de Eyes Like Yours! https://t.co/9HBFaCsg0y ShakHQ",1428,606
2015-03-25 17:32:00,shakira,"Happy 1st birthday to the Shakira album, released a year ago today! Listen on @Spotify http://t.co/3M4KDRx7h5 ShakHQ http://t.co/yG17s45oHF",1878,715
2015-03-25 17:33:00,shakira,El álbum Shakira cumple un año hoy! Lo pueden escuchar en @Spotify aquí http://t.co/3M4KDRx7h5 ShakHQ #1YearOfShakira http://t.co/Ycb6I6wnJF,1982,782
2015-03-26 19:15:00,shakira,"In the week the Shakira album celebrates its 1st birthday, our #TBT is one of the official press shots! ShakHQ http://t.co/jf1WRmtKmI",2341,847
2015-03-26 19:18:00,shakira,"En la semana que celebramos el 1r aniversario del álbum Shakira, nuestro #TBT es una de las fotos oficiales! ShakHQ http://t.co/gViEJjmNj4",3811,2599
2015-03-27 20:34:00,shakira,"According to economist @heckmanequation, we should think holistically about the benefits of early childhood dev't. http://t.co/CBEu8KY4e6",1370,541
2015-03-30 15:13:00,shakira,I'm excited to join the @WeHeartIt community ... Me hace mucha ilusión unirme a la comunidad de @weheartit ... http://t.co/4048O5fXB1 Shak,1529,546
2015-03-30 20:29:00,shakira,"Sasha ""haciendo ejercicio"" con su gimnasio de mi colección de @FisherPrice - le encanta! http://t.co/yMl8IuwQbp http://t.co/pabYglErFZ",2140,795
2015-03-30 20:30:00,shakira,"Sasha ""working out"" w/his Kick and Play Piano from my FP collection for ECD--he loves it! http://t.co/aDcNYS2Avf http://t.co/JabM6739CB",2132,761
2015-03-31 16:08:00,shakira,Desde ayer más de 632 niñ@s de 0 a 5 en #QuintanaRoo serán beneficiados con la inauguración de dos nuevos CIPIs! Shak http://t.co/hu1OA4BBuP,2320,1443
2015-04-02 17:54:00,shakira,"""I have Daddy's feet, it looks like I've been playing football my whole life"" http://t.co/x8tqWlqPJU",7357,3277
2015-04-02 17:54:00,shakira,"""Tengo los pies de papi, parece que hubiese estado jugando futbol toda mi vida"" http://t.co/BkYpJjLSlh",6461,3001
2015-04-06 15:48:00,shakira,"#TBT Fijación Oral, Vol. 1 is ten years old this week! Fijación Oral, Vol.1 celebra 10 años esta semana! ShakHQ http://t.co/3q6qzRGmb9",5161,1673
2015-04-09 15:08:00,shakira,Loving your pics of souvenirs from our time together - thanks for posting them! #LoveRockbyShakira http://t.co/rWVWJZChPU,1988,545
2015-04-09 15:10:00,shakira,Gracias por compartir sus recuerdos de momentos juntos - Me encantan! #LoveRockbyShakira http://t.co/q7h3aXmrIe,2658,799
2015-04-10 20:25:00,shakira,Qué buenos minutos de Jackson Martínez! Ya estamos empezando a ver su mejor versión! Shak,2905,1458
2015-04-11 18:03:00,shakira,Wait till you see what's coming up next! https://t.co/QOesore9nv,860,312
2015-04-11 18:08:00,shakira,#cantstopwontstop  https://t.co/CA77wVsIEe,865,248
2015-04-11 18:21:00,shakira,You haven't seen anything yet...;-) https://t.co/Gs89ucK7FI,1005,302
2015-04-12 14:26:00,shakira,Ayer con la alianza Primero lo Primero inauguramos un nuevo centro para la primera infancia en Cartagena! https://t.co/ceQmWou608,2381,606
2015-04-12 14:27:00,shakira,"Yesterday with the alliance Primero Lo Primero we opened a new ECD center in Cartagena, Colombia. https://t.co/A9kEOXkFfE",2249,614
2015-04-14 22:03:00,shakira,Hoy en Nueva York @HispanicEd está discutiendo estrategias de mejoramiento de la educación para #latinos en EEUU ShakHQ,1677,554
2015-04-14 22:04:00,shakira,@HispanicEd is in NYC today discussing strategies on behalf of #latino educational opportunities across the nation. ShakHQ,440,211
2015-04-15 16:15:00,shakira,Sasha out for a stroll! / Sasha de paseo! Shak http://t.co/4h9FTBfiAE,7320,2897
2015-04-16 21:32:00,shakira,Quedan solo 15 días para nominar a los premios ALAS-BID a aquellos educadores extraordinarios que conoces. Participa ya! @MovimientoALAS,1343,440
2015-04-16 21:33:00,shakira,Just 15 days left to nominate the most extraordinary educators you know to the Premios ALAS-BID. Participate now! @MovimientoALAS,1475,507
2015-04-20 21:50:00,shakira,"Just got my 3 @GWR records framed! So, logically, I decided to chill next to them on my couch! :) Shak http://t.co/bUBBzzWX7y",2694,986
2015-04-20 21:52:00,shakira,Acabo de recibir mis 3 @GWR récord enmarcados. Y como es lógico he decidido relajarme con ellos un rato en el sofá! http://t.co/0SEQB1aKxE,3486,1334
2015-04-21 14:26:00,shakira,"""Sabías que es más fácil enseñarle a leer a un bebe que a un niño de 5 años?"" 
Glenn Doman",2207,933
2015-04-21 14:27:00,shakira,"""Did you know it is actually easier to teach a baby to read than a five-year-old""? Glenn Doman http://t.co/QzWU9kUSf7",1766,669
2015-04-21 20:54:00,shakira,Awesome Barça match today! Get ready for the semifinals!! Shak http://t.co/TIJgGVIo2g,6235,3356
2015-04-26 15:52:00,shakira,.@UNICEF is taking action to help children+families affected by horrific #NepalEarthquake You can help: http://t.co/MJdxacJinT,2500,1516
2015-04-29 18:14:00,shakira,"Wow, just heard that the ""La La La"" video hit 500 million views! That's insane! Shak https://t.co/ATtAuvYB6A",2303,999
2015-05-02 17:27:00,shakira,Queremos presentarles a Sasha Piqué Mebarak--para conocerlo visiten http://t.co/Um9AzMiDCd,4223,2253
2015-05-02 17:27:00,shakira,We'd like to introduce you to Sasha Piqué Mebarak--to meet him go to http://t.co/UqZJlMxz5H,2459,1187
2015-05-03 17:07:00,shakira,"With the ""Las de la Intuición"" video (http://t.co/YzUAbw1NSw) set to reach 50m views here's a #TBT from it. ShakHQ http://t.co/FLi4LIyXQr",1367,551
2015-05-03 17:09:00,shakira,"Con el video de ""Las de la Intuición"" http://t.co/YzUAbw1NSw a punto de llegar a los 50 millones, nuestro #TBT ShakHQ http://t.co/s9gCMYet4G",1810,751
2015-05-03 20:47:00,shakira,#TBT as a girl! On #IWD2015 Stand #UpForSchool to empower the next generation of women: http://t.co/1fJAW5MAFe http://t.co/C9QAFXsxqi,3475,2934
2015-05-08 14:20:00,shakira,#earlyed is good for businesses. See why Shak supports expanded pre-K with @firstfiveyears &amp; #InvestInUS http://t.co/RNBtVEHbTD ShakHQ,1543,510
2015-05-08 20:55:00,shakira,Camp Nou today / Hoy en el Camp Nou. Shak http://t.co/bKPpJQCwtL,5310,2355
2015-05-10 17:01:00,shakira,Shakira Bird is starring in this week’s #AngryBirdsFriends #LoveRocks Tournament! -&gt; http://t.co/q2lLjgusn0 ShakHQ http://t.co/mbbK0sdq4d,1044,375
2015-05-10 17:02:00,shakira,¡Shakira Bird es la protagonista de #AngryBirdsFriends esta semana! -&gt; http://t.co/q2lLjgusn0 ShakHQ http://t.co/DYOBdULBiQ,1256,472
2015-05-10 20:38:00,shakira,Shakira Bird is rocking this week’s Angry Birds Friends Love Rocks Tournament http://t.co/q2lLjgcQYq https://t.co/T2SQullvsg ShakHQ,1038,342
2015-05-10 22:55:00,shakira,At U2's awesome concert! Shak http://t.co/3FLMdD26Ze,5811,1696
2015-05-11 15:46:00,shakira,Todos los niños cuentan. Feliz de presentarles este vídeo de los #PremiosAlasBid que se entregan este martes https://t.co/bZApb9fgFg @el_BID,1655,497
2015-05-17 20:00:00,shakira,Felicidades FCB por este titulo fruto del esfuerzo! Y a mi campeón 3 ligas hemos celebrado juntos y vamos por mas! :) http://t.co/8e07zmrNLM,5767,3583
2015-05-21 15:25:00,shakira,#TBT Shak in St Petersburg 4 years ago this week! / Hace 4 años... Shak en St. Petersburgo! https://t.co/JkukUQctes ShakHQ,1669,626
2015-05-23 23:51:00,shakira,A day to celebrate and Milan's first goal at Camp Nou! Un día de celebración!Y el primer gol de Milan en el Camp Nou! http://t.co/OihlCUeZyb,6007,3627
2015-05-23 23:58:00,shakira,No estoy perdido! Estoy en el Camp Nou!! http://t.co/no97R8cbv6,4900,2219
2015-05-26 17:35:00,shakira,Back in action with the one &amp; only Anna Kaiser​! @TheAnnaKaiser @AKTINMOTION http://t.co/BqgrRSg59c,2579,766
2015-05-28 17:38:00,shakira,"#TBT 4 years ago Shak made an emotional trip to her father's homeland, Lebanon, for her first ever Beirut show! https://t.co/Hkk0tIhXjC SHQ",1465,535
2015-05-28 17:40:00,shakira,#TBT Hace 4 años Shak realizó una visita muy emotiva a Líbano y allí hizo su primer show https://t.co/Hkk0tIhXjC ShakiraHQ,1592,600
2015-05-30 22:58:00,shakira,"Campeones campeones oe oe oe!!! / 2 in the bag, one more to go!!! http://t.co/JeSjzPWW9l",8931,4563
2015-05-31 15:26:00,shakira,Con mi suegrito! Shak http://t.co/ViP9rEErrn,3745,1092
2015-06-03 21:37:00,shakira,"Great news! You can now get @UNICEF #WorldBabyShower gifts via your Baby Registry on @thebump -
http://t.co/K58bVRFwbN
ShakHQ",1215,475
2015-06-05 17:27:00,shakira,On set today! De rodaje hoy! @3DWhite http://t.co/1mdnmzjQNc,4677,1786
2015-06-06 22:52:00,shakira,"Noche feliz! Celebrando con la familia, Milan y Sasha el bebe del año del triplete!! Shak #UCLfinal http://t.co/AN03SHZf7H",5840,2553
2015-06-06 22:54:00,shakira,"Happy night! Celebrating with the family, Milan and Sasha, the baby of the year of the treble!! Shak #UCLfinal http://t.co/Rqh22OLAQa",6620,2562
2015-06-09 20:35:00,shakira,Came to surprise some friends tonight! Vine a sorprender a unos amigos esta noche! Shak http://t.co/3teL6Hf2Yy,7556,2096
2015-06-10 18:21:00,shakira,Did you watch Shak answering the call from the makers of @AngryBirds?! https://t.co/Ti3al7yhk2 ShakHQ,1072,349
2015-06-10 18:21:00,shakira,Ya vieron a Shak contestando la llamada de los creadores de @AngryBirds?! https://t.co/Ti3al7yhk2 ShakHQ,1202,411
2015-06-13 14:32:00,shakira,Can't believe this was four years ago today! https://t.co/Yf7jCBjDri Shak,2728,1160
2015-06-14 16:07:00,shakira,Dancing and working with @TheAnnaKaiser today!! @AKTINMOTION http://t.co/gVnO9dj7UX,6705,1785
2015-06-18 11:28:00,shakira,Be part of the debate: “Advancing Early Childhood Education for Hispanics” @HispanicEd Chicago Symposium. ShakHQ,2055,673
2015-06-18 21:04:00,shakira,"I did fly higher, it's just that it's not on tape!!! ;) Shak http://t.co/N3tdWlTkWr",4284,1365
2015-06-25 20:49:00,shakira,Loving this tune right now that @Shazam helped me find. http://t.co/L9dIkvoCgU Shak,11656,11721
2015-06-29 17:30:00,shakira,Felices 5 meses Sasha! / Happy 5 months Sasha! Shak http://t.co/yxDV1mavdA,11011,3366
2015-06-30 15:02:00,shakira,You can now follow Shak on @Shazam / Ahora ya pueden seguir a Shak en Shazam http://t.co/9PGrs4NK5L  ShakHQ,1600,586
2015-06-30 19:28:00,shakira,Nadie viviendo en este siglo debería apoyar tanta ignorancia.  2/2 http://t.co/jsx0KHdmzO,6022,4748
2015-06-30 19:28:00,shakira,Este discurso racista y odioso intenta dividir a un país q durante años se ha encaminado en la defensa de la diversidad y la democracia 1/2,6266,4151
2015-06-30 19:29:00,shakira,"No one living in this century should stand behind so much ignorance. 2/2
http://t.co/jsx0KHdmzO",5481,3651
2015-06-30 19:29:00,shakira,This is a hateful and racist speech that attempts to divide a country that for years has promoted diversity and democracy! 1/2,4971,2965
2015-07-04 19:51:00,shakira,Celebramos estos 202 años de mi Barranquilla querida!!,3750,1788
2015-07-05 12:17:00,shakira,Playing dress up! @robzangardi http://t.co/HPzcbQkexC,6877,2350
2015-07-08 08:40:00,shakira,Hahaha! RT @kyweezybeeitch Man names his daughter Shakira solely for this purpose https://t.co/hcQvPtZLZK,4747,2749
2015-07-09 09:58:00,shakira,Last night on stage with my friends from @manaoficial / Anoche en el escenario con mis amigos de Maná. Shak http://t.co/MYTGY1O2wy,4696,1485
2015-07-12 16:36:00,shakira,".@LoveRocks is adding tomorrow a new world and 40 new levels! Download now! https://t.co/ec8zB4Abgu
ShakHQ
https://t.co/0HWb5E8ZzQ",1409,391
2015-07-12 16:37:00,shakira,".@LoveRocks añadirá mañana un nuevo mundo con 40 niveles nuevos!  https://t.co/ec8zB4Abgu
ShakHQ
https://t.co/xDFAAIdkw0",1946,506
2015-07-13 20:25:00,shakira,So exciting to see over 1200 hard-working teachers submitted for our #PremiosALASBid- It's an honor to be able to recognize their efforts.,1755,539
2015-07-13 20:25:00,shakira,Muy emocionante ver en los #PremiosALASBid más de 1200 solicitudes para los maestros más dedicados!Es un honor poder reconocer sus esfuerzos,2051,680
2015-07-14 11:26:00,shakira,Shak's Rabiosa video just hit 200m views! El video de Rabiosa ya tiene 200 millones de reproducciones! https://t.co/j2KcG3UkAM ShakHQ,2293,800
2015-07-15 19:57:00,shakira,Feliz 20 aniversario @ShakiraPD! Muchas gracias por su apoyo y por todo el esfuerzo que dedican a ayudar a @fpiesdecalzos! Los quiero!,2593,855
2015-07-18 23:04:00,shakira,This is what I'm wearing tonight! / Lo que llevo puesto esta noche! http://t.co/Sjnxkw0mvq,3850,1134
2015-07-19 00:58:00,shakira,At the Barcelona Beach Festival! / en el Barcelona Beach Festival! -Shak https://t.co/XsM9oGt6Qq,2261,744
2015-07-21 13:40:00,shakira,.@JuanLuisGuerra atrapado en el elevador de mi casa!! JL espero quieras volver a visitarme!! Shak http://t.co/f6fwB5LvWe,4883,1357
2015-07-22 16:24:00,shakira,Shak's No video ft @cerati ​ premiered 10 years ago today! https://t.co/iHm9Bf9S83 ShakHQ,1763,625
2015-07-22 16:24:00,shakira,"El vídeo de la canción ""No"" feat. Gustavo Cerati se estrenó hoy hace 10 años! https://t.co/iHm9Bf9S83  ShakHQ",2757,1187
2015-07-23 17:57:00,shakira,#TBT Shak on the @RollingStone cover in April 2002 /Shak en la tapa de la revista RollingStone de Abril 2002! ShakHQ http://t.co/yxSKPAJEG2,3754,1349
2015-07-29 16:21:00,shakira,Happy 6 months Sasha! Shak http://t.co/90JIoMD4QZ,11365,4283
2015-08-03 20:04:00,shakira,On Intl Women's day I want to highlight the power of education as a catalyst to transform the lives of millions of girls around the world.,2877,1616
2015-08-03 20:10:00,shakira,En el día de la mujer quiero señalar el poder de la educación: catalizador que transforma las vidas de millones de niñas alrededor del mundo,3677,2013
2015-08-05 20:34:00,shakira,The A team! http://t.co/TXNVLtFZr2,4396,1622
2015-08-10 13:15:00,shakira,"Gurus?! Who would have thought I'd need one to create a game with the Angry Birds people.... Shak
https://t.co/UhErGKRjkR",2005,789
2015-08-10 13:16:00,shakira,"Gurus?! Quién hubiera pensado que necesitaría uno para crear un juego con la gente de Angry Birds... Shak
https://t.co/Zoz9g6qcDl",2397,894
2015-08-11 22:22:00,shakira,Great to see @LoveRocks in the UK Observer newspaper's Apps of the Month today. ShakHQ https://t.co/83nqjAxpAy,1792,496
2015-08-13 15:25:00,shakira,#TBT En esta semana se cumplen 16 años de la grabación del álbum MTV Unplugged! https://t.co/sXtO5HfZCl ShakHQ,2222,840
2015-08-13 15:25:00,shakira,#TBT 16 years ago this week Shak recorded her MTV Unplugged album https://t.co/sXtO5GYoKN  ShakHQ,1779,622
2015-08-14 23:05:00,shakira,I am thrilled to announce that I will be playing Gazelle in @DisneyAnimation's #Zootopia (1/2) http://t.co/qRpZFEjeik,3982,1561
2015-08-14 23:06:00,shakira,"(2/2) I'll be singing a brand new song for the movie called ""Try Everything""! Shak",2495,1025
2015-08-14 23:06:00,shakira,Feliz de haber participado en la nueva película de @DisneyAnimation #Zootopia en donde estaré interpretando a Gazelle http://t.co/M6fyi8HYNG,4295,1762
2015-08-14 23:08:00,shakira,"y ""Try Everything"" mi nueva canción para la película. Shak",3181,1269
2015-08-23 19:29:00,shakira,"My baby and blue skies!
Mi niño y el cielo azul! Shak http://t.co/1Gc2DMf9vx",12099,3381
2015-08-27 20:15:00,shakira,Sign our petition #UpForSchool to help 59 million out-of-school children get an education https://t.co/nKYLI1PwS0 http://t.co/Y8llqziHtO,3617,1476
2015-08-27 20:17:00,shakira,Firma esta peticion #UpForSchool para que 59 millones de niños sin acceso a la educación puedan asistir a la escuela https://t.co/nKYLI1PwS0,2025,922
2015-08-29 16:41:00,shakira,"My very first Grammy, from 2001! Do you guys have souvenirs of our time together? Share them using #LoveRockbyShakira http://t.co/fJCktgBUJe",2507,847
2015-08-29 16:42:00,shakira,Mi primer Grammy del año 2001! Guardan algún recuerdo de nuestro tiempo juntos? Para compartirlos: #LoveRockbyShakira http://t.co/X7GDifoKBA,2434,862
2015-09-04 19:47:00,shakira,"""World Baby Shower is big hit, says @UNICEF​"" Full story: http://t.co/DwuvUAcUg2 👍 ShakHQ http://t.co/ls0pg36VN8",1710,577
2015-09-04 19:50:00,shakira,"""El Baby Shower Mundial ha tenido un gran impacto, según @unicef_es"" Más información: http://t.co/3mUGNJguny 👍
ShakHQ http://t.co/BDYTMEnpCY",2065,738
2015-09-09 15:01:00,shakira,"No se pierdan el anuncio de televisión de la nueva fragancia de Shakira, Love Rock! ShakHQ
https://t.co/nRcPQSwnAD",1700,686
2015-09-09 15:03:00,shakira,"Check out the TV spot for the brand new fragrance, Love Rock! by Shakira. ShakHQ
https://t.co/TSpWpJfnVc",2050,823
2015-09-10 14:29:00,shakira,Watch: @UNICEF's video showing Shak speaking up for early childhood development during UN week. http://t.co/AKoTKpVN0c ShakHQ,1039,409
2015-09-10 14:30:00,shakira,No se pierdan este vídeo de @unicef_es que resume la semana de Shak en Naciones Unidas http://t.co/AKoTKpVN0c ShakHQ,1266,515
2015-09-16 18:14:00,shakira,Meet my new friend Rojo. Shak http://t.co/TIsezkCx4E,2707,883
2015-09-16 22:13:00,shakira,"Getting kids in school affects us all / Tengas hijos o no, tener a todos los niños del mundo en el colegio nos afecta a todos #UpForSchool",1368,489
2015-09-16 22:22:00,shakira,Sign here to tell your current leaders that we need to build our future leaders. #upforschool  https://t.co/nKYLI1PwS0,1006,401
2015-09-16 22:23:00,shakira,Firma la petición para decirles a nuestros líderes de hoy que hay que hacer más para criar los líderes de mañana. https://t.co/76A6jdWpFk,1316,524
2015-09-17 13:48:00,shakira,"From today, Shakira Bird is a special guest in @AngryBirds POP!! Download it for free: http://t.co/zpJ83NoyHA ShakHQ http://t.co/4BpHrA8p43",1228,599
2015-09-17 13:49:00,shakira,El Shakira bird es un invitado especial @AngryBirds POP! Pueden descargarlo de gratis  http://t.co/zpJ83NoyHA ShakHQ http://t.co/vXj1znfcGE,1373,612
2015-09-17 15:39:00,shakira,Packing for my trip to see @AngryBirds Red on Golden Island! I can never decide what to wear... ShakBird http://t.co/Zp9s2N3GMx,1265,583
2015-09-17 16:47:00,shakira,@angrybirds Hey! Looking forward to it! And I like red… ShakBird,303,179
2015-09-17 18:53:00,shakira,Squawk! Did you check out the trailer for my guest appearance on @AngryBirds POP? https://t.co/XBWxYCFtUc ShakBird,903,399
2015-09-17 19:00:00,shakira,"@AngryBirds Ha! Yes, that is clearly true! ShakBird",393,212
2015-09-18 19:48:00,shakira,15 years ago the leaders of the world made a pledge to have every child in school by the year 2015. 59 million kids have yet to make the cut,1146,649
2015-09-18 19:51:00,shakira,Let’s tell them we must stand #upforschool https://t.co/nKYLI1PwS0,889,398
2015-09-18 19:52:00,shakira,59 millones de niños aun no han podido entrar. Alcemos la voz de nuevo. #upforschool https://t.co/76A6jdWpFk,1321,595
2015-09-18 19:52:00,shakira,"Hace 15 años, los líderes del mundo se comprometieron a tener todos los niños en el colegio para el 2015 (1/2)",1046,523
2015-09-23 00:03:00,shakira,"Had a very productive ""Meeting of the Minds"" today at the @UN Hoy en una reunión muy productiva que hemos convocado https://t.co/K0gYPwt7jf",1165,409
2015-09-23 01:34:00,shakira,"Shak talked about the refugees crisis in Syria today @UN with @UNICEF. ShakHQ #UNGA #ECD
https://t.co/aO2TY9Gts2",3111,1534
2015-09-23 03:07:00,shakira,Shak habló hoy sobre la crisis de los refugiados sirios en @UN con @unicef_es (vídeo con subtítulos) ShakHQ https://t.co/VAW5tQ7zHB,1348,529
2015-09-23 15:31:00,shakira,Watch Shak's full speech at the @UN with @UNICEF in NYC yesterday #ECD #UNGA https://t.co/E8y09cr41k ShakHQ,998,443
2015-09-23 15:32:00,shakira,"Vean el discurso íntegro que Shak realizó ayer en @UN con @unicef_es #UNGA (CC para subtítulos en español) https://t.co/E8y09cr41k
ShakHQ",1079,486
2015-09-23 15:52:00,shakira,Here are the images that Shak was referring to in her speech / Aquí las fotos que Shak mencionaba en su discurso SHQ http://t.co/dXN3uDevht,1572,574
2015-09-24 14:14:00,shakira,To get live updates from Shak's conference please follow @educationnation or the hashtag #FPHappyFactor. ShakHQ http://t.co/jtUnAkP3Qu,818,300
2015-09-24 14:17:00,shakira,Para tener todos los detalles de la conferencia de Shak pueden seguir a @educationnation o #FPHappyFactor SHQ http://t.co/IyLIRhvcMS,941,335
2015-09-24 16:23:00,shakira,Para más información sobre este foro centrado en Desarrollo Infantil Temprano visiten http://t.co/2f2rwbMjWu ShakHQ https://t.co/L9rEIMvXTl,985,342
2015-09-25 01:19:00,shakira,Moms around the world have surprisingly similar hopes &amp; wishes for their children.  http://t.co/8V8opfSfBf ShakHQ http://t.co/KYFfS2BUmT,1905,503
2015-09-25 01:20:00,shakira,"Las madres de todo el mundo tienen unas esperanzas y deseos similares para sus hijos http://t.co/2f2rwbMjWu
ShakHQ http://t.co/77rEw44Kj0",2576,738
2015-09-25 13:55:00,shakira,"In around 45 min, Shak will perform at the Opening Ceremony of the @UN's General Assembly in NY. Watch: http://t.co/BjGXAa41cx ShakHQ #UNGA",1134,422
2015-09-25 13:56:00,shakira,En 45min Shak cantará en la ceremonia de inauguración de la Asamblea General de @UN. Para verlo en vivo http://t.co/BjGXAa41cx #UNGA ShakHQ,1180,451
2015-09-25 14:51:00,shakira,Shak's about to perform at the Opening Ceremony of the @UN's General Assembly in NYC. Watch LIVE now: https://t.co/mkyEmV5B12 #UNGA ShakHQ,969,397
2015-09-25 14:52:00,shakira,Shak está a punto de cantar en en la ceremonia de inauguración de la Asamblea General de @UN. #UNGA https://t.co/4ie5f14OW9 ShakHQ,1108,443
2015-09-25 14:58:00,shakira,Shak's performing at the Opening Ceremony of the United Nations​'s General Assembly in NYC. Watch live now: http://t.co/WkwunUFq2B ShakHQ,1121,455
2015-09-25 22:39:00,shakira,Mommy I also want education for all children around the world!It's time for change! Not a moment to lose #UpForSchool http://t.co/Cjvoxukmx7,4651,1602
