,pub_date,headline
5356,2016-01-22T00:00:00Z,Hillary Clinton and Bernie Sanders Ads Diverge on Road to Caucuses
5357,2016-01-22T00:00:00Z,"Bernie Sanders, and Simon and Garfunkel, Put Focus on Voters"
5358,2016-01-22T11:30:00Z,"With a Ranch on a Hill, Joining a Renaissance in Israel"
5359,2016-01-22T00:00:00Z,Rockefeller Foundation to Take Food-Waste Fight to Davos
5360,2016-01-22T00:00:00Z,"Pearson, Ex-Owner of Financial Times, to Shed 4,000 Jobs"
5361,2016-01-22T00:00:00Z,"Verdasco, Like Others, Finds Defeating Nadal Doesn’t Guarantee Success"
5362,2016-01-22T00:00:00Z,Hillary Clinton’s Paid Speeches to Wall Street Animate Her Opponents
5363,2016-01-22T00:00:00Z,"VW Admits Cheating in the U.S., but Not in Europe"
5364,2016-01-22T00:00:00Z,Barclays to Scale Back Asia Businesses as Part of Overhaul
5365,2016-01-22T00:00:00Z,Self-Driving Cars May Get Here Before We’re Ready
5366,2016-01-22T00:00:00Z,"Putin ‘Probably Approved’ Litvinenko Poisoning, British Inquiry Says"
5367,2016-01-22T00:00:00Z,European Central Bank Says It’s Ready for New Stimulus — but Not Yet
5368,2016-01-22T00:00:00Z,Asian Markets Follow U.S. Stocks Downward
5369,2016-01-22T11:38:43Z,Boletín
5370,2016-01-23T21:37:07Z,"In Return to Iowa, Bernie Sanders Picks Up Where He Left Off on Wall Street and Clinton"
5371,2016-01-23T20:33:33Z,Donald Trump Says Megyn Kelly Should Skip Debate; Fox Says She&#8217;ll Be There
5372,2016-01-23T00:00:00Z,"At Givenchy, Riccardo Tisci Celebrates the Freedom of Dress"
5373,2016-01-23T19:07:57Z,"In Surprise Showing, Iowa&#8217;s Senior Senator Appears at Donald Trump Rally"
5374,2016-01-23T18:58:24Z,"In Support of Ted Cruz, Glenn Beck Slams Donald Trump"
5375,2016-01-23T18:36:08Z,Des Moines Register Endorses Marco Rubio and Hillary Clinton
5376,2016-01-23T18:17:52Z,Donald Trump Would &#8216;Love&#8217; to See Michael Bloomberg Run
5377,2016-01-23T00:00:00Z,"Men’s Fashion Week: Comme, Junya, Margiela in Pictures"
5378,2016-01-23T18:00:55Z,Initial Turn
5379,2016-01-23T00:00:00Z,Hermés: Fall 2016
5380,2016-01-23T16:30:07+0000,U.S. Relies Heavily on Saudi Money to Support Syrian Rebels
5381,2016-01-23T16:16:39Z,"&#8216;Hillarycare&#8217; Failed, but Hillary Clinton Reminds Voters She Tried"
5382,2016-01-23T16:02:07Z,#Blizzard2016 on Instagram
5383,2016-01-23T15:36:32Z,Negative Words for Negative Ads From Bush-Aligned &#8216;Super PAC&#8217;
5384,2016-01-23T14:55:39Z,No Split Between Simon and Garfunkel Over Bernie Sanders&#8217;s Use of Their Song
5385,2016-01-23T14:24:03Z,One Republican Candidate Wouldn&#8217;t Mind Seeing Michael Bloomberg in the Race
5386,2016-01-23T00:00:00Z,Balmain: Fall 2016
5387,2016-01-23T00:00:00Z,"Status of Airports, Trains and Other Services in the New York Area"
5388,2016-01-23T13:04:29Z,"Levels, Rates, and Sweden"
5389,2016-01-23T13:03:46Z,How To Make Donald Trump President
5390,2016-01-23T12:26:48Z,Shoveling Snow Through the Decades
5391,2016-01-23T12:00:20Z,Variety Puzzle: A Thoughtful Acrostic
5392,2016-01-23T00:00:00Z,Dior Homme: Fall 2016
5393,2016-01-23T09:01:00Z,Wonks and Minions
5394,2016-01-23T09:00:52Z,&#8216;A Little Variety': We Welcome Your Comments
5395,2016-01-23T00:00:00Z,Sacai: Fall 2016
5396,2016-01-23T00:00:00Z,Kenzo: Fall 2016
5397,2016-01-23T00:00:00Z,Snowstorm Sends Heavy Snow Across East Coast
5398,2016-01-23T00:00:00Z,Quotation of the Day
5399,2016-01-23T00:00:00Z,"Corrections: January 23, 2016"
5400,2016-01-23T00:00:00Z,What to Watch Saturday
5401,2016-01-23T00:00:00Z,George Washington Wins
5402,2016-01-23T00:00:00Z,Support for FIFA Hopeful
5403,2016-01-23T00:00:00Z,Two Mets Reach Deals
5404,2016-01-23T00:00:00Z,Svindal Extends Streak
5405,2016-01-23T00:00:00Z,"Islanders Wallop Senators, as the Devils Did Before Them "
5406,2016-01-23T00:00:00Z,Cespedes Deal Proves Mets May Know a Thing or Two
5407,2016-01-23T00:00:00Z,"Paid Notice: Memorials  FELD, ISABEL"
5408,2016-01-23T00:00:00Z,"Paid Notice: Deaths  CHASIN, DR"
5409,2016-01-23T00:00:00Z,"Paid Notice: Deaths  DAYTON, ROBERT"
5410,2016-01-23T00:00:00Z,"Paid Notice: Deaths  BLAUSTEIN, HELEN"
5411,2016-01-23T00:00:00Z,Azarenka Advances to Round of 16; Third-Ranked Muguruza Is Ousted
5412,2016-01-23T00:00:00Z,Flood of Support After Bronx Councilman James Vacca Reveals on Twitter He Is Gay
5413,2016-01-23T00:00:00Z,"Knicks Lose Their Cool, and a Game Slips Away"
5414,2016-01-23T00:00:00Z,Jazz Send the Nets to Their Fifth Loss in a Row
5415,2016-01-23T00:00:00Z,Death of Man in Brooklyn Fire Is Called a Homicide
5416,2016-01-23T00:00:00Z,Spain’s Acting Prime Minister Declines Invitation to Form Government
5417,2016-01-23T00:00:00Z,Success Academy Founder Defends Schools Against Charges of Bias
5418,2016-01-23T00:00:00Z,Coming to Terms with Donald
5419,2016-01-23T00:00:00Z,Ted Cruz Condemns Donald Trump for His Use of Eminent Domain
5420,2016-01-23T00:00:00Z,‘The X-Files’ in the Age of Truthers
5421,2016-01-23T00:00:00Z,A Waiting List for Justice in New Orleans
5422,2016-01-23T00:00:00Z,The Fading Two-State Solution
5423,2016-01-23T00:00:00Z,France Plans a New Keyboard to Shift Control to Typists
5424,2016-01-23T00:00:00Z,Academy Members Respond to Swift Changes for Board
5425,2016-01-23T00:00:00Z,"Scarsdale Man Stabbed Wife 21 Times, Prosecutor Says"
5426,2016-01-23T00:00:00Z,J. T. Miller Leads Rangers Over the Hurricanes
5427,2016-01-23T00:00:00Z,"Clues Emerge on Robert Levinson, C.I.A. Consultant Who Vanished in Iran"
5428,2016-01-23T00:00:00Z,"Marshawn Lynch May End His Career, Seahawks Executive Says"
5429,2016-01-23T00:00:00Z,Who Needs Assassins When You’ve Got Hackers?
5430,2016-01-23T00:00:00Z,UConn Undaunted by Uneven Start (It’s Not March Yet)
5431,2016-01-23T00:00:00Z,"Sarah Palin, This Is What PTSD Is Really Like"
5432,2016-01-23T00:00:00Z,Mosquito-Borne Zika Virus Found in 3 New York State Patients
5433,2016-01-23T00:00:00Z,"Their Boss Stays on the Sideline, but Obama Aides Tilt to Clinton"
5434,2016-01-23T00:00:00Z,2 Women Hurt in Robbery at Hotel Near J.F.K. Airport
5435,2016-01-23T00:00:00Z,Judge Orders Medical Examination of Sumner Redstone
5436,2016-01-23T00:00:00Z,Google Pays Britain $185 Million to Settle Back Taxes
5437,2016-01-23T00:00:00Z,Community Gardens Imperiled by New York’s Affordable Housing Plans
5438,2016-01-23T00:00:00Z,"In Case of Blizzard, Do Nothing"
5439,2016-01-23T00:00:00Z,Storage of Records of Background Checks Shifted After Last Year&#8217;s Security Breach 
5440,2016-01-23T00:00:00Z,Anger in Michigan Over Appointing Emergency Managers
5441,2016-01-23T00:00:00Z,Steven Moffat Leaving ‘Doctor Who’ in 2017
5442,2016-01-23T00:00:00Z,Florida: Man Held in Officer’s Ambush
5443,2016-01-23T00:00:00Z,Illinois: Officers Who Described Shooting Are Taken Off Chicago Streets
5444,2016-01-23T00:00:00Z,Fears About China&#8217;s Economy Fester at Davos
5445,2016-01-23T00:00:00Z,Illinois: Chicago Cuts Public School Jobs
5446,2016-01-23T00:00:00Z,Dole Salads Packaged in Ohio Linked to Listeria Death
5447,2016-01-23T00:00:00Z,Philips Halts Sale of Controlling Stake in LED Business
5448,2016-01-23T00:00:00Z,Review: Keanu Reeves Undertakes an Investigation in ‘Exposed’
5449,2016-01-23T00:00:00Z,"Review: ‘The Boy,’ in Which a Doll May be Alive, or the Heroine May Be Mad"
5450,2016-01-23T00:00:00Z,Review: Daniel Wohl’s ‘Holographic’ Is Performed for the First Time
5451,2016-01-23T00:00:00Z,"Review: ‘A Ride on the Irish Cream,’ Erin Markey’s Tale of an Odd Affair"
5452,2016-01-23T00:00:00Z,"Review: ‘The Book of Disquiet,’ Opera as One Man, With Films"
5453,2016-01-23T00:00:00Z,"Review: ‘Elektra’ Runs Wild, With Ann Liv Young"
5454,2016-01-23T00:00:00Z,"Review: John Epperson Steps Out, Leaving the Diva at Home"
5455,2016-01-23T00:00:00Z,‘Art From the Holocaust’: The Beauty and Brutality in Forbidden Works
5456,2016-01-23T00:00:00Z,Donald Trump Blasts Ted Cruz Using the Senator’s Own Words
5457,2016-01-23T00:00:00Z,Four Killed in Saskatchewan School Shooting
5458,2016-01-23T00:00:00Z,"With Calm and Experience, John Kasich Connects in New Hampshire"
5459,2016-01-23T00:00:00Z,Cow Who Escaped New York Slaughterhouse Finds Sanctuary
5460,2016-01-23T00:00:00Z,"Cavaliers, No. 1 in the East, Fire Coach David Blatt"
5461,2016-01-23T00:00:00Z,Opposing Factions Take to Facebook in Oregon Wildlife Refuge Dispute
5462,2016-01-23T00:00:00Z,"New Suspect in Paris Attacks Is Detained, Belgian Officials Say"
5463,2016-01-23T00:00:00Z,U.S. May Put Forces at Iraqi Bases in Effort to Retake Mosul
5464,2016-01-23T00:00:00Z,Kansas Court of Appeals Voids Restrictive 2015 Abortion Law
5465,2016-01-23T00:00:00Z,"Review: Chelsea Handler Chats Up Racism, Marriage and More"
5466,2016-01-23T00:00:00Z,Haiti Postpones Presidential Runoff as Violence Rises
5467,2016-01-23T00:00:00Z,Interview: The Directors Behind a Mapplethorpe Documentary
5468,2016-01-23T00:00:00Z,Why the Surge in Merger Litigation Fizzled
5469,2016-01-23T00:00:00Z,U.S. and Allies Weigh Military Action Against ISIS in Libya
5470,2016-01-23T00:00:00Z,Goldman Sachs and Morgan Stanley Cut Chiefs’ Pay
5471,2016-01-23T00:00:00Z,Robo-Advisers for Investors Are Not One-Size-Fits-All
5472,2016-01-23T00:00:00Z,Academy Board Endorses Changes to Increase Diversity in Oscar Nominees and Itself
5473,2016-01-23T00:00:00Z,Mexican Politician Is Freed From Jail but Must Stay in Spain
5474,2016-01-23T00:00:00Z,C.D.C. Issues Travel Alert for 8 More Locations Over Zika Virus
5475,2016-01-23T00:00:00Z,Takata Airbag Flaw Linked to 10th Death; 5 Million More Vehicles Recalled
5476,2016-01-23T00:00:00Z,Steve Kerr Returning to the Sideline as the Warriors’ Coach
5477,2016-01-23T00:00:00Z,Lindsey Vonn Is One Victory From Downhill Skiing Record
5478,2016-01-23T00:00:00Z,"Home Resales Rallied in December, and Prices Rose as Well"
5479,2016-01-23T00:00:00Z,"Sundance Officially Sidesteps Oscar Controversy, but Its Opening Film Doesn’t"
5480,2016-01-23T00:00:00Z,A New Year Chill on I.P.O.s
5481,2016-01-23T00:00:00Z,Who Ever Said No Two Snowflakes Were Alike?
5482,2016-01-23T00:00:00Z,"In Gun Debate, the Sides Aren’t Equal"
5483,2016-01-23T00:00:00Z,Measuring Health Care
5484,2016-01-23T00:00:00Z,Alphabet Close to Overtaking Apple as Most Valuable Company
5485,2016-01-23T00:00:00Z,Russians’ Anxiety Swells as Oil Prices Collapse
5486,2016-01-23T00:00:00Z,Talk to Beijing on Markets?
5487,2016-01-23T00:00:00Z,Coal Leasing Moratorium
5488,2016-01-23T00:00:00Z,Food Airdrops to Syrians
5489,2016-01-23T00:00:00Z,"Whitesboro, N.Y., in Reversal, Will Change a Logo Called Racist"
5490,2016-01-23T00:00:00Z,How the Snow Storm Is Affecting Travel
5491,2016-01-23T00:00:00Z,"On Yoenis Cespedes, Mets Have Reason to Proceed With Caution"
5492,2016-01-23T00:00:00Z,Sotheby’s Announces $12 Million Loss Over Taubman Sale
5493,2016-01-23T00:00:00Z,"Man Who Tried to Attack Paris Police Acted Alone, Germany Finds"
5494,2016-01-23T00:00:00Z,"After Preparing for the Snowstorm, Prepare to Shovel"
5495,2016-01-23T00:00:00Z,Netflix and Blizzard: What to Watch During the Storm
5496,2016-01-23T00:00:00Z,Free Tuition at Harvard? It’s Already Affordable
5497,2016-01-23T00:00:00Z,Arrest of Leftist Israeli Activist Underlines Political Split
5498,2016-01-23T00:00:00Z,‘Too Big to Fail’ Banks Thriving a Few Years After Financial Crisis
5499,2016-01-23T00:00:00Z,Charlotte Rampling Says Oscars ‘Boycott’ Is ‘Racist Against Whites’
5500,2016-01-23T00:00:00Z,Belinda Bencic Is a Phenom Who Loves to Lob
5501,2016-01-23T00:00:00Z,Group Backing Jeb Bush Draws on ‘Jeopardy’ to Attack John Kasich
5502,2016-01-23T00:00:00Z,"Bill Johnson, U.S. Olympic Downhill Skiing Champion, Dies at 55"
5503,2016-01-23T00:00:00Z,Opposition and Confusion at Hearing on Mayor de Blasio’s Horse Plan
5504,2016-01-23T00:00:00Z,The Price of Requiring Regulators to Do More Cost-Benefit Analysis
5505,2016-01-23T00:00:00Z,Michigan Governor Says Race Had No Role in Flint Water Response
5506,2016-01-23T00:00:00Z,"Grigor Dimitrov, a Federer-Like Player, Loses Again to the Real Thing"
5507,2016-01-23T00:00:00Z,U.S. Moves to Limit Emissions of Planet-Warming Methane
5508,2016-01-23T00:00:00Z,Some Evangelicals Struggle With Black Lives Matter Movement
5509,2016-01-23T00:00:00Z,Russian Fund Under Scrutiny for Loan to Company Linked to Kremlin
5510,2016-01-23T11:30:00Z,Ease the Burden on Okinawans
5511,2016-01-23T00:00:00Z,When College Scholarship Programs Falter
5512,2016-01-23T00:00:00Z,Judge Dismisses G.M.’s First Ignition Defect Case
5513,2016-01-23T11:30:00Z,Letters to the Editor
5514,2016-01-23T00:00:00Z,Voice for Hazaras Laments Lost Chances in Afghanistan’s Tumult
5515,2016-01-23T11:30:00Z,Europe's New Normal
5516,2016-01-23T00:00:00Z,"Stuff We Liked: Judge Judy, Best Countries, Unlikely Job Hunts"
5517,2016-01-23T11:30:00Z,Chappatte on Sarah Palin’s Endorsement of Donald Trump
5518,2016-01-23T00:00:00Z,Market Picks Up Steam as Oil Prices Rise
5519,2016-01-23T00:00:00Z,Lincoln Center Will Create a Performing Arts Hall of Fame
5520,2016-01-23T00:00:00Z,Making the Screen Easier to Read
5521,2016-01-23T00:00:00Z,Israeli Forces Remove Dozens of Settlers From Hebron Homes
5522,2016-01-23T00:00:00Z,Tunisia Sets Nationwide Curfew Amid Growing Unrest
5523,2016-01-23T00:00:00Z,Dire Warnings Along East Coast as Snow Piles Up
5524,2016-01-23T00:00:00Z,Fashion Wants Alber Elbaz to Start His Own Line
5525,2016-01-23T00:00:00Z,Carefully Considering Pension Payment Options
5526,2016-01-23T00:00:00Z,Clinton-Sanders Battle in Iowa May Be Decided by O’Malley Supporters
5527,2016-01-23T00:00:00Z,G.E. Reports Strong Quarterly Profit but Sales Are Below Forecasts
5528,2016-01-23T00:00:00Z,Jason Rezaian Travels to U.S. on Washington Post Owner’s Plane
5529,2016-01-23T00:00:00Z,Jonathan Anderson for Loewe: ‘A Purist Kind of Thing’
5530,2016-01-23T13:00:00Z,All Blacks Add Spice to European Cup
5531,2016-01-23T00:00:00Z,"In Fast Transition, Maryland Excels Under New Rules"
5532,2016-01-23T00:00:00Z,Salonen Makes Clear He Won’t Lead New York Philharmonic
5533,2016-01-23T00:00:00Z,Q. and A.: Shawna Yang Ryan on the 1947 Incident That Shaped Taiwan’s Identity
5534,2016-01-23T00:00:00Z,"Vietnam’s Sacred Turtle Dies at an Awkward, Some Say Ominous, Time"
5535,2016-01-23T00:00:00Z,Dozens of Migrants Drown as European Refugee Crisis Continues
5536,2016-01-23T00:00:00Z,Shabab Stage Deadly Attack on Beachfront Restaurant in Mogadishu
5537,2016-01-23T00:00:00Z,North Korea Says It’s Holding U.S. Student for ‘Hostile Act’
5538,2016-01-23T00:00:00Z,A G.O.P. Majority in New Hampshire Pipes Up: We’re Not for Donald Trump
5539,2016-01-23T00:00:00Z,Chris Christie and His Ambitions: A New Jersey Vanishing Act
5540,2016-01-23T00:00:00Z,Older Drivers Hit the Road for Uber and Lyft
5541,2016-01-23T00:00:00Z,Sheldon Silver’s Lawyers Seek Acquittal or Retrial in Corruption Case
5542,2016-01-23T00:00:00Z,Philips Calls Off Sale of Controlling Stake in LED Business
5543,2016-01-23T00:00:00Z,Global Markets Continue to Rally as Investors Seek Bargains
5544,2016-01-23T00:00:00Z,Japan Economy Minister Fights Accusations of Selling Favors
5545,2016-01-23T00:00:00Z,A Chance to Dance for Minority Ballerinas
5546,2016-01-23T00:00:00Z,"Mustafa Koc, Leader of Turkish Conglomerate, Dies at 55"
5547,2016-01-23T00:00:00Z,Ways to Be Free
5548,2016-01-23T00:00:00Z,"Noreen Corcoran, ‘Bachelor Father’ Actress, Dies at 72"
5549,2016-01-24T00:00:00Z,Editorial: Naciones Unidas puede sellar la paz en Colombia
5550,2016-01-24T00:00:00Z,Miedo y frustración incrementan los linchamientos en México
5551,2016-01-24T00:00:00Z,‘The X-Files’ Season 10 Premiere: A Crazier Mulder Than Usual
5552,2016-01-24T00:00:00Z,"‘Billions’ Season 1, Episode 2: Part of the Firmament"
5553,2016-01-24T00:00:00Z,"‘Downton Abbey’ Season 6, Episode 4: The Engine Purrs"
5554,2016-01-24T21:46:09Z,Boston Globe Endorses Hillary Clinton
5555,2016-01-24T21:44:13Z,Donald Trump Did Stay at a Holiday Inn Express on Friday Night
5556,2016-01-24T18:00:45Z,Puppy Amuser
5557,2016-01-24T00:00:00Z,For the Love of Broadway
5558,2016-01-24T17:24:32Z,Winter Wonderland in Manhattan’s Heart
5559,2016-01-24T00:00:00Z,Versace: Couture
5560,2016-01-24T16:47:31Z,Donald Trump Hears a Lesson in Humility at Church
5561,2016-01-24T00:00:00Z,Making a Haute Couture Look: Atelier Versace
5562,2016-01-24T00:00:00Z,Thom Browne: Fall 2016
5563,2016-01-24T14:55:50Z,Studio in a School Expands Arts Education Nationwide
5564,2016-01-24T14:39:17Z,Chris Christie Warns New Hampshire Against Voting for Donald Trump
5565,2016-01-24T00:00:00Z,Umit Benan: Fall 2016
5566,2016-01-24T12:52:36Z,1966: Indira Gandhi Becomes Prime Minister
5567,2016-01-24T00:00:00Z,What to Watch Sunday
5568,2016-01-24T12:29:00Z,Chris Christie Attacks Marco Rubio Over Blizzard Remark
5569,2016-01-24T00:00:00Z,Men’s Fashion Week: Hermès and Sacai in Pictures
5570,2016-01-24T12:15:36Z,Hillary Clinton Says Senator Charles Grassley Wants &#8216;to Defeat Me&#8217;
5571,2016-01-24T12:09:56Z,Candidates React to Bloomberg With Dismissals and Differences
5572,2016-01-24T00:00:00Z,"The East Coast, Coated by a Winter Blast"
5573,2016-01-24T00:00:00Z,What to Cook This Week
5574,2016-01-24T00:00:00Z,"The Snowstorm Is Over, but Travel Delays Aren’t"
5575,2016-01-24T00:00:00Z,"Marriage, Poverty and the Political Divide"
5576,2016-01-24T09:49:54Z,1941: Minister Says British Gains Aided Palestine
5577,2016-01-24T09:00:29Z,Drone Lobbying Heats Up on Capitol Hill
5578,2016-01-24T00:00:00Z,Lanvin: Fall 2016
5579,2016-01-24T06:40:15Z,Loving a Grandpa Right Down to His Toes
5580,2016-01-24T00:00:00Z,"Your Weekend Briefing: Blizzard, Bloomberg, N.F.L."
5581,2016-01-24T00:00:00Z,Your Weekend Briefing
5582,2016-01-24T01:33:55+0000,Bernie Sanders and Fans Embrace Tune of ‘America’ in Ad Free of Attacks
5583,2016-01-24T00:00:00Z,Quotation of the Day
5584,2016-01-24T00:00:00Z,"Corrections: January 24, 2016"
5585,2016-01-24T00:00:00Z,"Hena Daniels, Andrew Doba"
5586,2016-01-24T00:00:00Z,"Margaret Howe, Sergio Vera Gutiérrez"
5587,2016-01-24T00:00:00Z,"Isabel Solmonson, Elliot Cohen"
5588,2016-01-24T00:00:00Z,"Elise Chang, Alastair Kusack"
5589,2016-01-24T00:00:00Z,McIlroy Is One of the Leaders
5590,2016-01-24T00:00:00Z,"Kenneth Cohen, Christopher Conway"
5591,2016-01-24T00:00:00Z,United Shocked at Home
5592,2016-01-24T00:00:00Z,Julia Groeblacher and Daniel Castillo: They’ll Always Have Baghdad
5593,2016-01-24T00:00:00Z,"Sarah Pous, Thomas Brown V"
5594,2016-01-24T00:00:00Z,"Danielle Borovoy, Daniel Greenberg"
5595,2016-01-24T00:00:00Z,"Stephanie Schneider, Matthew Schwartz"
5596,2016-01-24T00:00:00Z,"Bruce Gober, Donald Ratner"
5597,2016-01-24T00:00:00Z,"James Purcell Jr., Barry Steinhart"
5598,2016-01-24T00:00:00Z,"Allison White, Matthew Alexander"
5599,2016-01-24T00:00:00Z,"Maria Simon, Adam Kushner"
5600,2016-01-24T00:00:00Z,"Amélie de Richemont, Thomas Atkinson"
5601,2016-01-24T00:00:00Z,Knicks Show Little but Midseason Malaise in Loss to Hornets
5602,2016-01-24T00:00:00Z,Lindsay Vonn Sets Downhill Record
5603,2016-01-24T00:00:00Z,"Paid Notice: Deaths  HAINES, DANIEL W."
5604,2016-01-24T00:00:00Z,"Paid Notice: Deaths  MISSETT, BARBARA THATCHER"
5605,2016-01-24T00:00:00Z,"Paid Notice: Deaths  TIPSON, LYNN BAIRD"
5606,2016-01-24T00:00:00Z,"Paid Notice: Deaths  CHASIN, DR"
5607,2016-01-24T00:00:00Z,"Paid Notice: Deaths  BOTTNER, HAROLD"
5608,2016-01-24T00:00:00Z,"Paid Notice: Deaths  VAN NESS, JOHN R."
5609,2016-01-24T00:00:00Z,"Paid Notice: Deaths  WASHINGTON, BRYAN R."
5610,2016-01-24T00:00:00Z,"Paid Notice: Deaths  BOROWITZ, RABBI EUGENE"
5611,2016-01-24T00:00:00Z,"Paid Notice: Deaths  BLAUSTEIN, HELEN"
5612,2016-01-24T00:00:00Z,"Paid Notice: Deaths  PARKER, JUDSON GARRETT"
5613,2016-01-24T00:00:00Z,"Paid Notice: Deaths  FLEISCHER, PAULA"
5614,2016-01-24T00:00:00Z,"Paid Notice: Deaths  MCCAFFREY, SUSAN MARY"
5615,2016-01-24T00:00:00Z,"Paid Notice: Deaths  LEVY, NORMA"
5616,2016-01-24T00:00:00Z,"Paid Notice: Deaths  REED, HOWARD"
5617,2016-01-24T00:00:00Z,"Paid Notice: Deaths  DAYTON, ROBERT"
5618,2016-01-24T00:00:00Z,"Paid Notice: Deaths  SLOAN, HOWARD"
5619,2016-01-24T00:00:00Z,"Paid Notice: Deaths  SPIRO, EMIL"
5620,2016-01-24T00:00:00Z,"Paid Notice: Deaths  WILLENSKY, MIRIAM"
5621,2016-01-24T00:00:00Z,"Paid Notice: Deaths  IMMERMAN, ROBERT M."
5622,2016-01-24T00:00:00Z,"Paid Notice: Deaths  WARHEIT, WALTER S"
5623,2016-01-24T00:00:00Z,"Paid Notice: Deaths  LEVITT, NELSON"
5624,2016-01-24T00:00:00Z,"Paid Notice: Deaths  EVANS, JOHN C"
5625,2016-01-24T00:00:00Z,"Paid Notice: Deaths  LAMONT, AUSTIN"
5626,2016-01-24T00:00:00Z,"Paid Notice: Deaths  WEIDENFELD, LORD GEORGE"
5627,2016-01-24T00:00:00Z,"Paid Notice: Deaths  BARNWELL, JOHN"
5628,2016-01-24T00:00:00Z,"Paid Notice: Deaths  FEINBERG, JACOB"
5629,2016-01-24T00:00:00Z,"Paid Notice: Deaths  WALKER, ROBERT STRINGFELLOW IV ""BOB."" 74"
5630,2016-01-24T00:00:00Z,"Paid Notice: Deaths  GERSTEL, JOEL M."
5631,2016-01-24T00:00:00Z,"Paid Notice: Deaths  GIBBONS, MARTHE"
5632,2016-01-24T00:00:00Z,"Paid Notice: Deaths  MCGRATH, EARL"
5633,2016-01-24T00:00:00Z,"Paid Notice: Deaths  GILBERT, WILLIAM"
5634,2016-01-24T00:00:00Z,"Paid Notice: Deaths  COLBY, MARVELLE (SEITMAN)"
5635,2016-01-24T00:00:00Z,"Paid Notice: Deaths  MACHT, STANLEY H."
5636,2016-01-24T00:00:00Z,"Paid Notice: Deaths  CHILDS, KIRSTEN ANNE"
5637,2016-01-24T00:00:00Z,"Paid Notice: Deaths  COHEN, LESTER"
5638,2016-01-24T00:00:00Z,"Paid Notice: Deaths  BOROWITZ, RABBI EUGENE BERNARD"
5639,2016-01-24T00:00:00Z,"Paid Notice: Deaths  ZIELENZIGER, DR"
5640,2016-01-24T00:00:00Z,"Paid Notice: Deaths  KADISON, RHODA"
5641,2016-01-24T00:00:00Z,"Paid Notice: Deaths  WASHBURN, SETH H"
5642,2016-01-24T00:00:00Z,"Paid Notice: Deaths  GREENFELD, MARVIN"
5643,2016-01-24T00:00:00Z,"Paid Notice: Deaths  SHEIB, MARC B."
5644,2016-01-24T00:00:00Z,"Paid Notice: Deaths  SHEPPARD, ANNAMAY"
5645,2016-01-24T00:00:00Z,"Paid Notice: Deaths  ABRAMSON, RICHARD"
5646,2016-01-24T00:00:00Z,"Paid Notice: Deaths  VANDERSALL, THORNTON M.D"
5647,2016-01-24T00:00:00Z,"Paid Notice: Deaths  POLLNER, MARTIN"
5648,2016-01-24T00:00:00Z,"Paid Notice: Deaths  EPPLER, JEROME C"
5649,2016-01-24T00:00:00Z,"Paid Notice: Deaths  GANZ, ARNOLD R."
5650,2016-01-24T00:00:00Z,"Paid Notice: Deaths  MURPHY, ARTHUR W."
5651,2016-01-24T00:00:00Z,"Paid Notice: Deaths  RABINOVITCH, RALPH D"
5652,2016-01-24T00:00:00Z,"Paid Notice: Deaths  SIDEROW, NEIL"
5653,2016-01-24T00:00:00Z,"Paid Notice: Deaths  RYAN, DR. JAMES H."
5654,2016-01-24T00:00:00Z,"Paid Notice: Deaths  GERSTEL, JOEL"
5655,2016-01-24T00:00:00Z,"Paid Notice: Deaths  FREDENBURGH, HAROLD"
5656,2016-01-24T00:00:00Z,"Paid Notice: Memorials  WEIDENFELD, LORD GEORGE THE AMERICA, ISRAEL FRIENDSHIP LEAGUE EXPRESSES ITS GREAT SORROW AT THE PASSING OF LORD GEORGE WEIDENFELD. HIS WISDOM, EXPERIENCE, GOOD WILL AND WARM FRIENDSHIP CAN NEVER BE REPLACED AND WILL NEVER BE FORGOTTEN. HIS ACTIVITIES IN SUPPORT OF EFFORTS TO RESOLVE THE CHALLENGES OF INTERNATIONAL AFFAIRS INVOLVED INTIMATE CONTACT WITH WORLD LEADERS AT THE HIGHEST LEVELS. HE WILL ESPECIALLY BE REMEMBERED FOR GUIDING THE RENEWAL OF GERMAN PARTICIPATION IN WORLD AFFAIRS WHICH ACCELERATED GERMANY'S ACCEPTANCE IN THE COUNCILS OF PEACE AND CONSTRUCTIVE DIALOGUE. HIS COMMITMENT TO THE SURVIVAL AND SUCCESS OF ISRAEL IN WORLD AFFAIRS CAN BE MATCHED BY FEW PARTICIPANTS IN INTERNATIONAL DIPLOMACY. WE SEND OUR SINCERE CONDOLENCES TO LADY WEIDENFELD AND HIS ADORING FAMILY. MORTIMER B. ZUCKERMAN, HONORARY PRESIDENT; KENNETH J. BIALKIN, CHAIRMAN; AMBASSADOR DAN GILLERMAN, CHAIRMAN OF ISRAEL BOARD; DANIELLA RILOV, EXECUTIVE DIRECTOR; RUBY SHAMIR, EXECUTIVE DIRECTOR, AIFL ISRAEL AND DIRECTOR OF INTERNATIONAL OPERATIONS; DR. CHARLOTTE K. FRANK, CHAIR, EXECUTIVE COMMITTEE; IRA J. GREENBLATT, TREASURER; PETER J. HALASZ, SECRETARY JAMES S. TISCH 1"
5657,2016-01-24T00:00:00Z,"Paid Notice: Deaths  FITZSIMONS, JOHN JOSEPH"
5658,2016-01-24T00:00:00Z,"Paid Notice: Deaths  GERSTEL, JOEL"
5659,2016-01-24T00:00:00Z,A Day of Endorsements for Presidential Candidates in Iowa
5660,2016-01-24T00:00:00Z,Bernie Sanders Courts Elusive Voters: Young Iowans
5661,2016-01-24T00:00:00Z,Gas Leak in Los Angeles Has Residents Looking Warily Toward Flint
5662,2016-01-24T00:00:00Z,The Big Four in Saudi Arabia’s Government
5663,2016-01-24T00:00:00Z,When the Water Turned Brown 
5664,2016-01-24T00:00:00Z,Penguins Rally for Win Behind Star&#8217;s Hat Trick; Sharks Edge Wild on a Late Goal 
5665,2016-01-24T00:00:00Z,LeBron James and Tyronn Lue Agree on Need to Improve
5666,2016-01-24T00:00:00Z,"After a Double About-Face, Yoenis Cespedes Is Back in Queens"
5667,2016-01-24T00:00:00Z,El Salvador Advises Against Pregnancy Until 2018 in Answer to Zika Fears
5668,2016-01-24T00:00:00Z,"La Loche, the Canadian Town Where 4 Were Killed, Has a Bleak History"
5669,2016-01-24T00:00:00Z,"Iraqi Leader Asks U.S. for Help to Train Police Forces, Officials Say"
5670,2016-01-24T00:00:00Z,Kansas Follows Cold Start With a Hot Finish to Beat Texas
5671,2016-01-24T00:00:00Z,"Afghan Officials, Voicing Security Fears on Facebook, Are Fired for Their Trouble"
5672,2016-01-24T00:00:00Z,Crackdown by Egypt Draws Attention to an Anniversary It Aimed to Avoid 
5673,2016-01-24T00:00:00Z,"A Lake in Bolivia Evaporates, and With It a Way of Life"
5674,2016-01-24T00:00:00Z,Health Scare Eclipses Action on Courts; Bottom of Draw Offers Path for Azarenka 
5675,2016-01-24T00:00:00Z,"For Many Workers, Staying Home Is Not an Option During Blizzard"
5676,2016-01-24T00:00:00Z,"Duquesne Basketball Team, Stuck on Turnpike, Plays Cards and Makes a Snow Angel"
5677,2016-01-24T00:00:00Z,Failed Talks Raise Specter of Biggest Default in Puerto Rico Crisis
5678,2016-01-24T00:00:00Z,Dennis Hastert’s Lawyers Ask for a Sentencing Delay
5679,2016-01-24T00:00:00Z,Manson Follower Denied Parole Again in California
5680,2016-01-24T00:00:00Z,Mississippi State&#8217;s Rise Follows Its &#8216;Pied Piper&#8217; 
