,pub_date,headline
2043,2016-01-10T00:00:00Z,"Paid Notice: Deaths  FULLER, LEE M."
2044,2016-01-10T00:00:00Z,"Paid Notice: Deaths  DELFINER, HENRY"
2045,2016-01-10T00:00:00Z,"Paid Notice: Deaths  MCKEAND, CAROL EVAN"
2046,2016-01-10T00:00:00Z,"Paid Notice: Deaths  STANLEY, TED"
2047,2016-01-10T00:00:00Z,"Paid Notice: Deaths  HALPERT, CAROLYN MCDANIEL"
2048,2016-01-10T00:00:00Z,"Paid Notice: Deaths  SQUIRE, ANNETTE C"
2049,2016-01-10T00:00:00Z,"Paid Notice: Deaths  SWEENEY, ANNE J"
2050,2016-01-10T00:00:00Z,"Paid Notice: Deaths  KAYE, HON"
2051,2016-01-10T00:00:00Z,"Paid Notice: Deaths  RYAN, DAVID FRANCIS"
2052,2016-01-10T00:00:00Z,"Paid Notice: Deaths  SULSER, FRIDOLIN"
2053,2016-01-10T00:00:00Z,"Paid Notice: Deaths  KAYE, JUDGE JUDITH S"
2054,2016-01-10T00:00:00Z,"Paid Notice: Deaths  ROSENBERG, IRVING"
2055,2016-01-10T00:00:00Z,"Paid Notice: Deaths  O'BRIEN, MRS"
2056,2016-01-10T00:00:00Z,"Paid Notice: Deaths  KAYE, HON"
2057,2016-01-10T00:00:00Z,"Paid Notice: Memorials  WALTUCH, RANDALL E"
2058,2016-01-10T00:00:00Z,"Paid Notice: Deaths  BERG, IVAR E"
2059,2016-01-10T00:00:00Z,"Paid Notice: Deaths  HOWAT, ANNE H"
2060,2016-01-10T00:00:00Z,"Paid Notice: Deaths  KAYE, JUDITH S"
2061,2016-01-10T00:00:00Z,"Paid Notice: Deaths  KAYE, JUDITH"
2062,2016-01-10T00:00:00Z,"Paid Notice: Deaths  LONSDALE, JOHN WHITTAKER"
2063,2016-01-10T00:00:00Z,"Paid Notice: Deaths  SHIELDS, WILLIAM X."
2064,2016-01-10T00:00:00Z,"Paid Notice: Deaths  KAYE, JUDITH"
2065,2016-01-10T00:00:00Z,"Paid Notice: Deaths  VON ZUBEN, FREDERICK G."
2066,2016-01-10T00:00:00Z,"Paid Notice: Deaths  KAYE, HONORABLE JUDITH S"
2067,2016-01-10T00:00:00Z,"Paid Notice: Deaths  WOLNEK, STEPHEN"
2068,2016-01-10T00:00:00Z,"Paid Notice: Deaths  KURZ, RONA HOFFMAN"
2069,2016-01-10T00:00:00Z,"Paid Notice: Deaths  KAYE, JUDITH"
2070,2016-01-10T00:00:00Z,"Paid Notice: Deaths  KREMEN, ANDREA"
2071,2016-01-10T00:00:00Z,"Paid Notice: Deaths  SEFF, GLORIA NELSON"
2072,2016-01-10T00:00:00Z,"Paid Notice: Deaths  PAHLAVI, HER IMPERIAL HIGHNESS PRINCESS ASHRAF"
2073,2016-01-10T00:00:00Z,"Woman Raped by 5 Men in Brooklyn Playground, Police Say"
2074,2016-01-10T00:00:00Z,Los actores Sean Penn y Kate del Castillo entrevistaron a ‘El Chapo’ en México para la revista Rolling Stone
2075,2016-01-10T00:00:00Z,Sean Penn Met With ‘El Chapo’ for Interview in His Hide-Out
2076,2016-01-10T00:00:00Z,‘Girls’ Creator Lena Dunham Visits Iowa on Tour to Support Hillary Clinton
2077,2016-01-10T00:00:00Z,Chiefs End 22-Year Run of Playoff Futility by Thrashing the Texans
2078,2016-01-10T00:00:00Z,U.S.C. Upends Arizona in Four Overtimes
2079,2016-01-10T00:00:00Z,"Taliban Step Up Urban Assaults, Testing the Mettle of Afghan Forces"
2080,2016-01-10T00:00:00Z,Insurers Say Costs Are Climbing as More Enroll Past Health Act Deadline 
2081,2016-01-10T00:00:00Z,Flyers Shut Out Islanders for Third Straight Win
2082,2016-01-10T00:00:00Z,Two Young Pistons Step Up in a Win Over the Nets
2083,2016-01-10T00:00:00Z,"La película biográfica que ‘El Chapo’ quería hacer llevó a su captura, según el gobierno mexicano"
2084,2016-01-10T00:00:00Z,Gobierno de México considera extraditar a Joaquín ‘El Chapo’ Guzmán a Estados Unidos
2085,2016-01-10T00:00:00Z,"Republican Candidates, Minus Donald Trump and Ted Cruz, Play Nice at Poverty Forum"
2086,2016-01-10T00:00:00Z,Talks on Phoenix Bus Strike Hit an Impasse
2087,2016-01-10T00:00:00Z,"Cubans, Fearing Loss of Favored Status in U.S., Rush to Make an Arduous Journey"
2088,2016-01-10T00:00:00Z,A Tumultuous Housing Program in Algeria
2089,2016-01-10T00:00:00Z,Separatists in Catalonia Select Leader to Avoid Vote
2090,2016-01-10T00:00:00Z,All-Bedouin Tech Company Hints at Shift in Israel
2091,2016-01-10T00:00:00Z,"China’s Hunger for Commodities Wanes, and Pain Spreads Among Producers"
2092,2016-01-10T00:00:00Z,"Flint Wants Safe Water, and Someone to Answer for Its Crisis "
2093,2016-01-10T00:00:00Z,Lindsey Vonn’s 36th Downhill Win Ties a Mark
2094,2016-01-10T00:00:00Z,Carmelo Anthony Shares the Load by Shooting Less and Trusting More
2095,2016-01-10T00:00:00Z,Rangers Take Unlikely Lead but Are Still Seeking a Turnaround
2096,2016-01-10T00:00:00Z,"Teams Find That Help Could Be on a Couch, a Long-Distance Call Away "
2097,2016-01-10T00:00:00Z,Rest vs. Rust: A Bye Offers No Guarantees
2098,2016-01-10T00:00:00Z,Vikings Coach’s Trouble With Winning: Enjoying It
2099,2016-01-10T00:00:00Z,Rick Cluchey Dies at 82; Prison Theater Was His Redemption
2100,2016-01-10T00:00:00Z,Real Madrid Wins Easily in Zidane’s Debut as Coach
2101,2016-01-10T00:00:00Z,"Florence King, Writer Who Wielded an Acerbic Wit, Dies at 80"
2102,2016-01-10T00:00:00Z,A Placebo Treatment for Pain
2103,2016-01-10T00:00:00Z,Two Sides of Gratitude
2104,2016-01-10T00:00:00Z,"Review: Cielo, an Italian Restaurant in Wilton, Brims with Variety"
2105,2016-01-10T00:00:00Z,"Back in Postseason, the Redskins Move On From a Loss That Lingered"
2106,2016-01-10T00:00:00Z,How to Fix the Country’s Failing Schools. And How Not To.
2107,2016-01-10T00:00:00Z,America and Its Fellow Executioners
2108,2016-01-10T00:00:00Z,Adam Gase Is Hired as the Dolphins’ Coach
2109,2016-01-10T00:00:00Z,"Review: Butcher’s Bar &amp; Grill, a Newcomer in Williston Park"
2110,2016-01-10T00:00:00Z,"At the Supreme Court, a Big Threat to Unions"
2111,2016-01-10T00:00:00Z,Review: Eastern Comforts at Roots Asian Kitchen
2112,2016-01-10T00:00:00Z,Egypt’s President Turns to Religion to Bolster His Authority
2113,2016-01-10T00:00:00Z,"Leo, Hillary and Their Bears"
2114,2016-01-10T00:00:00Z,"As College Football’s Popularity Expands, So Does Its Champions’ Jewelry"
2115,2016-01-10T00:00:00Z,The Ideological Roots of the Oregon Standoff
2116,2016-01-10T00:00:00Z,St. Teresa and the Single Ladies
2117,2016-01-10T00:00:00Z,The Joy of Psyching Myself Out­
2118,2016-01-10T00:00:00Z,Drone Regulations Should Focus on Safety and Privacy
2119,2016-01-10T00:00:00Z,Is the Hoverboard Cool?
2120,2016-01-10T00:00:00Z,"Scientists, Give Up Your Emails"
2121,2016-01-10T00:00:00Z,Obnoxiousness Is the New Charisma
2122,2016-01-10T00:00:00Z,The Strip
2123,2016-01-10T00:00:00Z,"To Be Happier, Start Thinking More About Your Death"
2124,2016-01-10T00:00:00Z,A Year of Challenges in the News Business­
2125,2016-01-10T00:00:00Z,Myanmar’s Peace Prize Winner and Crimes Against Humanity
2126,2016-01-10T00:00:00Z,"As Fatherhood Nears, Love Is the High Score"
2127,2016-01-10T00:00:00Z,"When She Gets Into the Kitchen, a Young Woman Gets ‘in the Zone’"
2128,2016-01-10T00:00:00Z,"In Hartford Schools, Granting Artistic License to Learn"
2129,2016-01-10T00:00:00Z,Security for College Football Championship Game Is Strengthened
2130,2016-01-10T00:00:00Z,Clash in &#8217;08 Put Clemson and Alabama on Path to Current Title Game
2131,2016-01-10T00:00:00Z,"Mexican Drug Lord’s Quest for Movie Fame Helped Lead to Capture, Official Says"
2132,2016-01-10T00:00:00Z,Dorthaan Kirk Is Newark’s First Lady of Jazz
2133,2016-01-10T00:00:00Z,A Start-Up That Aims to Bring Back the Farm-to-Vase Bouquet
2134,2016-01-10T00:00:00Z,There Are Debates That Even a Playoff Will Never Settle
2135,2016-01-10T00:00:00Z,Mexico Moves to Extradite Drug Kingpin Called El Chapo to the U.S.
2136,2016-01-10T00:00:00Z,"For Republicans, Mounting Fears of Lasting Split"
2137,2016-01-10T00:00:00Z,Tom Coughlin Is Expected to Talk With Eagles About Coaching Job
2138,2016-01-10T00:00:00Z,"Challenging Uber, Lyft Bets on a Road Wide Enough for Two"
2139,2016-01-10T00:00:00Z,Drawing on Experience to Teach Independent Living Skills
2140,2016-01-10T00:00:00Z,One Market Prediction Is Sure: Wall Street Will Be Wrong
2141,2016-01-10T00:00:00Z,Christopher Cabrera of Xactly: Learning to Stay Above the Drama
2142,2016-01-10T00:00:00Z,"Marco Rubio Shows N.F.L. Fans He’s One of Them, and Smiles"
2143,2016-01-10T00:00:00Z,SoHo. TriBeCa. And ReBeCha? 
2144,2016-01-10T00:00:00Z,How ‘Crazy’ Are the North Koreans?
2145,2016-01-10T00:00:00Z,"Farhad and Mike’s Week in Tech: Cars With, and Without, Drivers"
2146,2016-01-10T00:00:00Z,‘Broken System’ Allows ISIS to Profit From Looted Antiquities
2147,2016-01-10T00:00:00Z,New York Police Officer Is Shot Breaking Up a Brawl in the Bronx
2148,2016-01-10T00:00:00Z,A Backyard Fight Club as an Alternative to Gun Violence
2149,2016-01-10T00:00:00Z,Campus Sex … With a Syllabus
2150,2016-01-10T00:00:00Z,Chasing the Lure of a Royal Past With Greyhound Racing in Punjab
2151,2016-01-10T00:00:00Z,The Lark-Owl Scale: When Couples’ Sleep Patterns Diverge
2152,2016-01-10T00:00:00Z,Doctors Unionize to Resist the Medical Machine
2153,2016-01-10T00:00:00Z,Bill Cunningham | Winter Flair
2154,2016-01-10T00:00:00Z,Evening Hours | New Year’s Eve at the Metropolitan Opera
2155,2016-01-10T00:00:00Z,"For a Local Sinatra, Construction, Crooning and Despair"
2156,2016-01-10T00:00:00Z,You Don’t Need More Free Time
2157,2016-01-10T00:00:00Z,"For the New York Yankees, a Troubling Trade"
2158,2016-01-10T00:00:00Z,"How Al Roker and His Wife, Deborah Roberts, Spend Their Sundays"
2159,2016-01-10T00:00:00Z,Big City Book Club to Discuss ‘We Are Not Ourselves’
2160,2016-01-10T00:00:00Z,Inside The New York Times Book Review Podcast: ‘The Defender’
2161,2016-01-10T00:00:00Z,Young Moviemakers Meet Old Masters at the Frick
2162,2016-01-10T00:00:00Z,"Stories of Brooklyn, From Gowanus to the Heights"
2163,2016-01-10T00:00:00Z,"European Starling, the Bard’s Bird"
2164,2016-01-10T00:00:00Z,"Old Mariner, With Rhymes and Love for East Village"
2165,2016-01-10T00:00:00Z,Exclusive | 101 Warren Street
2166,2016-01-10T00:00:00Z,Albert Watson’s TriBeCa Penthouse Listed at $21.5 Million
2167,2016-01-10T00:00:00Z,"For $26 Million, Terraces in Greenwich Village"
2168,2016-01-10T00:00:00Z,Janet Delaney Photographs New York in the 1980s
2169,2016-01-10T00:00:00Z,A State of Mind
2170,2016-01-10T00:00:00Z,When Can Women Stop Trying to Look Perfect?
2171,2016-01-10T00:00:00Z,"On Location | Amenia, N.Y."
2172,2016-01-10T00:00:00Z,A Country House for a Family of Six
2173,2016-01-10T00:00:00Z,Home Sales Around the New York Region
2174,2016-01-10T00:00:00Z,"‘Dictator,’ by Robert Harris"
2175,2016-01-10T00:00:00Z,"‘The Geography of Genius,’ by Eric Weiner"
2176,2016-01-10T00:00:00Z,"‘Shame and Wonder,’ by David Searcy"
2177,2016-01-10T00:00:00Z,"‘The Idealist: Aaron Swartz and the Rise of Free Culture on the Internet,’ by Justin Peters"
2178,2016-01-10T00:00:00Z,"‘One Child,’ by Mei Fong"
2179,2016-01-10T00:00:00Z,"‘Alex Haley: And the Books That Changed a Nation,’ by Robert J. Norrell"
2180,2016-01-10T00:00:00Z,"Christopher Hitchens’s ‘And Yet . . .’ and Roger Scruton’s ‘Fools, Frauds and Firebrands’"
2181,2016-01-10T00:00:00Z,New York City
2182,2016-01-10T00:00:00Z,"‘Fake Missed Connections,’ by Brett Fletcher Lauer"
2183,2016-01-10T00:00:00Z,Words Unwired 
2184,2016-01-10T00:00:00Z,Dave Hickey’s ‘25 Women: Essays on Their Art’
2185,2016-01-10T00:00:00Z,"‘Defenders of the Unborn,’ by Daniel K. Williams"
2186,2016-01-10T00:00:00Z,"‘Paradise City,’ by Elizabeth Day"
2187,2016-01-10T00:00:00Z,"‘The Sleep of the Righteous,’ by Wolfgang Hilbig"
2188,2016-01-10T00:00:00Z,On the Market in New York and New Jersey
2189,2016-01-10T00:00:00Z,Homes for Sale in New York and New Jersey
2190,2016-01-10T00:00:00Z,In the Presence of History
2191,2016-01-10T00:00:00Z,Editors’ Choice
2192,2016-01-10T00:00:00Z,Paperback Row
2193,2016-01-10T00:00:00Z,Letters: The Year in Poetry
2194,2016-01-10T00:00:00Z,When Teamwork Doesn’t Work for Women
2195,2016-01-10T00:00:00Z,On the Market in New York City
2196,2016-01-10T00:00:00Z,Homes for Sale in Brooklyn and Manhattan
2197,2016-01-10T00:00:00Z,"Ratings Agencies Still Coming Up Short, Years After Crisis"
2198,2016-01-10T00:00:00Z,A Fighter’s Hour of Need
2199,2016-01-10T00:00:00Z,Independent Spirit in Many Flavors at the Out of Israel Showcase at 92Y
2200,2016-01-10T00:00:00Z,Winter Jazzfest Returns With a Marathon
2201,2016-01-10T00:00:00Z,Jane Bryant Quinn’s Upper West Side Home
2202,2016-01-10T00:00:00Z,What I Love | Jane Bryant Quinn
2203,2016-01-10T00:00:00Z,Maggie Smith Shifts From Dowager to Down and Out for ‘The Lady in the Van’
2204,2016-01-10T00:00:00Z,Where Sports Fans Should Go in 2016
2205,2016-01-10T00:00:00Z,Where Music Lovers Should Go in 2016
2206,2016-01-10T00:00:00Z,Where Foodies Should Go in 2016
2207,2016-01-10T00:00:00Z,Where History Buffs Should Go in 2016
2208,2016-01-10T00:00:00Z,It’s Payback Time for Women
2209,2016-01-10T00:00:00Z,A Self-Appointed Herald of Hip-Hop in China
2210,2016-01-10T00:00:00Z,‘Gulf’
2211,2016-01-10T00:00:00Z,Sex and the Saudi
2212,2016-01-10T00:00:00Z,The 12.27.15 Issue
2213,2016-01-10T00:00:00Z,"All the Toil, None of the Credit"
2214,2016-01-10T00:00:00Z,"She Went to a College for a Job, and Found a Husband, Too"
2215,2016-01-10T00:00:00Z,When Opposites Attract
2216,2016-01-10T00:00:00Z,"Kitson, Where Kim Kardashian and Britney Spears Shopped, Sees the End"
2217,2016-01-10T00:00:00Z,Brooklyn Houses Clad in Metal
2218,2016-01-10T00:00:00Z,What Donald Trump Owes George Wallace
2219,2016-01-10T00:00:00Z,"Christy O&#8217;Connor Jr., Irish Golfer, Dies at 67"
2220,2016-01-10T00:00:00Z,Nicholas Caldwell of the Whispers Dies at 71
2221,2016-01-10T00:00:00Z,"Things to Do in the Hudson Valley, Jan. 9 Through 17"
2222,2016-01-10T00:00:00Z,"Things to Do on Long Island, Jan. 9 Through 17"
2223,2016-01-10T00:00:00Z,"Things to Do in Connecticut, Jan. 9 Through 17"
2224,2016-01-10T00:00:00Z,"Things to Do in New Jersey, Jan. 9 Through 17"
2225,2016-01-10T00:00:00Z,Mama Mea Culpa: A Tattered Family Relationship Needs Mending
2226,2016-01-10T00:00:00Z,"‘The Finest Hours’ Relives a Perilous, Forgotten Rescue"
2227,2016-01-10T00:00:00Z,How an Unlikely Duo Became the Hottest Songwriters in Pop Music
2228,2016-01-10T00:00:00Z,"Zhu, Chris Young and Wiki Release New Albums"
2229,2016-01-10T00:00:00Z,52 Places: New Ways to Get There
2230,2016-01-10T00:00:00Z,Honoring Mom (and Molière) With ‘Imagining the Imaginary Invalid’
2231,2016-01-10T00:00:00Z,Roger Rosenblatt: By the Book
2232,2016-01-10T00:00:00Z,My Accidental Career as a Russian Screenwriter
2233,2016-01-10T00:00:00Z,Моя случайная карьера российского сценариста
2234,2016-01-10T00:00:00Z,"Mexican Pork Chops, by Way of Brooklyn"
2235,2016-01-10T00:00:00Z,"A Couple Find Instant Attraction, Longtime Love, Then Discord"
2236,2016-01-10T00:00:00Z,A Bachelor Pad for a Brooklyn Comedian
2237,2016-01-10T00:00:00Z,Talking Hops at Bitter &amp; Esters in Prospect Heights
2238,2016-01-10T00:00:00Z,"From ‘Lulu’ to ‘Madama Butterfly,’ Tragedy Transcended by a Visceral Truth"
2239,2016-01-10T00:00:00Z,"In ‘Fiddler,’ a Balancing Act to Rival Tevye’s"
2240,2016-01-10T00:00:00Z,Big Opera or Cozy Concert? Take Your Pick
2241,2016-01-10T00:00:00Z,‘Bone Tomahawk’ Gets Another Look
2242,2016-01-10T00:00:00Z,"Hindu Heroes, Savored Through Fantastical Masks at the Met"
2243,2016-01-10T00:00:00Z,‘Younger’ Ages Into a Second Season on TV Land
2244,2016-01-10T00:00:00Z,"‘MDLSX,’ From the Troupe Motus, Comes to La MaMa Downstairs"
2245,2016-01-10T00:00:00Z,Where Home Brewers Tell Their Tales
2246,2016-01-10T00:00:00Z,Samantha Bee Prepares to Debut ‘Full Frontal’
2247,2016-01-10T00:00:00Z,"Lauren Gunderson on ‘I and You,’ a Play With an Explosive Twist"
2248,2016-01-10T00:00:00Z,"The Mystic, the Monk and the Play Brought to You by Powerball"
2249,2016-01-10T00:00:00Z,Judge John Hodgman on What Makes a Caesar
2250,2016-01-10T00:00:00Z,Debbie Wasserman Schultz Thinks Young Women Are Complacent
2251,2016-01-10T00:00:00Z,Why Do We Feed Wild Animals?
2252,2016-01-10T00:00:00Z,"Morristown, N.J., Historic With a Lively Downtown"
2253,2016-01-10T00:00:00Z,"Living in Morristown, N.J."
2254,2016-01-10T00:00:00Z,"Richard Sapper, Designer of Sleek Housewares, Dies at 83"
2255,2016-01-10T00:00:00Z,8 Things You Can Do Now to Save Money on Travel
2256,2016-01-10T00:00:00Z,Are There Any Unforgivable Sins in Literature?
2257,2016-01-10T00:00:00Z,To Catch a Rapist
2258,2016-01-10T00:00:00Z,The Empty Threat of ‘Boots on the Ground’
2259,2016-01-10T00:00:00Z,Samantha Hunt’s ‘Mr. Splitfoot’
2260,2016-01-10T00:00:00Z,"‘The Confidence Game,’ by Maria Konnikova"
2261,2016-01-10T00:00:00Z,How to Deal With Flight Delays and Other Travel Headaches
2262,2016-01-10T00:00:00Z,Elizabeth Strout’s ‘My Name Is Lucy Barton’
2263,2016-01-10T00:00:00Z,"‘The Defender,’ by Ethan Michaeli"
2264,2016-01-10T00:00:00Z,Inside the List
2265,2016-01-11T00:00:00Z,Kenneth Nicholson’s Spring/Summer 2016 collection
2266,2016-01-11T00:00:00Z,Meagan Delaney in Dutchess County
2267,2016-01-11T00:00:00Z,El espectáculo que ha rodeado la captura del ‘Chapo’ alimenta la desconfianza en México
2268,2016-01-11T00:00:00Z,From Chicago to Broadway
2269,2016-01-11T00:00:00Z,Aterrizando en Venezuela: La pasión de los chavistas no se extingue
2270,2016-01-11T00:00:00Z,Readers Respond to the Lonesome Single Men of New York
2271,2016-01-11T00:00:00Z,Digging Deeper Into Vivian Maier’s Past
2272,2016-01-11T22:00:00Z,Hog the Mirror
2273,2016-01-11T00:00:00Z,Aterrizando en Venezuela: Nostalgia y consejos de los lectores para sentirme en casa en Caracas
2274,2016-01-11T00:00:00Z,Las incursiones de Sean Penn en el reportaje suelen confundir el activismo con el periodismo
2275,2016-01-11T00:00:00Z,"Alejandro González Iñárritu, ganador del Golden Globe, habla sobre cómo hizo ‘Revenant: el renacido’"
2276,2016-01-11T19:08:46Z,Rand Paul and Carly Fiorina Are Dropped From Mainstage Republican Debate
2277,2016-01-11T00:00:00Z,David Bowie in the Movies
2278,2016-01-11T00:00:00Z,Your Evening Briefing
2279,2016-01-11T00:00:00Z,"Your Monday Evening Briefing: David Bowie, Golden Globes, Sean Penn"
2280,2016-01-11T00:00:00Z,Three’s a Trend: Hoods on the Men’s Runways
2281,2016-01-11T17:55:58Z,Julian Castro Warns Latinos Would Suffer if G.O.P. Abandons Health Law
2282,2016-01-11T00:00:00Z,"In London, Men’s Designers Explore Change — and Tradition"
2283,2016-01-11T17:38:54Z,"Marco Rubio Takes Darker Tone, Saying American Dream &#8216;Is Dying&#8217;"
2284,2016-01-11T17:08:58Z,David Bowie’s Effect on Music Videos
2285,2016-01-11T16:56:35Z,When Good Medicine Mixes With Bad
2286,2016-01-11T00:00:00Z,"At the Golden Globes, Earrings From Another Era"
2287,2016-01-11T16:49:04Z,Ringling Circus Elephants
2288,2016-01-11T16:38:23Z,White House Increases Outreach for State of the Union
2289,2016-01-11T16:03:44Z,Hillary Clinton Confronts Bernie Sanders as Polls Show Her Lead in Iowa Narrowing
2290,2016-01-11T15:59:55Z,"A Personalized Diet, Better Suited to You"
2291,2016-01-11T15:59:22+0000,"Lessons, and Parallels, in Jeb Bush’s Failed Run for Governor"
2292,2016-01-11T15:53:51Z,Unhappy New Year at Broadway Box Office
2293,2016-01-11T15:52:57Z,"Jan. 11, 2016 — Pictures of the Day"
2294,2016-01-11T00:00:00Z,Pictures of the Day: London and Elsewhere
2295,2016-01-11T00:00:00Z,"David Bowie’s Style, Through the Years"
2296,2016-01-11T15:41:14Z,Facts &#038; Figures: The Rise of Independents
2297,2016-01-11T15:36:20Z,When a Big Baby Isn&#8217;t So Big
2298,2016-01-11T00:00:00Z,Index-Card Financial Advice From Readers
2299,2016-01-11T00:00:00Z,Five Fashion Hairstylists on How to Create Casual Buns
2300,2016-01-11T00:00:00Z,Three’s a Trend: Men in Fur
2301,2016-01-11T14:52:47Z,Adele Cedes Billboard&#8217;s Singles Chart to Justin Bieber After 10 Weeks
2302,2016-01-11T00:00:00Z,1955-65 | The Last Decade of New York’s Old Penn Station
2303,2016-01-11T14:32:53Z,Ratings Drop for Golden Globes
2304,2016-01-11T14:30:00Z,Sarah Howe Wins T.S. Eliot Poetry Prize
2305,2016-01-11T13:53:34Z,Children&#8217;s Book Awards Honor Diversity
2306,2016-01-11T13:32:29Z,Story Approval by Drug Lord? Times Editors Discuss Rolling Stone Case
2307,2016-01-11T13:11:53Z,Iowa Poll Finds Ted Cruz and Donald Trump in Tight Race
2308,2016-01-11T12:47:00Z,Whitney Museum Acquires Major Work by Archibald Motley
2309,2016-01-11T12:45:34Z,Donald Trump Has Commanding Lead in Latest New Hampshire Poll
2310,2016-01-11T00:00:00Z,"From One New Brand, Unisex Shirts and Pottery"
2311,2016-01-11T00:00:00Z,The Shirts (and Pottery) of Bruta
2312,2016-01-11T11:32:52Z,1941: Germany and Italy Join Forces
2313,2016-01-11T00:00:00Z,Liam Hodges: Fall 2016
2314,2016-01-11T11:04:12Z,焦糖柠檬意面
2315,2016-01-11T11:03:02Z,Share Your Memories of David Bowie
2316,2016-01-11T00:00:00Z,The Other Side of Billionaires
2317,2016-01-11T00:00:00Z,Burberry: Fall 2016
2318,2016-01-11T00:00:00Z,‘I Am Drowning.’ The Voices of People With Medical Debt.
2319,2016-01-11T00:00:00Z,Japan and 'Inherited Guilt'
2320,2016-01-11T10:30:10+0000,Signs of the ‘Human Age’
2321,2016-01-11T00:00:00Z,Thom Sweeney: Fall 2016
2322,2016-01-11T10:05:38Z,1916: Draft Is Likely In Great Britain
2323,2016-01-11T09:41:32Z,Daily Report: The Tech News Cycle is About to Ramp Up
2324,2016-01-11T09:24:52Z,"Popular Approval For Stronger Gun Safety, But Scant Optimism"
2325,2016-01-11T00:00:00Z,Knits and Shearling Among the Trends at London Collections Men
2326,2016-01-11T07:00:51Z,Two Debates Set the Course for a Contentious Final Sprint
2327,2016-01-11T06:30:05Z,Marco Rubio Continues a General Election Approach to Primaries
2328,2016-01-11T06:15:34Z,Senators Return From Holiday With 2016 Elections Fresh on Their Minds
2329,2016-01-11T00:00:00Z,Your Monday Briefing
2330,2016-01-11T00:00:00Z,New York Today: Every Dog Has Its Train
2331,2016-01-11T06:00:44Z,E.L.L. Practice + Prompt | Celebrating Martin Luther King&#8217;s Legacy
2332,2016-01-11T06:00:09Z,Supreme Court to Hear Arguments Over Requiring Union Members to Pay Dues
2333,2016-01-11T05:59:23Z,Morning Agenda: Chinese Stocks Plunge Again
2334,2016-01-11T00:00:00Z,Cruise and Airline News: Four New Ships from Carnival
2335,2016-01-11T05:45:02Z,"I.P.F., Not Aging, Could Be Causing Breathlessness"
2336,2016-01-11T00:00:00Z,"Your Monday Briefing: Hillary Clinton, Golden Globes, David Bowie"
2337,2016-01-11T05:30:03Z,"What&#8217;s Going On in This Picture? | Jan. 11, 2016"
2338,2016-01-11T05:03:27Z,What Is Your Opinion of Hoverboards?
2339,2016-01-11T05:00:39Z,Staying Put Amid Puerto Rico&#8217;s Economic Crisis
2340,2016-01-11T04:27:48Z,"News Q&#8217;s | &#8216;El Chapo&#8217; Captured, A Secret Interview Comes to Light One Day Later"
2341,2016-01-11T03:21:42Z,When Philosophy Lost Its Way
2342,2016-01-11T00:00:00Z,Focus on Illegal Guns
2343,2016-01-11T00:00:00Z,Governors Get Smarter on Medicaid
2344,2016-01-11T00:00:00Z,The Obama Boom
2345,2016-01-11T00:00:00Z,Rwanda’s Entrenched President
2346,2016-01-11T00:00:00Z,Iran’s Other Scary Weapons Program
2347,2016-01-11T00:00:00Z,How to Be Liberal in Lower Alabama
2348,2016-01-11T00:00:00Z,Older Women Struggling to Find Work
2349,2016-01-11T00:00:00Z,Sharing the Profits From Cell Research
2350,2016-01-11T00:00:00Z,Rules of Discovery for Civil Litigation
2351,2016-01-11T00:00:00Z,California’s Water Politics
2352,2016-01-11T01:40:38+0000,Theatrics Surrounding El Chapo’s Capture Distract From Mexico’s Real Woes
2353,2016-01-11T00:00:00Z,Ricky Gervais Hosts the Golden Globes With Beer and Vinegar
2354,2016-01-11T00:02:36Z,Word of the Day + Quiz | prude
2355,2016-01-11T00:00:00Z,House to Weigh Overhaul of Open Records Process
2356,2016-01-11T00:00:00Z,Bruin Sports to Team Up With Others as Investor
2357,2016-01-11T00:00:00Z,"Paid Notice: Deaths  HOWAT, ANNE HADLEY"
2358,2016-01-11T00:00:00Z,"Paid Notice: Deaths  CHABON, BRENDA"
2359,2016-01-11T00:00:00Z,"Paid Notice: Deaths  KREMEN, ANDREA"
2360,2016-01-11T00:00:00Z,"Paid Notice: Deaths  ROSENBLATT, HELEN"
2361,2016-01-11T00:00:00Z,"Paid Notice: Deaths  HELLER, LEON I."
2362,2016-01-11T00:00:00Z,"Paid Notice: Deaths  KAYE, JUDITH S"
2363,2016-01-11T00:00:00Z,"Paid Notice: Deaths  CARPENTER, DAVID CHANDLER"
2364,2016-01-11T00:00:00Z,"Paid Notice: Deaths  SHAPIRO, LORRAINE"
2365,2016-01-11T00:00:00Z,"Paid Notice: Deaths  PAHLAVI, HER IMPERIAL HIGHNESS PRINCESS ASHRAF"
2366,2016-01-11T00:00:00Z,"Paid Notice: Deaths  DOPPELT, ELEANOR"
2367,2016-01-11T00:00:00Z,"Paid Notice: Memorials  MOORE, JOHN MCDONALD"
2368,2016-01-11T00:00:00Z,"Paid Notice: Deaths  CARON, ANNE T."
2369,2016-01-11T00:00:00Z,"Paid Notice: Deaths  VON ZUBEN, FREDERICK G."
2370,2016-01-11T00:00:00Z,"Paid Notice: Deaths  DOPPELT, ELEANOR"
2371,2016-01-11T00:00:00Z,"Paid Notice: Deaths  KAYE, HON"
2372,2016-01-11T00:00:00Z,"Paid Notice: Deaths  ELLENBERG, JAMES LOUIS"
2373,2016-01-11T00:00:00Z,"Paid Notice: Deaths  GLASSER, GILDA"
2374,2016-01-11T00:00:00Z,Fatal Bus Crash in Mexico
2375,2016-01-11T00:00:00Z,Masters Champion Loses
2376,2016-01-11T00:00:00Z,Arkansas Star Leaving
2377,2016-01-11T00:00:00Z,Spieth Wins at 30 Under
2378,2016-01-11T00:00:00Z,El Chapo’s Arrest Prompts Mixed Feelings Among Mexicans in New York
2379,2016-01-11T00:00:00Z,"Steady and Unselfish, Knicks Are Winning the Games They Used to Lose"
2380,2016-01-11T00:00:00Z,Golden Globes Red Carpet: Couture Without the Cliché
2381,2016-01-11T00:00:00Z,"Amid Flashy Australian Compatriots, Samantha Stosur Quietly Stays the Course"
2382,2016-01-11T00:00:00Z,Review: Shedding Skins in Motus’s Genre-Blurring ‘MDLSX’ at La MaMa
2383,2016-01-11T00:00:00Z,N.B.A. Game of the Week: Cleveland at San Antonio
2384,2016-01-11T00:00:00Z,Knocking at Opportunity From Alabama’s Sideline
2385,2016-01-11T00:00:00Z,Taking Control After a Tumultuous Childhood
2386,2016-01-11T00:00:00Z,‘The Revenant’ Wins Best Dramatic Film at the Golden Globes
2387,2016-01-11T00:00:00Z,Seahawks Pull a Win From Their Long Sleeves
2388,2016-01-11T00:00:00Z,Supreme Court Case on Public Sector Union Fees Rouses Political Suspicions
2389,2016-01-11T00:00:00Z,Quotation of the Day
