,pub_date,headline
3693,2016-01-16T00:00:00Z,"Steelers’ Antonio Brown Is Out, and Ben Roethlisberger Is Questionable"
3694,2016-01-16T00:00:00Z,Rams’ Move Raises Questions About Raiders and Chargers
3695,2016-01-16T00:00:00Z,Medical Aid Sent to Starving Syrian Town of Madaya
3696,2016-01-16T00:00:00Z,Sean Penn Says His El Chapo Article ‘Has Failed’
3697,2016-01-16T00:00:00Z,Republicans Intensify Attacks After a Pitched Debate
3698,2016-01-16T00:00:00Z,What Are New York Values?
3699,2016-01-16T00:00:00Z,Many in Jakarta Seem to Shrug Off Terrorist Attack
3700,2016-01-16T00:00:00Z,"Goodbye, Golf Clubs. Hello, Hiking Boots and Kayak."
3701,2016-01-16T00:00:00Z,"The Greatest Hoax in Sports Reporting History (The Times Fell for It, Too)"
3702,2016-01-16T00:00:00Z,"New Orleans Puts Poor on ‘Waiting List’ for Lawyers, Suit Alleges"
3703,2016-01-16T00:00:00Z,George Miller on ‘Mad Max: Fury Road’ and Furiosa Tattoos
3704,2016-01-16T00:00:00Z,"Shabab Say They Overran African Union Base in Somalia, Killing Dozens"
3705,2016-01-16T00:00:00Z,New Yorkers Quickly Unite Against Cruz After ‘New York Values’ Comment
3706,2016-01-16T00:00:00Z,"Stuff We Liked: Bikes, Baristas and Powerball"
3707,2016-01-16T00:00:00Z,Walmart to Close 269 Stores as Retailers Struggle
3708,2016-01-16T00:00:00Z,Wrestlers Find Well-Worn Path to U.F.C. Title Bout
3709,2016-01-16T00:00:00Z,State Tax Refunds May Be Delayed by Security Precautions
3710,2016-01-16T00:00:00Z,Can Germany Be Honest About Its Refugee Problems?
3711,2016-01-16T00:00:00Z,"Retail Sales Were Lackluster in December, Signaling Fragile Economy"
3712,2016-01-16T00:00:00Z,"Macedonian Prime Minister Steps Down, but Tensions Over Vote Linger"
3713,2016-01-16T00:00:00Z,Anger and Scrutiny Grow Over Poisoned Water in Michigan City
3714,2016-01-16T00:00:00Z,Deleting User Accounts on a Mac
3715,2016-01-16T00:00:00Z,"Burundi’s Forces Are Engaging in Gang Rape, U.N. Official Says"
3716,2016-01-16T00:00:00Z,Search for 12 Marines Continues After Hawaii Helicopter Crash
3717,2016-01-16T00:00:00Z,A Flat Fourth Quarter for Wells Fargo
3718,2016-01-16T00:00:00Z,BlackRock’s Profit Up as Money Pours Into Exchange Traded Funds
3719,2016-01-16T00:00:00Z,Oil Price Falls as Global Growth Anxiety Weighs on Markets
3720,2016-01-16T00:00:00Z,Citigroup’s Profit Rises Even as It Builds Cushion for Energy Loans
3721,2016-01-16T00:00:00Z,Ronald Perelman to Explore ‘Strategic Alternatives’ for Revlon
3722,2016-01-16T00:00:00Z,"Ousted Communist Official’s Brother Is Living in United States, China Says"
3723,2016-01-16T00:00:00Z,"As Taiwan Election Nears, Mainland Media Plays Down Politics"
3724,2016-01-16T00:00:00Z,"6 Hospitalized, One of Them Brain-Dead, After Drug Trial in France"
3725,2016-01-16T00:00:00Z,Turkey Releases Detained Academics Who Signed Petition Defending Kurds
3726,2016-01-16T00:00:00Z,"At Pitti Uomo, Angles of Approach"
3727,2016-01-16T00:00:00Z,"Day After a Victory Over Ebola, Sierra Leone Reports a Death"
3728,2016-01-16T11:30:00Z,Racing 92 Sets Out to Conquer the World
3729,2016-01-16T00:00:00Z,Military Victories Over Boko Haram Mean Little to Nigerians
3730,2016-01-16T00:00:00Z,G.E. to Sell Appliance Division to Haier for $5.4 Billion
3731,2016-01-16T00:00:00Z,Who Won the Republican Debate? Ted Cruz and Donald Trump Impress Critics
3732,2016-01-16T00:00:00Z,"In Song, a Remnant of China’s Former Imperial Language"
3733,2016-01-16T00:00:00Z,Pittsburgh Steelers at Denver Broncos Preview
3734,2016-01-16T00:00:00Z,Green Bay Packers at Arizona Cardinals Preview
3735,2016-01-16T00:00:00Z,Seattle Seahawks at Carolina Panthers Preview
3736,2016-01-16T00:00:00Z,Kansas City Chiefs at New England Patriots Preview
3737,2016-01-16T00:00:00Z,N.F.L. Divisional Playoffs: Injuries and New Blood Could Sway Fates
3738,2016-01-16T00:00:00Z,"This Year, Novak Djokovic’s Sights Are Set on Paris and Rio"
3739,2016-01-16T00:00:00Z,The Author Elizabeth Strout on ‘Lucy Barton’ and How Her Characters Come Into Being
3740,2016-01-17T00:00:00Z,El Eticista: Creo que mi papá era gay. ¿Debería decirle a mi mamá?
3741,2016-01-17T00:00:00Z,"Opinión: Para los carteles de México, la política también es negocio"
3742,2016-01-17T00:00:00Z,"For Martin Luther King’s Birthday, Black Leaders as Obituaries Portrayed Them"
3743,2016-01-17T00:00:00Z,"‘Billions’ Recap, Season 1 Premiere: Money and Sin"
3744,2016-01-17T22:34:21Z,My Take on the Democratic Presidential Debate
3745,2016-01-17T00:00:00Z,"‘Downton Abbey’ Season 6, Episode 3 Recap: So Nice to See Him Again?"
3746,2016-01-17T21:10:07Z,"Bernie Sanders Releases Details on Health Plan That Would Raise Taxes but, He Argues, Save on Costs"
3747,2016-01-17T00:00:00Z,Roosevelt Hotel Honors a Promise
3748,2016-01-17T20:30:57Z,Who Made the Smartest Comment of the Democratic Debate?
3749,2016-01-17T18:37:50Z,Bernie Sanders Supporters Invoke Martin Luther King Jr.
3750,2016-01-17T00:00:00Z,NYC Winter Jazzfest Marathon
3751,2016-01-17T18:00:20Z,Sublime Physical Performance
3752,2016-01-17T00:00:00Z,대량멸종 이후 작은 종들만 살아남아
3753,2016-01-17T00:00:00Z,Moncler Gamme Bleu: Fall 2016
3754,2016-01-17T17:48:12+0000,Short Answers to Hard Questions About Zika Virus
3755,2016-01-17T00:00:00Z,Cartoon: Heng on North Korea’s Nuclear Testing
3756,2016-01-17T16:42:49Z,Die Hard Conservatives
3757,2016-01-17T00:00:00Z,Damir Doma: Fall 2016
3758,2016-01-17T16:10:28+0000,Letters and Numbers: A Watch's Typeface
3759,2016-01-17T15:20:57Z,Netflix&#8217;s Expansion Attracts Some Unexpected Customers
3760,2016-01-17T00:00:00Z,Prada: Fall 2016
3761,2016-01-17T14:36:27Z,Verbatim: Debbie Wasserman Schultz Says Democratic Debate Schedule Was Intended to &#8216;Maximize&#8217; Exposure to Voters
3762,2016-01-17T13:48:37Z,Republican Candidates Assail Iran Agreements
3763,2016-01-17T00:00:00Z,What to Watch Sunday
3764,2016-01-17T00:00:00Z,"In Milan, Men’s Shows Reference Couture — and Space Travel"
3765,2016-01-17T00:00:00Z,Missoni: Fall 2016
3766,2016-01-17T00:00:00Z,What to Cook This Week
3767,2016-01-17T00:00:00Z,Calvin Klein Collection: Fall 2016
3768,2016-01-17T00:00:00Z,Salvatore Ferragamo: Fall 2016
3769,2016-01-17T09:00:43Z,1966: Nigerian Rebels Surrender
3770,2016-01-17T07:00:41Z,1941: Relief Director Tells Plight of Jews in Europe
3771,2016-01-17T06:54:05Z,A Daughter Too Kind for Her Own Good
3772,2016-01-17T00:00:00Z,Bottega Veneta: Fall 2016
3773,2016-01-17T00:00:00Z,She Plays Hillary Clinton as Bernie Sanders Prepares to Debate
3774,2016-01-17T00:00:00Z,"Corrections: January 17, 2016"
3775,2016-01-17T00:00:00Z,Quotation of the Day
3776,2016-01-17T00:00:00Z,"Assailants Yell ‘ISIS! ISIS!’ During Attack on Man in Bronx, Police Say"
3777,2016-01-17T00:00:00Z,Schedule Is Altered for Allyson Felix
3778,2016-01-17T00:00:00Z,Kobe Bryant Will Forgo Rio Games
3779,2016-01-17T00:00:00Z,Heavyweight Retains Title in Brooklyn
3780,2016-01-17T00:00:00Z,Aksel Lund Svindal Wins Downhill
3781,2016-01-17T00:00:00Z,Katie Ledecky Dominates in Texas
3782,2016-01-17T00:00:00Z,3 Share Lead in South Africa
3783,2016-01-17T00:00:00Z,Tie for Lead at the Sony Open
3784,2016-01-17T00:00:00Z,American Pharoah Honored
3785,2016-01-17T00:00:00Z,American Missionary Among the Dead in Burkina Faso Siege
3786,2016-01-17T00:00:00Z,"Hillary Clinton and Bernie Sanders Turn Focus to South Carolina, Courting Black Leaders"
3787,2016-01-17T00:00:00Z,"Richard Elliott, Kevin Tobia"
3788,2016-01-17T00:00:00Z,"Rachel Spencer, Justin Turetsky"
3789,2016-01-17T00:25:23+0000,Virginia Man Is Accused of Trying to Join ISIS
3790,2016-01-17T00:00:00Z,"Sasha Silver, Charlie Moran"
3791,2016-01-17T00:00:00Z,"Annette Georgia, Michael Kolber"
3792,2016-01-17T00:00:00Z,"Nina Wainwright, Nathan Strauss"
3793,2016-01-17T00:00:00Z,"Once Smitten Teenagers, Now Spouses"
3794,2016-01-17T00:00:00Z,"Miriam Fischer, Eric Wachter"
3795,2016-01-17T00:00:00Z,"Hannah Gursky, William Theodat"
3796,2016-01-17T00:00:00Z,"Emily Parker, Jonathan Ivers"
3797,2016-01-17T00:00:00Z,"Micaela Roberts, Daniel Morrison"
3798,2016-01-17T00:00:00Z,"Jillian Rudnitzky, Daniel Brand"
3799,2016-01-17T00:00:00Z,"Melissa Goldberg, Evan Mintz"
3800,2016-01-17T00:00:00Z,"Rena Fischler, Michael Jacobs"
3801,2016-01-17T00:00:00Z,"Kathleen Webb, Alexander Mattielli"
3802,2016-01-17T00:00:00Z,"Carisa Jackson, John Hansbury"
3803,2016-01-17T00:00:00Z,"Tracey Atlas, Matthew Harrison"
3804,2016-01-17T00:00:00Z,"Rachel Rosenblatt, John Bone"
3805,2016-01-17T00:08:45+0000,"Before Debris Collapse in China, Safety Fears Were Discussed"
3806,2016-01-17T00:00:00Z,Devils Break Out of Slump by Handing the Coyotes a Rare Shutout Defeat 
3807,2016-01-17T00:00:00Z,"Among the Captives Freed by Iran, a U.S. Researcher Held for 40 Days"
3808,2016-01-17T00:00:00Z,"Paid Notice: Deaths  GENUNG, DIANA RIGGS"
3809,2016-01-17T00:00:00Z,"Paid Notice: Deaths  PERRY, SUSAN M."
3810,2016-01-17T00:00:00Z,"Paid Notice: Deaths  MANUS, MORTON"
3811,2016-01-17T00:00:00Z,"Paid Notice: Deaths  HAGERMAN, PETER S."
3812,2016-01-17T00:00:00Z,"Paid Notice: Deaths  DE SIMONE, LILLIAN IMUNDO"
3813,2016-01-17T00:00:00Z,"Paid Notice: Deaths  SCHOCH, ANTON"
3814,2016-01-17T00:00:00Z,"Paid Notice: Deaths  MESSMORE, MARY ANNE"
3815,2016-01-17T00:00:00Z,"Paid Notice: Deaths  LIEBER, CONSTANCE E"
3816,2016-01-17T00:00:00Z,"Paid Notice: Memorials  BUTTERFIELD, MARY DURYEA ""MISSY"" DIED PEACEFULLY ON JANUARY 9TH. LOVING MOTHER TO JOHN PECK (MEN) AND NINA NOEL (CHARLIE). DEVOTED STEPMOTHER TO THREE AND GRANDMOTHER TO FOUR BOYS. HER SPARKLE AND LAUGHTER WILL BE MISSED BY ALL. 1"
3817,2016-01-17T00:00:00Z,"Paid Notice: Deaths  SCAGLIONE, CAROLYN R"
3818,2016-01-17T00:00:00Z,"Paid Notice: Deaths  PIERCE, DEREK BRYAN"
3819,2016-01-17T00:00:00Z,"Paid Notice: Deaths  GLIZE, KANE, AVERY"
3820,2016-01-17T00:00:00Z,"Paid Notice: Deaths  SCAGLIONE, CAROLYN R"
3821,2016-01-17T00:00:00Z,"Paid Notice: Deaths  KIGGEN, EDITH ADAMS"
3822,2016-01-17T00:00:00Z,"Paid Notice: Deaths  PRESENT, DANIEL"
3823,2016-01-17T00:00:00Z,"Paid Notice: Deaths  HODGMAN, MARY MORRIS"
3824,2016-01-17T00:00:00Z,"Paid Notice: Deaths  ALLOCCA, MICHAEL A"
3825,2016-01-17T00:00:00Z,"Paid Notice: Deaths  MARGULIES, DAVID"
3826,2016-01-17T00:00:00Z,"Paid Notice: Deaths  SHULTIS, JOHN ""JACK"" CLINTON"
3827,2016-01-17T00:00:00Z,"Paid Notice: Deaths  RIETMAN, JAAP"
3828,2016-01-17T00:00:00Z,"Paid Notice: Memorials  WALLENBERG, RAOUL"
3829,2016-01-17T00:00:00Z,"Paid Notice: Deaths  KLEIMAN, ELAINE (APPEL)"
3830,2016-01-17T00:00:00Z,"Paid Notice: Deaths  EVANS, JACK"
3831,2016-01-17T00:00:00Z,"Paid Notice: Memorials  GODFRIED, RITA"
3832,2016-01-17T00:00:00Z,"Paid Notice: Deaths  ESTES, MILANO, KATHLEEN WIFE"
3833,2016-01-17T00:00:00Z,"Paid Notice: Deaths  GREENBAUM, THEODORA SIMON"
3834,2016-01-17T00:00:00Z,"Paid Notice: Deaths  CARPENTER, DAVID CHANDLER"
3835,2016-01-17T00:00:00Z,"Paid Notice: Deaths  SIEGLER, LILLIAN R (NEE MENKES)"
3836,2016-01-17T00:00:00Z,"Paid Notice: Deaths  HORNER, LARRY DEAN"
3837,2016-01-17T00:00:00Z,"Paid Notice: Deaths  KIMMELMAN, MIRIAM E."
3838,2016-01-17T00:00:00Z,"Paid Notice: Deaths  PRESENT, DANIEL H."
3839,2016-01-17T00:00:00Z,"Paid Notice: Deaths  ELKIN, PETER M"
3840,2016-01-17T00:00:00Z,"Paid Notice: Deaths  COCHRANE, LYDIA GOODWIN (STEINWAY)"
3841,2016-01-17T00:00:00Z,"Paid Notice: Deaths  ZUCKERMAN, GEORGE R."
3842,2016-01-17T00:00:00Z,"Paid Notice: Deaths  HERRON, CAROLINE RAND"
3843,2016-01-17T00:00:00Z,"Paid Notice: Deaths  WHITMAN, HELEN"
3844,2016-01-17T00:00:00Z,"Paid Notice: Memorials  COHEN, EILEEN S"
3845,2016-01-17T00:00:00Z,"Paid Notice: Deaths  SINGH, JYOTI SHANKAR"
3846,2016-01-17T00:00:00Z,"Paid Notice: Deaths  COCHRANE, LYDIA GOODWIN (STEINWAY)"
3847,2016-01-17T00:00:00Z,"Paid Notice: Deaths  KELLMAN, LILLIAN STRAUSS"
3848,2016-01-17T00:00:00Z,"Paid Notice: Memorials  LANGFELDER, VILMOS"
3849,2016-01-17T00:00:00Z,"Paid Notice: Deaths  PRESENT, DR"
3850,2016-01-17T00:00:00Z,"Paid Notice: Deaths  MEYERS, DONALD I."
3851,2016-01-17T00:00:00Z,"Paid Notice: Deaths  BARNETT, RALPH"
3852,2016-01-17T00:00:00Z,"Paid Notice: Deaths  SILVERMAN, ROBERT E."
3853,2016-01-17T00:00:00Z,"Paid Notice: Deaths  PERLMAN, LUCILLE"
3854,2016-01-17T00:00:00Z,"Paid Notice: Memorials  LANGE, BRAD"
3855,2016-01-17T00:00:00Z,"Paid Notice: Deaths  BLAUFARB, LEON SOLOMON"
3856,2016-01-17T00:00:00Z,"Paid Notice: Deaths  PELTZ, LEON, M.D."
3857,2016-01-17T00:00:00Z,"Paid Notice: Deaths  HERZOG, DIANA"
3858,2016-01-17T00:00:00Z,"Paid Notice: Memorials  NETZER, CORINNE T"
3859,2016-01-17T00:00:00Z,"Paid Notice: Deaths  MARCHAL, JACQUES"
3860,2016-01-17T00:00:00Z,"Paid Notice: Deaths  MEADOW, CLAIRE S."
3861,2016-01-17T00:00:00Z,"Paid Notice: Deaths  SCHALLER, RALPH F"
3862,2016-01-17T00:00:00Z,"Paid Notice: Memorials  KLEIER, JONATHAN"
3863,2016-01-17T00:00:00Z,"Paid Notice: Deaths  DONLEAVY, THOMAS JOSEPH ""T.J."
3864,2016-01-17T00:00:00Z,"Paid Notice: Deaths  MCTAGUE, MARILYN ANN"
3865,2016-01-17T00:00:00Z,"Paid Notice: Deaths  DUNHAM, WILLIAM B."
3866,2016-01-17T00:00:00Z,"Paid Notice: Deaths  BECKHARD, MADELEINE (NEE KLEIN) OF O'FALLON"
3867,2016-01-17T00:00:00Z,"Paid Notice: Deaths  PINES, JAMES M."
3868,2016-01-17T00:00:00Z,"Paid Notice: Deaths  COLEMAN, ZDZISLAWA ANNA"
3869,2016-01-17T00:00:00Z,"Paid Notice: Deaths  FULLER, LEE M."
3870,2016-01-17T00:00:00Z,"Paid Notice: Deaths  MAIMIN, DAVID S."
3871,2016-01-17T00:00:00Z,"Paid Notice: Deaths  WALDEN, MARVIN EUGENE"
3872,2016-01-17T00:00:00Z,"Paid Notice: Memorials  SPOKOJNY, DR"
3873,2016-01-17T00:00:00Z,"Paid Notice: Deaths  HERZOG, DIANA E"
3874,2016-01-17T00:00:00Z,"Cardinals Survive, Ending Carson Palmer’s Drought"
3875,2016-01-17T00:00:00Z,"After Forward&#8217;s Strong Words Feed Rivalry, Grizzlies Earn Anticlimactic Win"
3876,2016-01-17T00:00:00Z,Drug Overdoses Propel Rise in Mortality Rates of Young Whites
3877,2016-01-17T00:00:00Z,Hawks’ Paul Millsap Reaches Milestone in Win Over Nets
3878,2016-01-17T00:00:00Z,Notre Dame Sends No. 9 Duke to a Second Straight Loss; No. 2 Oklahoma Survives 
3879,2016-01-17T00:00:00Z,"For Broadcast of Super Bowl I, NFL Network Picks Excess Over Tact"
3880,2016-01-17T00:00:00Z,"Manners Fit Jeb Bush, if Not an Uncouth Race"
3881,2016-01-17T00:00:00Z,Donald Trump Gets Personal in Attacks on Ted Cruz at Tea Party Convention
3882,2016-01-17T00:00:00Z,Mike Mularkey Gets Titans’ Coaching Job for Real
3883,2016-01-17T00:00:00Z,Henrik Lundqvist Hits Milestone as Rangers Edge the Flyers
3884,2016-01-17T00:00:00Z,John Terry’s Goal Helps Chelsea Salvage a Draw and Stay Unbeaten Under Its New Manager
3885,2016-01-17T00:00:00Z,Patriots Methodically Clear First Hurdle
3886,2016-01-17T00:00:00Z,Federal Emergency Is Declared in Flint Over Contaminated Water
3887,2016-01-17T00:00:00Z,Cleveland Is Accused of &#8216;Blatant Dodge&#8217; for Not Paying After Verdicts
3888,2016-01-17T00:00:00Z,New Guidelines Nudge Doctors to Give Patients Access to Medical Records
3889,2016-01-17T00:00:00Z,"On Paper, Italy Allows Abortions, but Few Doctors Will Perform Them"
3890,2016-01-17T00:00:00Z,Standoff in Oregon Attracts Supporters Bearing Disparate Grievances
3891,2016-01-17T00:00:00Z,Flamboyant Egyptian Politician Craves Public Eye 
3892,2016-01-17T00:00:00Z,Los detalles de la gran cacería para capturar al ‘Chapo’ en México
3893,2016-01-17T00:00:00Z,Alabama Player&#8217;s Misfortunes Typify Pitfalls of College Sports 
3894,2016-01-17T00:00:00Z,Researchers Confirm Exact Site of Hangings From 1692 Salem Witch Trials
3895,2016-01-17T00:00:00Z,Archdiocese of Seattle Names 77 People as Child Abusers
3896,2016-01-17T00:00:00Z,"With Iran Nuclear Deal Implemented, What Happens Next?"
3897,2016-01-17T00:00:00Z,Iran Complies With Nuclear Deal; Sanctions Are Lifted
3898,2016-01-17T00:00:00Z,Linebacker Luke Kuechly Quietly Leads a Brash Panthers Defense
3899,2016-01-17T00:00:00Z,Broncos’ Movie Buff Harris Has Been Stealing the Show From Opposing Receivers
3900,2016-01-17T00:00:00Z,Keep Guns Away From Abusers
3901,2016-01-17T00:00:00Z,When Oil-Rich Countries Need More Cash
3902,2016-01-17T00:00:00Z,"Leonid Zhabotinsky, Strongman for the Ages, Dies at 77 "
3903,2016-01-17T00:00:00Z,The Death Penalty Endgame
3904,2016-01-17T00:00:00Z,"Operating on a Shoestring, Ireland Struggles to Develop First-Rate Tennis Players"
3905,2016-01-17T00:00:00Z,"With Triple Crown Winner at Last, Sport Aims to Ride the Momentum "
3906,2016-01-17T00:00:00Z,"Maria Teresa de Filippis, Pioneer of Auto Racing, Dies at 89"
3907,2016-01-17T00:00:00Z,"C. D. Wright, Poet of Ozarks and Beyond, Dies at 67"
3908,2016-01-17T00:00:00Z,"After Losing a Daughter, Mustering Strength for 3 Who Remain"
3909,2016-01-17T00:00:00Z,Reigning Cats and Dogs
3910,2016-01-17T00:00:00Z,"Under an Arizona Sun, Phelps Rediscovers a Love of Swimming, and Life"
3911,2016-01-17T00:00:00Z,A Picasso’s Economics Lesson
3912,2016-01-17T00:00:00Z,The Destruction of Progressive Wisconsin
3913,2016-01-17T00:00:00Z,The Bill Clinton Question
3914,2016-01-17T00:00:00Z,Hallelujah College
3915,2016-01-17T00:00:00Z,Some Inconvenient Gun Facts for Liberals
3916,2016-01-17T00:00:00Z,Donald Trump’s Existential Pickle
3917,2016-01-17T00:00:00Z,Cancer and Climate Change
3918,2016-01-17T00:00:00Z,Why I Taught Myself to Procrastinate
3919,2016-01-17T00:00:00Z,Rocco Casagrande
3920,2016-01-17T00:00:00Z,The Man Who Fell From Fame
3921,2016-01-17T00:00:00Z,When Anger Trumped Progress
3922,2016-01-17T00:00:00Z,How Measurement Fails Doctors and Teachers
3923,2016-01-17T00:00:00Z,The Founders’ Intent
3924,2016-01-17T00:00:00Z,Deadly Standoff Leaves Burkina Faso Stunned
3925,2016-01-17T00:00:00Z,Soviet Star Defenseman&#8217;s Latest Turn
3926,2016-01-17T00:00:00Z,Letters to the Editor
3927,2016-01-17T00:00:00Z,Chris Davis’s Deal With Orioles Keeps Yoenis Cespedes in Play for Mets
3928,2016-01-17T00:00:00Z,Singer’s Apology for Waving Taiwan Flag Stirs Backlash of Its Own
3929,2016-01-17T00:00:00Z,The Unluckiest Captain in China
3930,2016-01-17T00:00:00Z,Two Brothers Are Growing Into Their Game on Opposite Coasts 
3931,2016-01-17T00:00:00Z,What’s Harder Than Renting a Car? Filing a Complaint
3932,2016-01-17T00:00:00Z,"In Forbes Media Sale, Five-Figure Battle Started a $100 Million War"
3933,2016-01-17T00:00:00Z,"Clinton Campaign Underestimated Sanders Strengths, Allies Say"
3934,2016-01-17T00:00:00Z,"Unbeaten at Home, Warriors Are Still in Fight for a Playoff Edge"
3935,2016-01-17T00:00:00Z,The Place of Refuge in the West Village
3936,2016-01-17T00:00:00Z,"Profiles of Saeed Abedini, Amir Hekmati and Jason Rezaian"
3937,2016-01-17T00:00:00Z,Sgt. E. Castro: A Prison Peacemaker
3938,2016-01-17T00:00:00Z,The Strip
3939,2016-01-17T00:00:00Z,Hawaii Baby With Brain Damage Is First U.S. Case Tied to Zika Virus
3940,2016-01-17T00:00:00Z,Exploring Des Moines and Beyond in Iowa
3941,2016-01-17T00:00:00Z,"In Tehran, Iranians Play Down Milestone"
3942,2016-01-17T00:00:00Z,Apartments That Feel Like Saunas
3943,2016-01-17T00:00:00Z,Paul Giamatti Had a Busy Year of Mad Guys and Bad Hair
3944,2016-01-17T00:00:00Z,Farhad and Mike’s Week in Tech: A Not-So-‘Basic’ Shift in Start-Ups
3945,2016-01-17T00:00:00Z,"Iran Frees Americans, Including Jason Rezaian, in Prisoner Swap"
3946,2016-01-17T00:00:00Z,"In Maine, Local Control Is a Luxury Fewer Towns Can Afford"
3947,2016-01-17T00:00:00Z,What Donald Trump’s Plaza Deal Reveals About His White House Bid
3948,2016-01-17T00:00:00Z,"Eileen Myles, the Poet Muse of ‘Transparent’"
3949,2016-01-17T00:00:00Z,David Bowie: Invisible New Yorker
3950,2016-01-17T00:00:00Z,"How El Chapo Was Finally Captured, Again"
3951,2016-01-17T00:00:00Z,"Tsai Ing-wen Elected President of Taiwan, First Woman to Hold Office"
3952,2016-01-17T00:00:00Z,"Serena Williams, Rejecting Health Doubts, Insists She’s Ready"
3953,2016-01-17T00:00:00Z,An Ever-Changing Menu at Prospect Cafe in West Hartford
3954,2016-01-17T00:00:00Z,Review: Rye Roadhouse Maintains Its Louisiana Charm
3955,2016-01-17T00:00:00Z,Review: Global Sensibility at the Plum and the Pear
3956,2016-01-17T00:00:00Z,"Review: Mazi, a Greek Taverna Refined by Time and Fire"
3957,2016-01-17T00:00:00Z,"At Fairfield Museum, Exploring Craftsmanship Across Centuries"
3958,2016-01-17T00:00:00Z,Walter Weissman Photographs Celebrities
3959,2016-01-17T00:00:00Z,Chamber Music Society Aims to Expand Its Reach
3960,2016-01-17T00:00:00Z,In Praise of Blue Notes: What Makes Music Sad?
3961,2016-01-17T00:00:00Z,He Irons. She Stitches.
3962,2016-01-17T00:00:00Z,Bill Cunningham | Free Spirits
3963,2016-01-17T00:00:00Z,Farmers Markets and Food-Borne Illness
3964,2016-01-17T00:00:00Z,A Year Junk Bonds Lived Up to Their Name
3965,2016-01-17T00:00:00Z,Brownsville’s Broken Windows
3966,2016-01-17T00:00:00Z,Investing Advice That Doubles as a Bookmark
3967,2016-01-17T00:00:00Z,"For E.T.F. Traders, Lessons From the Panic"
3968,2016-01-17T00:00:00Z,Signs of a Retail Rebound as Consumers Take On More Debt
3969,2016-01-17T00:00:00Z,"Loose Lips Sink Careers, Even for C.E.O.s"
3970,2016-01-17T00:00:00Z,Follow Your Conscience Without Losing Your Shirt
3971,2016-01-17T00:00:00Z,Fund Managers Win With Tech Stalwarts and Burly Brand Names
3972,2016-01-17T00:00:00Z,"When Emerging Markets Roar, Stand Your Ground"
3973,2016-01-17T00:00:00Z,Inside The New York Times Book Review: ‘City of Thorns’
3974,2016-01-17T00:00:00Z,A Yacht Club in Brooklyn Elects Its First Female Commodore
3975,2016-01-17T00:00:00Z,"Andrew Smith, Who Played on Butler’s Final Four Teams, Dies at 25"
3976,2016-01-17T00:00:00Z,Robust 4th Quarter Couldn’t Redeem Market After an Anxious Year
3977,2016-01-17T00:00:00Z,How the Rev. Michael A. Walrond Jr. Spends His Sundays
3978,2016-01-17T00:00:00Z,When Prisoners Had Ski Jumps
3979,2016-01-17T00:00:00Z,"His Strength Sapped, Top Marathoner Ryan Hall Decides to Stop"
3980,2016-01-17T00:00:00Z,A Fashion Entrepreneur at Home in Brooklyn
3981,2016-01-17T00:00:00Z,What I Love | Andrew Livingston
3982,2016-01-17T00:00:00Z,"In Online Dating, ‘Sextortion’ and Scams"
3983,2016-01-17T00:00:00Z,Greenwich Village Townhouse Flipped for $23.3 Million
3984,2016-01-17T00:00:00Z,Big Ticket | 146 Waverly Place
3985,2016-01-17T00:00:00Z,"Ian Rankin’s ‘Even Dogs in the Wild,’ and More"
3986,2016-01-17T00:00:00Z,Iowa’s Heartland Beyond the Campaign Trail
3987,2016-01-17T00:00:00Z,Short Stories
3988,2016-01-17T00:00:00Z,"‘The Invitation-Only Zone,’ by Robert S. Boynton"
3989,2016-01-17T00:00:00Z,"‘The Kindness of Enemies,’ by Leila Aboulela"
3990,2016-01-17T00:00:00Z,"‘The Love of Strangers,’ by Nile Green"
3991,2016-01-17T00:00:00Z,"‘The Blue Line,’ by Ingrid Betancourt"
3992,2016-01-17T00:00:00Z,"‘Your Heart Is a Muscle the Size of a Fist,’ by Sunil Yapa"
3993,2016-01-17T00:00:00Z,"‘The Illegal,’ by Lawrence Hill"
3994,2016-01-17T00:00:00Z,"‘Midnight in Broad Daylight,’ by Pamela Rotner Sakamoto"
3995,2016-01-17T00:00:00Z,"‘Blood and Earth,’ by Kevin Bales"
3996,2016-01-17T00:00:00Z,"‘Conquerors: How Portugal Forged the First Global Empire,’ by Roger Crowley"
3997,2016-01-17T00:00:00Z,"‘Strictly No Elephants,’ ‘Big Friends’ and More"
3998,2016-01-17T00:00:00Z,"Junk Bonds Go Sour, but the Question Is How Sour"
3999,2016-01-17T00:00:00Z,Taller Condos on the Upper East Side
4000,2016-01-17T00:00:00Z,"‘Paper Wishes,’ by Lois Sepahban"
4001,2016-01-17T00:00:00Z,"‘Passenger,’ by Alexandra Bracken"
4002,2016-01-17T00:00:00Z,"‘City of Thorns,’ by Ben Rawlence"
4003,2016-01-17T00:00:00Z,Home Sales Around the New York Region
4004,2016-01-17T00:00:00Z,The Facts of Refugee Life in Fiction
4005,2016-01-17T00:00:00Z,Editors’ Choice
4006,2016-01-17T00:00:00Z,Paperback Row
4007,2016-01-17T00:00:00Z,Letters: Fail Better
4008,2016-01-17T00:00:00Z,On the Market in New York City
4009,2016-01-17T00:00:00Z,On the Market in the New York Region
4010,2016-01-17T00:00:00Z,Homes for Sale in New York and New Jersey
4011,2016-01-17T00:00:00Z,Homes for Sale in Brooklyn and Manhattan
4012,2016-01-17T00:00:00Z,How to Bridge That Stubborn Pay Gap
4013,2016-01-17T00:00:00Z,Prices Drop for Luxury New York Real Estate
4014,2016-01-17T00:00:00Z,‘The Fourth Sign of the Zodiac’ (excerpt)
4015,2016-01-17T00:00:00Z,How to Take Your Baby to Work
4016,2016-01-17T00:00:00Z,Prithvi Raj Singh Oberoi Knows a Bit About Luxury Travel
4017,2016-01-17T00:00:00Z,To Catch a Scammer in Madrid
4018,2016-01-17T00:00:00Z,The 1.3.16 Issue
4019,2016-01-17T00:00:00Z,"To Save Its Salmon, California Calls In the Fish Matchmaker"
4020,2016-01-17T00:00:00Z,From a Fight in the Playground to a Proposal
4021,2016-01-17T00:00:00Z,"On Again, For Life"
4022,2016-01-17T00:00:00Z,"In Greenpoint, a Doughnut Shop Where Time Stands Still"
4023,2016-01-17T00:00:00Z,"Divorced Parents, Living Close for the Children’s Sake"
4024,2016-01-17T00:00:00Z,Mmmm. Doughnuts.
4025,2016-01-17T00:00:00Z,"Things to Do on Long Island, Jan. 16 Through 24"
4026,2016-01-17T00:00:00Z,"Things to Do in New Jersey, Jan. 16 Through 24"
4027,2016-01-17T00:00:00Z,Young Republicans in New York
4028,2016-01-17T00:00:00Z,"Things to Do in the Hudson Valley, Jan. 16 Through 24"
4029,2016-01-17T00:00:00Z,"Things to Do in Connecticut, Jan. 16 Through 24"
4030,2016-01-17T00:00:00Z,"Martha Kelly in ‘Baskets’: Funny, if You’re O.K. With That"
4031,2016-01-17T00:00:00Z,Savages Embrace Love With Controlled Chaos on ‘Adore Life’
4032,2016-01-17T00:00:00Z,A Bitcoin Believer’s Crisis of Faith
4033,2016-01-17T00:00:00Z,‘Mad Tiger’ and Other Films Join a New Wave of Punk Documentaries
4034,2016-01-17T00:00:00Z,New Video Collections Examine Machines Modern and Less So
4035,2016-01-17T00:00:00Z,"With ‘Ride Along 2’ and Other Films, Will Packer Blurs the Niche Lines"
4036,2016-01-17T00:00:00Z,Division of Labor and Costs in a Relationship
4037,2016-01-17T00:00:00Z,"Chairlift on the Arias, Beats and Jazz Grooves That Fed ‘Moth’"
