,pub_date,headline
5079,2018-09-21T13:00:01+0000,"The Week in Tech: Are Robots Coming for Your Job? Eventually, Yes."
5080,2018-09-21T09:00:09+0000,Dianne Feinstein Rode One Court Fight to the Senate. Another Has Left Her Under Siege.
5081,2018-09-23T23:37:29+0000,The Supreme Court Is Coming Apart
5082,2018-09-23T15:29:27+0000,Welcome to College. Your Parents Are in the Tents Next Door.
5083,2018-09-23T22:55:19+0000,Trump’s China Fight Puts U.S. Tech in the Cross Hairs
5084,2018-09-23T20:44:26+0000,App-Only Banks Rise in Europe and Aim at Traditional Lenders
5085,2018-09-21T15:58:07+0000,"Many Voters Tend to Believe Christine Blasey Ford, Even if They Question Her Motive"
5086,2018-09-21T16:05:12+0000,Sheet-Pan Suppers Without the Meat
5087,2018-09-21T16:22:26+0000,DC Superheroes Have Their Own Streaming Service Now
5088,2018-09-21T16:22:29+0000,"In Reversal, Trump No Longer Demands Declassification of Russia Documents"
5089,2018-09-21T13:52:21+0000,"A ‘Hillbilly’ From Arkansas, Doing Life in Qatar"
5090,2018-09-21T13:57:53+0000,Is Your College Football Team in the Wrong League?
5091,2018-09-23T17:00:01+0000,Accused Sexual Assaulter’s Tale of Ostracism
5092,2018-09-23T15:29:27+0000,Welcome to College. Your Parents Are in the Tents Next Door.
5093,2018-09-23T22:55:19+0000,Trump’s China Fight Puts U.S. Tech in the Cross Hairs
5094,2018-09-23T04:05:01+0000,"Nancy Brous, Kurt Nelson"
5095,2018-09-23T04:05:03+0000,"Maggie Parker, Jason Stein"
5096,2018-09-23T05:00:07+0000,What’s on TV Sunday: ‘Anthony Bourdain: Parts Unknown’ and ‘Maniac’
5097,2018-09-23T20:44:26+0000,App-Only Banks Rise in Europe and Aim at Traditional Lenders
5098,2018-09-22T02:00:01+0000,Hearty Entree
5099,2018-09-22T02:01:38+0000,Google C.E.O. Denies Allegations of Political Bias in Search Results
5100,2018-09-22T02:40:14+0000,"At Missouri Rally, Trump Vows to Eliminate ‘Lingering Stench’ at the Justice Department"
5101,2018-09-23T01:26:32+0000,Hong Kong Is Bound Tighter to China (by Bridge and Bullet Train)
5102,2018-09-21T09:00:09+0000,New Fiction Traces the Anguish of Lost Young Men
5103,2018-09-22T22:27:13+0000,"For Tiger Woods at the Tour Championship, the End of a Drought Awaits"
5104,2018-09-22T19:40:51+0000,Six Siblings of a Republican Congressman Endorse His Opponent in Campaign Ads
5105,2018-09-22T21:08:42+0000,Campaign Sign for New Jersey Congressman Vandalized With Swastikas and Racist Graffiti
5106,2018-09-22T18:47:36+0000,Tentative Deal Reached for Christine Blasey Ford to Testify on Thursday
5107,2018-09-22T09:00:12+0000,"From Bobbi Brown, a Boutique Hotel in New Jersey"
5108,2018-09-22T13:00:42+0000,12 More Women Accuse California Doctor and Teacher in Sexual Assault Case
5109,2018-09-21T08:30:01+0000,News Quiz: Test Your Knowledge of the Week’s Headlines
5110,2018-09-21T14:54:50+0000,Prelude to Fall
5111,2018-09-21T08:30:01+0000,News Quiz: Test Your Knowledge of the Week’s Headlines
5112,2018-09-22T02:42:53+0000,NYC
5113,2018-09-22T11:58:58+0000,Stella Jean: Spring 2019
5114,2018-09-21T14:54:50+0000,Prelude to Fall
5115,2018-09-22T18:21:02+0000,Agnona: Spring 2019
5116,2018-09-23T10:00:01+0000,Her Strength Kept Her Family Together. Her Absence Sets Them Adrift.
5117,2018-09-21T09:00:09+0000,"New in Paperback: ‘Sticky Fingers,’ ‘Lea’"
5118,2018-09-21T09:00:13+0000,"Jeff Bezos Cites a Big Number, but Few Details, in Plan for Low-Income Montessori Preschools"
5119,2018-09-21T09:30:07+0000,G.E. Steps Into Europe’s Offshore Wind Market
5120,2018-09-21T00:14:11+0000,Suge Knight Gets 28 Years in Prison in Hit-and-Run Plea Deal
5121,2018-09-21T00:29:28+0000,NASA’s TESS Starts Collecting Planets
5122,2018-09-21T08:52:51+0000,"Brunello Cucinelli, Prince of All He Surveys"
5123,2018-09-21T10:00:01+0000,Stolen Bits of Time Turned Into a Lifetime Together
5124,2018-09-21T10:00:06+0000,New York Today: The Rundown on Our State IDs
5125,2018-09-21T10:00:07+0000,Retooling the Met Opera’s Problematic ‘Ring’ Machine
5126,2018-09-21T10:00:06+0000,The Choreographer Kyle Abraham Mixes Things Up at City Ballet
5127,2018-09-21T14:03:31+0000,The Final Battle to Acquire Sky: DealBook’s One Thing to Watch Today
5128,2018-09-21T14:27:18+0000,Cambodia Frees Australian Filmmaker Convicted of Spying
5129,2018-09-21T17:01:46+0000,Esi Edugyan on ‘Washington Black’
5130,2018-09-22T07:00:12+0000,"25 Years After Escobar’s Death, Medellín Struggles to Demolish a Legend"
5131,2018-09-22T09:00:13+0000,"For Hackers, Anonymity Was Once Critical. That’s Changing."
5132,2018-09-22T10:00:01+0000,Justin Theroux Is on the Prowl
5133,2018-09-22T10:12:43+0000,Attack on Military Parade in Iran Kills at Least 25
5134,2018-09-23T04:00:01+0000,"Lily Mercer, Austin Belcak"
5135,2018-09-23T04:05:01+0000,"Whitney Jefferson, Anderson Evans"
5136,2018-09-23T04:05:01+0000,"Kelsey Rhodes, Jeremy Brill"
5137,2018-09-22T20:19:03+0000,Trump Galvanized a Movement of Women. Kavanaugh Is Testing It.
5138,2018-09-22T18:30:09+0000,Back From the Storm
5139,2018-09-22T18:30:08+0000,The Burden of Proof for Kavanaugh
5140,2018-09-22T13:07:58+0000,Ruling on Health Care Subsidies Could Prove Costly for Government
5141,2018-09-23T04:05:01+0000,"Gloria Park, Eric DeJong"
5142,2018-09-23T04:05:01+0000,"Stephanie Rivkin, Joel Sircus"
5143,2018-09-23T20:55:25+0000,"Your Monday News Briefing: Brett Kavanaugh, China, Japan"
5144,2018-09-23T21:44:03+0000,Presidential Lying Is Contagious
5145,2018-09-23T18:27:13+0000,‘The House With a Clock in Its Walls’ Is No. 1 as ‘Life Itself’ Fizzles
5146,2018-09-23T23:31:38+0000,Jeff Bezos and the Trap of the Charitable-Industrial Complex
5147,2018-09-23T17:00:01+0000,Missing American Maestros? Look Again
5148,2018-09-23T17:58:24+0000,The Met Is Creating New Operas (Including Its First by Women)
5149,2018-09-23T20:37:15+0000,Kavanaugh to Give Senate Calendars From 1982 to Back Up Denial
5150,2018-09-23T10:10:32+0000,"Your Weekend Briefing: Brett Kavanaugh, Hurricane Florence, Russia"
5151,2018-09-22T18:30:08+0000,The Burden of Proof for Kavanaugh
5152,2018-09-23T04:05:01+0000,"Whitney Jefferson, Anderson Evans"
5153,2018-09-23T04:05:01+0000,"Kelsey Rhodes, Jeremy Brill"
5154,2018-09-23T04:05:01+0000,"Gloria Park, Eric DeJong"
5155,2018-09-23T04:05:01+0000,"Stephanie Rivkin, Joel Sircus"
5156,2018-09-23T04:00:01+0000,"Lily Mercer, Austin Belcak"
5157,2018-09-22T13:07:58+0000,Ruling on Health Care Subsidies Could Prove Costly for Government
5158,2018-09-23T21:44:03+0000,Presidential Lying Is Contagious
5159,2018-09-23T23:31:38+0000,Jeff Bezos and the Trap of the Charitable-Industrial Complex
5160,2018-09-23T20:37:15+0000,Kavanaugh to Give Senate Calendars From 1982 to Back Up Denial
5161,2018-09-23T20:55:25+0000,"Your Monday News Briefing: Brett Kavanaugh, China, Japan"
5162,2018-09-23T17:58:24+0000,The Met Is Creating New Operas (Including Its First by Women)
5163,2018-09-23T18:27:13+0000,‘The House With a Clock in Its Walls’ Is No. 1 as ‘Life Itself’ Fizzles
5164,2018-09-23T10:10:32+0000,"Your Weekend Briefing: Brett Kavanaugh, Hurricane Florence, Russia"
5165,2018-09-23T14:00:04+0000,Porcelain Finds Its Outside Voice
5166,2018-09-23T17:00:01+0000,Missing American Maestros? Look Again
5167,2018-09-21T22:15:21+0000,Two Days in Milan With Luke and Lucie Meier
5168,2018-09-23T10:00:01+0000,A Marine’s Life in Four Objects He Left Behind
5169,2018-09-23T10:00:01+0000,"A Beloved Model Soldier, His Suicide and Its Impact"
5170,2018-09-23T10:00:01+0000,"During an Insider Attack, Their Son Sacrificed His Life to Save Another"
5171,2018-09-23T10:00:01+0000,How a Generation of Kids Honor the Uncle They Never Knew
5172,2018-09-21T09:00:14+0000,Culture and Conservation Beneath the Sea
5173,2018-09-21T09:00:19+0000,"How Dayna Isom Johnson, of Etsy, Spends Her Sundays"
5174,2018-09-21T09:00:09+0000,The Writing Dead
5175,2018-09-21T09:00:09+0000,What Is Your Reaction to the Sexual Assault Allegations Against Judge Kavanaugh?
5176,2018-09-21T00:10:56+0000,"With 104 Wins and a Division Title, the Red Sox Now Confront Postseason Pressure"
5177,2018-09-21T00:34:51+0000,When The Times Kept Female Reporters Upstairs
5178,2018-09-21T01:33:58+0000,"Sword Killing Was ‘Practice’ for Racial Terrorism, Man Told Police"
5179,2018-09-21T01:43:05+0000,"No Corrections: September 21, 2018"
5180,2018-09-21T03:37:56+0000,Baker Mayfield Ends Cleveland Browns’ 635-Day Winless Streak
5181,2018-09-22T22:00:34+0000,Trump Administration Aims to Sharply Restrict New Green Cards for Those on Public Aid
5182,2018-09-22T14:30:01+0000,10 Recipes Readers Love
5183,2018-09-22T14:45:04+0000,Why Does the Tennis Season End Before It’s Over? 
5184,2018-09-22T16:00:01+0000,Variety: Puns and Anagrams
5185,2018-09-22T14:00:03+0000,Why Do My Rent-Stabilized Neighbors Own Vacation Homes?
5186,2018-09-22T14:02:48+0000,"Hurricane Florence Has Gone, but Challenges for the Carolinas Have Just Begun"
5187,2018-09-22T18:30:06+0000,Is This Man the Antidote to Donald Trump?
5188,2018-09-22T09:00:13+0000,"In Wayétu Moore’s Ambitious Debut Novel, Liberia Is Reborn"
5189,2018-09-22T18:30:08+0000,A Retirement Home’s Lessons in How to Keep in Touch 
5190,2018-09-22T18:30:07+0000,Sick to Your Stomach? #MeToo
5191,2018-09-21T07:40:36+0000,Fingers Point to China After Break-Ins Target New Zealand Professor
5192,2018-09-22T18:30:06+0000,Is This Man the Antidote to Donald Trump?
5193,2018-09-22T18:30:08+0000,A Retirement Home’s Lessons in How to Keep in Touch 
5194,2018-09-22T18:30:07+0000,Sick to Your Stomach? #MeToo
5195,2018-09-21T20:59:51+0000,The Death Toll for Afghan Forces Is Secret. Here’s Why.
5196,2018-09-21T17:00:04+0000,"Workers Overdose on the Job, and Employers Struggle to Respond"
5197,2018-09-22T00:12:36+0000,Trump’s Ex-Lawyer Is Said to Have Proposed Diverting Funds to Manafort and Gates
5198,2018-09-22T00:55:36+0000,This I Believe About Blasey v. Kavanaugh
5199,2018-09-22T03:30:43+0000,"Quotation of the Day: Trump Says if Attack on Kavanaugh Accuser Was ‘as Bad as She Says,’ Charges Would Have Been Filed"
5200,2018-09-21T12:25:11+0000,Another Case of Vanishing Latino Children
5201,2018-09-21T09:00:14+0000,Culture and Conservation Beneath the Sea
5202,2018-09-21T09:00:19+0000,"How Dayna Isom Johnson, of Etsy, Spends Her Sundays"
5203,2018-09-21T09:00:09+0000,The Writing Dead
5204,2018-09-21T09:00:09+0000,What Is Your Reaction to the Sexual Assault Allegations Against Judge Kavanaugh?
5205,2018-09-21T09:31:17+0000,"Your Friday News Briefing: Christine Blasey Ford, Boston Red Sox, ‘Maniac’"
5206,2018-09-21T10:00:04+0000,Why Is Trump Tacitly Supporting Corruption in Guatemala?
5207,2018-09-21T10:47:01+0000,"Tran Dai Quang, Hard-Line Vietnamese President, Dies at 61"
5208,2018-09-21T11:01:32+0000,"Restaurant Wants to Use Marijuana to Ease Lobsters’ Pain. Slow Your Roll, Maine Says."
5209,2018-09-21T13:30:03+0000,Another Condo Tower Sprouts in Downtown Brooklyn
5210,2018-09-21T15:14:07+0000,Is History Repeating Itself in Europe?
5211,2018-09-21T22:00:01+0000,The Art of Puzzle-Making
5212,2018-09-21T20:59:51+0000,The Death Toll for Afghan Forces Is Secret. Here’s Why.
5213,2018-09-21T21:34:34+0000,On Politics With Lisa Lerer: ‘I Found My Voice’
5214,2018-09-23T21:23:47+0000,San Francisco’s Jimmy Garoppolo Out for Season With Torn A.C.L.
5215,2018-09-23T22:00:00+0000,More Sagacious
5216,2018-09-23T23:36:34+0000,"Thomas, Kavanaugh and Race"
5217,2018-09-23T16:59:41+0000,China Is Confronting New U.S. Hostility. But Is It Ready for the Fight?
5218,2018-09-23T17:21:00+0000,Seeking America’s Quietest Spots: The Quest for Silence in a Loud World
5219,2018-09-23T20:02:30+0000,"Trump at the U.N.: Undiplomatic? This Time, Aides Fear the Opposite"
5220,2018-09-23T18:36:13+0000,Review: New ‘Magnum P.I.’ Is Mostly Nostalgia and Testosterone
5221,2018-09-22T22:00:34+0000,Trump Administration Aims to Sharply Restrict New Green Cards for Those on Public Aid
5222,2018-09-21T22:00:01+0000,The Art of Puzzle-Making
5223,2018-09-22T14:00:03+0000,Why Do My Rent-Stabilized Neighbors Own Vacation Homes?
5224,2018-09-22T14:02:48+0000,"Hurricane Florence Has Gone, but Challenges for the Carolinas Have Just Begun"
5225,2018-09-22T14:30:01+0000,10 Recipes Readers Love
5226,2018-09-22T14:45:04+0000,Why Does the Tennis Season End Before It’s Over? 
5227,2018-09-22T10:02:36+0000,Salvatore Ferragamo M/W: Spring 2019
5228,2018-09-22T13:22:39+0000,Roberto Cavalli: Spring 2019
5229,2018-09-22T17:33:22+0000,Gunmen Strike at Military Parade in Iran
5230,2018-09-23T10:00:01+0000,They Each Loved Her. Now They All Love One Another.
5231,2018-09-23T10:00:01+0000,The Army Brought Them Together. The War Tore Them Apart.
5232,2018-09-21T03:57:59+0000,Red Sox Win A.L. East Despite Giancarlo Stanton’s Grand Slam
5233,2018-09-21T04:00:01+0000,Pudge Will Keep Us Together
5234,2018-09-21T00:59:12+0000,"Quotation of the Day: Hey, Alexa, Defrost My Peas"
5235,2018-09-23T18:28:38+0000,"How Tiger Woods Won the Tour Championship, Shot by Shot"
5236,2018-09-23T18:32:36+0000,Review: The Mystery Plane of ‘Manifest’ Flies to Dullness
5237,2018-09-23T21:00:24+0000,Want to See What’s Up Amazon’s Sleeve? Take a Tour of Seattle
5238,2018-09-22T04:54:40+0000,FEMA Chief Brock Long Must Reimburse U.S. for Misuse of Agency Vehicles
5239,2018-09-22T05:00:07+0000,7 Golden Things
5240,2018-09-22T13:00:01+0000,Good Design With a Mix of Chemistry
5241,2018-09-22T05:00:07+0000,7 Golden Things
5242,2018-09-21T23:14:23+0000,It Was a Suspected ‘Birth Tourism’ Site. Then Came Late-Night Screams.
5243,2018-09-21T21:04:54+0000,"Michael Saudino, a New Jersey Sheriff, Resigns Over Racist Remarks"
5244,2018-09-21T23:46:39+0000,What Teenagers Think About the Allegations Against Brett Kavanaugh
5245,2018-09-22T08:30:00+0000,"Revisiting Kashmir, A New Hope in Alabama and More"
5246,2018-09-22T18:30:06+0000,Britain Stumbles Toward Disunion
5247,2018-09-22T18:30:06+0000,Nietzsche Made Me Do It
5248,2018-09-22T15:21:52+0000,Coming of Age in American Detention
5249,2018-09-22T13:00:01+0000,Good Design With a Mix of Chemistry
5250,2018-09-23T04:00:01+0000,"Kathleen Temrowski, Daniel Meyering"
5251,2018-09-23T04:00:01+0000,"Anne Salzman, Miika Tomi"
5252,2018-09-23T04:05:01+0000,"Leslie Hart, Christopher Van Bell"
5253,2018-09-23T04:10:01+0000,"Anna Uhls, Jordan Burke"
5254,2018-09-23T04:10:01+0000,"Paulie Dibner, Owen Parsons"
5255,2018-09-21T19:28:13+0000,"PayPal Cuts Off Alex Jones’s Infowars, Joining Other Tech Giants"
5256,2018-09-21T19:28:49+0000,Trump’s Demand of Christine Blasey Ford
5257,2018-09-21T17:47:30+0000,Rod Rosenstein Suggested Secretly Recording Trump and Discussed 25th Amendment
5258,2018-09-21T17:52:10+0000,What Do You Do When Someone Makes a Racist Remark?
5259,2018-09-21T21:04:54+0000,"Michael Saudino, a New Jersey Sheriff, Resigns Over Racist Remarks"
5260,2018-09-21T16:37:08+0000,A Cambodian Refugee Cooks From Memory at Nyum Bai
5261,2018-09-22T18:30:06+0000,Nietzsche Made Me Do It
5262,2018-09-22T15:21:52+0000,Coming of Age in American Detention
5263,2018-09-22T13:00:01+0000,Good Design With a Mix of Chemistry
5264,2018-09-23T21:00:24+0000,Want to See What’s Up Amazon’s Sleeve? Take a Tour of Seattle
5265,2018-09-23T17:00:01+0000,The D.E.A.’s Vital Role
5266,2018-09-23T17:01:30+0000,Christine Blasey Ford Reaches Deal to Testify at Kavanaugh Hearing
5267,2018-09-23T09:00:04+0000,"Walmart, Patagonia and Lyft Make Push to Increase Voter Turnout"
5268,2018-09-22T03:43:21+0000,Listen to the World
5269,2018-09-22T09:00:01+0000,Are You a Democratic Socialist?
5270,2018-09-23T10:00:02+0000,A Widow Starts Over With Her Husband Buried Close By
5271,2018-09-21T19:54:56+0000,"A Flight Over the Flooding, Saving Lives"
5272,2018-09-21T21:19:18+0000,Versace: Spring 2019
5273,2018-09-21T23:21:15+0000,"Marilyn Lloyd, 89, Tennessee Trailblazer in Congress, Dies"
5274,2018-09-21T23:41:56+0000,"As Economy Roars, Army Falls Thousands Short of Recruiting Goals"
5275,2018-09-22T07:00:07+0000,"These Robots Run, Dance and Flip. But Are They a Business?"
5276,2018-09-22T00:40:50+0000,"Tiger Woods, Grinding Through Round 2, Keeps Share of Tour Championship Lead"
5277,2018-09-21T18:28:19+0000,‘Saturday Night Live’ Adds New Cast Member for 44th Season
5278,2018-09-21T19:00:03+0000,When Feedback From Distant Bosses Feels Like an Insult
5279,2018-09-21T19:33:39+0000,Orrin Evans Has Been Playing Jazz for Years. So Why Is He a Rising Star?
5280,2018-09-21T19:34:39+0000,Brazil Fires Diplomat Accused of Assaulting Women
5281,2018-09-21T09:00:11+0000,Empty Nests Are Overrated
5282,2018-09-23T22:41:21+0000,"For Paul Simon and Joan Baez, Farewells Reckon With Past and Present"
5283,2018-09-23T22:45:00+0000,"Scandal Shakes a Virginia House Republican, Adding to Electoral Tremors"
5284,2018-09-23T20:25:07+0000,Review: Bringing Ted Shawn Back Into the Limelight
5285,2018-09-22T11:50:26+0000,China and Vatican Reach Deal on Appointment of Bishops
5286,2018-09-21T23:21:15+0000,"Marilyn Lloyd, 89, Tennessee Trailblazer in Congress, Dies"
5287,2018-09-21T23:41:56+0000,"As Economy Roars, Army Falls Thousands Short of Recruiting Goals"
5288,2018-09-22T00:40:50+0000,"Tiger Woods, Grinding Through Round 2, Keeps Share of Tour Championship Lead"
5289,2018-09-22T07:00:07+0000,"These Robots Run, Dance and Flip. But Are They a Business?"
5290,2018-09-22T09:00:10+0000,"Photos: Hurricane Maria, and Puerto Rico One Year Later"
5291,2018-09-22T16:00:00+0000,Me and My White Teachers
5292,2018-09-22T17:30:55+0000,How I Made a Crossword Puzzle You Can Hear
5293,2018-09-21T16:00:49+0000,The Frick Likely to Take Over the Met Breuer
5294,2018-09-21T16:14:33+0000,"Truly Delicious, Truly Simple"
5295,2018-09-21T16:57:35+0000,"The Playlist: Unreleased Chris Cornell, and 12 More New Songs"
5296,2018-09-21T19:00:03+0000,When Feedback From Distant Bosses Feels Like an Insult
5297,2018-09-21T19:33:39+0000,Orrin Evans Has Been Playing Jazz for Years. So Why Is He a Rising Star?
5298,2018-09-21T19:34:39+0000,Brazil Fires Diplomat Accused of Assaulting Women
5299,2018-09-21T14:02:39+0000,"Cody Wilson, 3-D Printed Gun Proponent, Is Arrested in Taiwan on Sex Assault Charge"
5300,2018-09-21T17:36:54+0000,"Review: Hear the Beat of Dancing Feet, Right in Times Square"
5301,2018-09-21T16:57:35+0000,"The Playlist: Unreleased Chris Cornell, and 12 More New Songs"
5302,2018-09-21T14:00:52+0000,"Glenstone, a Private Art Xanadu, Invests $200 Million in a Public Vision"
5303,2018-09-21T14:02:39+0000,"Cody Wilson, 3-D Printed Gun Proponent, Is Arrested in Taiwan on Sex Assault Charge"
5304,2018-09-21T10:32:14+0000,DealBook Briefing: Does Bank of America Care About Investment Banking?
5305,2018-09-21T11:25:42+0000,Can LeBron James Bring Back Showtime in Year 1? Don’t Bet Against Him
5306,2018-09-21T16:00:49+0000,The Frick Likely to Take Over the Met Breuer
5307,2018-09-21T16:14:33+0000,"Truly Delicious, Truly Simple"
5308,2018-09-21T17:36:54+0000,"Review: Hear the Beat of Dancing Feet, Right in Times Square"
5309,2018-09-21T08:00:09+0000,‘A Little Life’ Comes to the Stage. The Audience Can’t Look Away.
5310,2018-09-21T09:00:02+0000,How Long Do I Retain Immunity?
5311,2018-09-23T04:00:01+0000,"Scott Friesen, Alexander Davenport"
5312,2018-09-23T04:00:01+0000,"Sarah Perlmeter, Jonah Freelander"
5313,2018-09-23T04:00:01+0000,"Richard Bachmann, Matthew Farber"
5314,2018-09-23T04:05:01+0000,"Emily Sternfeld, John Craig Jr."
5315,2018-09-23T04:05:01+0000,"Jannine Versi, Daniel Weisberg"
5316,2018-09-23T00:09:20+0000,Wildfire Breaks Out Near Crowded Refugee Camp on Greek Island
5317,2018-09-24T23:15:17+0000,How Rosenstein Protects Mueller From Trump
5318,2018-09-25T06:30:05+0000,The Strange Life of Garden Eels
5319,2018-09-25T08:00:01+0000,58 Jazz Giants in One Immortal Image
5320,2018-09-25T09:00:01+0000,Do You Want Your Parents to Live Nearby When You Go to College?
5321,2018-09-25T09:00:05+0000,Is This Seat Taken? And Will You Marry Me? 
5322,2018-09-25T09:00:01+0000,Should I Go to a Gender-Reveal Party?
5323,2018-09-25T09:00:05+0000,"The 52 Places Traveler: In the Italian Dolomites, Dramatic Skies and Stone Giants"
5324,2018-09-25T12:26:13+0000,First Comes the ‘Shocking’ News. Then Comes the Navel-Gazing.
5325,2018-09-25T13:00:04+0000,Recent Commercial Real Estate Transactions
5326,2018-09-25T22:32:07+0000,‘I Believe Her’: Mazie Hirono Takes an Aggressive Stance in Kavanaugh Hearings
5327,2018-09-25T23:14:52+0000,"Frances Edelstein, Queen of the Polish Tea Room, Is Dead at 92"
5328,2018-09-25T23:19:59+0000,Trump to China: ‘I Own You.’ Guess Again. 
5329,2018-09-24T09:00:12+0000,It’s ‘One Tough Year’ After Hurricanes Tore Through British Virgin Islands
5330,2018-09-24T09:00:10+0000,"At Sentencing Hearing, Psychologist Says Cosby Remains a Threat"
5331,2018-09-24T10:00:04+0000,The Trouble With South Sudan’s New Peace Deal
5332,2018-09-24T13:38:13+0000,Sears C.E.O. Lampert Sounds Alarm on Bankruptcy Risk
5333,2018-09-24T13:39:03+0000,"Bag Fee Creep, and How to Fight It"
5334,2018-09-23T23:47:03+0000,South Korea’s Leader Opens a Door to the North
5335,2018-09-24T06:00:01+0000,Word + Quiz: sanguine
5336,2018-09-23T19:51:56+0000,Trump’s Tariff Trap 
5337,2018-09-25T09:00:05+0000,"The 52 Places Traveler: In the Italian Dolomites, Dramatic Skies and Stone Giants"
5338,2018-09-25T09:00:05+0000,New & Noteworthy
5339,2018-09-25T09:12:51+0000,"Offering Manicures With Your Hot Pot, China’s Haidilao Plans a Global Push"
5340,2018-09-25T08:00:01+0000,58 Jazz Giants in One Immortal Image
5341,2018-09-25T09:00:01+0000,Do You Want Your Parents to Live Nearby When You Go to College?
5342,2018-09-25T09:00:05+0000,Is This Seat Taken? And Will You Marry Me? 
5343,2018-09-25T09:00:01+0000,Should I Go to a Gender-Reveal Party?
5344,2018-09-25T10:33:42+0000,Gay Courtship on Vietnam’s ‘The Bachelor’ Turned Heads Abroad. Back Home? Meh.
5345,2018-09-25T11:00:05+0000,My Surprising Duet With Arthur Mitchell in Cold War Moscow
5346,2018-09-25T14:47:15+0000,"A Baroness, Her Skulls and a Macabre Exhibition"
5347,2018-09-25T22:01:19+0000,Tom Steyer to Spend Millions Backing Andrew Gillum in Florida
5348,2018-09-25T22:32:07+0000,‘I Believe Her’: Mazie Hirono Takes an Aggressive Stance in Kavanaugh Hearings
5349,2018-09-25T23:14:52+0000,"Frances Edelstein, Queen of the Polish Tea Room, Is Dead at 92"
5350,2018-09-25T23:19:59+0000,Trump to China: ‘I Own You.’ Guess Again. 
5351,2018-09-25T16:59:59+0000,"Alabama Revisits Ten Commandments, Hoping for Help From Kavanaugh"
5352,2018-09-25T17:00:28+0000,Review: The Met’s New ‘Samson’ Succeeds Only as Kitsch
5353,2018-09-25T17:28:31+0000,How Trump Is Being Protected in New York (and What It May Cost)
5354,2018-09-25T16:18:46+0000,Trump Unleashes on Kavanaugh Accuser as Key Republican Wavers
5355,2018-09-25T18:17:59+0000,"Flash Flooding in Connecticut, New Jersey and New York Turns Roads Into Rivers"
5356,2018-09-25T21:09:44+0000,3-D Printed Implant Gives Patches the Dachshund a New Skull
5357,2018-09-25T23:54:03+0000,"Quotation of the Day: Bill Cosby, Once a Model of Fatherhood, Is Sent to Prison for Sexual Assault"
5358,2018-09-25T18:25:33+0000,One Reason for Slow Wage Growth? More Benefits
5359,2018-09-24T13:38:13+0000,Sears C.E.O. Lampert Sounds Alarm on Bankruptcy Risk
5360,2018-09-24T13:39:03+0000,"Bag Fee Creep, and How to Fight It"
5361,2018-09-24T09:00:12+0000,It’s ‘One Tough Year’ After Hurricanes Tore Through British Virgin Islands
5362,2018-09-24T09:00:10+0000,"At Sentencing Hearing, Psychologist Says Cosby Remains a Threat"
5363,2018-09-24T10:00:04+0000,The Trouble With South Sudan’s New Peace Deal
5364,2018-09-24T15:49:29+0000,"Soju, Straight From New York"
5365,2018-09-24T15:53:44+0000,What Artists Would Do if They Could Fly to the Moon
5366,2018-09-24T09:00:07+0000,Congratulations. Your Study Went Nowhere.
5367,2018-09-24T15:00:04+0000,Giving Malaria a Deadline
5368,2018-09-24T10:00:04+0000,The Trouble With South Sudan’s New Peace Deal
5369,2018-09-24T23:03:56+0000,"North Carolina, a ‘Slow Spender’ State, Struggles to Hand Out Storm Aid"
5370,2018-09-24T23:15:45+0000,Buybacks Continued to Boom Last Quarter: DealBook’s Closing Bell
5371,2018-09-24T23:57:26+0000,More Scare Tactics From the Trump Administration
5372,2018-09-25T03:00:31+0000,"By Starting a Reliever, the Yankees Imitate and Eliminate the Rays"
5373,2018-09-25T05:00:04+0000,What’s on TV Tuesday: ‘Doctor Who’ and ‘This Is Us’
5374,2018-09-25T01:44:34+0000,Thousands Are Arrested in Ethiopia After Ethnic Violence
5375,2018-09-25T01:56:32+0000,‘Lion King’ Puppet Specialist Charged With Manufacturing 3-D Printed Gun at Theater
5376,2018-09-24T20:05:26+0000,Thousands Flee in Cameroon as Separatists Battle for New Nation
5377,2018-09-24T23:56:57+0000,"Kavanaugh’s Yearbook Page Is ‘Horrible, Hurtful’ to a Woman It Named"
5378,2018-09-24T09:00:04+0000,"Cuba: My Brother, My Teacher"
5379,2018-09-23T10:00:02+0000,Seeing Signs: Proof That Her Husband Is With Her
5380,2018-09-23T11:31:49+0000,Giorgio Armani: Spring 2019
5381,2018-09-23T15:13:41+0000,"Jeremy Corbyn, at Labour Party Conference, Faces Pressure on New Brexit Vote"
5382,2018-09-23T15:57:44+0000,Are Landlords Telling the Truth? The City Doesn’t Always Check. He Does.
5383,2018-09-25T21:02:52+0000,"Joshua Roth, Who Brought Agents to Visual Artists, Dies at 40"
5384,2018-09-25T21:12:09+0000,Germany’s Bishops Apologize for Sex Abuse and Pledge to Pursue Justice
5385,2018-09-25T21:33:39+0000,‘The Good Place’ Is Coming Back for Season 3. Here’s What to Remember
5386,2018-09-25T16:25:17+0000,Bill Cosby Sentenced as Brett Kavanaugh Battles Accusations. And It’s Only Tuesday.
5387,2018-09-24T16:55:54+0000,Sophisticated Spreads From the Heartland
5388,2018-09-24T23:40:17+0000,"Jair Bolsonaro, Candidate in Brazil, Faces Women’s Calls: #NotHim"
