,pub_date,headline
5421,2016-02-22T00:00:00Z,"Paid Notice: Memorials  OXLEY, J. LEONARD. PIANIST, CONDUCTOR, ARRANGER"
5422,2016-02-22T00:00:00Z,"Paid Notice: Deaths  JACOBSON, SEYMOUR B."
5423,2016-02-22T00:00:00Z,"Paid Notice: Deaths  AGRUSA, PAULA TRIFFO"
5424,2016-02-22T00:00:00Z,"Paid Notice: Deaths  SULIMIRSKI, WITOLD S"
5425,2016-02-22T00:00:00Z,"Paid Notice: Deaths  KAUFMAN, ROBERT"
5426,2016-02-22T00:00:00Z,"Paid Notice: Deaths  KAUFMAN, ROBERT"
5427,2016-02-22T00:00:00Z,"Paid Notice: Deaths  BOWDEN, BARBARA A."
5428,2016-02-22T00:00:00Z,"Paid Notice: Deaths  GAZARIAN, JEAN BERNARD"
5429,2016-02-22T00:00:00Z,"Paid Notice: Deaths  KARP, BELLA"
5430,2016-02-22T00:00:00Z,"Paid Notice: Deaths  KAUFMAN, ROBERT"
5431,2016-02-22T00:00:00Z,"Paid Notice: Deaths  KAUFMAN, ROBERT"
5432,2016-02-22T00:00:00Z,"Paid Notice: Deaths  LUCAS, THOMAS PARKER"
5433,2016-02-22T00:00:00Z,N.B.A. Game of the Week: Warriors at Thunder
5434,2016-02-22T00:00:00Z,"Douglas L. Inman, Coastal Science Pioneer, Dies at 95"
5435,2016-02-22T00:00:00Z,"Rosario Ferré, Writer Who Examined Puerto Rican Identity, Dies at 77"
5436,2016-02-22T00:00:00Z,Copa Am&eacute;rica Draw Hands U.S. a Tough Task
5437,2016-02-22T00:00:00Z,Escape From Bushworld
5438,2016-02-22T00:00:00Z,"Review: ‘Nice Fish,’ Mark Rylance and Louis Jenkins’s Quirky Ice Fishing Tale"
5439,2016-02-22T00:00:00Z,Governors Devise Bipartisan Effort to Reduce Opioid Abuse
5440,2016-02-22T00:00:00Z,"Brewers’ Ryan Braun Is Headed to Old Spot, Making Room in Right"
5441,2016-02-22T00:00:00Z,"In a Black Church in South Carolina, Bernie Sanders Struggles to Get an ‘Amen’"
5442,2016-02-22T00:00:00Z,Nets Are Undone by Hornets
5443,2016-02-22T00:00:00Z,Delegate Count Leaving Bernie Sanders With Steep Climb
5444,2016-02-22T00:00:00Z,"Jimmer Fredette, a Basketball Prodigy, Now Plays Catch-Up"
5445,2016-02-22T00:00:00Z,"As a Species, the Knuckleball Flutters but Survives "
5446,2016-02-22T00:00:00Z,Yankees Hope New Workout Area Puts Them on Upward Trajectory
5447,2016-02-22T00:00:00Z,Wild Muster a Show of Strength in Their Long-Awaited Outdoor Game
5448,2016-02-22T00:00:00Z,Quotation of the Day
5449,2016-02-22T00:00:00Z,"No Corrections: February 22, 2016"
5450,2016-02-22T00:00:00Z,Teaching Bronx Students the Language of Computers
5451,2016-02-22T00:00:00Z,A Rising Call to Promote STEM Education and Cut Liberal Arts Funding
5452,2016-02-22T00:00:00Z,Iran’s Thwarted Reformers Set Careful Goals for Coming Vote
5453,2016-02-22T00:00:00Z,Wellness App Aims to Improve Workplace Nutrition
5454,2016-02-22T00:00:00Z,When a State Balks at a City’s Minimum Wage
5455,2016-02-22T00:00:00Z,College Student Missing After Plane Lands in a Long Island Harbor
5456,2016-02-22T00:00:00Z,Maple Syrup Makers in New York Savor Aftertaste of a Mild Winter
5457,2016-02-22T00:00:00Z,"Allergan Earnings, the Mobile World Congress and Durable Goods Data"
5458,2016-02-22T00:00:00Z,India Sends Troops to Disrupt Protest Parching Delhi
5459,2016-02-22T00:00:00Z,U.S. Scrambles to Contain Growing ISIS Threat in Libya
5460,2016-02-22T00:00:00Z,"Like the Last President to Visit Cuba, Obama Seeks a Change"
5461,2016-02-22T00:00:00Z,Review: George London Foundation Singing Competition Offers Arias to Please a Crowd
5462,2016-02-22T00:00:00Z,Review: Limón Dance Company Reconstructs Its Founder’s ‘Dialogues’
5463,2016-02-22T00:00:00Z,"16 Years After Bush v. Gore, Still Wrestling With Ballot-Box Rules"
5464,2016-02-22T00:00:00Z,Bernie Sanders Hits a Roadblock
5465,2016-02-22T00:00:00Z,Oscars Pin Hopes on Chris Rock for Ratings
5466,2016-02-22T00:00:00Z,Review: ‘Madama Butterfly’ Showcases Ana María Martínez
5467,2016-02-22T00:00:00Z,A Lingerie Brand Offers Real Women as (Role) Models
5468,2016-02-22T00:00:00Z,"Review: ‘Suspects,’ Britain’s Unscripted Relative of ‘Law &amp; Order’"
5469,2016-02-22T00:00:00Z,"Reporting on Life, Death and Corruption in Southeast Asia"
5470,2016-02-22T00:00:00Z,Treasury Auctions Set for the Week of Feb. 22
5471,2016-02-22T00:00:00Z,A Bruised San Bernardino Shows Cultural Stirrings
5472,2016-02-22T00:00:00Z,When Peacekeepers Come Home
5473,2016-02-22T00:00:00Z,5G Is a New Frontier for Mobile Carriers and Tech Companies
5474,2016-02-22T00:00:00Z,"When Harper Lee, of ‘Mockingbird,’ Corresponded With Opus the Penguin’s Creator"
5475,2016-02-22T00:00:00Z,Election of a Female President Opens a New Era for a Former Boys Club
5476,2016-02-22T00:00:00Z,The European Dream: A Requiem
5477,2016-02-22T00:00:00Z,Truce Unravels as Fighting Picks Up in Ukraine
5478,2016-02-22T11:30:00Z,What Passes for Sedition in India
5479,2016-02-22T00:00:00Z,Yoenis Cespedes Appears Early; the Mets Appear Pleased
5480,2016-02-22T00:00:00Z,London Mayor Joins Chorus Demanding Exit From E.U.
5481,2016-02-22T00:00:00Z,Yale Banishes Demons. Next Are Tigers and Lions.
5482,2016-02-22T00:00:00Z,‘Deadpool’ Holds Top Spot at Box Office
5483,2016-02-22T00:00:00Z,"Caution Rebuffed, Unicorns and Other Start-Ups Fixate on Rainbows"
5484,2016-02-22T00:00:00Z,"Review: In ‘Evicted,’ Home Is an Elusive Goal for America’s Poor"
5485,2016-02-22T00:00:00Z,Kerry Says U.S. and Russia Near Syria Truce Deal as 100 Die in Attacks
5486,2016-02-22T00:00:00Z,Welsh Town Leads a British Revolt Against the Tax System and Corporations
5487,2016-02-22T00:00:00Z,"After South Carolina, Cruz and Rubio Vie to Become Top Rival to Trump"
5488,2016-02-22T00:00:00Z,"Samsung Announces Gear 360, a New Virtual Reality Camera"
5489,2016-02-22T00:00:00Z,Liv Tyler’s Final Touches for Belstaff
5490,2016-02-22T00:00:00Z,"Review: In ‘The Woodsman,’ a Love Lost in Oz Under a Witch’s Spell"
5491,2016-02-22T00:00:00Z,"Trump Targets Free Trade, and G.O.P. Follows Suit"
5492,2016-02-22T00:00:00Z,"Ticket Sellers Promise Marquee Names, but the Comics Rarely Show"
5493,2016-02-22T00:00:00Z,U.S. Calls for Release of Uganda’s Opposition Leader
5494,2016-02-22T00:00:00Z,"A Long Island Enclave Where Skeet Shooting Is Legal, to the Surprise of Village Officials"
5495,2016-02-22T00:00:00Z,Referendum to Let Bolivian President Seek a Fourth Term Appears Headed for Defeat
5496,2016-02-22T00:00:00Z,"Apple Still Holds the Keys to Its Cloud Service, but Reluctantly"
5497,2016-02-22T00:00:00Z,Pivotal Nursing Home Suit Raises a Simple Question: Who Signed the Contract?
5498,2016-02-22T00:00:00Z,Kalamazoo Searches for Motive in Spree That Killed 6
5499,2016-02-22T11:30:00Z,"In F.A. Cup, a Fan’s Act Raises Specter of Stadium Violence"
5500,2016-02-22T00:00:00Z,South Carolina and Nevada Takeaways: Messages Get Results
5501,2016-02-22T15:31:54Z,The Guantanamo Docket
5502,2016-02-23T00:00:00Z,Unearthing Bogotá’s Past on the Carrera Séptima
5503,2016-02-23T00:00:00Z,"Crossing Borders, Confronting Boundaries"
5504,2016-02-23T00:00:00Z,"Trump and Ryan, Matter and Antimatter"
5505,2016-02-23T00:00:00Z,Five Spring Trends for Men
5506,2016-02-23T00:00:00Z,Inside “Tom House: Tom of Finland in Los Angeles”
5507,2016-02-23T00:00:00Z,8 Ways to Elevate Your Breakfast
5508,2016-02-23T00:00:00Z,"Predator or Prey: Shark Fishing in Baja, Mexico"
5509,2016-02-23T00:00:00Z,&apos;The People v. O.J. Simpson’ Episode 4: The Rise of Cochran
5510,2016-02-23T22:32:38+0000,Review: Maria Hassabi’s ‘Plastic’ Sends Dancers Crawling Through MoMA
5511,2016-02-23T22:19:25Z,Gabrielle Giffords Joins Hillary Clinton in South Carolina to Pay Tribute to Victims of Gun Violence
5512,2016-02-23T00:00:00Z,The Nevada Republican Caucuses
5513,2016-02-23T22:00:12Z,Goes Underwater
5514,2016-02-23T21:05:00+0000,What Roles Get Black Actors to the Oscars?
5515,2016-02-23T19:47:48Z,"Told to &#8216;Take the Gloves Off,&#8217; John Kasich Says the Race Is Out of His Hands"
5516,2016-02-23T05:00:00Z,3 Steps to Brewing a Better Cup of Coffee
5517,2016-02-23T18:26:09+0000,CBS Films Aims to Recreate Shootout After Boston Marathon Bombing
5518,2016-02-23T18:01:34Z,The Rest of the World Gets a Breather as Republican Presidential Candidates Attack One Another
5519,2016-02-23T00:00:00Z,"Your Tuesday Evening Briefing: Donald Trump, Syria, Zika"
5520,2016-02-23T00:00:00Z,Your Evening Briefing
5521,2016-02-23T17:43:31Z,How to Get Rid of a Tattoo You’ve Outgrown
5522,2016-02-23T17:08:05Z,What We&#8217;re Reading
5523,2016-02-23T16:52:36Z,"Feb. 23, 2016 — Photos of the Day"
5524,2016-02-23T00:00:00Z,Pictures of the Day: Greece and More
5525,2016-02-23T00:00:00Z,Judiciary Committee Letter Opposing Supreme Court Hearings
5526,2016-02-23T00:00:00Z,Race in America: Your Stories
5527,2016-02-23T00:00:00Z,"Three’s a Trend: Dark, Romantic — and Lacy"
5528,2016-02-23T16:01:12Z,Whole Grain Blueberry Muffins
5529,2016-02-23T00:00:00Z,Scuba Diving in Thailand
5530,2016-02-23T14:51:02Z,Facts &#038; Figures: Majority of Americans Say Senate Should Vote on Supreme Court Nominee
5531,2016-02-23T14:32:59+0000,How Will Obama’s Plan to Close Guantánamo Work?
5532,2016-02-23T14:12:23Z,Rubio-Kasich Revisited
5533,2016-02-23T13:55:56Z,University of Oklahoma Agrees to Return Pissarro Painting Looted by Nazis
5534,2016-02-23T13:52:17Z,"Rivals No More, Marco Rubio and Jeb Bush Talk and Agree to Meet"
5535,2016-02-23T13:28:53Z,Group Predicts 17 Percent Increase in Latino Vote From 2012
5536,2016-02-23T00:00:00Z,Karlie Kloss and Natalia Vodianova at Fabulous Fund Fair
5537,2016-02-23T00:00:00Z,"Off the Runway, London Fashion Week"
5538,2016-02-23T12:41:43Z,Ben Carson Says Obama Can&#8217;t Identify With Black Experience Because He Was &#8216;Raised White&#8217;
5539,2016-02-23T00:00:00Z,How Should Asian-Americans Feel About the Peter Liang Protests?
5540,2016-02-23T00:00:00Z,The Plan for Closing Guantánamo Bay Prison
5541,2016-02-23T00:00:00Z,Take Two: James Franco and Augusten Burroughs
5542,2016-02-23T00:00:00Z,Trump’s Letter to Giuliani and the Response
5543,2016-02-23T00:00:00Z,Cape Coverage
5544,2016-02-23T00:00:00Z,"London Fashion Week: Erdem, Burberry and Christopher Kane in Pictures"
5545,2016-02-23T11:28:05Z,Major David Hockney Show Planned for Tate Britain
5546,2016-02-23T11:18:57Z,"Spike Lee, in Radio Ad, Endorses &#8216;My Brother Bernie Sanders&#8217;"
5547,2016-02-23T11:14:11Z,Realistic Growth Prospects
5548,2016-02-23T11:02:05Z,1941: Duce Says Nazi Troops in Libya
5549,2016-02-23T10:31:13Z,Golden Memories
5550,2016-02-23T10:28:41Z,Adviser to Koch Brothers to Join Marco Rubio&#8217;s Campaign
5551,2016-02-23T10:05:20Z,1916: Massive Attacks Near Verdun
5552,2016-02-23T00:00:00Z,A Young Ukrainian Designer Cheerfully at Home in Milan
5553,2016-02-23T00:00:00Z,Investigation Summary in the Shooting of Kenneth Releford
5554,2016-02-23T09:44:40Z,Ted Cruz Takes a More Aggressive Stance on Illegal Immigration
5555,2016-02-23T00:00:00Z,Marianna Senchina’s Romantic Fall Collection
5556,2016-02-23T09:04:54Z,"Bill Gates, the &#8216;Impatient Optimist,&#8217; Lays Out his Clean-Energy Innovation Agenda"
5557,2016-02-23T00:00:00Z,Marques’Almeida: Fall 2016
5558,2016-02-23T00:00:00Z,The Daily Shoe: Christopher Kane
5559,2016-02-23T00:00:00Z,Bill Gates’s Clean-Energy Moon Shot
5560,2016-02-23T08:57:07Z,Bill Gates’s Clean-Energy Moon Shot
5561,2016-02-23T08:55:23Z,"Donald Trump Has Slight Edge Over John Kasich in Ohio, Poll Says"
5562,2016-02-23T00:00:00Z,The Daily Bag: Burberry
5563,2016-02-23T00:00:00Z,Putting the Old Apartments Behind Her
5564,2016-02-23T08:00:29Z,Bright Passages
5565,2016-02-23T00:00:00Z,The Daily Jewel: Peter Pilotto
5566,2016-02-23T00:00:00Z,"Donald Trump, Crony Capitalist"
5567,2016-02-23T07:30:35Z,"Weekly News Quiz | Feb. 16-22, 2016"
5568,2016-02-23T07:30:32Z,1916: An Eyewitness at Verdun
5569,2016-02-23T07:00:56Z,Rivals Chase Donald Trump Into Nevada Caucuses
5570,2016-02-23T06:31:50Z,Morning Agenda: United Technologies Declines Honeywell Offer
5571,2016-02-23T00:00:00Z,Chappatte on Apple and the F.B.I.
5572,2016-02-23T00:00:00Z,Battle for the Supreme Court: Our Insiders’ Guide
5573,2016-02-23T06:00:35Z,"With Plenty to Discuss, Senators Will Meet for First Time Since Antonin Scalia&#8217;s Death"
5574,2016-02-23T00:00:00Z,New York Today: Monumental Decisions
5575,2016-02-23T00:00:00Z,"Your Tuesday Briefing: Nevada, iPhone, Kalamazoo"
5576,2016-02-23T05:45:54Z,Getting Pregnant After a Miscarriage
5577,2016-02-23T00:00:00Z,Your Tuesday Morning Briefing
5578,2016-02-23T05:30:44Z,Student Question | Should We Think Twice Before Buying Online?
5579,2016-02-23T00:00:00Z,Block by Block: Hell’s Kitchen
5580,2016-02-23T04:50:00Z,Block by Block | Hell’s Kitchen
5581,2016-02-23T04:45:14Z,News Q&#8217;s | Haryana State in India Proposes New Caste Status in Bid to Quell Protests
5582,2016-02-23T03:59:11+0000,How Society Pays When Women’s Work Is Unpaid
5583,2016-02-23T03:21:40Z,Notes From Psychiatry&#8217;s Battle Lines
5584,2016-02-23T03:21:37Z,Kenyans Reacquire an Old Taste: Eating Healthier
5585,2016-02-23T00:00:00Z,The Plan to Shut Down Gitmo
5586,2016-02-23T00:00:00Z,Relying Again on an Unreliable Mr. Putin
5587,2016-02-23T00:00:00Z,Three Views of Marriage
5588,2016-02-23T00:00:00Z,The Supreme Court and Police Searches
5589,2016-02-23T03:20:00Z,Has Encryption Gone Too Far?
5590,2016-02-23T03:00:59Z,Photographing Hip-Hop&#8217;s Golden Era
5591,2016-02-23T02:37:30Z,This Is What A Real Wall Street Shill Sounds Like
5592,2016-02-23T01:23:34Z,Donald Trump on Protester: &#8216;I&#8217;d Like to Punch Him in the Face&#8217;
5593,2016-02-23T00:00:00Z,Quotation of the Day
5594,2016-02-23T00:00:00Z,"Corrections: February 23, 2016"
5595,2016-02-23T00:00:00Z,What to Watch Tuesday
5596,2016-02-23T00:00:00Z,Blue Jackets Top Bruins; Capitals Win
5597,2016-02-23T00:00:00Z,Jeff Francoeur Returns to Braves
5598,2016-02-23T00:00:00Z,"Kyla Ross, U.S. Gold Medalist, Retires"
5599,2016-02-23T00:00:00Z,Norwegian Ski Jumper Sets a Record
5600,2016-02-23T00:00:00Z,No. 12 Miami Knocks Off No. 3 Virginia
5601,2016-02-23T00:00:00Z,Manchester United Reaches F.A. Cup Quarterfinals
5602,2016-02-23T00:02:33Z,Word of the Day + Quiz | zealot
5603,2016-02-23T00:00:00Z,Obama to Visit Florida Factory to Polish Stimulus’s Legacy
5604,2016-02-23T00:00:00Z,"Review: In ‘Playing to the Edge,’ Michael V. Hayden, Bush-Era Spymaster, Defends His Record"
5605,2016-02-23T00:00:00Z,"Paid Notice: Deaths  MEYERSON, PHILIP"
5606,2016-02-23T00:00:00Z,"Paid Notice: Deaths  MELNICK, THELMA"
5607,2016-02-23T00:00:00Z,"Paid Notice: Memorials  KAYE, ROBBIE"
5608,2016-02-23T00:00:00Z,"Paid Notice: Deaths  HENDRICKS, DR"
5609,2016-02-23T00:00:00Z,"Paid Notice: Deaths  RUSSO, THERESA"
5610,2016-02-23T00:00:00Z,"Paid Notice: Memorials  DRABKIN, STEVEN WAYNE"
5611,2016-02-23T00:00:00Z,"Paid Notice: Deaths  MYLES, MARTIN B."
5612,2016-02-23T00:00:00Z,"Paid Notice: Deaths  BRIORDY, DENNIS SR."
5613,2016-02-23T00:00:00Z,"Paid Notice: Deaths  ISAACSON, LEONARD A"
5614,2016-02-23T00:00:00Z,"Paid Notice: Deaths  ADES, ROBERT J"
5615,2016-02-23T00:00:00Z,"Paid Notice: Deaths  BARSH, SUSAN"
5616,2016-02-23T00:00:00Z,"Paid Notice: Deaths  ISAACSON, LEONARD A"
5617,2016-02-23T00:00:00Z,"Paid Notice: Deaths  KAUFMAN, ROBERT"
5618,2016-02-23T00:00:00Z,"Paid Notice: Deaths  KAUFMAN, ROBERT"
5619,2016-02-23T00:00:00Z,"Paid Notice: Deaths  NAHMIAS, JACK"
5620,2016-02-23T00:00:00Z,"Paid Notice: Deaths  KARP, BELLA"
5621,2016-02-23T00:00:00Z,"Warriors Post 50th Win, Beating the Hawks"
5622,2016-02-23T00:00:00Z,"Chris Carter Expects More ‘X-Files,’ Definitely Reads Reviews"
5623,2016-02-23T00:00:00Z,Jury Awards New York Firefighters $183 Million in 2005 Blaze
5624,2016-02-23T00:00:00Z,Knicks Summon Reinforcement but Fall Far Short of Raptors
5625,2016-02-23T00:00:00Z,Massachusetts: Cosby&#8217;s Wife Gives Deposition 
5626,2016-02-23T00:00:00Z,House Panel Confirms Inquiry Into Democrat 
5627,2016-02-23T00:00:00Z,Missouri: McCaskill to Undergo Cancer Treatment
5628,2016-02-23T00:00:00Z,Virginia: Bill Allowing More Concealed Guns Passes 
5629,2016-02-23T00:00:00Z,Maryland: Court Shields Abortion Clinic Applicants 
5630,2016-02-23T00:00:00Z,"24 Years Later, Joe Biden’s Words Haunt Democrats"
5631,2016-02-23T00:00:00Z,"Review: ‘Smokefall,’ About Several Generations of an Eccentric Family"
5632,2016-02-23T00:00:00Z,PBS Is Creating a Channel Exclusively for Children
5633,2016-02-23T00:00:00Z,"Review: In ‘Her Requiem,’ a Gifted Daughter and Her Two Warring Parents"
5634,2016-02-23T00:00:00Z,Yankees Willing to Hold Meeting With StubHub
5635,2016-02-23T00:00:00Z,"The Magic Shop, a Venerable Recording Studio in SoHo, Will Close"
5636,2016-02-23T00:00:00Z,"Mets’ Rafael Montero, After Early Promise and Setbacks, Hopes to Regroup"
5637,2016-02-23T00:00:00Z,Joe Biden Speech From 1992 Gives G.O.P. Fodder in Court Fight
5638,2016-02-23T00:00:00Z,Off-Campus ‘Ghetto Party’ Condemned by Fairfield University
5639,2016-02-23T00:00:00Z,"A. J. Pierzynski, the Man They Love to Hate, Is Still Behind the Plate"
5640,2016-02-23T00:00:00Z,Shifting Game Plan: Think Small and Fire 3-Pointers
5641,2016-02-23T00:00:00Z,Russia Wants Closer Look From Above the U.S.
5642,2016-02-23T00:00:00Z,Woman’s Lawsuit Says DNA Proves Mt. Sinai Doctor Assaulted Her
5643,2016-02-23T00:00:00Z,Zimbabwe: Government Seizes Mining Operations
5644,2016-02-23T00:00:00Z,"Origin of Bullet That Struck New York Officer Remains Unclear, Police Say"
5645,2016-02-23T00:00:00Z,Analysts Question Viability of Deep Tax Cuts Proposed by Republican Candidates
5646,2016-02-23T00:00:00Z,Fiji: Deadly Cyclone Devastates Island
5647,2016-02-23T00:00:00Z,"For Apple, a Search for a Moral High Ground in a Heated Debate"
5648,2016-02-23T00:00:00Z,Consultant to Politicians in Brazil Faces Arrest
5649,2016-02-23T00:00:00Z,Mobs in Ukraine Attack Russian Banks in Burst of &#8216;Office Pogroms&#8217;
5650,2016-02-23T00:00:00Z,Man Testifies How Night Out in the West Village Ended With Gay Slurs and a Friend’s Killing
5651,2016-02-23T00:00:00Z,"Bubba Watson, a Candid and Sensitive Champion, Shows His Vulnerable Side"
5652,2016-02-23T00:00:00Z,"Voters Might Not Miss Jeb Bush, but Campaign Reporters Will"
5653,2016-02-23T00:00:00Z,Ex-Deportation Officer Accused of Demanding Bribes and Sex From Immigrants
5654,2016-02-23T00:00:00Z,"Brock Nelson, a Prolific Scorer, Eases the Islanders’ Burden"
5655,2016-02-23T00:00:00Z,"Lee Stempniak, a Steady Veteran, Stabilizes the Devils"
5656,2016-02-23T00:00:00Z,Grief Gives Way to Division in First Court Arguments Since Scalia&#8217;s Death
5657,2016-02-23T00:00:00Z,United Technologies Declines Renewed Offer From Honeywell
5658,2016-02-23T00:00:00Z,Poor Prediction Sinks Fitbit Shares in After-Hours Trading
5659,2016-02-23T00:00:00Z,Lumber Liquidators Takes Hit After C.D.C. Elevates Warning
5660,2016-02-23T00:00:00Z,Atlantic City Officials Spurn Proposed Takeover by State
5661,2016-02-23T00:00:00Z,Norwegian Air Flies in the Face of the Trans-Atlantic Establishment
5662,2016-02-23T00:00:00Z,"John E. Reinhardt, Ambassador and Head of U.S. Information Agency, Dies at 95"
5663,2016-02-23T00:00:00Z,"Seeking iPhone Data, Through the Front Door"
5664,2016-02-23T00:00:00Z,Two Ranking Democrats to Offer Bill Aimed at Inversions
5665,2016-02-23T00:00:00Z,Legionnaires’ Outbreak in Flint Was Met With Silence
5666,2016-02-23T00:00:00Z,More Reason to Doubt Claim That Sanders Won Hispanic Vote in Nevada
5667,2016-02-23T00:00:00Z,F.D.A. Asks If Faulty Blood Monitor Tainted Xarelto Approval
5668,2016-02-23T00:00:00Z,"Truce, Cease-Fire and Armistice: The Legal Nuances"
5669,2016-02-23T00:00:00Z,"Leslie Ferraro, Disney’s Co-Chairwoman of Digital Media, Resigns"
5670,2016-02-23T00:00:00Z,"Polls Show Bolivian Leader Losing Vote, but He Sees Tie"
5671,2016-02-23T00:00:00Z,"Film Academy Trips Over Its Own Rules, Racing to Answer Calls for Diversity"
5672,2016-02-23T00:00:00Z,Iran’s Hard-Line Press Adds to Bounty on Salman Rushdie
5673,2016-02-23T00:00:00Z,Joe Biden Argued for Delaying Supreme Court Picks in 1992
5674,2016-02-23T00:00:00Z,"Hollywood’s Inclusion Problem Extends Beyond the Oscars, Study Says"
5675,2016-02-23T00:00:00Z,"At New York City Ballet, Works That Tell Stories and Don’t"
5676,2016-02-23T00:00:00Z,Tensions Over New York’s Homeless Shelters Explode After Disputed Rape Accusation
5677,2016-02-23T00:00:00Z,Xi Jinping’s News Alert: Chinese Media Must Serve the Party
5678,2016-02-23T00:00:00Z,"In Gaza, Bicycles Are a Battleground for Women Who Dare to Ride"
5679,2016-02-23T00:00:00Z,"At Funeral Mass for ‘Big Ang,’ the Sacred and the Irreverent Mingle"
5680,2016-02-23T00:00:00Z,Vaginal Ring With Drug Lowers H.I.V. Rates in African Women
5681,2016-02-23T00:00:00Z,A New Breed of Trader on Wall Street: Coders With a Ph.D.
5682,2016-02-23T00:00:00Z,Explaining E.T.F.s and How They Gained Their Allure
5683,2016-02-23T00:00:00Z,Review: Inon Barnatan Soldiers Through Hallowed Works at 92nd Street Y
5684,2016-02-23T00:00:00Z,How Democratic Superdelegates Can Overrule the Voters’ Will
5685,2016-02-23T00:00:00Z,"Review: Nicolas Altstaedt and Alexander Lonquich, in a Stirring Concert at the Frick"
5686,2016-02-23T00:00:00Z,The Winnowing of the Republican Field
5687,2016-02-23T00:00:00Z,Pentagon to Send Congress Plan for Closing Guantánamo
5688,2016-02-23T00:00:00Z,U.S.-Russia Deal on a Partial Truce in Syria Raises More Doubt Than Optimism
5689,2016-02-23T00:00:00Z,"Review: ‘The Secret Garden,’ a Concert Revival in Which Sadness Morphs Into Joy"
5690,2016-02-23T00:00:00Z,Seas Are Rising at Fastest Rate in Last 28 Centuries
5691,2016-02-23T00:00:00Z,New York City Opera Unveils Rest of Season
5692,2016-02-23T00:00:00Z,"Jets, Seeking Salary Cap Room, Release Antonio Cromartie"
5693,2016-02-23T00:00:00Z,Mark Zuckerberg Backs Apple in Its Refusal to Unlock iPhone
5694,2016-02-23T00:00:00Z,Apple Showdown Heightens Challenge of Encrypted Data
5695,2016-02-23T00:00:00Z,Letters to the Editor
5696,2016-02-23T00:00:00Z,The Tears (and Fears) of a Clown
5697,2016-02-23T00:00:00Z,Bridging a Digital Divide That Leaves Schoolchildren Behind
5698,2016-02-23T00:00:00Z,Lech Walesa Files Made Public Despite Forgery Claims
5699,2016-02-23T00:00:00Z,Maggie Siff on ‘Billions’: ‘I Might Leave Marks’
5700,2016-02-23T00:00:00Z,"Kalamazoo Shooting Suspect Charged, but Motive Remains Mystery"
5701,2016-02-23T00:00:00Z,Income Inequality: ‘The Rules of the Game Are Fixed’
5702,2016-02-23T00:00:00Z,Invitation to a Dialogue: Ways Iraq Could Break Up
5703,2016-02-23T00:00:00Z,An Animal-Based Diet?
5704,2016-02-23T00:00:00Z,Coercion May Make People Feel Less Responsible for Actions
5705,2016-02-23T00:00:00Z,A Slow Unveiling for Tourette’s Disease
5706,2016-02-23T00:00:00Z,"While HSBC Stays Upbeat, Investors Worry About Rates and China"
5707,2016-02-23T00:00:00Z,How Jeb Bush Spent $130 Million Running for President With Nothing to Show for It
5708,2016-02-23T00:00:00Z,Yahoo’s Decision to Explore a Sale Exposes a Weak Board
5709,2016-02-23T00:00:00Z,"Not Every Drop of a Person’s Blood Is the Same, a Study Says"
5710,2016-02-23T00:00:00Z,Tribeca Film Festival Opening With Look at Met’s Costume Show
5711,2016-02-23T00:00:00Z,Writer Apologizes for SB Nation Article on Convicted Rapist
5712,2016-02-23T00:00:00Z,U.N. Finds ‘Deliberate’ Destruction of Hospitals in Syria
5713,2016-02-23T00:00:00Z,"U.S. Soccer Keeping Silent on FIFA Presidential Vote, for Now"
5714,2016-02-23T00:00:00Z,Univision Aims to Make Hispanic Voting Bloc Even More Formidable
5715,2016-02-23T00:00:00Z,"Eric Brown, Record-Breaking British Aviator and World War II Combat Pilot, Dies at 97"
5716,2016-02-23T00:00:00Z,A Do-It-Yourself Revolution in Diabetes Care
5717,2016-02-23T00:00:00Z,"Marco Rubio Bets on Nevada, a State That Shaped His Childhood"
5718,2016-02-23T00:00:00Z,No Shortcuts in Evaluating Your Investment Risk
5719,2016-02-23T00:00:00Z,Uganda Opposition Candidate Kizza Besigye Taken From Home
5720,2016-02-23T00:00:00Z,"A Turning Point for Syrian War, and U.S. Credibility"
5721,2016-02-23T00:00:00Z,Anthony Davis’s 59-Point Night Gives Pelicans Limited Hope
5722,2016-02-23T00:00:00Z,Can You ‘Suntan’ Through a Window?
5723,2016-02-23T00:00:00Z,Bangladesh Arrests Three Men in Priest’s Beheading
5724,2016-02-23T00:00:00Z,Sylvester Stallone on the Weakest Link in ‘Creed’: Himself
5725,2016-02-23T00:00:00Z,"Review: In ‘The End of Average,’ Cheers for Individual Complexity"
5726,2016-02-23T00:00:00Z,"Margaret Sullivan, New York Times Public Editor, Joining Washington Post"
5727,2016-02-23T00:00:00Z,"Michael Jaharis, Pharmaceutical Executive and Philanthropist, Dies at 87"
5728,2016-02-23T00:00:00Z,"An Island, a Focal Point for a Healthy Marine Ecosystem"
5729,2016-02-23T00:00:00Z,Clearing Clutter From the YouTube Video Screen
5730,2016-02-23T00:00:00Z,Construction Begins on the 5G Wireless Dream
5731,2016-02-23T00:00:00Z,China Moves to Halt ‘Weird’ Architecture
5732,2016-02-23T00:00:00Z,Big Names Use Social Media to Support Kesha in Legal Battle
5733,2016-02-23T00:00:00Z,"Sysco to Acquire Brakes Group, a Food Distributor in Europe"
5734,2016-02-23T00:00:00Z,Trump’s Remarks on Pigs’ Blood Elicit Challenge From Sister of Chapel Hill Victim
5735,2016-02-23T00:00:00Z,Beijing to Raise Threshold on Red Alerts for Smog
5736,2016-02-23T00:00:00Z,Dylan Citings in Court
5737,2016-02-23T00:00:00Z,"China’s Excess Production Has Intensified Slowdown, Business Group Says"
5738,2016-02-23T00:00:00Z,Haryana State in India Proposes New Caste Status in Bid to Quell Protests
5739,2016-02-23T00:00:00Z,‘Easy Money’ Isn’t Cheap: Hong Kong License Plate Sells for $2.3 Million
5740,2016-02-23T00:00:00Z,How to Make the Most of Drugs We Already Have
5741,2016-02-23T00:00:00Z,Narrow Focus May Aid F.B.I. in Apple Case
5742,2016-02-23T00:00:00Z,Cameron’s Referendum Gamble
5743,2016-02-23T00:00:00Z,Scientists Ponder the Prospect of Contagious Cancer
5744,2016-02-23T00:00:00Z,A Sri Lankan Lesson in Free Speech
5745,2016-02-23T11:30:00Z,India’s Crackdown on Dissent
