,pub_date,headline
4367,2016-10-24T16:05:49+0000,The New York Times is looking for a Deputy Video Editor
4368,2016-10-24T16:04:25+0000,Do Your Investments Actually Help You Reach Your Goals?
4369,2016-10-24T16:01:06+0000,Adam Conover Turns a Skeptical Eye to the Presidential Campaign
4370,2016-10-24T16:00:40+0000,"Free Puzzle Alert! If You Build It, They Will Come"
4371,2016-10-24T16:00:04+0000,Ian Stewart: Calculating the Cosmos
4372,2016-10-24T15:55:34+0000,How to Clean a Dusty Picasso at MoMA: Use Your Spit
4373,2016-10-24T15:52:23+0000,Plan to Bail Out ‘Too Big to Fail’ Banks Raises Skepticism
4374,2016-10-24T15:47:12Z,t
4375,2016-10-24T15:46:49+0000,New Oxford Shakespeare Edition Credits Christopher Marlowe as a Co-author
4376,2016-10-24T15:36:43+0000,The Best Sellers: Filed Under Sports
4377,2016-10-24T15:32:47+0000,Election May Be a Turning Point for Legal Marijuana
4378,2016-10-24T15:18:55+0000,"Lawyers for Adnan Syed, of ‘Serial’ Podcast, Ask Court to Free Him on Bail"
4379,2016-10-24T15:10:00+0000,14 Recipes for Right Now
4380,2016-10-24T15:09:00+0000,"Ties in N.F.L. Are Rarer Now, but Still Unsatisfying"
4381,2016-10-24T15:00:04+0000,Why Big Liars Often Start Out as Small Ones
4382,2016-10-24T14:58:59+0000,"To Flip the House, How Big Would a Clinton Victory Margin Need to Be?"
4383,2016-10-24T14:46:06+0000,"Drake Announces ‘More Life’ on His Preferred Platform, Apple Music"
4384,2016-10-24T14:45:54+0000,The Timeless Appeal of Abbreviated Swim Shorts
4385,2016-10-24T14:39:31Z,1916: Austrian Premier Killed as Protest Against the War
4386,2016-10-24T14:32:24+0000,"Review: In David Hare’s ‘Plenty,’ Time Takes the Edge Off a Femme Fatale"
4387,2016-10-24T14:05:31+0000,Venezuelan Democracy in Limbo
4388,2016-10-24T13:54:51+0000,Deals Lift the Markets as Tech Stocks Gain the Most
4389,2016-10-24T13:44:07+0000,Silicon Valley Fashion Week Is No Joke
4390,2016-10-24T13:24:13+0000,Arizona Dreaming: A Foreign Correspondent Wakes Up in the Wild Wild West
4391,2016-10-24T13:21:06+0000,China’s Digital Soft Power Play
4392,2016-10-24T13:00:05+0000,"In Japan, More Women Fight to Use Their Own Surnames"
4393,2016-10-24T12:39:59+0000,"Yes, Trump Really Is Saying ‘Big League,’ Not ‘Bigly,’ Linguists Say"
4394,2016-10-24T12:29:36+0000,A Podcast You Should Try
4395,2016-10-24T12:24:01+0000,Sorting Out a ‘Big’ Trump Controversy
4396,2016-10-24T12:22:19+0000,Donald Trump Voice Analysis
4397,2016-10-24T12:10:28+0000,Germany Withdraws Approval for Chinese Takeover of Aixtron
4398,2016-10-24T12:03:41+0000,California Today: The Bay Area’s Best Sandwich and Other Tips (Courtesy of Warriors Fans)
4399,2016-10-24T11:55:02+0000,TD Ameritrade to Buy Scottrade in $4 Billion Deal
4400,2016-10-24T11:35:25+0000,An Autumn Art Extravaganza in Paris
4401,2016-10-24T11:00:10+0000,Increasing CPR Training to Save Lives
4402,2016-10-24T10:47:04+0000,Why the U.S. Still Trails Many Wealthy Nations in Access to Care
4403,2016-10-24T10:46:39+0000,"In ‘Gaining Currency,’ a Look at China’s Global Ambitions for Its Money"
4404,2016-10-24T10:30:04+0000,What Knitting Can Teach Us About Parenting
4405,2016-10-24T10:30:04+0000,Clinton Leads Trump as Marathon Nears the Final Sprint
4406,2016-10-24T10:10:41+0000,"Gordon Hamilton, Climate Scientist, Dies at 50 in Antarctica Accident"
4407,2016-10-24T10:04:30+0000,"Morning Agenda: AT&T and Time Warner, Behind the Curtain at Teneo"
4408,2016-10-24T10:00:18+0000,A Wider-Eyed Watchdog of the Clutter Surrounding Earth
4409,2016-10-24T09:56:35+0000,New York Today: How to Build a Subway
4410,2016-10-24T09:50:24+0000,The Naked Truth About German Nudists
4411,2016-10-24T09:44:16+0000,"U.S. Election, Calais, AT&amp;T: Your Monday Briefing"
4412,2016-10-24T09:30:04+0000,"What’s Going On in This Picture? | Oct. 24, 2016"
4413,2016-10-24T09:00:27+0000,"After Almost a Century, the 2nd Avenue Subway Is Oh-So-Close to Arriving"
4414,2016-10-24T09:00:27+0000,Awaiting Next U.S. President: A Splintered Middle East in ‘Free Fall’
4415,2016-10-24T09:00:27+0000,Why the Justice Dept. Will Have Far Fewer Watchdogs in Polling Places
4416,2016-10-24T09:00:26+0000,Six New Thrillers for Fall
4417,2016-10-24T09:00:26+0000,Black Democrats to Hillary Clinton: Send Money to Take Congress
4418,2016-10-24T09:00:26+0000,"For Britain, Quitting the E.U.’s Market May Be a Tough Sell"
4419,2016-10-24T09:00:04+0000,Why Are Americans So Anxious?
4420,2016-10-24T09:00:01+0000,What Ordinary Moments Would You Include in a Video About Your Life?
4421,2016-10-24T08:49:36+0000,"Tom Hayden, Civil Rights and Antiwar Activist Turned Lawmaker, Dies at 76"
4422,2016-10-24T08:49:33+0000,Tom Hayden: 1939-2016
4423,2016-10-24T08:40:25+0000,"China Oceanwide Dips Into American Insurance, Buying Genworth"
4424,2016-10-24T08:30:04+0000,Questions for: ‘Hackers Used New Weapons to Disrupt Major websites Across U.S.’
4425,2016-10-24T08:29:11+0000,Clinton’s Specter of Illegitimacy
4426,2016-10-24T08:29:08+0000,It’s Trump’s Party
4427,2016-10-24T08:15:10+0000,"Faulting Term Limit, South Korean Leader Proposes Revising Constitution"
4428,2016-10-24T08:02:44Z,A Difficult Harvest for America&#8217;s Black Farmers
4429,2016-10-24T07:21:26+0000,My Wife’s Killer Was Not an ‘Illegal Immigrant’
4430,2016-10-24T07:21:25+0000,The Islamic State After Mosul
4431,2016-10-24T07:21:25+0000,Washington State’s Ambitious Carbon Tax Proposal
4432,2016-10-24T07:21:24+0000,Struggling to Serve at the Nation’s Richest University
4433,2016-10-24T07:21:24+0000,"The Death Penalty, Nearing Its End"
4434,2016-10-24T07:21:05+0000,Good News for the Hungry City
4435,2016-10-24T07:21:04+0000,Health and Jobs
4436,2016-10-24T07:21:03+0000,Legalizing Marijuana
4437,2016-10-24T07:21:03+0000,The Religious Right and the Election
4438,2016-10-24T07:05:46+0000,A Difficult Harvest for America’s Black Farmers
4439,2016-10-24T07:00:05+0000,Word + Quiz: genuflect
4440,2016-10-24T05:00:23+0000,What’s on TV Monday: Matt LeBlanc in ‘Man With a Plan’ and ‘Beyond Borders’
4441,2016-10-24T04:32:14+0000,"Corrections: October 24, 2016"
4442,2016-10-24T04:25:59+0000,生活在中國龐大的沙海
4443,2016-10-24T04:23:20+0000,Bill Murray Gets a Cubs Win and the Mark Twain Prize
4444,2016-10-24T04:17:00+0000,Living in China’s Expanding Deserts
4445,2016-10-24T04:02:27+0000,"AT&amp;T, Mosul, U.S. Presidential Election: Your Monday Briefing"
4446,2016-10-24T04:01:18+0000,Commercial Kitchens Getting a Taste of 3-D-Printed Food
4447,2016-10-24T04:01:17+0000,Food Industry Goes Beyond Looks to Fight Waste
4448,2016-10-24T03:38:32+0000,Dan Girardi’s Third-Period Goal Lifts Rangers Over the Coyotes
4449,2016-10-24T03:35:54+0000,"Sandra Lee Bartky, at the Vanguard of Feminist Philosophy, Dies at 81"
4450,2016-10-24T03:06:07+0000,"For Republicans Abandoning Donald Trump, Obama Has a Message: ‘Too Late’"
4451,2016-10-24T03:01:03+0000,"‘Insecure’ Season 1, Episode 3: Code Switching"
4452,2016-10-24T02:59:45+0000,‘The Walking Dead’ Season 7 Premiere: Negan’s Victim Is Revealed
4453,2016-10-24T02:30:26+0000,Venezuelan Congress Accuses Maduro Government of Staging Coup
4454,2016-10-24T02:04:08+0000,Victorian Cocktails and Medical Curiosities in (Where Else?) Brooklyn
4455,2016-10-24T02:01:24+0000,"‘Westworld’ Season 1, Episode 4: Truth and Consequences"
4456,2016-10-24T01:29:29+0000,Swift Opposition to Resurrection of AT&T Giant
4457,2016-10-24T01:25:44+0000,Crows and Ravens Make New York Comebacks to Caw (and Cr-r-ruck) About
4458,2016-10-24T01:18:51+0000,Making Sense of AT&T’s Bid for Time Warner
4459,2016-10-24T01:15:05+0000,Quotation of the Day
4460,2016-10-24T01:09:36+0000,"Steve Dillon, Comic Artist Who Helped Create ‘Preacher,’ Dies at 54"
4461,2016-10-24T00:50:50+0000,Cleveland Indians in 1948: A Story of Integration
4462,2016-10-24T00:47:05+0000,Time Warner’s Non-Mogul Mogul Who Foretold Its Worth
4463,2016-10-24T00:40:44+0000,A Brownstone and the Bitter Fight to Inherit It
4464,2016-10-24T00:40:27+0000,"After 108 Years of Unfulfilled Yearning, Cubs Fans Are Taking Nothing for Granted"
4465,2016-10-24T00:30:30+0000,New York’s M.L.S. Teams Finish Strong
4466,2016-10-24T00:28:58+0000,"Turn Onto Old Dixie. After a Long, Rocky Stretch, It Becomes Obama Highway."
4467,2016-10-24T00:27:15+0000,Sam Bradford Is Battered by Blitzes in Minnesota Vikings’ First Loss
4468,2016-10-24T00:17:43+0000,WikiLeaks’ Gift to American Democracy
4469,2016-10-24T00:00:05+0000,Haggling in the Rain
4470,2016-10-25T23:39:19+0000,Question in George Washington Bridge Trial: Who’s Been Fooling Whom?
4471,2016-10-25T23:32:27+0000,Athletes in Sexual Assault Case Can Play. Just Not at Home.
4472,2016-10-25T22:55:30+0000,Steven Banks Was Hired to Stem New York’s Homelessness Crisis. It Didn’t Happen.
4473,2016-10-25T22:53:56+0000,Shouts Greet Migrants in the Streets of France: ‘We Don’t Want Them’
4474,2016-10-25T22:38:34+0000,World Series: Here’s How the Indians Won Game 1
4475,2016-10-25T22:18:00+0000,Sumner Redstone Sues Ex-Girlfriends Over Accusations Including Elder Abuse
4476,2016-10-25T22:15:16+0000,The Crisis of Men in America
4477,2016-10-25T22:00:08+0000,"Clinton, Trump, Cubs: Your Tuesday Evening Briefing"
4478,2016-10-25T21:57:07+0000,"We’re Animals, After All"
4479,2016-10-25T21:54:22+0000,Cate Blanchett Morphs a Dozen Times in ‘Manifesto’
4480,2016-10-25T21:53:22+0000,One Last Growl for F.C.C.’s Sharp-Toothed Watchdog
4481,2016-10-25T21:43:36+0000,Balanchine’s ‘Prodigal Son’ Is Returning to Ballet Theater
4482,2016-10-25T21:38:54+0000,A Scene Right Out of Philip Roth: His Books Come Home to Newark’s Library
4483,2016-10-25T21:35:40+0000,Public Theater Takes Its Under the Radar Festival to a Warship
4484,2016-10-25T21:23:02Z,What We&#8217;re Reading
4485,2016-10-25T21:22:49+0000,"Consumer Confidence Slips, but Home Prices Continue to Climb"
4486,2016-10-25T21:22:32+0000,"A Retort to Shrinking Screens, in an Ultra-Immersive Show at the Whitney"
4487,2016-10-25T21:10:42+0000,"In ‘Rectify,’ Life After Prison and the Chance to Be Reborn"
4488,2016-10-25T21:10:28+0000,Review: 500 Years of Cultivation in ‘Portrait of a Garden’
4489,2016-10-25T21:08:27+0000,Tracing the Path of AIDS Through the Dance World
4490,2016-10-25T21:03:57+0000,"Review: In ‘Supersonic,’ the Band Oasis and Its Combative Brothers"
4491,2016-10-25T21:01:58+0000,Is New York Too Expensive for Restaurateurs? We Do the Math
4492,2016-10-25T20:56:16+0000,Why a Media Merger That Should Go Through Might Not
4493,2016-10-25T20:52:50+0000,Paul Beatty Wins Man Booker Prize With ‘The Sellout’
4494,2016-10-25T20:47:04+0000,Voter Attitudes Toward Hillary Clinton
4495,2016-10-25T20:42:41+0000,"Buffalo Philharmonic, Once Languishing, Has Come a Long Way"
4496,2016-10-25T20:39:01+0000,‘We Need to Clean This Up’: Clinton Aide’s Newly Public Email Shows Concern
4497,2016-10-25T20:39:00+0000,Artificial Intelligence as a Bridge for Art and Reality
4498,2016-10-25T20:37:03+0000,Review: Rip Van Winkle Meets Creepy Gnomes in ‘Now Is the Time. Now Is the Best Time. Now Is the Best Time of Your Life.’
4499,2016-10-25T20:26:50+0000,"Mosul, Heathrow, Quetta: Your Wednesday Briefing"
4500,2016-10-25T20:25:24+0000,"Review: ‘Turner,’ a Portrait of a Most Dazzling and Disagreeable Artist"
4501,2016-10-25T20:21:13+0000,The Path to College
4502,2016-10-25T20:13:46+0000,Inside Azzedine Alaïa’s Intimate Spring Show
4503,2016-10-25T20:11:08+0000,"Eleuteri, a Vintage Jeweler, Brings Italian Glamour to New York"
4504,2016-10-25T20:09:14+0000,"Review: In ‘Public Enemy,’ a Noble Whistle-Blower Turns Fanatic"
4505,2016-10-25T20:00:03+0000,Air Pollution’s Toll on Heart May Begin Early
4506,2016-10-25T19:58:13+0000,Gay American Politician Visits Iran. Secret Agents Are on the Case.
4507,2016-10-25T19:53:13+0000,12 Books to Read in Your 20s
4508,2016-10-25T19:53:11+0000,Accrediting Colleges
4509,2016-10-25T19:45:08+0000,College Is the Goal: Will These Teenagers Get There?
4510,2016-10-25T19:36:29+0000,Colin Powell Says He’ll Vote for Hillary Clinton
4511,2016-10-25T19:24:26+0000,"Chicago Cubs, Losers No More?"
4512,2016-10-25T19:17:55+0000,College Is the Goal
4513,2016-10-25T19:17:06+0000,College Is the Goal
4514,2016-10-25T19:12:36+0000,Giants Release Josh Brown After Documents Showed Abuse
4515,2016-10-25T19:10:26+0000,College Is the Goal. Will These Three Teenagers Get There?
4516,2016-10-25T19:06:18+0000,"White Gold Butchers, From April Bloomfield, Opens Uptown"
4517,2016-10-25T18:55:49+0000,How Does a Guy Go From Playing Baseball to Killing Men for a Living?
4518,2016-10-25T18:53:55+0000,"Vatican Clarifies the Rules for Cremation: Bury, Don’t Scatter"
4519,2016-10-25T18:52:32+0000,Jeremy Travis to Step Down as President of John Jay College in 2017
4520,2016-10-25T18:49:57+0000,The American Bar Association’s Cowardice
4521,2016-10-25T18:48:55+0000,Mosul Fight Unleashes New Horrors on Civilians
4522,2016-10-25T18:44:53+0000,Will the AT&T Merger Hurt Consumers?
4523,2016-10-25T18:39:24+0000,Recent Commercial Real Estate Transactions
4524,2016-10-25T18:27:15+0000,Foreign Aid for Haiti
4525,2016-10-25T18:27:09+0000,John John Florence Clinches His First World Surfing Title
4526,2016-10-25T18:25:36+0000,Why Does Fall Foliage Turn So Red and Fiery? It Depends.
4527,2016-10-25T18:11:10+0000,Prince’s Paisley Park Is Cleared to Open as a Museum
4528,2016-10-25T17:57:33+0000,The Funfetti Explosion
4529,2016-10-25T17:55:45+0000,"Seizing on Rising Costs, Trump Says Health Law Is ‘Over’"
4530,2016-10-25T17:55:07+0000,The 8 friends you make in the modern workplace
4531,2016-10-25T17:46:53+0000,A Quick Guide to Rising Obamacare Rates
4532,2016-10-25T17:36:43+0000,A Project Mends a Gash in the Street Grid of Washington
4533,2016-10-25T17:36:36+0000,Six Modern Mexican Design Studios to Watch
4534,2016-10-25T17:15:43+0000,"I Was Never Jackie Chan, and I’m Not Jeremy Lin"
4535,2016-10-25T17:15:39+0000,When Linsanity Happened
4536,2016-10-25T16:57:53+0000,Daily Report: Bigger Is Better. Or So They Say.
4537,2016-10-25T16:56:00+0000,Ex-Nurse Charged With Killing 8 Nursing Home Residents in Ontario
4538,2016-10-25T16:49:37+0000,AT&T’s Bid for Time Warner Faces Fierce Political Opposition
4539,2016-10-25T16:39:58+0000,Emma Rice Will Bow Out as Artistic Director of Shakespeare’s Globe
4540,2016-10-25T16:26:28+0000,How to Clean Up Instagram Comments
4541,2016-10-25T16:22:14+0000,A Classic Thanksgiving Dinner Menu
4542,2016-10-25T16:13:33+0000,Spain Moves From Deadlock to Gridlock
4543,2016-10-25T16:09:33+0000,The Enticing Power of Highly Plucked Brows
4544,2016-10-25T15:46:28+0000,Review: Jake Gyllenhaal Shines in a Joyous ‘Sunday in the Park With George’
4545,2016-10-25T15:33:52+0000,"If Immigration Can’t Be Stopped, Maybe It Can Be Managed"
4546,2016-10-25T15:23:01+0000,"At the Beatrice Inn, Cuisine for Animals"
4547,2016-10-25T15:22:58+0000,The Beatrice Inn
4548,2016-10-25T15:05:48+0000,"What Drives Donald Trump? Fear of Losing Status, Tapes Show"
4549,2016-10-25T15:00:05+0000,"Glenn Close Will Star, Again, in ‘Sunset Boulevard’ on Broadway"
4550,2016-10-25T14:43:03Z,1916: Great Attack At Verdun Inflicts Big Defeat on Prince
4551,2016-10-25T14:37:50+0000,Harvard Reaches Tentative Agreement to End Cafeteria Workers’ Strike
4552,2016-10-25T14:26:09+0000,AT&amp;T Cheerleading Squad for Merger: Nearly 100 Lobbyists
4553,2016-10-25T14:22:14+0000,"Eight Sleek, Portable Speakers"
4554,2016-10-25T14:19:39+0000,Brock Osweiler Shows Broncos They’re Better Off Without Him
4555,2016-10-25T14:06:59+0000,No Vacancies in California? Housing Report Begs to Differ
4556,2016-10-25T14:00:17+0000,Challenging Boundaries With Her Naked Body
4557,2016-10-25T13:58:35+0000,"As Some Big Names Disappoint, Market Dips"
4558,2016-10-25T13:54:16+0000,Monte dei Paschi to Cut Jobs and Close Branches in Turnaround Bid
4559,2016-10-25T13:46:09+0000,More Migrants Leave Calais ‘Jungle’ Camp as Demolition Begins
4560,2016-10-25T13:30:05+0000,"Pizzas, Pony Rides and Dolphin Shows: Balms for North Korea’s Elite"
4561,2016-10-25T13:22:02+0000,Trevor Noah: The First Time I Drove a Car. (I Was 6.)
4562,2016-10-25T12:31:26+0000,"‘The Worst We Have Ever Seen’: Fewer Migrants, More Death"
4563,2016-10-25T12:31:05+0000,What Do Trump and Marx Have in Common?
4564,2016-10-25T12:27:33+0000,The ‘Saddest’ Polar Bear Lives in a Mall in China
4565,2016-10-25T03:20:00Z,Is Trump Right About Putin?
4566,2016-10-25T12:17:27+0000,California Today: A One-Woman Lifeline for Eureka’s Homeless
4567,2016-10-25T12:13:26+0000,A Republican Confession
4568,2016-10-25T12:02:20+0000,Clinton Leads by 7 Points in North Carolina Poll
4569,2016-10-25T11:56:01+0000,Azzedine Alaïa and the Reason Not to Buy Into the ‘See Now/Shop Now’ Movement
4570,2016-10-25T11:48:31+0000,"News Quiz | Oct. 18-24, 2016"
4571,2016-10-25T11:34:21+0000,Word + Quiz: serenity
4572,2016-10-25T11:32:46+0000,"As ID Laws Fall, Voters See New Barriers Rise"
4573,2016-10-25T11:10:36+0000,Pakistan Reels After Attack on Police Training College Leaves 61 Dead
4574,2016-10-25T11:00:05+0000,Should the Food Industry Sneak Vegetables Into Food?
4575,2016-10-25T10:51:03+0000,Third Heathrow Airport Runway Backed by British Government
4576,2016-10-25T10:09:06+0000,"Morning Agenda: A New Media Order, Crisis Echos, MetLife Disputes Its Status"
4577,2016-10-25T10:02:29+0000,"Militants Bomb Kenya Hotel, Killing 12; Shabab Claim Responsibility"
4578,2016-10-25T10:01:35+0000,New York Today: Foliage in Full Force
4579,2016-10-25T10:00:20+0000,The Italian Winemakers’ Cult
4580,2016-10-25T10:00:17+0000,Self-Driving Truck’s First Mission: A 120-Mile Beer Run
4581,2016-10-25T10:00:14+0000,"A New Trump Brand Not Named for Trump? Yes, Meet Scion"
4582,2016-10-25T10:00:04+0000,Is It Harder to Write Humorously Than It Is to Write Seriously?
4583,2016-10-25T10:00:04+0000,"For Election Season, Hotel Packages"
4584,2016-10-25T09:45:44+0000,"Hillary Clinton, Donald Trump, World Series: Your Tuesday Briefing"
4585,2016-10-25T09:44:31+0000,Syngenta Warns of Delay in Takeover by ChemChina
4586,2016-10-25T09:00:39+0000,‘I Had a Scary Dream About Donald Trump’: Muslim Parents Face a Tense Election
4587,2016-10-25T09:00:25+0000,The Pentagon’s ‘Terminator Conundrum’: Robots That Could Kill on Their Own
4588,2016-10-25T09:00:25+0000,The Golden State Warriors Play the Beautiful Game
4589,2016-10-25T09:00:23+0000,"For Iran, Exerting Force While Making Nice Is Part of the Plan"
4590,2016-10-25T09:00:23+0000,A.I. Inspiration: The Science Fiction That Frames Discussion
4591,2016-10-25T09:00:22+0000,"Voters Fear Their Ballot Won’t Count, Poll Shows"
4592,2016-10-25T09:00:07+0000,New True-Crime Books for Fall
4593,2016-10-25T09:00:06+0000,Obama Brought Silicon Valley to Washington
4594,2016-10-25T09:00:06+0000,Omarosa Manigault Changed Parties for Trump
4595,2016-10-25T09:00:06+0000,From ‘Hamilton’ to Donald Trump: Are All ‘Grievances’ Created Equal?
4596,2016-10-25T09:00:05+0000,Six Centuries of Madness: An Asylum’s History
4597,2016-10-25T09:00:02+0000,Who Do You Want to Win the 2016 Presidential Election?
4598,2016-10-25T08:30:01+0000,"Questions for: ‘After 108 Years of Unfulfilled Yearning, Cubs Fans Are Taking Nothing for Granted’"
4599,2016-10-25T08:05:03+0000,Smashing Pumpkins
4600,2016-10-25T08:02:44Z,"After Egypt&#8217;s Revolution, a New Start in American Exile"
4601,2016-10-25T07:37:54+0000,"Dreamworld Theme Park Accident Kills 4, Australian Officials Say"
4602,2016-10-25T07:30:16+0000,The Problem for Women Is Not Winning. It’s Deciding to Run.
4603,2016-10-25T07:21:24+0000,The Epidemic of Worry
4604,2016-10-25T07:21:24+0000,Dear Republican Voters ...
4605,2016-10-25T07:21:23+0000,North Carolina’s Noxious Pig Farms
4606,2016-10-25T07:21:23+0000,The Cubs Reach the Promised Land. Now What?
4607,2016-10-25T07:21:09+0000,The Unhappy Warriors
4608,2016-10-25T07:21:04+0000,Your Facts or Mine?
4609,2016-10-25T07:21:03+0000,Don’t Lock ’Em Up. Give ’Em a Chance to Quit Drugs.
4610,2016-10-25T07:06:10+0000,"After Egypt’s Revolution, a New Start in American Exile"
4611,2016-10-25T05:00:26+0000,What’s on TV Tuesday: ‘Finding Dory’ and ‘The Adam Ruins Everything Election Special’
4612,2016-10-25T04:29:06+0000,"Corrections: October 25, 2016"
4613,2016-10-25T04:02:16+0000,"Calais Jungle, Mosul, Clinton: Your Tuesday Briefing"
4614,2016-10-25T04:01:08+0000,Resettling China’s ‘Ecological Migrants’
4615,2016-10-25T03:32:33+0000,Quotation of the Day
4616,2016-10-25T02:51:40+0000,U.N. Plans to Pay Victims of Cholera Outbreak It Caused in Haiti
4617,2016-10-25T02:24:54+0000,Report Highlights How Guns Flow Into New York From States With Weaker Laws
4618,2016-10-25T02:00:15+0000,Offer at a Pub
4619,2016-10-25T02:00:06+0000,"Review: In ‘A Life,’ Lonely and Looking to the Stars for Answers"
4620,2016-10-25T01:55:05+0000,"Review: In ‘The Harvest,’ a Crisis of Feeling for Young Evangelicals"
4621,2016-10-25T01:45:55+0000,Ex-Aide Says Christie Had ‘Memory Issue’ About Bridge Lane Closings
4622,2016-10-25T01:32:33+0000,"Arian Foster, Worn Down by Injuries, Announces Immediate Retirement"
4623,2016-10-25T01:31:32+0000,Yankees Plan Stadium Changes to Fight Attendance Drop
4624,2016-10-25T01:22:29+0000,"Cubs, Loaded With Talent, May Get Kyle Schwarber Back, Too"
4625,2016-10-25T01:14:14+0000,Soldiers Struggling to Repay Enlistment Bonuses Issued in Error
4626,2016-10-25T01:11:39+0000,"Seeking Senate Majority, Cuomo Tries New Tactic: Stumping for Democrats"
4627,2016-10-25T01:08:41+0000,Vatican to Act as Mediator Between Venezuela’s Dueling Sides
4628,2016-10-25T01:08:13+0000,"World Series Preview: For Cubs or Indians, Decades of Waiting Are Nearly Over"
4629,2016-10-25T00:54:00+0000, Turkey Barges Into the Mosul Fight
4630,2016-10-25T00:50:21+0000,"Promises, Promises From AT&T"
4631,2016-10-25T00:49:50+0000,LeBron James Remains a Rock Amid N.B.A.’s Changing Terrain
4632,2016-10-25T00:44:34+0000,"Once a Die-Hard Cubs Fan, Jason Kipnis Is Now Trying to Extend Their Misery"
4633,2016-10-25T00:43:00+0000,Next Job for Obama? Silicon Valley Is Hiring
4634,2016-10-25T00:41:09+0000,Obama Urges Democrats to Turn Out in Force Against Donald Trump and G.O.P.
4635,2016-10-25T00:33:05+0000,Justice Dept. Shakes Up Inquiry Into Eric Garner Chokehold Case
4636,2016-10-25T00:30:54+0000,Cleveland Indians Fans Hope That Ghosts of Past Are Put to Rest
4637,2016-10-25T00:29:11+0000,A Chilly Reaction to AT&amp;T-Time Warner Deal
4638,2016-10-25T00:21:58+0000,"Voters Increasingly Turning to Internet for Information, Survey Shows"
4639,2016-10-25T00:18:05+0000,Code Names and Covert Meetings in AT&T’s Courtship of Time Warner
4640,2016-10-25T00:16:53+0000,Letters on U.N.’s Response to Cholera in Haiti
4641,2016-10-25T00:10:20+0000,Consultant With Ties to Donald Trump Linked to Offer to Hide Source of Donations
4642,2016-10-25T00:00:43+0000,How an Aesthete’s Eye Can Help a Doctor’s Hand
4643,2016-10-25T00:00:03+0000,A Wedding Night Upgrade at the Plaza
4644,2016-10-26T23:55:48+0000,A Dangerous Standoff in Venezuela
4645,2016-10-26T23:55:41+0000,Banks Bet on the Next Big Thing: Financial Chatbots
4646,2016-10-26T23:51:05+0000,Microsoft Unveils Its First Desktop PC
4647,2016-10-26T23:46:10+0000,Buying at a Used Car Auction? What You Don’t Know Could Kill You
4648,2016-10-26T23:46:03+0000,New York City Vehicle Auction
4649,2016-10-26T23:45:40+0000,Election Therapy: Readers Tell Their Stories
4650,2016-10-26T23:42:58+0000,"As 3 African Nations Vow to Exit, International Court Faces Its Own Trial"
4651,2016-10-26T23:34:10+0000,"A Close Race for Darrell Issa, the House’s Mini-Trump"
4652,2016-10-26T23:33:13+0000,"As U.N. Ignores Jewish Ties to Holy Site, Israel Produces Ancient Evidence"
4653,2016-10-26T23:22:25+0000,"Republicans in Congress Fear Losses, and Then the Hard Part"
4654,2016-10-26T23:01:15+0000,Lighting Up the Night Skies
4655,2016-10-26T22:51:09+0000,"Kevin Curran, Writer and Producer for ‘The Simpsons,’ Dies at 59"
4656,2016-10-26T22:48:14+0000,Two Earthquakes Shake Up Central Italy
4657,2016-10-26T22:27:41+0000,"Montenegro’s Prime Minister Resigns, Perhaps Bolstering Country’s E.U. Hopes"
4658,2016-10-26T22:20:21+0000,Matthew Weiner to Create a Series for Amazon
4659,2016-10-26T22:20:03+0000,Tove Lo’s ‘Lady Wood’: More Professional Than Passionate
4660,2016-10-26T22:18:10+0000,"No Walls Here: Between Tijuana and San Diego, an Art Ethos Thrives"
4661,2016-10-26T22:16:17+0000,Patrick Belaga Is a Cellist Who Moonlights as a Model
4662,2016-10-26T22:09:49+0000,What Trump Tapes Reveal: Fear and Contempt
4663,2016-10-26T22:07:37+0000,What’s In for Fall? Looking Slightly Off
4664,2016-10-26T22:07:17+0000,"If Diamonds Are Forever, Your Data Could Be, Too"
4665,2016-10-26T22:03:12+0000,Playing Chicken With the Art World
4666,2016-10-26T22:01:46+0000,"Cubs, Trump, Mosul: Your Wednesday Evening Briefing"
4667,2016-10-26T22:00:21+0000,World Series: Here’s How the Chicago Cubs Won Game 2
4668,2016-10-26T21:52:58+0000,"Review: In John Grisham’s ‘The Whistler,’ a Serious Woman and Serious Crime"
4669,2016-10-26T21:50:27+0000,‘A New Start’ as Judge Halts Deliberations in Oregon Refuge Trial
4670,2016-10-26T21:45:49+0000,"What Else Is on the Ballot? Minimum Wage, Death Penalty and Guns"
4671,2016-10-26T21:35:51+0000,Go International Without Leaving Town
4672,2016-10-26T21:23:24+0000,"Duterte, Mosul, Calais Jungle: Your Thursday Briefing"
4673,2016-10-26T21:19:35+0000,New Jersey Symphony’s New Director on Defining Her Own Sound
4674,2016-10-26T21:19:31+0000,"Review: Dance That Tries to Capture One Body, Two Selves"
4675,2016-10-26T21:18:21+0000,"Before You Take a Road Trip, Do This"
4676,2016-10-26T21:12:51+0000,Paula Vogel’s ‘Indecent’ to Open on Broadway
