,pub_date,headline
1261,2016-10-07T04:00:00+0000,Over 190 Countries Adopt Plan to Offset Air Travel Emissions
1262,2016-10-07T04:00:00+0000,Donald Trump Takes Advantage of a Republican Party Pitted Against Itself
1263,2016-10-07T04:00:00+0000,Wells Fargo Scandal Blunts a Weapon in Banks’ Regulatory Fight
1264,2016-10-07T04:00:00+0000,"In Fight for Aleppo, Tangled Alliances in Syria Add to Chaos"
1265,2016-10-07T04:00:00+0000,Mars Cashes Out Warren Buffett to Take Control of Wrigley
1266,2016-10-07T04:00:00+0000,A Rare Move for Bob Dylan: Old Vic Play Is Set to His Music
1267,2016-10-07T04:00:00+0000,Video Visits in Jail
1268,2016-10-07T04:00:00+0000,"A Mother Criticizes Vince Staples, and the Rapper Defends Her"
1269,2016-10-07T04:00:00+0000,U.N. Syria Envoy Offers to Escort Rebel Fighters From Aleppo
1270,2016-10-07T04:00:00+0000,Motorcycle Bomb Near Istanbul Police Station Wounds at Least 10
1271,2016-10-07T04:00:00+0000,Daily Report: The Feds Can’t Resist Silicon Valley’s Data
1272,2016-10-07T04:00:00+0000,"World’s Oldest Man, After Century Wait, Celebrates Bar Mitzvah at Last"
1273,2016-10-07T04:00:00+0000,Kennedy Center Taps Broadway Producer to Lead Theater Programming
1274,2016-10-07T04:00:00+0000,Move Around an iMac by Touch
1275,2016-10-07T04:00:00+0000,Cardinals’ Carson Palmer Won’t Play Thursday Against 49ers
1276,2016-10-07T04:00:00+0000,"Range Is All the Rage in Paris, as Electric Cars Steal the Show"
1277,2016-10-07T04:00:00+0000,Video Review: VW Dresses Up the Alltrack for the Hard Road
1278,2016-10-07T04:00:00+0000,Deutsche Bank as Next Lehman Brothers: Far-Fetched but Not Unthinkable
1279,2016-10-07T04:00:00+0000,"With Senate Control at Stake, Koch Groups Start Endorsing by Name"
1280,2016-10-07T04:00:00+0000,Megyn Kelly and Sean Hannity Indulge in Testy Public Clash
1281,2016-10-07T04:00:00+0000,Mike Pence Disavows Donald Trump’s Earlier Proposal Barring Muslims
1282,2016-10-07T04:00:00+0000,"‘Valentin de Boulogne,’ Bright Star in Caravaggio’s Orbit"
1283,2016-10-07T04:00:00+0000,National Book Awards Finalists Include Colson Whitehead and Viet Thanh Nguyen
1284,2016-10-07T04:00:00+0000,"Deutsche Bank to Cut an Additional 1,000 Jobs in Germany"
1285,2016-10-07T04:00:00+0000,Wall St. Ends Mixed as Oil Prices Rise
1286,2016-10-07T04:00:00+0000,Hurricane Matthew Approaches Florida; Governor Urges 1.5 Million to Flee
1287,2016-10-07T04:00:00+0000,"Amid Hills of Wine and Truffles, a Mission to Give Fungus Room to Breathe"
1288,2016-10-07T04:00:00+0000,UKIP Lawmakers Clash at E.U. Parliament. One Ends Up on the Floor.
1289,2016-10-07T04:00:00+0000,Biting the E.U. That Feeds Him
1290,2016-10-07T04:00:00+0000,How to Get People to Evacuate? Try Fear
1291,2016-10-07T04:00:00+0000,"The White House Rule: No Tax Returns, No Job"
1292,2016-10-07T04:00:00+0000,Myanmar Gives Tourist Who Pulled Plug on Buddhist Chants 3 Months in Prison
1293,2016-10-07T04:00:00+0000,Protest Against Fox Correspondent Accused of Racism for Chinatown Interviews
1294,2016-10-07T04:00:00+0000,"More Asian-Americans Are Identifying as Democrats, Survey Finds"
1295,2016-10-07T04:00:00+0000,"Your Surgeon Is Probably a Republican, Your Psychiatrist Probably a Democrat"
1296,2016-10-07T04:00:00+0000,Malaysian Court Frees Australians Who Stripped to Briefs at Grand Prix
1297,2016-10-07T04:00:00+0000,Poland Steps Back From Stricter Anti-Abortion Law
1298,2016-10-07T04:00:00+0000,Pro-Trump Group to Release Ads as Part of Major Swing State Effort
1299,2016-10-07T04:00:00+0000,"Morning Agenda: Theranos Closes Labs, Twitter Chatter, Taking on Samsung"
1300,2016-10-07T04:00:00+0000,New York Burial Plots Will Now Allow Four-Legged Companions
1301,2016-10-07T04:00:00+0000,Donald Trump’s Ventures Began With a Lot of Hype. Here’s How They Turned Out.
1302,2016-10-07T04:00:00+0000,"Review: In Nate Parker’s ‘The Birth of a Nation,’ Must-See and Won’t-See Collide"
1303,2016-10-07T04:00:00+0000,Twitter’s Fate: Marc Benioff of Salesforce Addresses Acquisition Talk
1304,2016-10-07T04:00:00+0000,"We’re All a Little Biased, Even if We Don’t Know It"
1305,2016-10-07T04:00:00+0000,Questions and Answers on Hurricane Matthew
1306,2016-10-07T04:00:00+0000,"Review: In ‘The Girl on the Train,’ a Boozy Emily Blunt Never Winks"
1307,2016-10-07T04:00:00+0000,Inside a Scent Maker’s Brooklyn Brownstone
1308,2016-10-07T04:00:00+0000,"‘Glass Cliff,’ Not Just Ceiling, Often Impedes Women Rising in Politics"
1309,2016-10-07T04:00:00+0000,It Was Once a Required Item. Now the Hat Is Just for Fun.
1310,2016-10-07T09:13:16+0000,Nobel Peace Prize Winners Throughout History
1311,2016-10-08T23:49:02+0000,Navy’s Upset of Houston Tightens the National Title Picture
1312,2016-10-08T23:31:00+0000,Judge Dismisses S.E.C. Case Against Texas Attorney General
1313,2016-10-08T22:53:41+0000,Showing How Art Critical of Malaysian Premier Thrived During His Rule
1314,2016-10-08T21:13:51+0000,"The Desert Trippers: Old, Young, Nostalgic and Adventurous"
1315,2016-10-08T18:52:05+0000,Colombian Opposition to Peace Deal Feeds Off Gay Rights Backlash
1316,2016-10-08T04:00:00+0000,On the Trail: Week of Oct. 2
1317,2016-10-08T18:30:18+0000,Return to the Teenage Brain
1318,2016-10-08T18:30:09+0000,Among the Post-Liberals
1319,2016-10-08T18:30:09+0000,What’s God Got to Do With It?
1320,2016-10-08T04:00:00+0000,Hurricane Matthew’s Trail of Damage
1321,2016-10-08T17:40:38+0000,Why Republicans Are Probably Stuck With Donald Trump
1322,2016-10-08T17:21:24+0000,Hurricane Matthew Loses Strength
1323,2016-10-08T16:44:39+0000,Centuries of Buddhist Tradition Make Room for Bhutan’s First Law School
1324,2016-10-08T04:00:00+0000,A Guarded Culture’s Old and New Ways
1325,2016-10-08T16:34:48+0000,Lewd Donald Trump Tape Is a Breaking Point for Many in the G.O.P.
1326,2016-10-08T16:02:05+0000,"Paul Ryan, Reluctant Supporter, Weighs Response to Donald Trump’s Remarks"
1327,2016-10-08T15:31:17+0000,Conflict at Work? Empathy Can Smooth Ruffled Feathers
1328,2016-10-08T15:21:58+0000,"Review: Bob Dylan and the Rolling Stones, Electric, Not Just Nostalgic, at Desert Trip"
1329,2016-10-08T14:54:45+0000,Sign of Thaw With Iran: American Cellphones Ringing in Tehran
1330,2016-10-08T13:57:51+0000,"To Redefine Homestretch, Hillary Clinton Cues the Children"
1331,2016-10-08T12:38:02+0000,How U.S. Torture Left a Legacy of Damaged Minds
1332,2016-10-08T12:30:54+0000,Memories of a Secret C.I.A. Prison
1333,2016-10-08T10:00:19+0000,W.N.B.A. Stars Try to Move Up to Fashion’s Front Row
1334,2016-10-08T04:00:00+0000,"‘Obviously, Marital Vows Mean Nothing to Him’"
1335,2016-10-08T04:00:00+0000,"Paul Ryan and Mitch McConnell Reject Donald Trump’s Words, Over and Over, but Not His Candidacy"
1336,2016-10-08T05:57:35+0000,Donald Trump’s Apology That Wasn’t
1337,2016-10-08T04:00:00+0000,Transcript of Donald Trump’s Videotaped Apology
1338,2016-10-08T04:00:00+0000,"What’s on TV Saturday: ‘45 Years,’ ‘Carol,’ and Lin-Manuel Miranda on ‘S.N.L.’"
1339,2016-10-08T04:00:00+0000,Transcript: Donald Trump’s Taped Comments About Women
1340,2016-10-08T04:00:00+0000,"Joan Marie Johnson, of the Singing Trio the Dixie Cups, Dies at 72"
1341,2016-10-08T04:00:00+0000,"Cubs’ Jon Lester Shuts Door on Giants, Who Once Came Knocking for Him"
1342,2016-10-08T04:00:00+0000,"Corrections: October 8, 2016"
1343,2016-10-08T04:00:00+0000,N.C.A.A. Names Sites for Championships Moved Because of North Carolina Law
1344,2016-10-08T04:00:00+0000,Queens Prosecutor Releases 71-Page Report on a Fatal Police Shooting
1345,2016-10-08T04:00:00+0000,Mayor de Blasio’s Media Freeze-Out
1346,2016-10-08T04:00:00+0000,Haiti’s New Catastrophe
1347,2016-10-08T04:00:00+0000,"Donald Trump: King of the Old Boys’ Club, and Perhaps Its Destroyer"
1348,2016-10-08T02:53:57+0000,Leaked Speech Excerpts Show a Hillary Clinton at Ease With Wall Street
1349,2016-10-08T04:00:00+0000,Broadcast Booth Blues
1350,2016-10-08T04:00:00+0000,Dodgers Defeat Nationals in a Pitchers’ Duel That Wasn’t
1351,2016-10-08T04:00:00+0000,The Magic of That Wiffle Ball Sound
1352,2016-10-08T04:00:00+0000,"Austin Kalish, a Writer of ‘Maude’ Abortion Episode, Dies at 95"
1353,2016-10-08T04:00:00+0000,"Walter Darby Bannard, Artist of the Color Field Movement, Dies at 82"
1354,2016-10-08T04:00:00+0000,"Dale Schenk, Who Saw Immune System as Weapon Against Alzheimer’s, Dies at 59"
1355,2016-10-08T04:00:00+0000,New Jersey’s Gas Tax Won’t Be the Second-Lowest in the U.S. For Long
1356,2016-10-08T04:00:00+0000,President of City College Quits Abruptly Amid Scrutiny of Her Finances
1357,2016-10-08T04:00:00+0000,Howard Dean: How to Move Beyond the Two-Party System
1358,2016-10-08T04:00:00+0000,Period of a Revolution
1359,2016-10-08T04:00:00+0000,"Jim Kilroy, Real Estate Developer Renowned as a Yachtsman, Dies at 94"
1360,2016-10-08T04:00:00+0000,"No Hockey or J.Lo, but Vladimir Putin Still Gets 450 Roses for His Birthday"
1361,2016-10-08T04:00:00+0000,A Bill of Rights for Housecleaners
1362,2016-10-08T04:00:00+0000,Quotation of the Day
1363,2016-10-08T04:00:00+0000,Toll Rises by Hour in Haiti Amid Ruin Left by Hurricane Matthew
1364,2016-10-08T04:00:00+0000,Detroit House Preserves Memories of a Little-Known Part of Rosa Parks’s Life
1365,2016-10-08T04:00:00+0000,Cubs Enjoy Coveted Time Slot for Story Line 108 Years in the Making
1366,2016-10-08T04:00:00+0000,"As Hurricane Matthew Blows Past, Florida Sighs With Relief"
1367,2016-10-08T01:08:11+0000,"In Rare Encounter, a Private U.S. Delegation Visits North Korea"
1368,2016-10-08T04:00:00+0000,"For Britain’s ‘Brexit’ Bunch, the Party Just Ended"
1369,2016-10-08T04:00:00+0000,The Sleaziness of Donald Trump
1370,2016-10-08T04:00:00+0000,"Colorado Woman Swims Nearly 82 Miles, Likely Setting Record"
1371,2016-10-08T04:00:00+0000,"Peace Prize Seen Not Necessarily for Achievements, but Hopes"
1372,2016-10-08T04:00:00+0000,United States Men Win in Cuba in a Tuneup for Mexico
1373,2016-10-08T04:00:00+0000,Newly Released Hillary Clinton Emails Offer Glimpse at Husband’s Advice
1374,2016-10-08T04:00:00+0000,"Channeling Their Inner Cavaliers, Indians Push the Red Sox to the Brink"
1375,2016-10-08T04:00:00+0000,Transcript: Mayor Bill de Blasio on The New York Post
1376,2016-10-08T04:00:00+0000,Billy Bush Says He’s Ashamed by Lewd Talk With Donald Trump
1377,2016-10-08T04:00:00+0000,Derrick Rose Gives His Side in Civil Rape Lawsuit
1378,2016-10-08T04:00:00+0000,"In Lane-Closing Trial, Defense Questions a Key Witness’s Motivations"
1379,2016-10-08T00:32:37+0000,"Amanda Kessel Is Making Up for Lost Time, in a Hurry"
1380,2016-10-08T04:00:00+0000,John Kerry Calls for War Crimes Investigation of Russia and Assad Government
1381,2016-10-08T04:00:00+0000,Those Who Don’t Understand Trump Are Doomed to Repeat Him
1382,2016-10-08T04:00:00+0000,Jane Pauley Is Back — Again
1383,2016-10-08T04:00:00+0000,"De Blasio, Frustrated, Chooses to Take His Private Feuds Public, Again"
1384,2016-10-08T04:00:00+0000,Costa Rican Soccer Official Pleads Guilty in FIFA Corruption Case
1385,2016-10-08T04:00:00+0000,Salesforce Shareholders Besiege Possible Twitter Deal
1386,2016-10-08T04:00:00+0000,C.E.O. of Male-Escort Site Pleads Guilty to Promoting Prostitution
1387,2016-10-08T04:00:00+0000,Obama Votes in Chicago While on a Fund-Raising Trip
1388,2016-10-08T04:00:00+0000,"Libya Starts Expanding Oil Exports — for Now, at Least"
1389,2016-10-08T04:00:00+0000,"Canada Today: Giving Thanks, Canadian Style"
1390,2016-10-08T04:00:00+0000,Someone Mailed Feces to Four Philosophers: A Disquisition
1391,2016-10-08T04:00:00+0000,Review: This Dance Is a Jolt at the Joyce Theater
1392,2016-10-08T04:00:00+0000,"Review: In Mahler, Philadelphia Orchestra Finds Beauty Amid the Grit"
1393,2016-10-08T04:00:00+0000,Donald Trump Apology Caps Day of Outrage Over Lewd Tape
1394,2016-10-08T04:00:00+0000,Fiddling While Venezuela Starves? Bolívar Symphony Opens Carnegie Season
1395,2016-10-08T04:00:00+0000,A Ballerina Goes From Baby Bump to High Jumps
1396,2016-10-08T04:00:00+0000,Mylan to Settle EpiPen Overpricing Case for $465 Million
1397,2016-10-08T04:00:00+0000,Blue Jays Take Control of Division Series With Four Home Runs
1398,2016-10-08T04:00:00+0000,Voices From a Worsening Afghan War
1399,2016-10-08T04:00:00+0000,Review: ‘Fit for a Queen’ Sees ‘Dynasty’ Centuries Before the TV Show
1400,2016-10-08T04:00:00+0000,Paying $15 Billion for Twitter Will Be Hard for Anyone to Justify
1401,2016-10-08T04:00:00+0000,Trump Campaign Shifts $1.8 Million in Ads to Larger Markets
1402,2016-10-08T04:00:00+0000,David Bowie as Muse? Why One Composer Says So
1403,2016-10-08T04:00:00+0000,"‘A Doll’s House, Part 2’ to Open on Broadway"
1404,2016-10-08T04:00:00+0000,Review: This Sublime New Dance Work Embraces Wonder
1405,2016-10-08T04:00:00+0000,The Israeli-Palestinian Morass
1406,2016-10-08T04:00:00+0000,Donald Trump’s Tax Records: Other Voices
1407,2016-10-08T04:00:00+0000,Safety of Driverless Cars
1408,2016-10-08T04:00:00+0000,Ammon Bundy Case as Inkblot Test: What Will Jurors See in His Words?
1409,2016-10-08T04:00:00+0000,Russia Seeks to Reopen Military Bases in Vietnam and Cuba
1410,2016-10-08T04:00:00+0000,"Fleeing Threats in Venezuela, and Then a Florida Hurricane"
1411,2016-10-08T04:00:00+0000,Kosovo: The Road Team
1412,2016-10-08T04:00:00+0000,A Plea for Haiti
1413,2016-10-08T04:00:00+0000,Five Paintings Stolen in 2005 Return to Dutch Museum
1414,2016-10-08T04:00:00+0000,"Thomson Reuters to Add Up to 1,500 Jobs in Toronto"
1415,2016-10-08T04:00:00+0000,"After Hurricane Matthew, Devastation in Southern Haiti"
1416,2016-10-08T04:00:00+0000,"Move Over, Rats. New York Is Planning an Underground Park."
1417,2016-10-08T04:00:00+0000,Forecast Hints That Hurricane Matthew Could Loop Back
1418,2016-10-08T04:00:00+0000,Britain to Resume Sale of Lloyds Banking Group Stake
1419,2016-10-08T04:00:00+0000,Prosecutors Seek to Try Teenager as Adult After Shooting at South Carolina School
1420,2016-10-08T04:00:00+0000,American Chess Player Boycotts Championship in Iran Over Hijab Rule
1421,2016-10-08T04:00:00+0000,The ‘Ferguson Effect’
1422,2016-10-08T04:00:00+0000,Paul Taylor American Modern Dance Plans 3 Premieres for Lincoln Center
1423,2016-10-08T04:00:00+0000,The Playlist: Bruno Mars Gives His Funk a Flashy Makeover
1424,2016-10-08T04:00:00+0000,Nat Turner Was Far From Alone
1425,2016-10-08T04:00:00+0000,A Guide to Getting Rid of Your Big-Bank Checking Account
1426,2016-10-08T04:00:00+0000,Tiger Woods to Return to Golf Next Week in PGA Tour Opener
1427,2016-10-08T04:00:00+0000,"A Must-Win Debate for Donald Trump, but Not a Must-Rehearse One"
1428,2016-10-08T04:00:00+0000,"Mark Rothko, Son of Oregon, to Be Honored With Museum Wing"
1429,2016-10-08T04:00:00+0000,Many Florida Beach Residents Shrug Off Evacuation Orders
1430,2016-10-08T04:00:00+0000,My Dad Set the Precedent Donald Trump Is Flouting
1431,2016-10-08T04:00:00+0000,Daily Report: Salesforce Has Had Its Eye on Twitter. But Why?
1432,2016-10-08T04:00:00+0000,Making Financial Management Both Spouses’ Job
1433,2016-10-08T04:00:00+0000,Map Your Photos With a Desktop Computer
1434,2016-10-08T04:00:00+0000,Democrats Push to Extend Voter Registration in Storm-Damaged Florida
1435,2016-10-08T04:00:00+0000,The Second 2016 Presidential Debate: A Place for Student Predictions and Reactions
1436,2016-10-08T04:00:00+0000,Wall Street Slips After Jobs Report
1437,2016-10-08T04:00:00+0000,"Young, Transgender and Acting on TV"
1438,2016-10-08T04:00:00+0000,"At Frieze Art Week, All Eyes on the Pound"
1439,2016-10-08T04:00:00+0000,How to Improve Your Retirement Income if You Haven’t Saved
1440,2016-10-08T04:00:00+0000,A General’s New Mission: Leading a Charge Against PTSD
1441,2016-10-08T04:00:00+0000,"How This Jobs Report Can Help Clinton, and Trump"
1442,2016-10-08T04:00:00+0000,Your Boycott Won’t Help Iranian Women
1443,2016-10-08T04:00:00+0000,Justice Dept. Is Asked to Review Chinese Company’s Hollywood Purchases
1444,2016-10-08T04:00:00+0000,China Seeks Tighter Grip in Wake of a Religious Revival
1445,2016-10-08T04:00:00+0000,Let’s Talk a Millennial Into Getting a Flu Shot
1446,2016-10-08T04:00:00+0000,Björk in Montreal and Flower Art in Melbourne: Global Arts Guide
1447,2016-10-08T04:00:00+0000,"Morning Agenda: Corzine Nears Settlement, Ads Berate Wells Fargo, Pound Plunges"
1448,2016-10-08T04:00:00+0000,Donald Trump Adjusts His Complaints About Debate Microphone
1449,2016-10-08T04:00:00+0000,"Balance, Trump and Lies"
1450,2016-10-08T04:00:00+0000,Group Questions Donald Trump’s Lock on Evangelical Voters
1451,2016-10-08T04:00:00+0000,"In Splintered Georgia, 200 Political Parties Find Unity Against Russia"
1452,2016-10-08T04:00:00+0000,Planned Parenthood Opens $30 Million Effort to Target Millennial Voters
1453,2016-10-08T04:00:00+0000,Coloradan Finds a Rugby Home Where the Sport Is King
1454,2016-10-08T04:00:00+0000,"Colombia’s President, Juan Manuel Santos, Is Awarded Nobel Peace Prize"
1455,2016-10-08T04:00:00+0000,Grand Prix Drivers May Race Like Their Jobs Are on the Line
1456,2016-10-08T04:00:00+0000,"U.S. Set to Open a Climactic Battle Against ISIS in Mosul, Iraq"
1457,2016-10-08T04:00:00+0000,"U.S. Economy, Showing Resilience, Added 156,000 Jobs Last Month"
1458,2016-10-08T04:00:00+0000,Letterman Has No Love for ‘Damaged’ Trump
1459,2016-10-08T04:00:00+0000,I.P.O. Values Innogy Unit of German Utility RWE Around $22 Billion
1460,2016-10-08T04:00:00+0000,Third Piece of Debris Confirmed to Be From Missing Malaysian Jet
1461,2016-10-08T04:00:00+0000,Pound Drops Sharply in Asian Trading Amid ‘Brexit’ Fears
1462,2016-10-08T04:00:00+0000,Reefer Republic
1463,2016-10-08T04:00:00+0000,"Hurricane Matthew Avoids Direct Hit on Florida, Continues North"
1464,2016-10-08T04:00:00+0000,"Bing Thom, Daring Architect With a Sense of Place, Dies at 75"
1465,2016-10-08T07:02:18+0000,Quiz: How Much Do You Know About Nobel Peace Prize Winners?
1466,2016-10-08T04:00:00+0000,"Katie Holmes, Rooney Mara and Chloë Grace Moretz at Cartier’s Fashion Week Kickoff"
1467,2016-10-09T04:00:00+0000,‘Insecure’ Series Premiere: Single Black Woman
1468,2016-10-09T04:00:00+0000,"Superheroes, Villains and More at New York Comic Con"
1469,2016-10-09T04:00:00+0000,"A Neighborhood Changes, and People Keep Parking"
1470,2016-10-09T23:11:18+0000,North Carolina Resident Surveys Damage
1471,2016-10-09T22:06:38+0000,"Yes, Even Fresh-Faced Fans Cheered the Rock Stalwarts of ‘Oldchella’"
1472,2016-10-09T22:01:31+0000,Fall for Dance Festival Is Short but Packed
1473,2016-10-09T21:57:56+0000,"‘The Mothers,’ a Debut Novel, Is Already Creating a Stir"
1474,2016-10-09T21:54:08+0000,"Review: Paul McCartney and Neil Young Share a Bill, and Some Songs"
1475,2016-10-09T20:55:18+0000,Trump and Clinton’s Second Debate: Analysis
1476,2016-10-09T19:10:36+0000,"Behind Duterte’s Bluster, a Philippine Shift Away From the U.S."
1477,2016-10-09T04:00:00+0000,Lin-Manuel Miranda Brings ‘Hamilton’ Flavor to ‘S.N.L.’
1478,2016-10-09T04:00:00+0000,What We’re Seeing in the Second Presidential Debate
1479,2016-10-09T17:07:44+0000,'This Storm Is Not Over For North Carolina'
1480,2016-10-09T15:40:47+0000,"N.F.L.: Cowboys Like Their New QB, Patriots Love Their Old One"
1481,2016-10-09T15:19:27+0000,How NBC Finished Second on the Trump Video Story
1482,2016-10-09T04:00:00+0000,What to Cook This Week
1483,2016-10-09T12:24:16+0000,What to Expect From the Second Debate
1484,2016-10-09T12:02:55+0000,Attack by Palestinian Kills 2 Israelis in Jerusalem
1485,2016-10-09T09:00:30+0000,"Homes That Sold for $450,000 and Under"
1486,2016-10-09T04:00:00+0000,"What’s on TV Sunday: ‘Divorce,’ ‘Insecure’ and the Second Presidential Debate"
1487,2016-10-09T04:00:00+0000,"Dana Eisenberg, Jonathan Duber"
1488,2016-10-09T04:00:00+0000,"Anne-Marie Henderson, Alexander Cabot"
1489,2016-10-09T04:00:00+0000,"Shardeé Caesar, Shane Douglas"
1490,2016-10-09T04:28:03+0000,"Dyan Yu, Dong Joo Lee"
1491,2016-10-09T04:00:00+0000,"Rebecca Beland, John McNaught"
1492,2016-10-09T04:00:00+0000,"Jonathan Siegel, Matthew Harris"
1493,2016-10-09T04:00:00+0000,"Lily Salembier, James Sliger"
1494,2016-10-09T04:00:00+0000,"Hai-Ching Yang, Tao Jin"
1495,2016-10-09T04:00:00+0000,"Kathleen Whipple, Patrick Mitchell"
1496,2016-10-09T04:00:00+0000,"Kathryn Sugar, Julia Cohen"
1497,2016-10-09T04:00:00+0000,"Alyssa Kelly, Granger Jewett"
1498,2016-10-09T04:00:00+0000,"Christopher Pierce, Jonathan Pollock"
1499,2016-10-09T04:00:00+0000,"Stephanie Michael, Justin Barton"
1500,2016-10-09T04:00:00+0000,"Eleanor May, Peter Hawkins"
1501,2016-10-09T04:00:00+0000,"Colie McClellan, Mark Kennedy"
1502,2016-10-09T04:00:00+0000,"Julia Merrill, Matthew Himler"
1503,2016-10-09T04:00:00+0000,Tennessee’s Latest Comeback Falls Short Against Texas A&amp;M
1504,2016-10-09T04:00:00+0000,"Julia Hoyt, Minot Amory IV"
1505,2016-10-09T04:00:00+0000,"Eleanor Joseph, Andrew Johnston"
1506,2016-10-09T04:00:00+0000,"Bethany Heitman, Antoine Samuda"
1507,2016-10-09T04:00:00+0000,"Ann Horwitz, Ariel Dubin"
1508,2016-10-09T04:00:00+0000,"Lucia Finucane, Cyril Vergis"
1509,2016-10-09T04:00:00+0000,"Daniel D’Addario, Jacob Schneider"
1510,2016-10-09T04:00:00+0000,"Erin Geismar, Michael Bolan"
1511,2016-10-09T04:00:00+0000,"Corrections: October 9, 2016"
1512,2016-10-09T04:00:00+0000,"Catherine Barnao, Matthew Rowland"
1513,2016-10-09T04:00:00+0000,"Cara Crowley, Seth Stammler"
1514,2016-10-09T04:00:00+0000,"Annabeth Bondor-Stone, Connor White"
1515,2016-10-09T04:00:00+0000,"Tory Brooks, Scott Caputo"
1516,2016-10-09T04:00:00+0000,"Brett Barash, Dakota Sherman"
1517,2016-10-09T04:00:00+0000,"Sarah Armstrong, Matthew Porwoll"
1518,2016-10-09T04:00:00+0000,"Chloé Andrus, Martin Bringmann"
1519,2016-10-09T04:00:00+0000,"Dennis Adler, David Gevurtz"
1520,2016-10-09T04:00:00+0000,"Camille Balsan, Nicholas Rutherfurd"
1521,2016-10-09T04:00:00+0000,"Pitchers’ Swings, and Their Throws, Keep Cubs Rolling Past Giants"
1522,2016-10-09T04:00:00+0000,Panthers’ Cam Newton to Sit Out Game Monday With Concussion
1523,2016-10-09T04:00:00+0000,Quotation of the Day
1524,2016-10-09T04:00:00+0000,Penn State Ends Maryland’s 5-Game Winning Streak
1525,2016-10-09T02:00:46+0000,Why Care at Native American Hospitals Is Often Substandard
1526,2016-10-09T01:54:53+0000,Men Say Trump’s Remarks on Sex and Women Are Beyond the Pale
1527,2016-10-09T01:52:42+0000,Donald Trump’s Long Record of Degrading Women
1528,2016-10-09T01:43:36+0000,"Women React With Fury to Donald Trump’s Remarks, but Some Offer Support"
1529,2016-10-09T01:32:16+0000,Donald Trump’s Conduct Was Excused Again and Again. But Not This Time.
1530,2016-10-09T04:00:00+0000,Dodgers’ Hill and Nationals’ Roark Conquer Struggles and Morph Into Starters
1531,2016-10-09T00:37:05+0000,Seeing ‘Nothing to Live For’ as Haiti Seeks a Body Count After Hurricane Matthew
1532,2016-10-09T00:35:40+0000,"2 Police Officers Are Shot and Killed in Palm Springs, Calif."
1533,2016-10-09T04:00:00+0000,Movie Doubles
1534,2016-10-09T04:00:00+0000,Syria Provokes an American Anxiety: Is U.S. Power Really So Special?
1535,2016-10-09T04:00:00+0000,Kurdish Politician Who Vanished in Turkey Turns Up in Iraq
1536,2016-10-09T04:00:00+0000,Can’t Find a Plan on HealthCare.gov? One May Be Picked for You.
1537,2016-10-09T04:00:00+0000,The Strip
1538,2016-10-09T04:00:00+0000,Saudi-Led Airstrikes Blamed for Massacre at Funeral in Yemen
1539,2016-10-09T04:00:00+0000,Bangladesh Reports Killing 11 Militants in Raids
1540,2016-10-09T04:00:00+0000,"Roslyn Litman, Antitrust Lawyer and Civil Liberties Advocate, Dies at 88"
1541,2016-10-09T04:00:00+0000,John McCain Withdraws Support for Donald Trump After Disclosure of Recording
1542,2016-10-09T04:00:00+0000,How Donald Trump Could Send Republicans Crashing Down
1543,2016-10-09T04:00:00+0000,"After Water Fiasco, Trust of Officials Is in Short Supply in Flint"
1544,2016-10-09T04:00:00+0000,Donald and Billy on the Bus
1545,2016-10-09T04:00:00+0000,Carson Wentz’s Fast Success Animates the Eagles and Philadelphia
1546,2016-10-09T04:00:00+0000,Political Futures
1547,2016-10-09T04:00:00+0000,Tax Me. Please.
1548,2016-10-09T04:00:00+0000,Laura Benanti
1549,2016-10-09T04:00:00+0000,"Tough Donald Trump Coverage, if a Little Late"
1550,2016-10-09T04:00:00+0000,Shakespeare Explains the 2016 Election
1551,2016-10-09T04:00:00+0000,Donald Goes to the Dogs
1552,2016-10-09T04:00:00+0000,Surveillance in the Post-Obama Era
1553,2016-10-09T04:00:00+0000,From Voting Rights to Voting Wrongs
1554,2016-10-09T04:00:00+0000,Hillary Clinton’s Poisoned Prize
1555,2016-10-09T04:00:00+0000,The Lost Cultures of Whales
1556,2016-10-09T04:00:00+0000,The Nobel ‘Give Peace a Chance’ Prize
1557,2016-10-09T04:00:00+0000,Racial Profiling in Preschool
1558,2016-10-09T04:00:00+0000,Is Idealism Missing From the Presidential Campaign?
1559,2016-10-09T04:00:00+0000,Women’s Table Tennis World Cup Debuts in the United States
1560,2016-10-09T04:00:00+0000,"A High Holy Call for Lox, and Old Hands to Slice It, at Zabar’s"
1561,2016-10-09T04:00:00+0000,"Refusing to Surrender, Turkish Suspects Blow Themselves Up"
1562,2016-10-09T04:00:00+0000,A Weakened Hurricane Matthew Still Delivers Flooding and Power Failures
1563,2016-10-09T04:00:00+0000,"Nationals Build a Contender, a Neighborhood and a Legacy"
1564,2016-10-09T04:00:00+0000,I.O.C. Expands WADA’s Authority to Lead Antidoping Efforts
1565,2016-10-09T04:00:00+0000,"Healthy and Rested, Lynx Star Lindsay Whalen Is Primed for W.N.B.A. Finals"
1566,2016-10-09T04:00:00+0000,What Options Does the U.S. Have After Accusing Russia of Hacks?
1567,2016-10-09T04:00:00+0000,Abbie Sorrendino and Andrew Brenner: A Train Crash and a New Outlook
1568,2016-10-09T04:00:00+0000,"As Jordy Nelson Regains His Stride, So Do the Packers"
