,pub_date,headline
1692,2016-02-07T00:00:00Z,The Feds’ Best-Value Schools
1693,2016-02-07T00:00:00Z,Farhad and Mike’s Week in Tech: Start-Ups and the Circle of Life
1694,2016-02-07T00:00:00Z,How Sumner Redstone Went From Army Cryptographer to Media Mogul
1695,2016-02-07T00:00:00Z,2 Radio Journalists Attacked by Gunmen in Afghanistan
1696,2016-02-07T00:00:00Z,"Cover Crops, a Farming Revolution With Deep Roots in the Past"
1697,2016-02-07T00:00:00Z,"Wanted in China: More Male Teachers, to Make Boys Men"
1698,2016-02-07T00:00:00Z,Returning to a Gentler Gotham
1699,2016-02-07T00:00:00Z,Montclair Bread Company Has Sunday Treats All Week Long
1700,2016-02-07T00:00:00Z,"How Val DiFebo, C.E.O. of Deutsch NY, Spends Her Sundays"
1701,2016-02-07T00:00:00Z,Teaching a Medieval Russian Martial Art in a Flatiron Basement
1702,2016-02-07T00:00:00Z,Not Elegance but Survival
1703,2016-02-07T00:00:00Z,New York Welcomes Calvin Klein’s New Underwear Hunk and YouTube’s Tyler Oakley
1704,2016-02-07T00:00:00Z,Pleading the Case to Get Parking Tickets Dismissed
1705,2016-02-07T00:00:00Z,Tommy Hilfiger Drills Deep and Hits Fashion Pay Dirt
1706,2016-02-07T00:00:00Z,"The Praying Mantis, a Friend and Foe of New York City Gardens"
1707,2016-02-07T00:00:00Z,"City History, and Vantages, Often Overlooked"
1708,2016-02-07T00:00:00Z,Olivo Barbieri’s Serendipitous Choreography on the Adriatic
1709,2016-02-07T00:00:00Z,"Paul Bley’s Legacy, Invoked in Tribute"
1710,2016-02-07T00:00:00Z,21st-Century Music Rises on Three Stages
1711,2016-02-07T00:00:00Z,Samantha Bee Takes Her Place on Late Night
1712,2016-02-07T00:00:00Z,"Syndicated, in Brooklyn, Offers Movies, Munchies and Breakups on the Menu"
1713,2016-02-07T00:00:00Z,"New Albums From Infamous Stringdusters, Trixie Whitley and Others"
1714,2016-02-07T00:00:00Z,"For Deon Cole, the Comedy Keeps Him Busy"
1715,2016-02-07T00:00:00Z,"In Iowa, Voting Science at Work"
1716,2016-02-07T00:00:00Z,Big Ticket | 46 East 81st Street
1717,2016-02-07T00:00:00Z,Inside The New York Times Book Review: David Foster Wallace’s ‘Infinite Jest’
1718,2016-02-07T00:00:00Z,Snarky Puppy: A House Built on Solid Funk
1719,2016-02-07T00:00:00Z,Wood Shop Enters the Age of High-Tech
1720,2016-02-07T00:00:00Z,The Sheltering Campus: Why College Is Not Home
1721,2016-02-07T00:00:00Z,Who Needs Advanced Math? Not Everybody
1722,2016-02-07T00:00:00Z,Learning to Live Small (in a Dumpster)
1723,2016-02-07T00:00:00Z,The Feds’ Best-Value Schools
1724,2016-02-07T00:00:00Z,"Create Your Own Language, for Credit"
1725,2016-02-07T00:00:00Z,Social Practice Degrees Take Art to a Communal Level
1726,2016-02-07T00:00:00Z,A Valentine’s Day Reading List
1727,2016-02-07T00:00:00Z,Literature of Love
1728,2016-02-07T00:00:00Z,Home Sales Around the New York Region
1729,2016-02-07T00:00:00Z,The Big Problem With High Health Care Deductibles
1730,2016-02-07T00:00:00Z,Sick and Tired of ‘God Bless America’
1731,2016-02-07T00:00:00Z,Speed Dating for Rabbits
1732,2016-02-07T00:00:00Z,Homes for Sale in Brooklyn and Manhattan
1733,2016-02-07T00:00:00Z,On the Market in New York City
1734,2016-02-07T00:00:00Z,Homes for Sale in New York and Connecticut
1735,2016-02-07T00:00:00Z,On the Market in the New York Region
1736,2016-02-07T00:00:00Z,"At Dublin Hotel, the Night Life Beckons"
1737,2016-02-07T00:00:00Z,"At a San Francisco Restaurant, a Taste of Brittany"
1738,2016-02-07T00:00:00Z,Darryl Pinckney’s ‘Black Deutschland’
1739,2016-02-07T00:00:00Z,Laura Secor’s ‘Children of Paradise: The Struggle for the Soul of Iran’
1740,2016-02-07T00:00:00Z,"‘The Darkening Trapeze: Last Poems,’ by Larry Levis"
1741,2016-02-07T00:00:00Z,Group Portraits
1742,2016-02-07T00:00:00Z,"‘Dream Cities,’ by Wade Graham"
1743,2016-02-07T00:00:00Z,"‘The Big Red Book of Modern Chinese Literature,’ Edited by Yunte Huang"
1744,2016-02-07T00:00:00Z,"C. D. Wright’s ‘The Poet, the Lion’"
1745,2016-02-07T00:00:00Z,"‘Beasts and Children,’ by Amy Parker"
1746,2016-02-07T00:00:00Z,‘Infinite Jest’ at 20
1747,2016-02-07T00:00:00Z,Letters: Shedding Light on Dark Money
1748,2016-02-07T00:00:00Z,Editors’ Choice
1749,2016-02-07T00:00:00Z,Paperback Row
1750,2016-02-07T00:00:00Z,Target Margin Theater Takes On Eugene O’Neill
1751,2016-02-07T00:00:00Z,Hou Hsiao-Hsien Fuses the Formal and the Bloody
1752,2016-02-07T00:00:00Z,What I Love | Tim Daly
1753,2016-02-07T00:00:00Z,"What You Get When You Mix Chickens, China and Climate Change"
1754,2016-02-07T00:00:00Z,"In Tokyo, Brand-Name Stores by Brand-Name Architects"
1755,2016-02-07T00:00:00Z,How the Luxury Adventure Vacation Was Made
1756,2016-02-07T00:00:00Z,Who Killed the Sheridans?
1757,2016-02-07T00:00:00Z,‘Wild Common Prayer’
1758,2016-02-07T00:00:00Z,An Interview in Kazakhstan
1759,2016-02-07T00:00:00Z,How to Offer a Cash Reward
1760,2016-02-07T00:00:00Z,The 1.24.16 Issue
1761,2016-02-07T00:00:00Z,On Vacation. How to Keep the Boss at Bay?
1762,2016-02-07T00:00:00Z,There Was Something Magical About Her
1763,2016-02-07T00:00:00Z,Avoiding the Status Quo Together
1764,2016-02-07T00:00:00Z,"A Heart Filled With Love, Not Stuff"
1765,2016-02-07T00:00:00Z,"Things to Do in the Hudson Valley, Feb. 6 Through 14"
1766,2016-02-07T00:00:00Z,"Things to Do on Long Island, Feb. 6 Through Feb. 14"
1767,2016-02-07T00:00:00Z,"Things to Do in Connecticut, Feb. 6 Through Feb. 14"
1768,2016-02-07T00:00:00Z,"Things to Do in New Jersey, Feb. 6 Through Feb. 14"
1769,2016-02-07T00:00:00Z,"Please Sir, May I Have Some Mouret for Jennifer Jason Leigh?"
1770,2016-02-07T00:00:00Z,Presidential Pursuits
1771,2016-02-07T00:00:00Z,"In Movies, Books and TV, a Rabbit Hole of Kennedy Conspiracies"
1772,2016-02-07T00:00:00Z,"At Live Ideas Festival, a Twist on an Arab Dance and Scenes From Gaza"
1773,2016-02-07T00:00:00Z,Walt Bettinger of Charles Schwab: You’ve Got to Open Up to Move Up
1774,2016-02-07T00:00:00Z,Valentine’s Day Etiquette: How to Handle Tricky Situations
1775,2016-02-07T00:00:00Z,The Lives and Lies of a Professional Impostor
1776,2016-02-07T00:00:00Z,Who Are the True Heirs of Zionism?
1777,2016-02-07T00:00:00Z,"Fabio Luisi’s Future Looks Bright, Wherever It Is"
1778,2016-02-07T00:00:00Z,‘Cabin in the Sky’: Translating a Dated Body Language
1779,2016-02-07T00:00:00Z,"Sisterhood, Beyond the Script"
1780,2016-02-07T00:00:00Z,Cory Booker: By the Book
1781,2016-02-07T00:00:00Z,Seduced by Tuscany in Winter
1782,2016-02-07T00:00:00Z,When Your Baby Won’t Eat
1783,2016-02-07T00:00:00Z,The Privilege of Wild Food
1784,2016-02-07T00:00:00Z,Letter of Recommendation: William Blake’s Grave
1785,2016-02-07T00:00:00Z,A Hint of Danger in the Forest
1786,2016-02-07T00:00:00Z,Boys Matter
1787,2016-02-07T00:00:00Z,Congresswoman’s Long Quest: Bringing Pandas to New York
1788,2016-02-07T00:00:00Z,A Hudson Heights Co-op With a View
1789,2016-02-07T00:00:00Z,When Ling-Ling and Hsing Hsing Arrived in the U.S.
1790,2016-02-07T00:00:00Z,"With This Tattoo, I Thee Wed"
1791,2016-02-07T00:00:00Z,Cross-Country Skiing in the Jizera Mountains
1792,2016-02-07T00:00:00Z,Gambling on O’Neill: Forest Whitaker Makes His Broadway Debut in ‘Hughie’
1793,2016-02-07T00:00:00Z,Danny Meyer Thinks Tipping Is Socialist
1794,2016-02-07T00:00:00Z,Should a Man Have Told His Mother-in-Law That She Was Dying?
1795,2016-02-07T00:00:00Z,"‘In Europe’s Shadow,’ by Robert D. Kaplan"
1796,2016-02-07T00:00:00Z,"‘Paradise Now: The Story of American Utopianism,’ by Chris Jennings"
1797,2016-02-07T00:00:00Z,Hamilton Heights: Harlem Enclave With River Views
1798,2016-02-07T00:00:00Z,Living in Hamilton Heights
1799,2016-02-07T00:00:00Z,"In Ecuador, the Frugal Traveler Tries Luxury"
1800,2016-02-07T00:00:00Z,Fischli and Weiss: Anarchy at the Guggenheim
1801,2016-02-07T00:00:00Z,Josh Brolin Revels in the Role of Go-To Guy
1802,2016-02-07T00:00:00Z,When Is Criticism Unfair?
1803,2016-02-07T00:00:00Z,Bohemia’s Secret Spot for Cross-Country Skiing
1804,2016-02-07T00:00:00Z,Fighting ‘Erasure’
1805,2016-02-07T00:00:00Z,Hostels Come Furnished With History
1806,2016-02-07T00:00:00Z,"‘The Vegetarian,’ by Han Kang"
1807,2016-02-07T00:00:00Z,Everything About Everything: David Foster Wallace’s ‘Infinite Jest’ at 20
1808,2016-02-07T00:00:00Z,Janet Napolitano Reviews Peter Bergen’s ‘United States of Jihad’
1809,2016-02-07T00:00:00Z,Black Activism on Campus
1810,2016-02-07T00:00:00Z,Black America and the Class Divide
1811,2016-02-07T00:00:00Z,Inside the List
1812,2016-02-08T00:00:00Z,Twenty-Four Hours With John Kasich
1813,2016-02-08T00:00:00Z,Flor Garduño’s Visions in Black-and-White
1814,2016-02-08T00:00:00Z,Republicans Trade Attack Ads in New Hampshire
1815,2016-02-08T22:52:31+0000,Bad Shape of Knicks Starts With the Triangle
1816,2016-02-08T22:00:20Z,Purposeful Misdirection
1817,2016-02-08T21:44:49Z,Why People Own Guns in New Hampshire
1818,2016-02-08T21:18:10Z,"Zenefits, in a Shake-Up, Appoints New C.E.O., Replacing Parker Conrad"
1819,2016-02-08T21:00:06Z,Williamstown Season To Feature Marisa Tomei in &#8216;Rose Tattoo&#8217;
1820,2016-02-08T00:00:00Z,"‘The X-Files’ Season 10, Episode 4: Back in the Day"
1821,2016-02-08T20:49:56Z,"Donald Trump Tries a Town Hall Event, and It&#8217;s a Hit"
1822,2016-02-08T20:45:10Z,"Marco Rubio, Lampooned for Repeating Himself, Does It Again"
1823,2016-02-08T19:23:13Z,What&#8217;s Missing at the U.N. Climate Panel&#8217;s Meeting on Climate Change Communication
1824,2016-02-08T19:04:22Z,"Marco Rubio Skips a Burger, but Not a Chance to Counterattack Chris Christie"
1825,2016-02-08T18:43:18Z,John Kasich Draws Some Fans Who Might Not Help Him Much: Democrats
1826,2016-02-08T00:00:00Z,A Snowy End to the First Primary Campaign
1827,2016-02-08T00:00:00Z,On the Rise at New York Fashion Week
1828,2016-02-08T18:23:29Z,Can Activists Be Politicians?
1829,2016-02-08T00:00:00Z,Your Evening Briefing
1830,2016-02-08T00:00:00Z,"On a Royal Caribbean Cruise in a Storm, Anything but Smooth Sailing"
1831,2016-02-08T00:00:00Z,"Your Monday Evening Briefing: Denver Broncos, Coldplay, Barack Obama"
1832,2016-02-08T00:00:00Z,Rihanna’s ‘Anti’ Is the Record You Make When You Don’t Need to Sell Records
1833,2016-02-08T17:47:18Z,"Feb. 8, 2016 — Photos of the Day"
1834,2016-02-08T17:41:42Z,Bill Clinton Keeps Heat on Bernie Sanders on Eve of Primary
1835,2016-02-08T00:00:00Z,Reporting on Zika When You Have Zika
1836,2016-02-08T17:09:47Z,&#8216;Voter-Shaming&#8217; Mailer That Made Noise in Iowa Shows Up in New Hampshire
1837,2016-02-08T17:00:47Z,Michael Bloomberg Confirms He Is Weighing an Independent Run for President
1838,2016-02-08T00:00:00Z,Pictures of the Day: Turkey and Elsewhere
1839,2016-02-08T00:00:00Z,"A Beloved Childhood Lemon Tart Recipe, Courtesy of agnès b."
1840,2016-02-08T16:37:13Z,Beyoncé’s Halftime Show Inspires Ridiculous Criticism
1841,2016-02-08T16:28:56Z,Hard Money Men
1842,2016-02-08T00:00:00Z,A Unisex Clothing Line Inspired by the Construction of Buildings
1843,2016-02-08T00:00:00Z,Faan Fall/Winter 2016
1844,2016-02-08T15:47:56Z,Gay Voter to Marco Rubio: &#8216;Why Do You Want to Put Me Back in the Closet?&#8217;
1845,2016-02-08T15:44:35Z,How to Vote in the New Hampshire Primary
1846,2016-02-08T15:41:23Z,"For Chris Christie, Success on Tuesday Is a Moving Target"
1847,2016-02-08T00:00:00Z,New Hampshire Voters Make Their Statement
1848,2016-02-08T00:00:00Z,Bluffer’s Guide to the Oscars: Best Actress
1849,2016-02-08T15:18:28Z,Sanders Campaign Determined Not to Get Knocked Off Message by Clinton Attacks
1850,2016-02-08T15:15:47Z,ScienceTake | Building a Rescue Roach
1851,2016-02-08T14:55:28Z,Bill Clinton Has a Few Thoughts About the Meaning of &#8216;Establishment&#8217;
1852,2016-02-08T14:51:14Z,"Rihanna Rebounds in Second Week on the Charts, and &#8216;Anti&#8217; Takes No. 1"
1853,2016-02-08T14:45:48Z,An American Football Fan in Paris
1854,2016-02-08T14:23:27Z,Chris Christie Says Race Is &#8216;Wide Open&#8217; Heading Into Primary
1855,2016-02-08T14:01:54Z,Donald Trump Denies Saying What He Said About John McCain
1856,2016-02-08T00:00:00Z,A Nature-Inspired Drawing Event — With a Dance Twist
1857,2016-02-08T00:00:00Z,“In the Seed We Have the Universe”
1858,2016-02-08T13:25:57Z,"For Some Cord Cutters, Streaming Super Bowl Was a Nonstarter"
1859,2016-02-08T00:00:00Z,7 Trends From a Month of Men’s Fashion Shows
1860,2016-02-08T00:00:00Z,East Meets West in a One-of-a-Kind Cartier Pendant
1861,2016-02-08T13:07:12Z,Donald Trump&#8217;s Colorful Encounter With a Hometown Reporter
1862,2016-02-08T12:43:04Z,"In Hospitals, Smoke-Free Doesn&#8217;t Mean Abuse-Free"
1863,2016-02-08T12:36:20Z,A Party on the Verge of a Nervous Breakdown
1864,2016-02-08T00:00:00Z,The Many Frenemies of Ted Cruz
1865,2016-02-08T12:18:40Z,Marco Rubio’s Lighter Side
1866,2016-02-08T12:05:42Z,Flash-Free Video in 2016
1867,2016-02-08T00:00:00Z,Exploring the Desert Landscape of Namibia
1868,2016-02-08T12:00:26Z,The Unexpected Sequence
1869,2016-02-08T11:58:05Z,Of Mansplaining and Mastectomies
1870,2016-02-08T11:53:05Z,Andrew Cuomo to Raise Money for Hillary Clinton in New York
1871,2016-02-08T00:00:00Z,Delfina Delettrez Fendi’s Whimsical Jewelry — and Many Inspirations
1872,2016-02-08T00:00:00Z,Profile in Style: Delfina Delettrez Fendi
1873,2016-02-08T00:00:00Z,Perversity in a Bottle
1874,2016-02-08T11:25:20Z,Opening Up About Depression
1875,2016-02-08T00:00:00Z,Recipes for Happiness and Prosperity
1876,2016-02-08T10:30:09+0000,Resurrection: How New Hampshire Saved the 1992 Clinton Campaign
1877,2016-02-08T10:00:35Z,1966: Kennedy Seeks Nuclear Pledge
1878,2016-02-08T09:41:21Z,Daily Report: Waiting for the F.C.C.&#8217;s Lawyer to Take Another Stand
1879,2016-02-08T08:36:51Z,1941: House Passes Britain Aid Bill
1880,2016-02-08T08:05:40Z,Structural Humbug Revisited
1881,2016-02-08T07:00:23Z,"What&#8217;s Going On in This Picture? | Feb. 8, 2016"
1882,2016-02-08T07:00:05Z,One Day to Go Until the New Hampshire Primary
1883,2016-02-08T00:00:00Z,New York Today: Snowstorm Kickoff
1884,2016-02-08T06:05:58Z,Morning Agenda: Credit Suisse Chief Asks for a Smaller Bonus
1885,2016-02-08T06:00:47Z,Congress Declines to Hear Obama&#8217;s Budget Proposal in Person
1886,2016-02-08T00:00:00Z,"Your Monday Briefing: Denver Broncos, Marco Rubio, Bernie Sanders"
1887,2016-02-08T05:45:46Z,Simple Remedies for Constipation
1888,2016-02-08T00:00:00Z,Cruise and Air News: A Historic Ocean Liner Will Sail Again
1889,2016-02-08T05:18:42Z,E.L.L. Practice + Prompt | Chinese New Year
1890,2016-02-08T00:00:00Z,Bill Clinton’s 1992 ‘Last Dog Dies’ Speech in New Hampshire
1891,2016-02-08T04:27:39Z,News Q&#8217;s | Broncos Are Victorious in Super Bowl 50
1892,2016-02-08T00:00:00Z,End the Tampon Tax
1893,2016-02-08T00:00:00Z,The Zika Virus and Brazilian Women’s Right to Choose
1894,2016-02-08T00:00:00Z,The F.C.C. Gets Ready to Unlock the Cable Box
1895,2016-02-08T03:21:12Z,What Is the Self? It Depends
1896,2016-02-08T00:00:00Z,Hillary Has ‘Half a Dream’
1897,2016-02-08T00:00:00Z,"Ted Cruz, Hometown Anti-Hero"
1898,2016-02-08T00:00:00Z,The Many Ills of Campaign Money
1899,2016-02-08T00:00:00Z,"In the Skies and Fields, There’s Plenty More to Explore"
1900,2016-02-08T00:00:00Z,"Help for Depressed Mothers, and Their Children"
1901,2016-02-08T00:00:00Z,Gardens and Housing
1902,2016-02-08T00:00:00Z,Getting to the Root Causes of Drug Shortages
1903,2016-02-08T03:20:00Z,Which States Should Vote First in the Primaries?
1904,2016-02-08T00:00:00Z,Step by Step on a Desperate Trek by Migrants Through Mexico
1905,2016-02-08T03:00:13Z,The Last Word on James Dean and Dennis Stock
1906,2016-02-08T00:00:00Z,"It’s Denver, With a ‘D’"
1907,2016-02-08T00:00:00Z,Capitals Edge Flyers
1908,2016-02-08T00:00:00Z,Barcelona Ties Win Record
1909,2016-02-08T00:00:00Z,Fowler Fades in Phoenix
1910,2016-02-08T00:00:00Z,U.S. Advances in Fed Cup
1911,2016-02-08T00:00:00Z,Seahawks&#8217; Marshawn Lynch Points Toward Retirement
1912,2016-02-08T00:00:00Z,Cam Newton’s Season of Superlatives Ends in Disappointment
1913,2016-02-08T00:00:00Z,What to Watch Monday
1914,2016-02-08T00:00:00Z,"Super Bowl M.V.P. Von Miller, No. 2 in 2011 Draft, Comes Out on Top of No. 1"
1915,2016-02-08T00:00:00Z,"Once Again, Fuzzy N.F.L. Catch Rule Impacts Outcome"
1916,2016-02-08T00:00:00Z,"Missing From the Big Picture, a Tighter Focus on Peyton Manning"
1917,2016-02-08T00:04:56+0000,Knoedler Gallery Director Settles Lawsuit Over Fake Rothko
1918,2016-02-08T00:00:00Z,An Illustrated Look at Super Bowl 50
1919,2016-02-08T00:02:40Z,Student Question | Should Students Expect College to Be Like Home?
1920,2016-02-08T00:02:37Z,Word of the Day + Quiz | wanderlust
1921,2016-02-08T00:00:00Z,"Paid Notice: Deaths  RAPPAPORT, DOLLSEY G"
1922,2016-02-08T00:00:00Z,"Paid Notice: Deaths  TABB, STEPHEN (STEVE)"
1923,2016-02-08T00:00:00Z,"Paid Notice: Deaths  MACCRATE, CONSTANCE"
1924,2016-02-08T00:00:00Z,"Paid Notice: Deaths  TISHMAN, JOHN"
1925,2016-02-08T00:00:00Z,"Paid Notice: Deaths  CEDARBAUM, MIRIAM GOLDMAN"
1926,2016-02-08T00:00:00Z,"Paid Notice: Deaths  MITTENTHAL, RICHARD"
1927,2016-02-08T00:00:00Z,"Paid Notice: Deaths  TISHMAN, JOHN"
1928,2016-02-08T00:00:00Z,"Paid Notice: Deaths  CEDARBAUM, MIRIAM GOLDMAN"
1929,2016-02-08T00:00:00Z,"Paid Notice: Deaths  LEMLE, PEGGY"
1930,2016-02-08T00:00:00Z,"Paid Notice: Deaths  SLOAN, HOWARD"
1931,2016-02-08T00:00:00Z,"Paid Notice: Deaths  BRADLEY, DAVID WILLIAM"
1932,2016-02-08T00:00:00Z,"Paid Notice: Deaths  SMITH, PHILIP B"
1933,2016-02-08T00:00:00Z,"Paid Notice: Deaths  TISHMAN, JOHN"
1934,2016-02-08T00:00:00Z,"Paid Notice: Deaths  SMITH, PHILIP BATTERMAN"
1935,2016-02-08T00:00:00Z,"Paid Notice: Deaths  MAIDMAN, GAIL ANN LOWE"
1936,2016-02-08T00:00:00Z,"Paid Notice: Deaths  LERNER, RICHARD"
1937,2016-02-08T00:00:00Z,"Paid Notice: Deaths  KURZWEIL, EDITH D."
1938,2016-02-08T00:00:00Z,"Paid Notice: Deaths  KRUPP, ROSALIND MEHR"
1939,2016-02-08T00:00:00Z,"Paid Notice: Deaths  GERSON, DANIEL R."
1940,2016-02-08T00:00:00Z,"Paid Notice: Deaths  SCHOTTLAND, STANLEY ADRIAN"
1941,2016-02-08T00:00:00Z,"Paid Notice: Deaths  PAYNE, EVELYN"
1942,2016-02-08T00:00:00Z,Federal Specialist to Inspect Elevated Radiation at Indian Point
1943,2016-02-08T00:00:00Z,A Super Bowl Reunion 35 Years After Iran Hostages’ American Homecoming
1944,2016-02-08T00:00:00Z,"Retreat Favored by Republicans Makes Obama Feel at Home, Too"
1945,2016-02-08T00:00:00Z,"Super Bowl Ads Play It Safe, Sticking to the Script"
1946,2016-02-08T00:00:00Z,Broncos Win Super Bowl 50 as Defense Swarms Panthers
1947,2016-02-08T00:00:00Z,More Than a River Separates Bernie Sanders’s State From Primary’s
1948,2016-02-08T00:00:00Z,"Review: It’s Coldplay, Starring Beyoncé, at Super Bowl Halftime Show"
1949,2016-02-08T00:00:00Z,Bill Clinton Unleashes Stinging Attack on Bernie Sanders
1950,2016-02-08T00:00:00Z,Rikers Officer Is Accused of Having Sex With an Inmate
1951,2016-02-08T00:00:00Z,How Sea Walls Around Hoboken Might Have Stopped Hurricane Sandy’s Floods
1952,2016-02-08T00:00:00Z,New Hampshire&#8217;s First 9 Voters See Spotlight Slip Away
1953,2016-02-08T00:00:00Z,Pet Food Pantries Offer Relief to Animal Owners Struggling With Bills
1954,2016-02-08T00:00:00Z,"For Peyton Manning, the Setting Is Perfect for a Curtain Call"
1955,2016-02-08T00:00:00Z,Quotation of the Day
1956,2016-02-08T00:00:00Z,"‘The Good Wife’ Is Ending, CBS Announces in Super Bowl Ad"
1957,2016-02-08T00:00:00Z,"Oilers’ Connor McDavid Scores a Goal, but the Islanders Do Him Seven Better"
1958,2016-02-08T00:00:00Z,"In Flint, Hillary Clinton Prods Congress and Calls Response to Crisis ‘Immoral’"
1959,2016-02-08T00:00:00Z,Lindsey Vonn’s Grip on Overall Lead Loosens a Bit
1960,2016-02-08T00:00:00Z,"No Corrections: February 8, 2016"
1961,2016-02-08T00:00:00Z,Draft Registration for Women Would Stir a Sleepy Government Agency
1962,2016-02-08T00:00:00Z,Sluggish Chris Paul Finishes Hot as Clippers Defeat Heat
1963,2016-02-08T00:00:00Z,"Geneva, a City of Diplomacy, Brims With Totems of Peace and War"
1964,2016-02-08T00:00:00Z,Arizona State Women Top U.S.C. on a 3-Point Play
1965,2016-02-08T00:00:00Z,Bridgewater Executives Deny Report of Rift at the Hedge Fund
1966,2016-02-08T00:00:00Z,Lawyer for Plaintiffs Suing G.M. Steps Up Criticism of Another
1967,2016-02-08T00:00:00Z,New York Parking Alert: Alternate-Side Rules Suspended on Monday
1968,2016-02-08T00:00:00Z,How Julian Assange Is Destroying WikiLeaks
1969,2016-02-08T11:30:00Z,The Saga of Julian Assange
1970,2016-02-08T11:30:00Z,Congress's Visa Law Is Un-American
1971,2016-02-08T00:00:00Z,Connecticut Faces Lawsuit Over Ebola Quarantine Policies
1972,2016-02-08T00:00:00Z,West Bank Settlers’ Listings on Airbnb Draw Palestinian Anger
1973,2016-02-08T00:00:00Z,"Review: In ‘Une Éducation Manquée,’ Opera Lafayette Executes a Simple Plot"
1974,2016-02-08T00:00:00Z,Grammys Tend to Focus on Heroics in Singling Out the Jazz Solo
1975,2016-02-08T00:00:00Z,Review: Gemma Bond Dance Presents ‘Harvest’
1976,2016-02-08T00:00:00Z,Italian Student’s Brutal Killing May Be Issue in Egypt-U.S. Meetings
1977,2016-02-08T00:00:00Z,Review: Benjamin Millepied’s ‘La Nuit S’Achève’ at Paris Opera Ballet
1978,2016-02-08T00:00:00Z,Review: ‘The Grand Parade’ Romps Through the 20th Century
1979,2016-02-08T00:00:00Z,"Review: In ‘Homegrown,’ the Potential Terrorist Isn’t a World Away"
1980,2016-02-08T00:00:00Z,Review: Zurich Ballet’s ‘Swan Lake’ Looks to a Classic Version From Long Ago
1981,2016-02-08T00:00:00Z,Tagore Translation Deemed Racy Is Pulled From Stores in China
1982,2016-02-08T00:00:00Z,"‘Custom Melodies,’ Time Capsules in Song, at Chinatown Soup"
1983,2016-02-08T00:00:00Z,Credit Suisse C.E.O. Asks for a Cut in His Bonus
1984,2016-02-08T00:00:00Z,Review: Jeffrey E. Stern’s ‘The Last Thousand’ Explores the Mission of a Struggling Afghan School
1985,2016-02-08T00:00:00Z,"Review: Janis Ian, Singer of ‘At Seventeen,’ Now at 64 and in Solo Concert"
1986,2016-02-08T00:00:00Z,Performance Monkeys in the Year of the Monkey
1987,2016-02-08T00:00:00Z,Chinese Animal Trainers Looking for Respect in the Year of the Monkey
1988,2016-02-08T00:00:00Z,"The Republicans in New Hampshire, Angry and Afraid"
1989,2016-02-08T00:00:00Z,Net Neutrality Again Puts F.C.C. General Counsel at Center Stage
1990,2016-02-08T00:00:00Z,Treasury Auctions Set for This Week
1991,2016-02-08T00:00:00Z,"Michel Martelly, Haiti’s President, Departs Without a Successor"
1992,2016-02-08T00:00:00Z,"Carmelo Anthony Plays, but It’s Not Clear the Knicks Are Ready To"
1993,2016-02-08T00:00:00Z,"Beyond Volkswagen, Europe’s Diesels Flunked a Pollution Test"
1994,2016-02-08T00:00:00Z,"A Short Shutdown for Chipotle, Viacom’s Earnings and Yellen to Testify"
1995,2016-02-08T00:00:00Z,Official Quits Nobel Panel Over Inquiry Into Surgeon
1996,2016-02-08T00:00:00Z,"Dan Hicks, of the Hot Licks, Dies at 74; Countered the ’60s Sound"
1997,2016-02-08T00:00:00Z,Member of ISIS Group Led by ‘Jihadi John’ Is Reportedly Identified
1998,2016-02-08T00:00:00Z,"Built Up by Oil Boom, North Dakota Now Has an Emptier Feeling"
1999,2016-02-08T00:00:00Z,Marco Rubio Comes Back Swinging After Difficult Debate
2000,2016-02-08T00:00:00Z,Federal Inquiry Widens Over Fiat Chrysler Roll-Away Complaints
2001,2016-02-08T00:00:00Z,"‘Caesar’ Must Bow to ‘Kung Fu Panda 3,’ King of the Box Office"
2002,2016-02-08T00:00:00Z,A Booming Market for Art That Imitates Life After the Financial Crisis
2003,2016-02-08T00:00:00Z,China Struggles for Balance in Response to North Korea’s Boldness
2004,2016-02-08T00:00:00Z,German Regulator Orders Halt to Maple Bank Transactions
2005,2016-02-08T00:00:00Z,"Robin Chandler Duke, Philanthropist Who Championed Women’s Rights, Dies at 92"
2006,2016-02-08T00:00:00Z,Harsh Tone in Campaigns Bodes Ill for Governing
2007,2016-02-08T00:00:00Z,Donald Trump Relishes New Hampshire’s Embrace of His New York Bombast
2008,2016-02-08T00:00:00Z,A Director Pursues Diversity on Television by Telling Stories of Latinos
2009,2016-02-08T00:00:00Z,"After Taiwan Quake, Rescue Efforts Yield Some Signs of Life"
2010,2016-02-08T00:00:00Z,Gloria Steinem and Madeleine Albright Rebuke Young Women Backing Bernie Sanders
2011,2016-02-08T11:30:00Z,A Sly Fox Helps Leicester City’s Odds for a Dream Season
2012,2016-02-08T11:30:00Z,Missed Drop Goals Were Key to Losses in Six Nations
2013,2016-02-08T00:00:00Z,Our Man in New Hampshire: Flying North for a Winner
2014,2016-02-08T00:00:00Z,How to Watch Super Bowl 50
2015,2016-02-08T00:00:00Z,Larry David and Bernie Sanders Stop and Chat on ‘S.N.L.’
2016,2016-02-08T00:00:00Z,"Beyoncé in ‘Formation’: Entertainer, Activist, Both?"
2017,2016-02-08T00:00:00Z,Beyoncé Releases Surprise Single ‘Formation’ Ahead of Super Bowl Performance
2018,2016-02-08T00:00:00Z,"John L. Tishman, Builder Who Shaped American Skylines, Dies at 90"
2019,2016-02-08T00:00:00Z,"Marlow W. Cook, Senator Who Groomed Mitch McConnell, Dies at 89"
2020,2016-02-08T00:00:00Z,"Are You There, Teenagers? A Newsletter Aims for Your Inbox"
2021,2016-02-08T11:30:00Z,Inklings of a Chill in the Art Market
2022,2016-02-08T00:00:00Z,"Alice Denham, Who Kissed and Told About Literary New York, Dies at 89"
2023,2016-02-09T00:00:00Z,The Environmental Legacy of the Steel City
2024,2016-02-09T00:00:00Z,‘The People v. O.J. Simpson’ Episode 2: The Chase
2025,2016-02-09T22:18:42Z,Bernie Sanders on New Hampshire Victory
2026,2016-02-09T22:00:45Z,"Always, Sometimes, Never"
2027,2016-02-09T20:35:28Z,Sanders Supporters React to N.H. Results
2028,2016-02-09T00:00:00Z,New Hampshire Exit Polls
2029,2016-02-09T00:00:00Z,New Hampshire Exit Polls
2030,2016-02-09T18:55:57Z,Sununu &#038; Son: A Play for Primary Day
2031,2016-02-09T00:00:00Z,Your Evening Briefing
2032,2016-02-09T00:00:00Z,"Your Tuesday Evening Briefing: Donald Trump, James Clapper, Hillary Clinton"
