,pub_date,headline
3591,2018-09-17T04:12:13+0000,Typhoon Mangkhut: More Than 40 Bodies Found in Philippines Landslide
3592,2018-09-17T07:49:31+0000,Soon-Yi Previn Defends Woody Allen and Accuses Mia Farrow of Abuse
3593,2018-09-17T09:10:54+0000,"North and South Korea Push to End Korean War, but U.S. Remains Wary"
3594,2018-09-17T00:01:26+0000,"Time Magazine Is Bought by Marc Benioff, Salesforce Billionaire"
3595,2018-09-17T06:00:01+0000,Word + Quiz: apotheosis
3596,2018-09-17T09:00:09+0000,Europe’s Triumphs and Troubles Are Written in Swiss Ice
3597,2018-09-17T09:00:09+0000,The Threat to Roe v. Wade in the Case of the Missing Precedent
3598,2018-09-16T19:25:34+0000,Sweden to End Twitter Experiment Letting Ordinary People Be Nation’s Voice
3599,2018-09-16T19:25:55+0000,"After 25 Years, the Curtain Closes on ‘Theater Talk’"
3600,2018-09-16T20:16:54+0000,"Your Monday News Briefing: Typhoon Mangkhut, #MeToo, South Korea"
3601,2018-09-16T20:36:47+0000,Catholics and the Abuse Scandal
3602,2018-09-16T04:00:01+0000,"Lilian Faulhaber, Kwaku Akowuah"
3603,2018-09-16T04:00:01+0000,"Katlyn Niederee, Jon Rosborough"
3604,2018-09-16T04:05:01+0000,"Jenna Goldring, Nikola Lahcanski"
3605,2018-09-16T04:05:01+0000,"Rafaella Francisco, Christian Iannucci"
3606,2018-09-16T04:10:01+0000,"Ifna Ejebe, Devashish Das"
3607,2018-09-16T04:15:01+0000,"Elena Schneider, Eli Stokols"
3608,2018-09-16T05:00:06+0000,What’s on TV Sunday: ‘Warriors of Liberty City’ and ‘Cesar Chavez’
3609,2018-09-17T09:00:09+0000,The Threat to Roe v. Wade in the Case of the Missing Precedent
3610,2018-09-17T00:01:26+0000,"Time Magazine Is Bought by Marc Benioff, Salesforce Billionaire"
3611,2018-09-17T06:00:01+0000,Word + Quiz: apotheosis
3612,2018-09-17T23:38:01+0000,"Ira Sabin, Founder of JazzTimes Magazine, Is Dead at 90"
3613,2018-09-17T09:30:01+0000,How Much Do You Know About Guyana?
3614,2018-09-17T14:17:05+0000,Trump Is Making America Great Again. Just Not the Way He Thinks.
3615,2018-09-17T19:47:06+0000,Burberry M/W: Spring 2019
3616,2018-09-16T21:30:05+0000,A Trusted Pill Turned Deadly. How Tylenol Made a Comeback.
3617,2018-09-16T21:33:17+0000,New York Philharmonic Dismisses 2 Players for Unspecified Misconduct
3618,2018-09-16T22:43:04+0000,Yankees’ Power Dries Up in Another Dispiriting Loss to the Blue Jays
3619,2018-09-16T22:44:45+0000,Nature Roars. Washington Hears Nothing.
3620,2018-09-16T22:52:09+0000,"As Trump’s Trade War Mounts, China’s Wall Street Allies Lose Clout"
3621,2018-09-17T01:22:12+0000,"North Korea’s Trump-Era Strategy: Keep Making A-Bombs, but Quietly"
3622,2018-09-17T02:17:48+0000,Vontae Davis of Buffalo Bills Retires During an N.F.L. Game
3623,2018-09-17T09:00:02+0000,What Do You Think About Vegetarianism?
3624,2018-09-17T09:00:03+0000,Yet Another Worrisome Subway Statistic: More People Are Going on the Tracks
3625,2018-09-17T09:00:09+0000,"In Esi Edugyan’s Novel ‘Washington Black,’ a Slave Escapes by Hot-Air Balloon"
3626,2018-09-17T07:00:06+0000,Betting Against Tesla: Short-Sellers Make Their Case
3627,2018-09-17T09:02:09+0000,"Can Ethiopia’s New Leader, a Political Insider, Change It From the Inside Out?"
3628,2018-09-16T14:00:04+0000,"Jill Lepore on Writing the Story of America (in 1,000 Pages or Less)"
3629,2018-09-17T12:16:47+0000,Australia Hunts for Saboteur Hiding Needles in Strawberries
3630,2018-09-17T12:31:39+0000,"‘Insecure’ Season 3, Episode 6: The Bad Decision Index"
3631,2018-09-17T01:22:12+0000,"North Korea’s Trump-Era Strategy: Keep Making A-Bombs, but Quietly"
3632,2018-09-17T02:17:48+0000,Vontae Davis of Buffalo Bills Retires During an N.F.L. Game
3633,2018-09-17T09:00:03+0000,Yet Another Worrisome Subway Statistic: More People Are Going on the Tracks
3634,2018-09-17T09:00:09+0000,"In Esi Edugyan’s Novel ‘Washington Black,’ a Slave Escapes by Hot-Air Balloon"
3635,2018-09-17T09:00:02+0000,What Do You Think About Vegetarianism?
3636,2018-09-17T09:02:09+0000,"Can Ethiopia’s New Leader, a Political Insider, Change It From the Inside Out?"
3637,2018-09-15T09:00:07+0000,Fraying Ties With Trump Put Jim Mattis’s Fate in Doubt
3638,2018-09-15T09:45:30+0000,"12 Dead, Power Failures and Catastrophic Flooding in the Carolinas"
3639,2018-09-17T19:22:09+0000,"Alan Abel, Hoaxer Extraordinaire, Is (on Good Authority) Dead at 94"
3640,2018-09-17T12:16:47+0000,Australia Hunts for Saboteur Hiding Needles in Strawberries
3641,2018-09-17T12:31:39+0000,"‘Insecure’ Season 3, Episode 6: The Bad Decision Index"
3642,2018-09-17T12:52:10+0000,China Accuses Taiwan of Using Students for Espionage
3643,2018-09-17T11:45:20+0000,Are Music Festivals to Blame for Overdose Deaths?
3644,2018-09-17T12:10:17+0000,Florence Pushes Away From Carolinas but Rivers Keep Rising
3645,2018-09-17T17:57:13+0000,Brock Long’s Woes Mount as House G.O.P. Launches Travel Inquiry
3646,2018-09-17T17:06:55+0000,Hillary Clinton Condemns Trump in New Essay: ‘Our Democracy Is in Crisis’
3647,2018-09-15T09:00:07+0000,Fraying Ties With Trump Put Jim Mattis’s Fate in Doubt
3648,2018-09-15T14:00:03+0000,Can a Felon Be the President of My Condo Board?
3649,2018-09-17T02:17:48+0000,Vontae Davis of Buffalo Bills Retires During an N.F.L. Game
3650,2018-09-17T09:00:02+0000,What Do You Think About Vegetarianism?
3651,2018-09-17T09:00:03+0000,Yet Another Worrisome Subway Statistic: More People Are Going on the Tracks
3652,2018-09-17T09:00:09+0000,"In Esi Edugyan’s Novel ‘Washington Black,’ a Slave Escapes by Hot-Air Balloon"
3653,2018-09-17T07:00:06+0000,Betting Against Tesla: Short-Sellers Make Their Case
3654,2018-09-17T12:31:39+0000,"‘Insecure’ Season 3, Episode 6: The Bad Decision Index"
3655,2018-09-17T12:52:10+0000,China Accuses Taiwan of Using Students for Espionage
3656,2018-09-17T09:02:09+0000,"Can Ethiopia’s New Leader, a Political Insider, Change It From the Inside Out?"
3657,2018-09-15T12:05:51+0000,Alexachung: Spring 2019
3658,2018-09-17T16:34:39+0000,Emilia Wickstead: Spring 2019
3659,2018-09-17T16:34:39+0000,Emilia Wickstead: Spring 2019
3660,2018-09-15T00:01:52+0000,Companies Are Pushing for Less Disclosure. Is That Good for Investors?
3661,2018-09-15T10:00:01+0000,Wednesday Martin Dares to Call Her New Book ‘Untrue’
3662,2018-09-15T14:02:01+0000,California Had Its Own Climate Summit. Now What?
3663,2018-09-15T19:00:04+0000,Netflix Morning Meeting
3664,2018-09-15T22:09:41+0000,Quotation of the Day: China in Path of Strong Typhoon That Killed at Least 25 in the Philippines
3665,2018-09-15T13:29:30+0000,How to Help Those Affected by Florence
3666,2018-09-16T00:34:18+0000,College Football Scores: Brigham Young Upsets No. 6 Wisconsin
3667,2018-09-16T04:00:01+0000,"Elizabeth Bernal, Tyler Hall"
3668,2018-09-16T04:05:01+0000,"Margaret Williams, Frank Driscoll"
3669,2018-09-17T12:47:40+0000,Apple Shares in a Time of Trade War: DealBook’s One Thing to Watch Today
3670,2018-09-16T19:18:43+0000,"Before You Buy That Couch, an App Will Put It in Your Living Room"
3671,2018-09-17T03:56:49+0000,"Your Monday News Briefing: Typhoon, Kavanaugh, Brexit"
3672,2018-09-16T18:00:01+0000,Where ‘Rabbi Voice’ Came From (if It Exists) 
3673,2018-09-17T05:00:04+0000,"The Suburbs, Where Madness Meets Cat Murder"
3674,2018-09-16T19:58:40+0000,"5 Years Ago, Their 5Pointz Art Was Erased. Now There’s a Museum for It."
3675,2018-09-17T21:19:10+0000,"Alexandria Ocasio-Cortez and the Politics of a $3,000 Suit"
3676,2018-09-17T21:27:15+0000,Elon Musk Sued by Cave Rescuer He Accused of Being a Pedophile
3677,2018-09-17T21:28:02+0000,Mueller and Defense Lawyers Ask for Flynn Sentencing to Be Scheduled
3678,2018-09-17T22:56:11+0000,A San Francisco Tech Mogul Buys a Fabled Slice of New York Media
3679,2018-09-17T10:05:34+0000,DealBook Briefing: Business Titans Turn Their Backs on the G.O.P.
3680,2018-09-17T21:03:44+0000,"Before Heading Back to Football, Urban Meyer Has His Say"
3681,2018-09-17T21:19:10+0000,"Alexandria Ocasio-Cortez and the Politics of a $3,000 Suit"
3682,2018-09-17T21:27:15+0000,Elon Musk Sued by Cave Rescuer He Accused of Being a Pedophile
3683,2018-09-17T21:28:02+0000,Mueller and Defense Lawyers Ask for Flynn Sentencing to Be Scheduled
3684,2018-09-17T22:56:11+0000,A San Francisco Tech Mogul Buys a Fabled Slice of New York Media
3685,2018-09-17T23:01:11+0000,"For Sheldon Silver, a Last Stay-Out-of-Prison Gambit Fails"
3686,2018-09-17T17:33:44+0000,"Big Jay McNeely, 91, Dies; R&B’s ‘King of the Honkers’"
3687,2018-09-16T00:34:18+0000,College Football Scores: Brigham Young Upsets No. 6 Wisconsin
3688,2018-09-15T19:00:04+0000,Netflix Morning Meeting
3689,2018-09-15T22:09:41+0000,Quotation of the Day: China in Path of Strong Typhoon That Killed at Least 25 in the Philippines
3690,2018-09-16T04:05:01+0000,"Esther Lim, Robert Staley"
3691,2018-09-16T04:10:01+0000,"Kruti Parikh, Milan Thakkar"
3692,2018-09-15T10:00:01+0000,Wednesday Martin Dares to Call Her New Book ‘Untrue’
3693,2018-09-16T04:00:01+0000,"Elizabeth Bernal, Tyler Hall"
3694,2018-09-16T04:05:01+0000,"Margaret Williams, Frank Driscoll"
3695,2018-09-16T09:47:04+0000,Why the I.C.C. Should Rejoice When America Attacks It
3696,2018-09-16T10:02:22+0000,"Florence, Primaries, Paul Manafort: Your Weekend Briefing"
3697,2018-09-15T13:29:30+0000,How to Help Those Affected by Florence
3698,2018-09-15T14:02:01+0000,California Had Its Own Climate Summit. Now What?
3699,2018-09-15T18:10:18+0000,2-Year-Old Boy With Deadly Cancer Gets an Early Christmas From His Neighbors
3700,2018-09-16T18:14:06+0000,North Carolina Governor Warns ‘Risk to Life Is Rising’ as Florence Rages
3701,2018-09-17T15:05:27+0000,"Midterm Election Poll: California’s 25th District, Knight vs. Hill"
3702,2018-09-17T21:54:16+0000,Before and After Florence: See the Impact of the Storm
3703,2018-09-16T03:18:48+0000,See Inside Typhoon Mangkhut in 3-D
3704,2018-09-15T15:00:47+0000,Molly Goddard: Spring 2019
3705,2018-09-17T08:00:01+0000,"Article of the Day: ‘Rethinking What Gifted Education Means, and Whom It Should Serve’"
3706,2018-09-17T09:00:11+0000,A Journey to Kashmir’s Gurez Valley 
3707,2018-09-17T07:50:59+0000,"‘The Eggs Were Rolling Around Every Which Way, Up and Down the Aisle’"
3708,2018-09-17T10:00:05+0000,Lehman Failed for Good Reasons
3709,2018-09-17T09:00:10+0000,A Nobel Laureate Asks What Makes a ‘Disordered Mind’
3710,2018-09-17T09:00:08+0000,New Approach to Breast Reconstruction May Reduce Pain and Weakness for Some
3711,2018-09-17T00:54:11+0000,"No Corrections: September 17, 2018"
3712,2018-09-15T18:30:04+0000,Money Talks. Will the G.O.P. Listen?
3713,2018-09-15T22:03:43+0000,"‘Uh, What?’"
3714,2018-09-15T09:00:06+0000,#MeToo in the Monastery: A Chinese Abbot’s Fall Stirs Questions on Buddhism’s Path
3715,2018-09-15T09:00:08+0000,A Classic Dallas Hotel Gets Cool and Contemporary
3716,2018-09-15T16:00:03+0000,Edwin Moses: WADA’s Credibility Rides on Its Russia Decision
3717,2018-09-15T13:00:05+0000,Park Avenue Church Site Turned Condo
3718,2018-09-15T13:39:20+0000,"Boris Johnson, Eyes on Downing Street, Sets Political Fires"
3719,2018-09-15T18:30:04+0000,Money Talks. Will the G.O.P. Listen?
3720,2018-09-16T15:58:41+0000,"In the Balkans, Russia and the West Fight a Disinformation-Age Battle"
3721,2018-09-15T22:03:43+0000,"‘Uh, What?’"
3722,2018-09-16T04:10:01+0000,"Samantha Shipp, Demetrius Warrick"
3723,2018-09-17T18:55:27+0000,"Review: Cults, Demons and Nicolas Cage in ‘Mandy’"
3724,2018-09-17T19:00:03+0000,The Quest to Create and Perfect an Artificial Heart
3725,2018-09-17T19:26:00+0000,Ted Cruz’s Campaign Marked a Fund-Raising Letter an Official ‘Summons.’ It Wasn’t Against the Rules.
3726,2018-09-17T17:18:27+0000,Saltmarsh Sparrows Fight to Keep Their Heads Above Water
3727,2018-09-17T15:44:22+0000,An Avalanche of Japanese Shave Ice
3728,2018-09-17T16:10:55+0000,"Coffee, Their Way"
3729,2018-09-17T20:35:40+0000,When Being Separated From Your Luggage Is a Good Thing
3730,2018-09-17T21:30:03+0000,Toronto Symphony Taps Gustavo Gimeno as Its Music Director
3731,2018-09-17T21:34:57+0000,Burberry’s 50 Shades of the British Bourgeoisie
3732,2018-09-15T00:01:53+0000,"Taking Page From 2016, Trump Claims Democrats Will Destroy Safety Net"
3733,2018-09-16T04:10:01+0000,"Samantha Shipp, Demetrius Warrick"
3734,2018-09-16T15:58:41+0000,"In the Balkans, Russia and the West Fight a Disinformation-Age Battle"
3735,2018-09-16T07:07:59+0000,A Boy Named Chance in a Land Without Heart Surgeons
3736,2018-09-16T10:09:45+0000,Typhoon Mangkhut Slams Hong Kong and Southern China
3737,2018-09-16T14:00:05+0000,Low-Dose Aspirin Late in Life? Healthy People May Not Need It
3738,2018-09-16T14:01:12+0000,Berlin Marathon Results: Eliud Kipchoge Breaks World Record
3739,2018-09-16T03:04:13+0000,Yankees’ Old Reliables Prove to Be Anything But
3740,2018-09-16T04:00:01+0000,"Elettra Pauletto, Kenneth Rosen"
3741,2018-09-16T04:00:01+0000,"Marissa Padilla, Michael Collins"
3742,2018-09-16T04:00:01+0000,"Amira Saad, Bonnie Smith"
3743,2018-09-16T04:00:01+0000,"Mark Sexton, William Wallace"
3744,2018-09-16T22:30:03+0000,Review: ‘The Arts’ Makes a Wonky Case for the N.E.A.
3745,2018-09-19T20:41:33+0000,"Flooding in North Carolina, as Seen From a Drone"
3746,2018-09-19T21:13:38+0000,Listen: Giancarlo Espocito Reads ‘Making a Judgment on Love’
3747,2018-09-18T12:21:17+0000,Thoughts on the Athens Democracy Forum
3748,2018-09-18T14:45:57+0000,"Midterm Election Poll: Iowa’s 1st District, Blum vs. Finkenauer"
3749,2018-09-18T15:02:20+0000,Richard Quinn: Spring 2019
3750,2018-09-18T18:07:12+0000,How to Get Strong
3751,2018-09-19T14:25:21+0000,Luca Guadagnino’s Décor Debut
3752,2018-09-19T18:05:45+0000,Alberta Ferretti: Spring 2019
3753,2018-09-19T22:11:28+0000,‘Still Like Beer’: Examining Kavanaugh’s Comments on Drinking
3754,2018-09-17T09:00:42+0000,Inside a Reimagined Shoreditch Loft
3755,2018-09-18T14:45:57+0000,"Midterm Election Poll: Iowa’s 1st District, Blum vs. Finkenauer"
3756,2018-09-18T18:07:12+0000,How to Get Strong
3757,2018-09-19T20:41:33+0000,"Flooding in North Carolina, as Seen From a Drone"
3758,2018-09-17T00:29:48+0000,"Quotation of the Day: A Dry Refuge, for the Body and the Soul"
3759,2018-09-17T10:00:00+0000,Who Made My Puzzle?
3760,2018-09-17T10:00:04+0000,"Before I Say ‘I Do,’ a Word to the Exes"
3761,2018-09-17T09:00:02+0000,"For Kids With Concussions, Less Time Alone in a Dark Room "
3762,2018-09-17T09:00:06+0000,No. 1 Aim of Democratic Campaign Ads: Protect Pre-existing Conditions
3763,2018-09-17T13:02:07+0000,California Today: No Debates for Top California Offices? That Could Happen
3764,2018-09-17T16:19:00+0000,Lapses in Turning the Lights On
3765,2018-09-17T16:19:05+0000,Review: Tom Arnold’s ‘Trump Tapes’ Blows Smoke With No Smoking Gun
3766,2018-09-17T15:00:03+0000,Trump Is Making America Great Again
3767,2018-09-17T19:23:48+0000,"If You See Disinformation Ahead of the Midterms, We Want to Hear From You"
3768,2018-09-17T19:46:37+0000,Jules Feiffer Completes His Trilogy: A Song of American Deceptions
3769,2018-09-18T03:52:32+0000,Rockies Lose Trevor Story to Injury and N.L. West Lead to Dodgers
3770,2018-09-18T03:52:43+0000,"Your Tuesday News Briefing: Tariffs, SpaceX, Syria"
3771,2018-09-18T00:56:17+0000,Emmys Monologue: ‘Ronan Farrow Is on Line One’
3772,2018-09-18T01:43:44+0000,Henry Winkler Wins His First Emmy. Ayyy!
3773,2018-09-17T20:00:04+0000,Emmys 2018: ‘Game of Thrones’ and ‘Marvelous Mrs. Maisel’ Win Big Awards
3774,2018-09-17T21:51:37+0000,Trump Says Tariffs Will Save American Factories. History Shows Otherwise.
3775,2018-09-19T09:00:11+0000,"Lagoons of Pig Waste Are Overflowing After Florence. Yes, That’s as Nasty as It Sounds."
3776,2018-09-19T09:00:11+0000,"Trump Hit Iran With Oil Sanctions. So Far, They’re Working."
3777,2018-09-19T12:25:01+0000,White Nationalism + Lies
3778,2018-09-19T10:00:04+0000,A Nuclear Bomb Inside the Vatican
3779,2018-09-18T03:52:32+0000,Rockies Lose Trevor Story to Injury and N.L. West Lead to Dodgers
3780,2018-09-18T03:52:43+0000,"Your Tuesday News Briefing: Tariffs, SpaceX, Syria"
3781,2018-09-17T19:46:37+0000,Jules Feiffer Completes His Trilogy: A Song of American Deceptions
3782,2018-09-17T20:00:04+0000,Emmys 2018: ‘Game of Thrones’ and ‘Marvelous Mrs. Maisel’ Win Big Awards
3783,2018-09-17T23:53:02+0000,Surveillance Videos Offered Key Clues in Shooting Death of Rikers Island Officer
3784,2018-09-18T00:56:17+0000,Emmys Monologue: ‘Ronan Farrow Is on Line One’
3785,2018-09-19T09:00:11+0000,"Lagoons of Pig Waste Are Overflowing After Florence. Yes, That’s as Nasty as It Sounds."
3786,2018-09-19T09:00:11+0000,"Trump Hit Iran With Oil Sanctions. So Far, They’re Working."
3787,2018-09-19T10:00:04+0000,A Nuclear Bomb Inside the Vatican
3788,2018-09-18T23:51:42+0000,The Local Precinct Knew Her Troubles. The Officers Who Shot Her Came From Another.
3789,2018-09-19T21:33:01+0000,Arthur Mitchell: What to Watch and Read
3790,2018-09-19T21:52:26+0000,"A Year After Mexico Earthquake, Parents Demand Justice"
3791,2018-09-19T18:27:55+0000,"Review: City Ballet, in Turmoil, Shows the Value of What’s at Stake"
3792,2018-09-19T19:00:03+0000,"Why ‘Little Women’ Still Matters, 150 Years On"
3793,2018-09-19T19:00:01+0000,Notes From the Book Review Archives
3794,2018-09-19T13:00:04+0000,Life Insurance Offering More Incentive to Live Longer
3795,2018-09-19T13:33:04+0000,McDonald’s Stock Shrugs Off #MeToo With Good News From Europe: DealBook’s One Thing to Watch Today
3796,2018-09-19T22:17:33+0000,"Anti-Semitic Mailer Dogs Cuomo, Even After Big Victory"
3797,2018-09-19T22:57:15+0000,Tilray’s Wild Day: DealBook’s Closing Bell
3798,2018-09-19T23:03:12+0000,Where and Why Do People Come Together in Your Community?
3799,2018-09-19T17:35:57+0000,North and South Korea Plan to Jointly Bid on 2032 Summer Olympics
3800,2018-09-19T14:57:53+0000,Are Airlines Sure We Can Flee Planes Fast? No Way
3801,2018-09-19T19:30:20+0000,"Fewer Attacks, but a More Complex Terrorist Threat in 2017, U.S. Says"
3802,2018-09-19T23:18:53+0000,Everyone Deserves Better Than This Senate Spectacle
3803,2018-09-19T12:25:01+0000,White Nationalism + Lies
3804,2018-09-18T14:23:20+0000,In Fashion: Panda-Dial Watches
3805,2018-09-17T00:29:48+0000,"Quotation of the Day: A Dry Refuge, for the Body and the Soul"
3806,2018-09-18T07:19:10+0000,Putin Calls Downing of Russian Plane in Syria ‘Tragic’ and Absolves Israel
3807,2018-09-18T03:52:32+0000,Rockies Lose Trevor Story to Injury and N.L. West Lead to Dodgers
3808,2018-09-18T03:52:43+0000,"Your Tuesday News Briefing: Tariffs, SpaceX, Syria"
3809,2018-09-18T05:02:01+0000,The Night Sky
3810,2018-09-18T01:43:44+0000,Henry Winkler Wins His First Emmy. Ayyy!
3811,2018-09-18T09:00:12+0000,"Colombia Struck a Peace Deal With Guerrillas, but Many Return to Arms"
3812,2018-09-19T14:19:26+0000,T’s Design & Luxury Issue: No Room for Compromise
3813,2018-09-18T12:18:58+0000,“Leadership is Becoming Impossible”
3814,2018-09-18T16:12:56+0000,Kyoto Meets Tokyo in TriBeCa
3815,2018-09-18T19:57:07+0000,"‘I Don’t Have a Home’: Life After Florence in Wilmington, N.C."
3816,2018-09-17T12:42:06+0000,Erdem: Spring 2019
3817,2018-09-17T14:41:53+0000,“Strict Liability” for Facebook Content?
3818,2018-09-18T19:48:08+0000,See Flood Waters Rise Across the Carolinas After Hurricane Florence
3819,2018-09-17T13:04:04+0000,Corporate “Survival” Responsibility
3820,2018-09-19T13:30:39+0000,A Converted Farm in the English Countryside
3821,2018-09-19T15:11:24+0000,Jil Sander M/W: Spring 2019
3822,2018-09-19T19:57:10+0000,"As the Far Right Gains in Germany, Merkel Weakens"
3823,2018-09-19T20:34:31+0000,"Your Thursday News Briefing: North Korea, Pakistan, Taiwan"
3824,2018-09-19T12:00:04+0000,The Army Stopped Expelling Immigrant Recruits. But an Email Suggests It’s Still Trying.
3825,2018-09-19T12:06:19+0000,"R.I.P., the Celebrity Profile"
3826,2018-09-19T11:13:24+0000,"Najib Razak, Former Malaysian Prime Minister, to Face More Charges"
3827,2018-09-19T15:53:38+0000,"Review: It’s Called ‘Life Itself,’ and Yet Everyone’s Dead"
3828,2018-09-19T16:30:36+0000,How to Tell Us a Secret 
3829,2018-09-19T16:44:13+0000,Disney’s and Comcast’s Fight for Sky May End in Awkward Impasse
3830,2018-09-19T14:43:42+0000,Can the People Who Almost Brought Down the News Business Save It?
3831,2018-09-19T14:45:49+0000,Paul Scheer: The First Time I Got In a Bar Fight
3832,2018-09-19T19:02:01+0000,You May Be Surprised to Hear That Restoration Hardware Is Doing Great
3833,2018-09-19T17:00:04+0000,A Better Way to Get New York’s Traffic Moving
3834,2018-09-19T17:43:36+0000,"In Brexit Talks, Some See Hope in a Minimal ‘Blind’ Deal"
3835,2018-09-17T23:28:47+0000,A Dress Rehearsal for Our Deaths
3836,2018-09-17T18:26:31+0000,Is the Shofar … an Instrument of Technological Disruption?
3837,2018-09-18T16:51:36+0000,"Ehsan Yarshater, Iran Scholar With a Monumental Vision, Dies at 98"
3838,2018-09-18T17:26:32+0000,Why Women Can Take Years to Come Forward With Sexual Assault Allegations
3839,2018-09-18T17:43:29+0000,"Among the Mangroves, a Girl Learns to Swim"
3840,2018-09-18T19:30:05+0000,N.F.L. Hall of Famers Demand Health Insurance and Share of Revenue
3841,2018-09-18T19:32:44+0000,A Witty and Original Writer Shares His Love for the Essay
3842,2018-09-18T20:03:54+0000,The Beloved New York Drugstore Where Local Artists Get a Discount
3843,2018-09-18T18:26:53+0000,"For Capitalism, Every Social Leap Forward Is a Marketing Opportunity"
3844,2018-09-18T21:29:34+0000,"Cuomo and de Blasio: Making Nice, for Now"
3845,2018-09-18T19:32:44+0000,A Witty and Original Writer Shares His Love for the Essay
3846,2018-09-18T16:51:36+0000,"Ehsan Yarshater, Iran Scholar With a Monumental Vision, Dies at 98"
3847,2018-09-18T17:26:32+0000,Why Women Can Take Years to Come Forward With Sexual Assault Allegations
3848,2018-09-18T21:29:34+0000,"Cuomo and de Blasio: Making Nice, for Now"
3849,2018-09-18T23:54:07+0000,Will Donald Trump Stand Up to China? 
3850,2018-09-18T23:54:37+0000,Julie Chen Exits ‘The Talk’ as Les Moonves Faces Sexual Misconduct Allegations
3851,2018-09-18T15:22:04+0000,"Blackmail, Murder and Other Bad Behavior Abounds in Robert Galbraith’s ‘Lethal White’"
3852,2018-09-18T17:43:29+0000,"Among the Mangroves, a Girl Learns to Swim"
3853,2018-09-18T20:03:54+0000,The Beloved New York Drugstore Where Local Artists Get a Discount
3854,2018-09-18T14:37:07+0000,Patriots Take a Gamble on Josh Gordon. They’ve Been Down This Road Before.
3855,2018-09-17T21:29:05+0000,Bill Cosby’s Wife Asks Panel to Investigate Trial Judge
3856,2018-09-17T19:49:31+0000,"What 13,000 Patents Involving the DNA of Sea Life Tell Us About the Future"
3857,2018-09-17T19:51:26+0000,First Fatal Citi Bike Crash: Was the Bus Driver to Blame?
3858,2018-09-17T18:26:31+0000,Is the Shofar … an Instrument of Technological Disruption?
3859,2018-09-18T19:30:05+0000,N.F.L. Hall of Famers Demand Health Insurance and Share of Revenue
3860,2018-09-18T19:32:44+0000,A Witty and Original Writer Shares His Love for the Essay
3861,2018-09-18T18:26:53+0000,"For Capitalism, Every Social Leap Forward Is a Marketing Opportunity"
3862,2018-09-18T17:26:32+0000,Why Women Can Take Years to Come Forward With Sexual Assault Allegations
3863,2018-09-18T17:43:29+0000,"Among the Mangroves, a Girl Learns to Swim"
3864,2018-09-18T15:22:04+0000,"Blackmail, Murder and Other Bad Behavior Abounds in Robert Galbraith’s ‘Lethal White’"
3865,2018-09-18T10:27:57+0000,"With a Submarine, Japan Sends a Message in the South China Sea"
3866,2018-09-18T10:57:58+0000,"Pussy Riot Activist May Have Been Poisoned, German Doctors Say"
3867,2018-09-18T06:00:01+0000,Word + Quiz: debonair
3868,2018-09-19T07:33:01+0000,Learning With: ‘Christine Blasey Ford Wants F.B.I. to Investigate Kavanaugh Before She Testifies’
3869,2018-09-19T08:00:05+0000,Will Bill Cosby’s Trip From America’s Dad to Sex Offender End in Prison?
3870,2018-09-19T09:00:25+0000,"Bridgewater, Conn.: No Supermarkets, but Natural Beauty to Spare"
3871,2018-09-19T11:13:24+0000,"Najib Razak, Former Malaysian Prime Minister, to Face More Charges"
3872,2018-09-18T23:54:07+0000,Will Donald Trump Stand Up to China? 
3873,2018-09-18T23:54:37+0000,Julie Chen Exits ‘The Talk’ as Les Moonves Faces Sexual Misconduct Allegations
3874,2018-09-19T01:12:32+0000,"Corrections: Wednesday, September 19, 2018"
3875,2018-09-18T00:26:03+0000,The Decline and Fall of New York City Ballet
3876,2018-09-19T09:00:25+0000,"Bridgewater, Conn.: No Supermarkets, but Natural Beauty to Spare"
3877,2018-09-19T01:12:32+0000,"Corrections: Wednesday, September 19, 2018"
3878,2018-09-19T02:00:01+0000,Choked Up With Emotion
3879,2018-09-19T04:44:40+0000,On Politics: Kavanaugh’s Accuser Wants an Investigation
3880,2018-09-19T07:33:01+0000,Learning With: ‘Christine Blasey Ford Wants F.B.I. to Investigate Kavanaugh Before She Testifies’
3881,2018-09-19T08:00:05+0000,Will Bill Cosby’s Trip From America’s Dad to Sex Offender End in Prison?
3882,2018-09-17T00:35:03+0000,3 Tips to Have Better Conversations
3883,2018-09-17T02:36:58+0000,"Delay the Vote — for Kavanaugh, for His Accuser and for the Court"
3884,2018-09-17T21:29:05+0000,Bill Cosby’s Wife Asks Panel to Investigate Trial Judge
3885,2018-09-17T14:34:59+0000,"Floods in Nigeria Kill More Than 100, Wiping Out Homes and Farms"
3886,2018-09-17T13:56:03+0000,What the Heck Is That?
3887,2018-09-17T19:49:31+0000,"What 13,000 Patents Involving the DNA of Sea Life Tell Us About the Future"
3888,2018-09-17T09:00:10+0000,Reading the New South 
3889,2018-09-17T18:26:31+0000,Is the Shofar … an Instrument of Technological Disruption?
3890,2018-09-19T09:55:42+0000,Listen to ‘The Daily’: Will Dr. Blasey Testify?
3891,2018-09-19T14:50:22+0000,Arthur Arbesser: Spring 2019
