,pub_date,headline
1785,2018-09-10T23:00:03+0000,Don’t Force Google to Export Other Countries’ Laws
1786,2018-09-11T02:56:46+0000,"Ahead of the Primary, Cuomo Administration Offered Sweeteners to Get New Bridge Open"
1787,2018-09-11T09:00:07+0000,Primary Season Was Full of Surprises. Here’s Why the Polls Missed Some of Them.
1788,2018-09-11T22:30:30+0000,"Writing About Fried Fish, With a Side of History"
1789,2018-09-11T23:00:03+0000,Seeking Human Generosity’s Origins in an Ape’s Gift to Another Ape
1790,2018-09-09T20:34:38+0000,"Your Monday News Briefing: China, North Korea, Naomi Osaka"
1791,2018-09-09T23:30:57+0000,"For Giants, New Leaders but Old Mistakes in Loss to Jaguars"
1792,2018-09-10T00:41:21+0000,"How Much to Unload a Painting Off a Plane? Brazil Museum Got $320,000 Bill"
1793,2018-09-09T18:28:35+0000,An ‘Inappropriate’ Mailer and a Delayed Bridge Opening Put Cuomo on the Defensive
1794,2018-09-10T05:00:04+0000,What’s on TV Monday: ‘Jack Irish’ and ‘Swiped’
1795,2018-09-09T04:10:01+0000,"Huma Shah, Ardevan Yaghoubi"
1796,2018-09-11T13:00:04+0000,Recent Commercial Real Estate Transactions
1797,2018-09-11T14:38:54+0000,Jon Gruden Fails to Show Why He’s the Raiders’ $100 Million Man
1798,2018-09-11T14:59:45+0000,"At 9/11 Memorial, Remembering Those Lost"
1799,2018-09-11T15:11:14+0000,Review: Jean-Pierre Melville’s ‘When You Read This Letter’ Is a Vexing Noir
1800,2018-09-11T15:14:28+0000,Bombing in Afghanistan Kills at Least 68 at Peaceful Protest
1801,2018-09-11T14:00:06+0000,The Education of Amandla Stenberg
1802,2018-09-11T14:02:01+0000,"Plunder My Songbook, Bob Dylan Said. So He Did."
1803,2018-09-11T09:00:07+0000,Primary Season Was Full of Surprises. Here’s Why the Polls Missed Some of Them.
1804,2018-09-11T12:12:54+0000,"First, a Financial Crisis. Then a Geopolitical Crisis."
1805,2018-09-11T13:00:04+0000,Recent Commercial Real Estate Transactions
1806,2018-09-11T16:36:39+0000,‘It Was a Symbol of Lost New York’: Readers Remember Their Favorite New York City Spots
1807,2018-09-11T16:58:02+0000,Thoughts on Sept. 11
1808,2018-09-11T16:20:20+0000,"Celebrating the Fish Fry, a Late-Summer Black Tradition"
1809,2018-09-11T18:57:27+0000,"Review: In ‘Lizzie,’ an Oppressed Daughter Driven to Murder"
1810,2018-09-11T19:02:28+0000,A Hotel Where Every Room Is a Work of Art
1811,2018-09-11T19:10:11+0000,"The Best Photos From New York Fashion Week, Day 5"
1812,2018-09-11T17:24:54+0000,"Don’t Blame Google, Mr. Trump"
1813,2018-09-11T23:00:03+0000,Seeking Human Generosity’s Origins in an Ape’s Gift to Another Ape
1814,2018-09-11T22:30:30+0000,"Writing About Fried Fish, With a Side of History"
1815,2018-09-11T16:52:05+0000,Jed Distler
1816,2018-09-10T17:27:30+0000,"ESPN’s New Boss Changes Course, in Step With the N.F.L."
1817,2018-09-10T17:48:36+0000,"The Best Photos From New York Fashion Week, Day 4"
1818,2018-09-10T17:59:40+0000,Behind Hollywood’s Diversity Problem
1819,2018-09-10T10:00:04+0000,The Kavanaugh Hearings Are Over. Now What?
1820,2018-09-10T10:00:03+0000,Does Originalism Matter Anymore?
1821,2018-09-10T15:00:08+0000,Linzers Like You’ve Never Tasted
1822,2018-09-10T15:46:57+0000,Volvo’s I.P.O. Problems Go Beyond a Brewing Trade War
1823,2018-09-10T14:08:06+0000,"In ‘The First,’ on Hulu, the Future Is Not That Dark"
1824,2018-09-10T16:14:16+0000,Design Report: The Softer Side of Contemporary Furniture
1825,2018-09-10T17:00:04+0000,Berkeley Rep Chooses New York Stage and Film Leader as Artistic Director
1826,2018-09-10T09:45:25+0000,New Taliban Attacks Kill Dozens of Afghan Soldiers and Police Officers
1827,2018-09-11T17:31:08+0000,Worker at Arizona Center for Migrant Children Is Convicted of Sexual Abuse
1828,2018-09-11T18:00:01+0000,"What’s Going On in This Graph? | Sept. 12, 2018"
1829,2018-09-11T18:00:15+0000,"Tax Breaks for Luxury Towers Spur Redevelopment, and Backlash"
1830,2018-09-11T18:01:03+0000,Prosecutors Are Said to Issue Subpoenas Over Pelvic-Mesh Surgery Financing
1831,2018-09-11T16:32:47+0000,A Toast to the Bride and Groom (With Their Signature Cocktails)
1832,2018-09-11T16:59:02+0000,The Dress in His Painting? She Designed It
1833,2018-09-11T17:09:44+0000,"To Fix the Subway, Vote in State Elections"
1834,2018-09-11T21:04:53+0000,"Kulsoom Nawaz, Wife of Jailed Former Pakistan Leader, Is Dead"
1835,2018-09-11T15:02:08+0000,New iPhones Are Coming. Here’s How to Save on an Upgrade.
1836,2018-09-11T22:04:07+0000,How 3 Little Letters (I.D.C.) Are Riling Up New York Progressives
1837,2018-09-11T11:54:17+0000,Tu resumen de noticias de hoy
1838,2018-09-11T12:33:10+0000,California Today: Who Owns the Risk for Earthquakes?
1839,2018-09-11T10:11:39+0000,South Korean Leader Urges ‘Bold Decisions’ on North’s Denuclearization
1840,2018-09-11T16:32:47+0000,A Toast to the Bride and Groom (With Their Signature Cocktails)
1841,2018-09-11T09:00:02+0000,"A Trail of ‘Bread Crumbs,’ Leading Conspiracy Theorists Into the Wilderness"
1842,2018-09-11T09:00:03+0000,Americans Want to Believe Jobs Are the Solution to Poverty. They’re Not.
1843,2018-09-11T09:00:05+0000,Here’s What to Watch in New Hampshire’s Primary Election
1844,2018-09-11T01:10:46+0000,The Handmaid’s Court
1845,2018-09-11T04:59:35+0000,"Serena Williams Cartoon ‘Not About Race,’ Artist Says. Experts Strongly Disagree."
1846,2018-09-11T05:00:05+0000,What’s on TV Tuesday: ‘The Purge’ and ‘Call the Midwife’
1847,2018-09-10T23:35:35+0000,Senate Poised to Pass Bill to Stop Flow of Opioids Through the Mail
1848,2018-09-11T09:00:01+0000,New Sentences: From Chelsea Hodson’s ‘Tonight I’m Someone Else’
1849,2018-09-09T15:47:06+0000,What We Learned in N.F.L. Week 1
1850,2018-09-09T15:54:38+0000,Players and Fans See Sexism in Serena Williams’s Treatment at U.S. Open
1851,2018-09-09T09:00:09+0000,"Homes That Sold for Around $450,000"
1852,2018-09-09T10:02:46+0000,"N.F.L., Serena Williams, Midterm Elections: Your Weekend Briefing"
1853,2018-09-09T04:05:01+0000,"Tiffany Chang, Kyle Bibby"
1854,2018-09-09T04:10:01+0000,"Melissa Loder, Bethany Gostanian"
1855,2018-09-10T17:27:30+0000,"ESPN’s New Boss Changes Course, in Step With the N.F.L."
1856,2018-09-10T17:48:36+0000,"The Best Photos From New York Fashion Week, Day 4"
1857,2018-09-09T15:47:06+0000,What We Learned in N.F.L. Week 1
1858,2018-09-09T18:19:25+0000,"Carlos Ramos, Umpire Known for Rigidity, Lands in U.S. Open Firestorm"
1859,2018-09-09T19:00:01+0000,When College Students Feel Suicidal
1860,2018-09-09T20:30:09+0000,Andrew Cuomo Owes Cynthia Nixon an Apology
1861,2018-09-09T20:34:09+0000,Lil Rel Howery and Jerrod Carmichael Think You’re Wrong About Multicamera Sitcoms
1862,2018-09-09T21:04:53+0000,Volkswagen Trial Offers Hedge Funds a Chance to Settle Old Scores
1863,2018-09-09T15:54:38+0000,Players and Fans See Sexism in Serena Williams’s Treatment at U.S. Open
1864,2018-09-09T04:05:01+0000,"Tiffany Chang, Kyle Bibby"
1865,2018-09-09T04:10:01+0000,"Melissa Loder, Bethany Gostanian"
1866,2018-09-11T23:57:55+0000,"As Florence’s Power Nears the Carolinas, Residents Brace for the Worst"
1867,2018-09-11T03:34:32+0000,"Your Tuesday News Briefing: Lithuania, Trade, Hurricane Florence"
1868,2018-09-11T15:20:29+0000,Visual Investigations at The New York Times
1869,2018-09-11T22:50:05+0000,How to Mentor a Teen to Use Tech Responsibly
1870,2018-09-10T16:37:51+0000,"Remembering The Village Voice, Music Criticism’s Crucible"
1871,2018-09-11T06:30:06+0000,Do Parrots Know Economics? Kind Of
1872,2018-09-11T18:27:11+0000,"Lake Bell, Carmelo Anthony and Liev Schreiber Party at Fashion Week"
1873,2018-09-11T20:22:52+0000,Coach 1941: Spring 2019
1874,2018-09-09T23:34:19+0000,Boss M/W: Spring 2019
1875,2018-09-09T16:36:57+0000,Brock Collection: Spring 2019
1876,2018-09-10T00:16:58+0000,Telfar: 2019
1877,2018-09-11T23:11:19+0000,Hundreds of Thousands of Catalans Rally for Independence in Barcelona
1878,2018-09-11T23:17:00+0000,"Henry Bawnik, Survivor of Death Camps and an Inferno at Sea, Dies at 92"
1879,2018-09-11T23:28:22+0000,Cosby’s Lawyers and Wife Seek Judge’s Recusal Before Sentencing
1880,2018-09-09T09:00:09+0000,"Affairs, Pheasant Feathers and White House Stays: 6 Big Money-in-Politics Scandals"
1881,2018-09-09T10:10:37+0000,"Across Afghanistan, Scores Are Killed in a Deadly Wave of Violence"
1882,2018-09-09T04:00:01+0000,"Laura McFeely, Lee-Or Ankori-Karlinsky"
1883,2018-09-09T04:00:01+0000,"Abigail Olson, John Powers"
1884,2018-09-09T04:00:01+0000,"Lily Haydock, Frank Sanders IV"
1885,2018-09-09T04:05:01+0000,"Elisa Walsh, Winston Yan"
1886,2018-09-09T04:15:01+0000,This Week’s Wedding Announcements
1887,2018-09-11T09:00:09+0000,Sally Field Talks About Her Life ‘In Pieces’
1888,2018-09-11T09:13:48+0000,More Evacuations as ‘Monster’ Storm Looms
1889,2018-09-11T04:01:05+0000,"Lasker Awards Given for Work in Genetics, Anesthesia and Promoting Women in Science"
1890,2018-09-11T07:00:01+0000,Remembering 9/11
1891,2018-09-11T09:00:05+0000,A Top Goldman Banker Raised Ethics Concerns. Then He Was Gone.
1892,2018-09-11T05:05:31+0000,On Politics: A Plan to Roll Back Methane Rules
1893,2018-09-10T06:24:22+0000,"Kem Sokha, Cambodia’s Jailed Opposition Leader, Is Released"
1894,2018-09-10T07:01:52+0000,Naomi Osaka Lost Her Moment of Triumph. Let’s Not Forget Her Match.
1895,2018-09-10T09:00:01+0000,Using Tai Chi to Build Strength
1896,2018-09-10T09:37:45+0000,"Your Monday News Briefing: Les Moonves, Serena Williams, Hurricane Florence"
1897,2018-09-10T00:10:09+0000,"Serena Williams Spotlights Tennis Inequities, but in the Best Way?"
1898,2018-09-10T03:12:48+0000,"John Legend, Andrew Lloyd Webber and Tim Rice Join the EGOT Club"
1899,2018-09-09T05:00:05+0000,What’s on TV Sunday: ‘Kidding’ and ‘The Deuce’
1900,2018-09-09T19:00:01+0000,"Brett Kavanaugh, Release All Your Records"
1901,2018-09-09T17:20:28+0000,Review: Guy Pearce Is ‘Jack Irish’ in a Noir Down Under
1902,2018-09-09T01:29:27+0000,"Quotation of the Day: A Major Win, Tinged With Tears"
1903,2018-09-10T23:42:22+0000,"After 9/11, a Police Captain Wanted to Change His Life. He Opened a Pizza Place."
1904,2018-09-11T00:06:33+0000,Serena Williams Came In on a High Road. It Made Her Fall More Devastating.
1905,2018-09-11T00:13:37+0000,"From Trump to Trade, the Financial Crisis Still Resonates 10 Years Later"
1906,2018-09-11T00:24:18+0000,Cynthia Nixon and the Benefit of a Smear
1907,2018-09-11T15:56:58+0000,"Your Questions About FIRE, Answered"
1908,2018-09-11T16:00:28+0000,Teaching and ‘Doing’ Can Go Together
1909,2018-09-11T16:08:46+0000,A Fine-Dining Veteran Turns to Street Food 
1910,2018-09-11T16:22:09+0000,"How to Cook in Your Dorm Room, First Apartment and Beyond"
1911,2018-09-11T18:40:01+0000,The Red Ball That Bounced Through Toledo (in 2015) Is on the Move Again
1912,2018-09-11T18:48:07+0000,"As the News Cycle Lurches, Jill Lepore Offers a Long, Steady View of American History"
1913,2018-09-11T18:54:16+0000,"Review: Drugs, Guns and Poses in ‘White Boy Rick’"
1914,2018-09-11T17:39:14+0000,E.U.’s Leadership Seeks to Contain Hungary’s Orban
1915,2018-09-11T17:58:51+0000,7 Roles. 14 Actors. 2 Languages. 1 Stage.
1916,2018-09-11T18:08:16+0000,"After Migrants Drowned at Sea, Debate Over Who Should Have Saved Them"
1917,2018-09-11T14:02:31+0000,"On Shelter Island, a Pool House as Discreet as Its Environs"
1918,2018-09-11T15:27:27+0000,‘Anonymous’ Is Hiding in Plain Sight
1919,2018-09-11T20:08:30+0000,"As Elkhart, Ind., Goes, So Goes the Nation, and Elkhart Is Nervous"
1920,2018-09-09T14:30:01+0000,What to Cook This Week
1921,2018-09-09T14:39:36+0000,How ‘Plaid Shirt Guy’ Got Prime Seating at a Trump Rally
1922,2018-09-09T15:03:58+0000,"Migrants’ Emotional Ties to U.S. Expressed in Flags, Tombs and Fancy Homes"
1923,2018-09-09T15:08:00+0000,Giant Trap Is Deployed to Catch Plastic Littering the Pacific Ocean
1924,2018-09-10T21:09:58+0000,U.S. Weighs Sanctions Against Chinese Officials Over Muslim Detention Camps
1925,2018-09-10T21:35:36+0000,"Tito Capobianco, Assertive Opera Director, Is Dead at 87"
1926,2018-09-10T16:58:20+0000,When Serena Williams Lost Her Cool at the U.S. Open
1927,2018-09-09T01:29:27+0000,"Quotation of the Day: A Major Win, Tinged With Tears"
1928,2018-09-11T04:01:05+0000,"Lasker Awards Given for Work in Genetics, Anesthesia and Promoting Women in Science"
1929,2018-09-11T09:00:05+0000,A Top Goldman Banker Raised Ethics Concerns. Then He Was Gone.
1930,2018-09-11T09:00:09+0000,Sally Field Talks About Her Life ‘In Pieces’
1931,2018-09-11T09:13:48+0000,More Evacuations as ‘Monster’ Storm Looms
1932,2018-09-10T23:42:22+0000,"After 9/11, a Police Captain Wanted to Change His Life. He Opened a Pizza Place."
1933,2018-09-11T00:06:33+0000,Serena Williams Came In on a High Road. It Made Her Fall More Devastating.
1934,2018-09-11T00:13:37+0000,"From Trump to Trade, the Financial Crisis Still Resonates 10 Years Later"
1935,2018-09-11T00:24:18+0000,Cynthia Nixon and the Benefit of a Smear
1936,2018-09-11T05:05:31+0000,On Politics: A Plan to Roll Back Methane Rules
1937,2018-09-11T07:00:01+0000,Remembering 9/11
1938,2018-09-11T16:52:02+0000,Miles Okazaki
1939,2018-09-11T00:39:17+0000,The Most Glittering Moments From Sasha Velour’s Fashion Week Drag Show
1940,2018-09-11T16:39:38+0000,New Hampshire Primary Election Results
1941,2018-09-10T17:26:35+0000,"Midterm Election Poll: Texas’ 23rd District, Hurd vs. Ortiz Jones"
1942,2018-09-10T09:54:12+0000,Listen to ‘The Daily’: An Interview With George Papadopoulos
1943,2018-09-10T16:44:48+0000,"Remembering The Village Voice, Music Criticism’s Crucible, Part 2"
1944,2018-09-09T20:01:46+0000,How a C.I.A. Drone Base Grew in the Desert
1945,2018-09-10T11:19:13+0000,"The N.F.L.’s New Tackling Rule: The Good, the Bad and the Confusing"
1946,2018-09-10T12:32:04+0000,"Adam Schiff, the Congressman Calling Attention to Money Laundering"
1947,2018-09-09T20:47:52+0000,Trump Says Tariffs Mean Ford Can Make New Model at Home. Ford Says It Won’t.
1948,2018-09-09T23:00:03+0000,Don’t Let Migrant Kids Rot
1949,2018-09-10T01:45:01+0000,Review: A Disjointed Revival of Shaw’s Satirical ‘Heartbreak House’
1950,2018-09-10T15:50:03+0000,The Freedom Trail in Mississippi Is a Chronicle of Outrage and Courage
1951,2018-09-10T15:53:07+0000,"Bolton Expands on His Boss’s Views, Except on North Korea"
1952,2018-09-10T16:43:23+0000,Review: A Beatboxer Climbs Up and Out in ‘The Unwritten Law’
1953,2018-09-10T12:32:04+0000,"Adam Schiff, the Congressman Calling Attention to Money Laundering"
1954,2018-09-10T12:53:08+0000,"‘Insecure’ Season 3, Episode 5: The Bad Decision Index"
1955,2018-09-10T11:19:13+0000,"The N.F.L.’s New Tackling Rule: The Good, the Bad and the Confusing"
1956,2018-09-10T14:50:44+0000,Recipes From Black America
1957,2018-09-11T09:00:47+0000,"A Portland Craftsman, Cubed"
1958,2018-09-11T12:45:29+0000,Proenza Schouler Goes on a Fashion Cleanse
1959,2018-09-11T02:47:41+0000,Quotation of the Day: Nazi Collaborator or National Hero? A Test for Lithuania
1960,2018-09-11T06:45:09+0000,"How Teeth Became Tusks, and Tusks Became Liabilities"
1961,2018-09-11T21:48:07+0000,"KiKi Layne, ‘Beale Street’s’ Breakout Star, Has a 4 a.m. Moment"
1962,2018-09-11T21:52:47+0000,Beauty Is More Diverse Than Ever. But Is It Diverse Enough?
1963,2018-09-09T16:56:03+0000,Catalonia Separatists Urge a Show of Strength on the Streets
1964,2018-09-09T16:56:14+0000,"In 1993, ‘Joy Luck Club’ Changed Hollywood. Until It Didn’t."
1965,2018-09-09T20:47:52+0000,Trump Says Tariffs Mean Ford Can Make New Model at Home. Ford Says It Won’t.
1966,2018-09-09T21:42:37+0000,Tesla Needs to Build Investor Trust. The Exit of Its Accountant Won’t Help.
1967,2018-09-11T06:45:09+0000,"How Teeth Became Tusks, and Tusks Became Liabilities"
1968,2018-09-11T12:45:29+0000,Proenza Schouler Goes on a Fashion Cleanse
1969,2018-09-11T12:00:04+0000,A First for New York: New Conductors at the Met Opera and Philharmonic
1970,2018-09-10T23:00:04+0000,Democrats Are Credible on Health Care
1971,2018-09-11T00:02:08+0000,Constitutional Standoff Pushes Guatemala Toward Authoritarianism
1972,2018-09-11T00:16:38+0000,"Proposed Rules Would Reduce Sexual Misconduct Inquiries, Education Dept. Estimates"
1973,2018-09-10T15:50:03+0000,The Freedom Trail in Mississippi Is a Chronicle of Outrage and Courage
1974,2018-09-10T15:53:07+0000,"Bolton Expands on His Boss’s Views, Except on North Korea"
1975,2018-09-10T21:31:59+0000,We’re Trying Something New. This Is ‘On Politics.’
1976,2018-09-10T16:43:23+0000,Review: A Beatboxer Climbs Up and Out in ‘The Unwritten Law’
1977,2018-09-11T00:39:24+0000,Sasha Velour Gives New York Fashion Week the ‘Gift of Showz’
1978,2018-09-11T02:47:41+0000,Quotation of the Day: Nazi Collaborator or National Hero? A Test for Lithuania
1979,2018-09-10T14:50:44+0000,Recipes From Black America
1980,2018-09-09T21:05:54+0000,Forecasters Expect ‘Rapid Intensification’ of Hurricane Florence
1981,2018-09-10T09:45:01+0000,How Much Do You Know About France?
1982,2018-09-11T15:21:02+0000,Nigella Seeds and Rose-Water Sorbet
1983,2018-09-11T16:52:02+0000,Jed Distler
1984,2018-09-11T16:52:04+0000,Miles Okazaki
1985,2018-09-10T20:07:59+0000,The Row: Spring 2019
1986,2018-09-10T21:51:00+0000,Proenza Schouler: Spring 2019
1987,2018-09-11T15:21:02+0000,Nigella Seeds and Rose-Water Sorbet
1988,2018-09-11T16:24:51+0000,Playing Games Can Be Hard Work. So Can Choosing Which Ones to Display.
1989,2018-09-11T16:27:31+0000,Does the Cost of Living in New York Spell the End of Its Artistic Life?
1990,2018-09-11T09:58:16+0000,"Bob Woodward on Trump, Nixon and Anonymity"
1991,2018-09-11T10:00:04+0000,Boring Is the New Black
1992,2018-09-11T10:00:04+0000,Silicon Valley Needs Regulation
1993,2018-09-11T09:00:01+0000,New & Noteworthy
1994,2018-09-11T09:00:04+0000,What Should I Do With Old Racist Memorabilia?
1995,2018-09-11T09:06:57+0000,Stephen Colbert Gives Les Moonves (His Boss) a Shove Out the Door
1996,2018-09-11T04:02:13+0000,"Yankees Rebound, and Aaron Judge Takes a Big Step Forward"
1997,2018-09-11T22:31:53+0000,He Led a Group of Disloyal New York Democrats. Will It Cost Him His Seat?
1998,2018-09-11T23:13:17+0000,The Most Contrarian College in America
1999,2018-09-11T23:22:55+0000,"Stay Out of Venezuela, Mr. Trump"
2000,2018-09-11T20:32:21+0000,Listen Up: Here Are 3 Books on the Sexism Women Face in Hollywood.
2001,2018-09-11T18:22:56+0000,Was There a Double Standard for Judging Serena Williams?
2002,2018-09-11T18:34:05+0000,Beyond ‘Crazy Rich Asians’: Angie Wang Makes a Movie
2003,2018-09-11T18:45:02+0000,The Slippery Slope of Regulating Social Media 
2004,2018-09-11T16:24:51+0000,Playing Games Can Be Hard Work. So Can Choosing Which Ones to Display.
2005,2018-09-11T16:27:31+0000,Does the Cost of Living in New York Spell the End of Its Artistic Life?
2006,2018-09-11T16:01:31+0000,Evacuating for Hurricane Florence: How to Prepare Yourself
2007,2018-09-11T16:01:31+0000,Evacuating for Hurricane Florence: How to Prepare Yourself
2008,2018-09-11T19:06:09+0000,Can Germany’s Center Hold Against the Far Right?
2009,2018-09-09T20:00:03+0000,MSK Cancer Center Orders Staff to ‘Do a Better Job’ of Disclosing Industry Ties
2010,2018-09-09T20:01:48+0000,"C.I.A. Drone Mission, Curtailed by Obama, Is Expanded in Africa Under Trump"
2011,2018-09-09T20:27:55+0000,Three Hours Up Close With Alex Jones of Infowars
2012,2018-09-09T20:58:41+0000,Serena Williams vs. Naomi Osaka: How the U.S. Open Descended Into Chaos
2013,2018-09-10T02:00:01+0000,"‘The Deuce’ Season 2 Premiere Recap: New York, 1977"
2014,2018-09-09T23:00:04+0000,Role Models Tell Girls That STEM’s for Them in New Campaign
2015,2018-09-09T23:02:30+0000,Obama’s Back!
2016,2018-09-09T23:05:03+0000,Can You Win an Election by Talking About Segregation?
2017,2018-09-11T19:06:09+0000,Can Germany’s Center Hold Against the Far Right?
2018,2018-09-10T18:32:13+0000,Three Things to Watch This Week
2019,2018-09-11T02:00:00+0000,High-Flown Speech
2020,2018-09-11T04:02:13+0000,"Yankees Rebound, and Aaron Judge Takes a Big Step Forward"
2021,2018-09-10T14:30:01+0000,What to Cook Right Now
2022,2018-09-11T06:00:01+0000,Word + Quiz: congenital
2023,2018-09-11T09:00:01+0000,New & Noteworthy
2024,2018-09-10T16:14:06+0000,Trump Falsely Claims G.D.P. Growth Is Higher Than Unemployment ‘for the First Time in 100 Years’
2025,2018-09-10T23:38:44+0000,The Real Lesson of Sept. 11
2026,2018-09-11T09:58:16+0000,"Bob Woodward on Trump, Nixon and Anonymity"
2027,2018-09-11T10:00:04+0000,Boring Is the New Black
2028,2018-09-11T10:00:04+0000,Silicon Valley Needs Regulation
2029,2018-09-11T16:01:31+0000,Evacuating for Hurricane Florence: How to Prepare Yourself
2030,2018-09-11T16:24:51+0000,Playing Games Can Be Hard Work. So Can Choosing Which Ones to Display.
2031,2018-09-11T16:27:31+0000,Does the Cost of Living in New York Spell the End of Its Artistic Life?
2032,2018-09-11T18:22:56+0000,Was There a Double Standard for Judging Serena Williams?
2033,2018-09-11T18:34:05+0000,Beyond ‘Crazy Rich Asians’: Angie Wang Makes a Movie
2034,2018-09-11T20:32:21+0000,Listen Up: Here Are 3 Books on the Sexism Women Face in Hollywood.
2035,2018-09-11T22:31:53+0000,He Led a Group of Disloyal New York Democrats. Will It Cost Him His Seat?
2036,2018-09-11T23:13:17+0000,The Most Contrarian College in America
2037,2018-09-10T23:38:44+0000,The Real Lesson of Sept. 11
2038,2018-09-11T06:00:01+0000,Word + Quiz: congenital
2039,2018-09-10T09:00:07+0000,How a Gang Hunted and Killed a 15-Year-Old in the Bronx
2040,2018-09-11T23:44:19+0000,Interest Groups Turn Up Pressure on Senators Before Kavanaugh Vote
2041,2018-09-09T00:46:29+0000,Brandon Maxwell: Spring 2019
2042,2018-09-09T16:04:13+0000,"Midterm Election Poll: Virginia’s 7th District, Brat vs. Spanberger"
2043,2018-09-10T21:08:33+0000,3.1. Phillip Lim: Spring 2019
2044,2018-09-11T00:26:07+0000,Zero + Maria Cornejo: Spring 2019
2045,2018-09-11T02:17:49+0000,Kozaburo: Spring 2019
2046,2018-09-11T16:52:02+0000,Miles Okazaki
2047,2018-09-10T02:40:39+0000,"A Mariner Slides and Dives, and the Yankees Merely Fall"
2048,2018-09-10T02:45:13+0000,A Spy Story: Sergei Skripal Was a Little Fish. He Had a Big Enemy.
2049,2018-09-10T12:05:42+0000,Several Reported Killed in Libya as Gunmen Storm National Oil Company
2050,2018-09-10T12:34:54+0000,California Today: Limiting Ammunition to Thwart Gun Violence
2051,2018-09-10T19:00:08+0000,She Grew Up Poor on a Kansas Farm. Her Memoir Is an Attempt to Understand Why.
2052,2018-09-10T09:45:10+0000,The Left’s Guide to Reclaiming the Constitution 
2053,2018-09-09T21:26:49+0000,Rich Nations Vowed Billions for Climate Change. Poor Countries Are Waiting.
2054,2018-09-09T21:42:43+0000,A Scourge for California Drivers: Hours on a Sidewalk to Renew a License
2055,2018-09-09T21:00:04+0000,Found in Tubs
2056,2018-09-09T22:21:14+0000,Bet the Giants. Cross a Parking Lot. Watch Them Play. Welcome to Week 1 of N.F.L. Sports Betting at the Meadowlands.
2057,2018-09-10T09:45:10+0000,The Left’s Guide to Reclaiming the Constitution 
2058,2018-09-09T21:26:49+0000,Rich Nations Vowed Billions for Climate Change. Poor Countries Are Waiting.
2059,2018-09-09T21:42:43+0000,A Scourge for California Drivers: Hours on a Sidewalk to Renew a License
2060,2018-09-09T21:00:04+0000,Found in Tubs
2061,2018-09-10T02:40:39+0000,"A Mariner Slides and Dives, and the Yankees Merely Fall"
2062,2018-09-10T02:45:13+0000,A Spy Story: Sergei Skripal Was a Little Fish. He Had a Big Enemy.
2063,2018-09-10T08:00:01+0000,"Gordon Parks on Poverty, the ‘Most Savage of Human Afflictions’"
2064,2018-09-10T09:00:01+0000,Renouncing Hate: What Happens When a White Nationalist Repents
2065,2018-09-09T22:21:14+0000,Bet the Giants. Cross a Parking Lot. Watch Them Play. Welcome to Week 1 of N.F.L. Sports Betting at the Meadowlands.
2066,2018-09-09T23:23:16+0000,"For Big Tech, a Comeuppance We’ve Seen Before: On Wall St."
2067,2018-09-11T15:38:34+0000,"They Defied Trump on Climate Change. Now, It’s Their Moment of Truth. "
2068,2018-09-11T15:43:54+0000,A Diagnosis Update: New Information on a Young Girl’s Rare Genetic Condition
2069,2018-09-11T13:07:38+0000,Zimbabwe Declares Cholera Emergency as Disease Spreads in Capital
2070,2018-09-11T13:25:23+0000,"Mark Carney, Bank of England Governor, Will Stay in Charge Until 2020"
2071,2018-09-11T18:37:32+0000,A Cartoonist’s Flock of Pigeons Fit for Fashion Week
2072,2018-09-10T09:00:01+0000,Renouncing Hate: What Happens When a White Nationalist Repents
2073,2018-09-10T09:00:11+0000,This Dublin Block Tells the Story of the City
2074,2018-09-10T09:00:07+0000,The Health Impact of Undescended Testicles
2075,2018-09-11T21:59:15+0000,These 3 Hurricane Misconceptions Can Be Dangerous. Scientists Want to Clear Them Up.
2076,2018-09-11T22:26:06+0000,‘The Daily’ Transcript: Interview With Bob Woodward
2077,2018-09-11T02:30:09+0000,Nazi Collaborator or National Hero? A Test for Lithuania
2078,2018-09-11T09:00:01+0000,How to Respond When Someone Comes Out to You
2079,2018-09-11T09:00:05+0000,"Henry Adams’s 1880 Novel, ‘Democracy,’ Resonates Now More Than Ever"
2080,2018-09-10T22:25:26+0000,"Celebrating Rosh Hashana With Less ‘Oy,’ More ‘Joy’ and a Bit of Gospel"
2081,2018-09-10T23:37:04+0000,Judge Chastises Both Sides in Maria Butina Case
2082,2018-09-11T00:00:05+0000,"Jordin Canada Is the Sue Bird Protégé Who’s Got Next, and Now"
2083,2018-09-11T00:34:48+0000,Sessions’s Lawyer Defends His Account of Trump Campaign Meeting
2084,2018-09-11T09:00:06+0000,A Travel Magazine With a Focus on Feminism
2085,2018-09-10T12:05:42+0000,Several Reported Killed in Libya as Gunmen Storm National Oil Company
2086,2018-09-10T12:34:54+0000,California Today: Limiting Ammunition to Thwart Gun Violence
