,pub_date,headline
3382,2016-02-14T00:00:00Z,Britain Aims to Strengthen North’s Cities
3383,2016-02-14T00:00:00Z,The Love Story Primary
3384,2016-02-14T00:00:00Z,How New York Made Pre-K a Success
3385,2016-02-14T00:00:00Z,Nikki Silva
3386,2016-02-14T00:00:00Z,Not Their Mother’s Candidate
3387,2016-02-14T00:00:00Z,"Amid Tension, Met and James Levine Mull Last Bow"
3388,2016-02-14T00:00:00Z,Can Health Care Providers Afford to Be Ready for Disaster?
3389,2016-02-14T00:00:00Z,"Death, the Prosperity Gospel and Me"
3390,2016-02-14T00:00:00Z,Bill Cunningham | The Look
3391,2016-02-14T00:00:00Z,Fixing Our Broken Water Systems
3392,2016-02-14T00:00:00Z,Narcissism Is Increasing. So You’re Not So Special.
3393,2016-02-14T00:00:00Z,When Hillary Clinton Killed Feminism
3394,2016-02-14T00:00:00Z,Are You a Toxic Waste Disposal Site?
3395,2016-02-14T00:00:00Z,The Orphaned ’90s
3396,2016-02-14T00:00:00Z,Jets Will No Longer Get a Free Ride on Carbon Emissions
3397,2016-02-14T00:00:00Z,How We View Obesity
3398,2016-02-14T00:00:00Z,"Facing Allies’ Doubt, John Kerry Voices Confidence in Syria Cease-Fire"
3399,2016-02-14T00:00:00Z,What to Look For in the Republican Debate
3400,2016-02-14T00:00:00Z,"War, Disease and Scandals Test Soccer Chief in Sierra Leone"
3401,2016-02-14T00:00:00Z,Catholic Leaders Say Zika Doesn’t Change Ban on Contraception
3402,2016-02-14T00:00:00Z,A Monthly Gift That Keeps on Not Giving
3403,2016-02-14T00:00:00Z,Mark Dunkerley: Where You Can See Airplanes and the Aloha Spirit
3404,2016-02-14T00:00:00Z,Injured Stanford Pitcher Fixes His Gaze on Big Picture 
3405,2016-02-14T00:00:00Z,The Best Team on Paper Hopes to Write a Different Ending
3406,2016-02-14T00:00:00Z,"Dividends, Wall Street’s Battered Status Symbol"
3407,2016-02-14T00:00:00Z,A 4-Legged Fire Alarm Graces the Field
3408,2016-02-14T00:00:00Z,Small Gifts to Bernie Sanders Challenge Hillary Clinton Fund-Raising Model
3409,2016-02-14T00:00:00Z,Letters to the Editor
3410,2016-02-14T00:00:00Z,"Fired for Cursing on the Job, Testing the Limits of Labor Law"
3411,2016-02-14T00:00:00Z,Roots of the Recent Violence Between Israelis and Palestinians
3412,2016-02-14T00:00:00Z,Francis Admonishes Bishops in Mexico to ‘Begin Anew’
3413,2016-02-14T00:00:00Z,"Even in Impersonations, Donald Trump Likes What He Sees of Himself"
3414,2016-02-14T00:00:00Z,"Taliban, Using Humvees Stolen From Army, Attack Check Post"
3415,2016-02-14T00:00:00Z,How to Watch the Republican Debate
3416,2016-02-14T00:00:00Z,Dreams of Creating a Duplex 
3417,2016-02-14T00:00:00Z,Falling Asleep to Grenades: Mexicans Tell Pope How They Live
3418,2016-02-14T00:00:00Z,"Farhad and Mike’s Week in Tech: Rethinking Twitter, and a Hurdle for Facebook"
3419,2016-02-14T00:00:00Z,‘Moonshot’ Metaphor on Cancer Is a Failure to Communicate
3420,2016-02-14T00:00:00Z,Chinese Start to Lose Confidence in Their Currency
3421,2016-02-14T00:00:00Z,"Peggy Siegal, Best Hostess in a Supporting Role"
3422,2016-02-14T00:00:00Z,Peggy Siegal Through the Years
3423,2016-02-14T00:00:00Z,The New Celebrity Power Move: Keeping Secrets
3424,2016-02-14T00:00:00Z,The House D.J. of the Bernie Sanders Campaign
3425,2016-02-14T00:00:00Z,"Constant Tide of Migrants at Sea, and at Turkish Cemetery"
3426,2016-02-14T00:00:00Z,North Korea Cancels Investigation Into Abductions of Japanese Citizens
3427,2016-02-14T00:00:00Z,Syrian War Could Turn on the Battle for Aleppo
3428,2016-02-14T00:00:00Z,"Ah, Spring! What Could Go Wrong?"
3429,2016-02-14T00:00:00Z,‘The Moors’ at Yale Rep: Flights of Fancy and Tales of Deceit
3430,2016-02-14T00:00:00Z,"Review: In ‘Nureyev’s Eyes,’ a Bond Between a Painter and a Dancer"
3431,2016-02-14T00:00:00Z,"While You Were Sleeping, They Made Art"
3432,2016-02-14T00:00:00Z,Art and Ceremony Intertwine at Hosftra University African Exhibit
3433,2016-02-14T00:00:00Z,"Review: At ToA, a Family’s Latest Foray Into Asian Fusion"
3434,2016-02-14T00:00:00Z,"Review: The Stockton Inn, After a Revamp, Adopts a Modern Menu"
3435,2016-02-14T00:00:00Z,"Review: Beneath the Rafters of the Barn, Steak and Seafood"
3436,2016-02-14T00:00:00Z,"Jake Page, Editor Who Made Science Accessible, Dies at 80"
3437,2016-02-14T00:00:00Z,"At Yonkers Brewing Company, Beer Steeped in Local Pride"
3438,2016-02-14T00:00:00Z,Leading a 21st-Century ‘21’ Club
3439,2016-02-14T00:00:00Z,Recalling the Past Lives of an East Village Bathhouse
3440,2016-02-14T00:00:00Z,"At a Chinatown Bar, Libations Sipped by the Light of Disco Balls"
3441,2016-02-14T00:00:00Z,Strange Fascinations in a Kitsch Hideaway
3442,2016-02-14T00:00:00Z,"Tommy Kelly, Who Played a Hollywood Tom Sawyer, Dies at 90"
3443,2016-02-14T00:00:00Z,"How Ute Lemper, German Chanteuse, Spends Her Sundays"
3444,2016-02-14T00:00:00Z,"Jesse Owens, a Film Hero Once Again"
3445,2016-02-14T00:00:00Z,A Day in the Life of a 24-Hour Gym
3446,2016-02-14T00:00:00Z,Why People Are Confused About What Experts Really Think
3447,2016-02-14T00:00:00Z,‘The Revenant’ Lends Trapper Chic a Dose of Gritty Realness
3448,2016-02-14T00:00:00Z,"Things to Do in Connecticut, Feb. 13 Through 21"
3449,2016-02-14T00:00:00Z,"Things to Do in New Jersey, Feb. 13 Through Feb. 21"
3450,2016-02-14T00:00:00Z,Inside The New York Times Book Review Podcast: Love and Death
3451,2016-02-14T00:00:00Z,"Things to Do on Long Island, Feb. 13 Through Feb. 21"
3452,2016-02-14T00:00:00Z,"Things to Do in the Hudson Valley, Feb. 13 Through 21"
3453,2016-02-14T00:00:00Z,The Choices That Led Small Business Owners to Wealth
3454,2016-02-14T00:00:00Z,When the Supposed Experts Lead Buyers Astray
3455,2016-02-14T00:00:00Z,When Amateur Ironmen Pay for the Elite Treatment
3456,2016-02-14T00:00:00Z,‘Mad Max’ Meets Motocross in Spring’s Most Daring Looks
3457,2016-02-14T00:00:00Z,"At Turin Hotel, a Minimalist Mood, With a Dash of History"
3458,2016-02-14T00:00:00Z,A Savvy Breed of Winemaker Takes Business Sense to the Winery
3459,2016-02-14T00:00:00Z,"For Some, It’s Time to Look Overseas Again"
3460,2016-02-14T00:00:00Z,What I Love | Babak Hakakian
3461,2016-02-14T00:00:00Z,A Partner in DDC Furniture on Living With the Elements
3462,2016-02-14T00:00:00Z,"Founded for the Poor, Mass General Looks to the Wealthy"
3463,2016-02-14T00:00:00Z,La misère sexuelle du monde arabe
3464,2016-02-14T00:00:00Z,The Sexual Misery of the Arab World
3465,2016-02-14T00:00:00Z,"‘Weathering,’ by Lucy Wood"
3466,2016-02-14T00:00:00Z,"‘The Narrow Door,’ by Paul Lisicky"
3467,2016-02-14T00:00:00Z,"‘The Red Hat,’ ‘The Story of Snowflake and Inkdrop’ and More"
3468,2016-02-14T00:00:00Z,"‘Pax,’ by Sara Pennypacker"
3469,2016-02-14T00:00:00Z,"‘Alive, Alive Oh!’ by Diana Athill"
3470,2016-02-14T00:00:00Z,"‘Where My Heart Used to Beat,’ by Sebastian Faulks"
3471,2016-02-14T00:00:00Z,"‘The High Mountains of Portugal,’ by Yann Martel"
3472,2016-02-14T00:00:00Z,"‘I’m Glad About You,’ by Theresa Rebeck"
3473,2016-02-14T00:00:00Z,"‘The Man Without a Shadow,’ by Joyce Carol Oates"
3474,2016-02-14T00:00:00Z,Romance
3475,2016-02-14T00:00:00Z,"‘Flight of Dreams,’ by Ariel Lawhon"
3476,2016-02-14T00:00:00Z,"‘The Photographer’s Wife,’ by Suzanne Joinson"
3477,2016-02-14T00:00:00Z,$18.87 Million for a Greenwich Village Penthouse
3478,2016-02-14T00:00:00Z,"‘Jakob’s Colors,’ by Lindsay Hawdon"
3479,2016-02-14T00:00:00Z,"‘The Heart,’ by Maylis de Kerangal"
3480,2016-02-14T00:00:00Z,"‘The Borden Murders,’ by Sarah Miller"
3481,2016-02-14T00:00:00Z,"‘Salt to the Sea,’ by Ruta Sepetys"
3482,2016-02-14T00:00:00Z,Death Becomes Them
3483,2016-02-14T00:00:00Z,Art Scene Heats Up in Downtown Los Angeles
3484,2016-02-14T00:00:00Z,On the Market in New York City
3485,2016-02-14T00:00:00Z,Homes for Sale in Brooklyn and Queens
3486,2016-02-14T00:00:00Z,Homes for Sale in New York and New Jersey
3487,2016-02-14T00:00:00Z,Letters: American Growth
3488,2016-02-14T00:00:00Z,On the Market in the New York Region
3489,2016-02-14T00:00:00Z,Homes for Sale in New York and New Jersey
3490,2016-02-14T00:00:00Z,A Closer Look at 529 Able Accounts
3491,2016-02-14T00:00:00Z,Editors’ Choice
3492,2016-02-14T00:00:00Z,Paperback Row
3493,2016-02-14T00:00:00Z,Assistant Coaches Join the Millionaire’s Club
3494,2016-02-14T00:00:00Z,Home Sales Around the New York Region
3495,2016-02-14T00:00:00Z,"George Washington, the Whiskey Baron of Mount Vernon"
3496,2016-02-14T00:00:00Z,"Skip the Upkeep and Rent the Jet, or Island, Instead"
3497,2016-02-14T00:00:00Z,Wim Wenders’s High Plains Grifter
3498,2016-02-14T00:00:00Z,The Secret Weapons of ‘Broad City’ Make Fine Art From Crude Humor
3499,2016-02-14T00:00:00Z,"Emmett Till and Tamir Rice, Sons of the Great Migration"
3500,2016-02-14T00:00:00Z,One Patient’s Story: ‘That’s a Kill Shot’
3501,2016-02-14T00:00:00Z,"It’s Like the N.B.A., Minus the Money, Fame and Fans"
3502,2016-02-14T00:00:00Z,"In Turkey, Adventure Travel Takes the Plunge"
3503,2016-02-14T00:00:00Z,A Concierge for Same-Sex Weddings in Florida
3504,2016-02-14T00:00:00Z,"A Terrible, Happy Accident in Rio"
3505,2016-02-14T00:00:00Z,How to Survive Falling Through the Ice
3506,2016-02-14T00:00:00Z,‘Taking It Home to Jerome’
3507,2016-02-14T00:00:00Z,The 1.31.16 Issue
3508,2016-02-14T00:00:00Z,"Michael J. Dowling: If It Can’t Be Done, You Haven’t Tried"
3509,2016-02-14T00:00:00Z,Moving to Jersey City? Join the Club.
3510,2016-02-14T00:00:00Z,Jersey City Today
3511,2016-02-14T00:00:00Z,From a ‘Dating Fast’ to a Quick Proposal
3512,2016-02-14T00:00:00Z,Close From Day 1
3513,2016-02-14T00:00:00Z,In a Foreign Land With Something to Declare
3514,2016-02-14T00:00:00Z,I Now Pronounce You Husband and Husband
3515,2016-02-14T00:00:00Z,A Reformed ‘Sneaker Pimp’ Takes On the N.C.A.A.
3516,2016-02-14T00:00:00Z,Exclusive | 22 Gramercy Park South
3517,2016-02-14T00:00:00Z,Half a Townhouse on Gramercy Park
3518,2016-02-14T00:00:00Z,Saint Laurent’s High-Voltage Glamour Woos a Rock ’n’ Roll Crowd
3519,2016-02-14T00:00:00Z,Finding Beauty in the Darkness
3520,2016-02-14T00:00:00Z,Oprah Made Me Eat It
3521,2016-02-14T00:00:00Z,"Gillian Jacobs, a Neurotic ‘Community’ Favorite, Finds ‘Love’"
3522,2016-02-14T00:00:00Z,"In ‘Sunset Song,’ a Hard Life Amid Cruel Beauty"
3523,2016-02-14T00:00:00Z,Ignore the GPS. That Ocean Is Not a Road.
3524,2016-02-14T00:00:00Z,‘For Claude Shannon’ Brings Brainy Dance to the Kitchen
3525,2016-02-14T00:00:00Z,"Ancient War in Japan, Followed by a Renaissance"
3526,2016-02-14T00:00:00Z,The New Power Dressing
3527,2016-02-14T00:00:00Z,The Boston Modern Orchestra Project Fought Bloat — and Won
3528,2016-02-14T00:00:00Z,"Mark Rylance, Onstage Again in ‘Nice Fish’"
3529,2016-02-14T00:00:00Z,"Adriana Lima, Candice Swanepoel and Karlie Kloss Transform Into Marvel Superheroes"
3530,2016-02-14T00:00:00Z,Defending a Video Game Designer
3531,2016-02-14T00:00:00Z,"Joel Grey, a Broadway Eminence, Comes of Age at 83"
3532,2016-02-14T00:00:00Z,"On Java, a Creative Explosion in an Ancient City"
3533,2016-02-14T00:00:00Z,What Caused This Otherwise Healthy Retiree’s Debilitating Cough?
3534,2016-02-14T00:00:00Z,The Killing of Warren Weinstein
3535,2016-02-14T00:00:00Z,Three Pantry Staples With the Power to Transform
3536,2016-02-14T00:00:00Z,Danielle Steel: By the Book
3537,2016-02-14T00:00:00Z,"For 12 Photographers, an Anxious Gaze on Israel and the West Bank"
3538,2016-02-14T00:00:00Z,The Road to the Top of the World
3539,2016-02-14T00:00:00Z,Room for the Dog on the Upper East Side
3540,2016-02-14T00:00:00Z,5 New York Hotel Bars That Melt Away the Winter Blues
3541,2016-02-14T00:00:00Z,"Future and Young Thug, Atlanta’s Hip-Hop Workaholics, Go Their Own Ways"
3542,2016-02-14T00:00:00Z,"New Writer, Same Goal: Exploring the World on a Budget"
3543,2016-02-14T00:00:00Z,Cooper Hewitt’s Triennial Asks: What Makes Something Beautiful?
3544,2016-02-14T00:00:00Z,"‘Major Crimes,’ With Ambition"
3545,2016-02-14T00:00:00Z,"Maxwell, an Elusive Soul Man, Steps Out"
3546,2016-02-14T00:00:00Z,Mitsuko Uchida and the Cleveland Orchestra Play Mozart
3547,2016-02-14T00:00:00Z,"Taylor Stanley, the Calmest Dancer at Lincoln Center"
3548,2016-02-14T00:00:00Z,Pee-wee’s Big Comeback
3549,2016-02-14T00:00:00Z,Chasing Redfish Off the South Texas Gulf Coast
3550,2016-02-14T00:00:00Z,Letter of Recommendation: The Beekeeper Joke
3551,2016-02-14T00:00:00Z,The Living Artist
3552,2016-02-14T00:00:00Z,Is It Selfish for a Gay Couple to Have Kids via Surrogacy?
3553,2016-02-14T00:00:00Z,"Long Island City: Fast-Growing, With Great Views"
3554,2016-02-14T00:00:00Z,Living in Long Island City
3555,2016-02-14T00:00:00Z,"The Season’s Most Seismic Earrings, on R&B and Hip-Hop’s Rising Stars"
3556,2016-02-14T00:00:00Z,Vancouver Explores Its First Nations Roots
3557,2016-02-14T00:00:00Z,Plaid and Argyle Are Back in Altered Dimensions
3558,2016-02-14T00:00:00Z,"This Spring in Women’s Fashion, There Are No Rules"
3559,2016-02-14T00:00:00Z,Touring Italy by Vespa
3560,2016-02-14T00:00:00Z,"‘Forty Rooms,’ by Olga Grushin"
3561,2016-02-14T00:00:00Z,A Diverse Pixar Crew Grabs an Oscar Nomination
3562,2016-02-14T00:00:00Z,The New Shape of Women’s Tailoring
3563,2016-02-14T00:00:00Z,"Sanctions Lifted, American Tourists Head to Iran"
3564,2016-02-14T00:00:00Z,Samantha Bee Likes to Make Things Uncomfortable
3565,2016-02-14T00:00:00Z,"‘The Good Death,’ ‘When Breath Becomes Air’ and More"
3566,2016-02-14T00:00:00Z,How to Wear a Slip Dress — in the Daytime
3567,2016-02-14T00:00:00Z,Inside the List
3568,2016-02-14T00:00:00Z,Market Report: Striped Bags
3569,2016-02-14T00:00:00Z,Market Report: Ballet Flats
3570,2016-02-14T00:00:00Z,The New Generation of Nomadic Chefs
3571,2016-02-14T00:00:00Z,"Bonnie Raitt, Lucinda Williams and Loretta Lynn Are Rocking On and On"
3572,2016-02-14T00:00:00Z,The Tiny London Shop Behind Some of the Very Best Libraries
3573,2016-02-14T00:00:00Z,Takashi Murakami on the Art of Collecting Art
3574,2016-02-14T00:00:00Z,The Everlasting Power of the Bad Girl Haircut
3575,2016-02-15T00:00:00Z,The Daily Bag: The Row
3576,2016-02-15T00:00:00Z,Why Angela Merkel Could Lead the U.N.
3577,2016-02-15T00:00:00Z,Celebrity Stylist Lindsey Dupuis Shows Her Southern Style
3578,2016-02-15T00:00:00Z,A Frequent Flyer’s Photos of Air Travel
3579,2016-02-15T00:00:00Z,"‘Better Call Saul’ Season 2 Premiere: No Seriously, Call Saul"
3580,2016-02-15T00:00:00Z,Rag & Bone: Fall 2016 RTW
3581,2016-02-15T00:00:00Z,Rag & Bone Menswear: Fall 2016 RTW
3582,2016-02-15T22:25:52Z,November's Referendum on Justice
3583,2016-02-15T00:00:00Z,Zac Posen: Fall 2016 RTW
3584,2016-02-15T22:00:55Z,Organic Meat and Milk Higher in Healthful Fatty Acids
3585,2016-02-15T22:00:40Z,Carved Decoration on a Ship&#8217;s Prow
3586,2016-02-15T00:00:00Z,How to Bring the Supreme Court Back Down to Earth
3587,2016-02-15T00:00:00Z,"‘The X-Files’ Season 10, Episode 5: Mulder’s Magic Mushrooms"
3588,2016-02-15T00:00:00Z,Thom Browne: Fall 2016 RTW
3589,2016-02-15T00:00:00Z,Zero + Maria Cornejo: Fall 2016 RTW
3590,2016-02-15T19:41:18Z,R.N.C. Disputes Donald Trump&#8217;s Claim on Debate Being Stacked With Donors
3591,2016-02-15T19:06:28Z,"Group Backing Ted Cruz Makes $573,000 Ad Buy in Nevada"
3592,2016-02-15T18:54:21Z,Rush Limbaugh Sees Strategy Behind Donald Trump&#8217;s &#8216;They Lied&#8217; Claim
3593,2016-02-15T18:36:54Z,Bernie Sanders Meets With Residents of Flint Before Campaign Rally in Michigan
3594,2016-02-15T00:00:00Z,Slide Show: Grammys Red Carpet
3595,2016-02-15T00:00:00Z,3.1 Phillip Lim: Fall 2016 RTW
3596,2016-02-15T00:00:00Z,The Row: Fall 2016 RTW
3597,2016-02-15T18:18:39Z,No Mention of &#8216;Birther&#8217; Debate as Donald Trump Woos Blacks in South Carolina
3598,2016-02-15T00:00:00Z,Romee Strijd Transforms at Jeremy Scott
3599,2016-02-15T00:00:00Z,Slide Show: Grammys Red Carpet
3600,2016-02-15T00:00:00Z,Off the Runway: Feb. 15
3601,2016-02-15T00:00:00Z,Shoppers Recall Their First Barneys Purchases
3602,2016-02-15T00:00:00Z,Jeremy Scott: Fall 2016 RTW
3603,2016-02-15T00:00:00Z,The Daily Jewel: Tommy Hilfiger
3604,2016-02-15T00:00:00Z,Yolanda Foster: Watching Her Daughter Gigi Hadid From the Front Row
3605,2016-02-15T17:00:29Z,Getting People to Exercise Requires the Right Incentive
3606,2016-02-15T16:59:22+0000,Partisan Standoff Leaves Supreme Court Seat Empty for More Than 350 Days
3607,2016-02-15T00:00:00Z,"Emmy Rossum is So Happy to Be Home, Despite the Dirt Floor"
3608,2016-02-15T16:21:39+0000,"South Carolina Church Bridges Racial Gap, but Not Political Divide"
3609,2016-02-15T16:09:32Z,"By Phone, James Dobson Tells South Carolinians Ted Cruz Is Only Alternative to Donald Trump"
3610,2016-02-15T16:06:40Z,"No Comment Necessary: Mitch McConnell on the Supreme Court, Then and Now"
3611,2016-02-15T15:50:03Z,Ads From Pro-Cruz Group Attacking Marco Rubio Are Pulled in South Carolina
3612,2016-02-15T15:47:59Z,Verbatim: Donald Trump on Dreamers
3613,2016-02-15T15:34:59Z,Donald Trump Calls Ted Cruz &#8216;Unstable&#8217; and &#8216;Dishonest&#8217;
3614,2016-02-15T00:00:00Z,Three’s a Trend: Reimagined Check
3615,2016-02-15T00:00:00Z,Opening Ceremony Sees the Future. And It Hovers.
3616,2016-02-15T15:02:12Z,Future Earns His Third Straight No. 1 With &#8216;EVOL&#8217;
3617,2016-02-15T00:00:00Z,Tommy Hilfiger: Fall 2016
3618,2016-02-15T00:00:00Z,The Corset: Back in Form
3619,2016-02-15T00:00:00Z,The Corset Comeback
3620,2016-02-15T14:15:23Z,The Author Pat Conroy Announces He Has Pancreatic Cancer
3621,2016-02-15T00:00:00Z,"A New, Bohemian Line — with Empowerment Built In"
3622,2016-02-15T14:13:18Z,"Ted Cruz Calls Donald Trump&#8217;s Sister, a Judge, an &#8216;Extremist&#8217;"
3623,2016-02-15T00:00:00Z,"Meet Dôen — a Breezy, Bohemian New Brand"
3624,2016-02-15T14:02:06Z,Pro-Jeb Bush Group Cancels Some Advertising in Super Tuesday States
3625,2016-02-15T00:00:00Z,"Your Daily Fashion Week Recap for Monday, Feb. 15"
3626,2016-02-15T00:00:00Z,Misha Nonoo and Opening Ceremony Party on Valentine’s Day
3627,2016-02-15T00:00:00Z,Misha Nonoo and Opening Ceremony Party on Valentine’s Day
3628,2016-02-15T13:00:19Z,Verbatim: John Kasich Suggests Changing Your College Major
3629,2016-02-15T00:00:00Z,Uptown — but Natural — Beauty at Carolina Herrera
3630,2016-02-15T00:00:00Z,Carolina Herrera: Fall 2016 RTW
3631,2016-02-15T12:15:02Z,Bard Music Festival Tackles the Puccini Paradox
3632,2016-02-15T12:00:40Z,The St. Petersburg Lottery
3633,2016-02-15T00:00:00Z,New York Fashion Week: Diane von Furstenberg and Prabal Gurung in Pictures
3634,2016-02-15T00:00:00Z,Hood by Air’s Shayne Oliver Returns to His American Roots
3635,2016-02-15T00:00:00Z,"At Victoria Beckham, Casual Corsets Meet Men’s Wear"
3636,2016-02-15T00:00:00Z,8 Recipes for the Week
3637,2016-02-15T11:06:29Z,Honolulu Biennial in 2017 to Spotlight Local and International Contemporary Artists
3638,2016-02-15T10:30:21Z,1966: Russia Rejects Foreign Outcry
3639,2016-02-15T00:00:00Z,"Johnny Lattner, Versatile Heisman-Winning Halfback With Notre Dame, Dies at 83"
3640,2016-02-15T00:00:00Z,Bernie Sanders and a First for Jews
3641,2016-02-15T09:57:47Z,Documentary on Migrants Wins Praise at Berlin Film Festival
3642,2016-02-15T09:46:23Z,Donald Trump Escalates Rhetoric Before South Carolina Primary
3643,2016-02-15T09:07:38Z,1941: British Parachutists Invade Italy
3644,2016-02-15T09:04:19Z,Oxford&#8217;s Halley Professor on How the Climate Challenge Could Derail a Brilliant Human Destiny
3645,2016-02-15T00:00:00Z,"Past Grammy Looks: The Good, the Bad and the Memorable"
3646,2016-02-15T07:34:05Z,Strong Dollar Blues
3647,2016-02-15T06:55:21Z,"From Black-and-White Negatives, a Positive View of Harlem"
3648,2016-02-15T00:00:00Z,Stick Insect Helps Scientists Study How Animals Move
3649,2016-02-15T06:00:01Z,ScienceTake | How the Stick Walks
3650,2016-02-15T00:00:00Z,In the Studio with Rag &amp; Bone
3651,2016-02-15T05:50:01Z,In The Studio | Rag and Bone
3652,2016-02-15T05:45:57Z,Doctor&#8217;s Orders: Stay in Bed and Do Nothing
3653,2016-02-15T05:45:02Z,"Support for Breast-Feeding, in a Multitude of Ways"
3654,2016-02-15T04:56:42Z,爱因斯坦的望远镜
3655,2016-02-15T03:31:26Z,"The Learning Network Is Taking a Winter Break, but We&#8217;ll Be Back on Feb. 22"
3656,2016-02-15T00:00:00Z,Don’t Privatize Air Traffic Control
3657,2016-02-15T03:20:16Z,Is Humanity Getting Better?
3658,2016-02-15T00:00:00Z,The Fire Meets the Wall
3659,2016-02-15T00:00:00Z,The Bison Roundup the Government Wants to Hide
3660,2016-02-15T00:00:00Z,Civility in Politics
3661,2016-02-15T00:00:00Z,Keep Congress’s Portraits
3662,2016-02-15T00:00:00Z,"O Yeah, Canada: The Border Republicans Forgot"
3663,2016-02-15T00:00:00Z,U.S. Aid for Abortions for Women With Zika
3664,2016-02-15T00:00:00Z,Obama May Meet Zika Head On in Cuba
3665,2016-02-15T00:00:00Z,What to Watch Monday
3666,2016-02-15T00:00:00Z,Quotation of the Day
3667,2016-02-15T00:00:00Z,"Corrections: February 15, 2016"
3668,2016-02-15T00:10:23Z,Hillary Clinton and Bernie Sanders Court Black Voters at Las Vegas Church
3669,2016-02-15T00:00:00Z,Chase Elliott Wins Daytona 500 Pole
3670,2016-02-15T00:00:00Z,Masahiro Tanaka Pitches on Mound
3671,2016-02-15T00:00:00Z,Roberta Vinci Triumphs in Russia
3672,2016-02-15T00:00:00Z,Kenyan Wins in Los Angeles Marathon
3673,2016-02-15T00:00:00Z,Peyton Manning Cited in Sexual-Assault Lawsuit
3674,2016-02-15T00:00:00Z,"Paid Notice: Deaths  WEINRIB, JEROME (JAY"
3675,2016-02-15T00:00:00Z,"Paid Notice: Deaths  FINK, SHERWIN ""ROCCO"""
3676,2016-02-15T00:00:00Z,"Paid Notice: Memorials  SOKOLOW, MEL"
3677,2016-02-15T00:00:00Z,"Paid Notice: Deaths  KALKSTEIN, GOLDIE B."
3678,2016-02-15T00:00:00Z,"Paid Notice: Deaths  CLARICK, DONALD E."
3679,2016-02-15T00:00:00Z,"Paid Notice: Deaths  HALSEY, GEORGE DAWSON"
3680,2016-02-15T00:00:00Z,"Paid Notice: Deaths  BOWDITCH, PHEBE ALEXANDER"
3681,2016-02-15T00:00:00Z,"Paid Notice: Deaths  BRACONI, FRANK"
3682,2016-02-15T00:00:00Z,"Paid Notice: Deaths  FIELD, JOSH"
3683,2016-02-15T00:00:00Z,"Paid Notice: Deaths  WEINRIB, JEROME"
3684,2016-02-15T00:00:00Z,"Paid Notice: Memorials  SCHULMAN KLOTZ, BRENDA FEB"
3685,2016-02-15T00:00:00Z,"Paid Notice: Deaths  KAUFMANN, PEGGY WEIL"
3686,2016-02-15T00:00:00Z,"Paid Notice: Deaths  PETERS, MARGERY ANTLE (NEE WATSON)"
3687,2016-02-15T00:00:00Z,"Paid Notice: Deaths  MENDELSON, DAVID"
3688,2016-02-15T00:00:00Z,"Paid Notice: Memorials  KROLL, ARTHUR H"
3689,2016-02-15T00:00:00Z,"Paid Notice: Deaths  WEINRIB, JEROME"
3690,2016-02-15T00:00:00Z,Rangers Lead With Their Fists in a Much-Needed Victory Over the Flyers
3691,2016-02-15T00:00:00Z,N.B.A. Game of the Week: Cavaliers at Thunder
3692,2016-02-15T00:00:00Z,New York Times Journalists Among Winners of 2015 Polk Awards
3693,2016-02-15T00:00:00Z,Players Who Start March Like Lions Often Go Out Like Lambs
3694,2016-02-15T00:00:00Z,Scalia’s Absence Is Likely to Alter Court’s Major Decisions This Term
3695,2016-02-15T00:00:00Z,Arsenal and Spurs Come Away Winners in Matchups of Top Four
3696,2016-02-15T00:00:00Z,Parade in Chinatown Raises Spirits During a Record Plunge in Temperature
3697,2016-02-15T00:00:00Z,"UConn Rolls, Though Only After Temple Threatens "
3698,2016-02-15T00:00:00Z,"With Death of Antonin Scalia, an Already Volatile Campaign Erupts"
3699,2016-02-15T00:00:00Z,"Warren Manzi, Author of New York’s Longest-Running Play, Dies at 60"
3700,2016-02-15T00:00:00Z,"Malawi Gets Its First Grammy Nomination, With Album by Prison Inmates"
3701,2016-02-15T00:00:00Z,Jeb Bush Adds a Weapon (His Brother) Despite Worries It Could Misfire
3702,2016-02-15T00:00:00Z,"Questions for the E.C.B. Leader, Fed Minutes and Walmart Earnings"
3703,2016-02-15T00:00:00Z,Brits Off Broadway Festival Announces Lineup
3704,2016-02-15T00:00:00Z,Trial Illuminates Porsches’ Rise to Power at Volkswagen
3705,2016-02-15T00:00:00Z,"Kobe Bryant, in His Final Lap, Is Happy to Surrender the Midseason Stage"
3706,2016-02-15T00:00:00Z,"In Mexican Slum, Pope Francis Laments Economic Gap"
3707,2016-02-15T00:00:00Z,"In Queens, Antonin Scalia Took Pride in Melting Pot and Confrontation"
3708,2016-02-15T00:00:00Z,Pilgrimage in Mexico Keeps a Cowboy Tradition Alive
3709,2016-02-15T00:00:00Z,"At United Pickle, Preserving the Standards of a Deli Staple"
3710,2016-02-15T00:00:00Z,New Report of U.S.-Made Cluster Bomb Use by Saudis in Yemen
3711,2016-02-15T00:00:00Z,Not Part of Video’s Script: An Arrest for Flying a Drone
3712,2016-02-15T00:00:00Z,"On the Move in New York, on Bicycles Built for More Than 2"
3713,2016-02-15T00:00:00Z,Brazil Pushes Public to Do Its Part in Fighting Zika Spread
3714,2016-02-15T00:00:00Z,Keith Kinkaid’s First Career Shutout Helps Devils Move Into Third Place
3715,2016-02-15T00:00:00Z,HSBC to Keep Headquarters in London Instead of Hong Kong
3716,2016-02-15T00:00:00Z,German Spurts From Fifth to First in Slalom in Japan
3717,2016-02-15T00:00:00Z,Zika Virus Increases Concerns About Employee Safety
3718,2016-02-15T00:00:00Z,Severe Contraction and Falling Prices in Japan Signal Tough Test for Abenomics
3719,2016-02-15T00:00:00Z,Revolution Is Absent From Runways
3720,2016-02-15T00:00:00Z,"Guns Blazing, Tombstone Is Back to Its Past"
3721,2016-02-15T00:00:00Z,Tombstone Survives on Spirit of the Wild West
3722,2016-02-15T00:00:00Z,"Jakob Denzinger, Suspected Nazi Prison Guard, Dies at 91"
3723,2016-02-15T00:00:00Z,Provisional President Elected in Haiti
3724,2016-02-15T00:00:00Z,New York Parking Alert: Alternate-Side Rules Suspended on Monday
3725,2016-02-15T00:00:00Z,"Esperanza Aguirre, an Official in Spain’s Governing Party, Quits Amid Corruption Claims"
3726,2016-02-15T00:00:00Z,"HomeAway, a Home Rental Service, Mocks the Competition"
3727,2016-02-15T00:00:00Z,A Leisurely Return for the New York State Legislature
3728,2016-02-15T00:00:00Z,The Lone Wolf at the Westminster Dog Show
