Date,author,content,number_of_likes,number_of_shares
2012-03-10 17:46:00,Twitter,Previewing tonight's debate between @BarackObama &amp; @MittRomney: http://t.co/j1mmleog. Follow the action at http://t.co/0jyFRgjq,154,282
2012-03-12 16:54:00,Twitter,Welcoming Pope Benedict XVI to Twitter. You can follow him here: @pontifex http://t.co/jHRHz2WT,660,1608
2012-03-21 17:21:00,Twitter,Celebrating all of you as we turn six. http://t.co/o23rmS2j,368,1489
2012-03-22 21:52:00,Twitter,RT @TwitterEng - We're hosting a Security Open House on March 29: http://t.co/xTcyTg0s,187,198
2012-04-05 17:08:00,Twitter,"How Twitter is shaping new ""water-cooler"" TV experiences: http://t.co/PxXeDWhh",130,169
2012-04-05 19:15:00,Twitter,Innovate through experimentation http://t.co/nHHIO4RX,155,193
2012-04-17 00:12:00,Twitter,Sunday night TV on Twitter http://t.co/qARpD8Or,145,160
2012-04-20 23:23:00,Twitter,Today's #OnlyOnTwitter - Photos across space and time: http://t.co/crhZ4Hit,199,214
2012-04-26 17:58:00,Twitter,"More to discover on iPhone and Android http://t.co/QZEiA1J4 Updates to discover, search and notifications",152,256
2012-04-26 21:43:00,Twitter,Our latest Hack Week fest focused on efficiency - and then there was Code Class. Check it! http://t.co/jp5DHhNw,139,188
2012-04-27 23:55:00,Twitter,"Latin Music's big night on Twitter, with nearly half a million Tweets for #Billboards2012: http://t.co/yZf076rw",154,236
2012-05-01 19:34:00,Twitter,"#protip Now you can embed a Tweet right on your WordPress blog, Posterous Space, or any website. Read more: https://t.co/WvDDXCMB",401,446
2012-05-01 20:25:00,Twitter,Let's Fly: Embeddable Tweets http://t.co/yQUeT8aE,245,354
2012-05-07 21:53:00,Twitter,Twitter is now available in Catalan &amp; Ukrainian: http://t.co/lJD7kwAs Gràcies and дякую to our translators.,313,1153
2012-05-09 04:07:00,Twitter,"At the #DNC2012, @MichelleObama's speech peaked at 28,003 TPM. Read more in our blog post: http://t.co/ekU0qhIx",199,600
2012-05-09 16:19:00,Twitter,Interact with more Tweets across the web with our new embedded timelines tool for websites http://t.co/fn8avma2,222,312
2012-05-10 18:36:00,Twitter,It's time for the @MLB #postseason. Don't miss a single pitch: http://t.co/h58L2ze9,133,171
2012-05-12 18:21:00,Twitter,The pulse of your city - Trends are now available in 100 more cities around the world. http://t.co/bckxh2zA,169,262
2012-05-14 19:02:00,Twitter,"Coming your way: The best of Twitter in your inbox, via our new email digest: http://t.co/rVsmHWkb",209,376
2012-05-17 14:41:00,Twitter,"The Federal Trade Commission's CTO, Ed Felten, just mentioned Twitter now supports Do Not Track. We applaud the FTC's leadership on DNT.",175,553
2012-05-17 22:46:00,Twitter,Please read our updated Terms of Service (https://t.co/MWdKesP9) &amp; Privacy Policy (https://t.co/3bcXG1Ku) - reflect current best practices.,355,632
2012-05-18 19:46:00,Twitter,Twitter and @NASCAR team up to put fans in the driver's seat: http://t.co/ZW8KIfVS,160,357
2012-05-21 23:39:00,Twitter,"Around the world, people shared their views of the #eclipse (#日食) on Twitter: http://t.co/P2tnlkEZ",222,406
2012-05-25 22:58:00,Twitter,"This week #OnlyOnTwitter, the President hosted a town hall http://t.co/hfyiXskp &amp; an author wrote a story http://t.co/5bQRt6DZ",102,134
2012-05-25 23:46:00,Twitter,"""With Twitter’s help, White House ‘bootstraps’ a new digital strategy""- http://t.co/vmTdoQRE - See also https://t.co/jNK4KrEi @TwBootstrap",207,232
2012-05-30 16:36:00,Twitter,Discover music on Twitter http://t.co/SybWPkLs,241,330
2012-06-01 17:41:00,Twitter,"Twitter, in your language http://t.co/fHRn5DV7",164,247
2012-06-02 03:43:00,Twitter,"In the final three minutes of the Super Bowl tonight, there were an average of 10,000 Tweets per second.",612,8541
2012-06-02 03:43:00,Twitter,"Madonna's performance during the Super Bowl's halftime show saw an average of 8,000 Tweets per second for five minutes.",594,5673
2012-06-02 04:31:00,Twitter,"The highest Tweets per second #SuperBowl peak came at the end of the game: 12,233. 2nd highest was during Madonna's performance: 10,245.",408,3307
2012-06-02 21:07:00,Twitter,Post-Bowl Twitter analysis http://t.co/OYYSRSew http://t.co/M0AtLQVd,338,578
2012-06-03 18:07:00,Twitter,"Twitter Now Available in Arabic, Farsi, Hebrew and Urdu. http://t.co/puV0dNYL",379,1293
2012-06-06 14:50:00,Twitter,"OTA recognizes Twitter for ""adoption of key technologies to help protect consumer privacy &amp; security"" @OTAlliance http://t.co/GLgwud3B",128,185
2012-06-06 16:04:00,Twitter,In flight: our new #Twitterbird http://t.co/8Aj759yc,302,1113
2012-06-07 19:19:00,Twitter,"Search is simpler with autocomplete, results from only people you follow and more http://t.co/vJAD3mt8",355,536
2012-06-09 04:31:00,Twitter,"Through day 2 of #DNC2012, 5.5million Tweets. President Clinton's speech peaked at 22,087 TPM. Read more: http://t.co/nADjSSix",163,494
2012-06-09 22:24:00,Twitter,Tune in and tweet in to the VMA's http://t.co/tEz5G080,95,172
2012-06-11 23:08:00,Twitter,Follow @gov to keep tabs on how #Election2012 plays out on @Twitter - the latest updates are there.,96,267
2012-06-13 20:37:00,Twitter,Experience more with expanded Tweets http://t.co/8gH7sqUE,302,509
2012-06-18 18:03:00,Twitter,"Now you can see a Tweet's total number of retweets and favorites, rather than ""50+"". An example from @keselowski: https://t.co/gi7qvz8Q.",281,743
2012-06-19 21:26:00,Twitter,A new way to experience profiles: with or without replies http://t.co/GUIilGkP,302,509
2012-06-21 23:35:00,Twitter,"We experienced some turbulence earlier today, and we apologize. Here is more information on what happened. http://t.co/cQLNmLs9",332,1785
2012-06-22 01:18:00,Twitter,"In this week's #OnlyOnTwitter, @KatyPerry invites her Twitter fans to a sneak peek of her movie: http://t.co/CHdLC38z",153,287
2012-06-22 16:42:00,Twitter,Want to see the best Tweets about #Euro2012 all in one place? We've got you covered. http://t.co/riNDcJZY,184,350
2012-06-26 13:11:00,Twitter,"We are working with Girls Who Code, a new program that will empower high school girls to pursue a career in technology. http://t.co/h0zbYNr8",348,1188
2012-06-30 05:59:00,Twitter,This week's #OnlyOnTwitter: Sports stars always shine. http://t.co/ygTDKUiY,134,197
2012-07-05 15:36:00,Twitter,Reading: New stories on power of Twitter in political campaigns: @adweek (http://t.co/Mje7dQRD) &amp; @AP (http://t.co/wTjyJuyN),115,189
2012-07-05 18:20:00,Twitter,A new standard for the mobile web http://t.co/orcSzIDu,261,576
2012-07-06 16:36:00,Twitter,Twitter &amp; @NASCAR are taking you to the Pocono 400 with http://t.co/0bLmhiUn. Read more: http://t.co/lHqQUIjl,137,213
2012-07-09 15:31:00,Twitter,"RT @TwitterStories: Daniel Jones, Peter Gregson &amp; Britten Sinfonia created music from Tweets. http://t.co/5bejkkXs #twitterstories",97,119
2012-07-09 16:29:00,Twitter,"RT @FCC: Honored to be doing live @Twitter chat Tues 9/11, 1:30pm ET/10:30am PT from @Twitter HQ. #AskJulius to send questions. Thx. Julius",71,73
2012-07-09 18:51:00,Twitter,"NY Fashion week is underway #nyfw. Here's our blog post http://t.co/jCfrjLa0 and a quick ""get started"" guide https://t.co/OkyH1HLE",93,163
2012-07-09 22:19:00,Twitter,The #VMA’s: A look back via Twitter http://t.co/ZBY8Q9l1,116,169
2012-07-09 22:51:00,Twitter,Hot off the press! Twitter buzz surrounding the #VMA's last night racked in nearly 15m Tweets!,167,287
2012-07-11 04:55:00,Twitter,"RT @gov Networks' call of @BarackObama reelection spiked #Election2012-related Tweets to 327,453 per minute at 11:19p EST.",218,578
2012-07-11 07:20:00,Twitter,"One hundred million votes and 31 million Tweets later, Election Day 2012 has come to a close: http://t.co/eKdONQtk",400,1280
2012-07-16 18:11:00,Twitter,More details in new Twitter for BlackBerry http://t.co/B9qrPtoP,268,314
2012-07-19 18:32:00,Twitter,¡Compruébelo! @Univision and @PremiosJuventud fans won't want to miss tonight's super show: http://t.co/VbvLVjHL,237,194
2012-07-26 20:58:00,Twitter,Our apologies for today's outage. http://t.co/CLL6s7Wi,323,1742
2012-07-27 02:09:00,Twitter,We've partnered with NBC to bring US fans closer than ever to the Olympic games. Visit http://t.co/3nZ0JOSy; read more http://t.co/1DChLWLR,212,429
2012-07-27 17:10:00,Twitter,Be a part of all the excitement leading up to the #Olympics Opening Ceremony with our new US event page: http://t.co/Xitbero2,196,447
2012-07-28 05:36:00,Twitter,Tonight's #onlyontwitter: The opening ceremony through the eyes of Olympians - http://t.co/kX8ZYObm,311,579
2012-07-31 00:34:00,Twitter,Now you can click on ticker symbols like $GE on http://t.co/coKFdEQL to see search results about stocks and companies,283,1147
2012-07-31 18:51:00,Twitter,Now you can connect your Twitter account to http://t.co/Q6IgFW5s to see your contacts' public profile info and latest Tweets beside emails.,357,1136
2012-07-31 19:53:00,Twitter,"Our approach to Trust &amp; Safety and private information: http://t.co/5WNSMLBb - ""We apologize for the part of this that we did mess up.""",201,621
2012-08-11 00:37:00,Twitter,Have you checked Discover lately? A new notification at the top of your stream shows when new Tweets are available. http://t.co/dL2NYafx,410,454
2012-08-11 02:31:00,Twitter,"RT @TwitterEng: Bolstering our infrastructure. ""As  usage patterns change, Twitter can remain resilient."" http://t.co/uML86B6s",151,217
2012-08-13 01:57:00,Twitter,There were more than 150 million Tweets about the Olympics. What did they talk about? Read our #Olympics recap: http://t.co/MgTKRgOi,335,963
2012-08-14 01:49:00,Twitter,The Twitter Political Index details the rise (and the end) of the #veepstakes over the past few days: http://t.co/Uh8rbtqq via @gov,164,198
2012-08-21 00:44:00,Twitter,Bootstrap 2.1 and counting http://t.co/kitCO7mI,150,218
2012-08-21 00:45:00,Twitter,"We mark the first year of Bootstrap, and introduce the newest version, Bootstrap 2.1: http://t.co/kitCO7mI",203,333
2012-08-29 04:04:00,Twitter,The results are in: @AnnDRomney had the biggest spike in conversation of the night. More #GOP2012 highlights here: http://t.co/ePd3q22V,125,325
2012-08-29 14:58:00,Twitter,Have you recovered from the Olympics? Good. Now join us for more awesome feats at the @Paralympic Games: http://t.co/AcoWdjfe,101,202
2012-08-29 17:16:00,Twitter,Introducing the Twitter Certified Products Program: Tools for businesses http://t.co/8bac4YYb,176,221
2012-08-29 21:05:00,Twitter,Thanks to @Herdict for making it easier for orgs to keep an eye on site accessibility &amp; other web blockages: http://t.co/KgleLWCs,103,97
2012-08-30 03:43:00,Twitter,Second night at the #GOP2012 convention. @PaulRyanVP drove the top 3 Tweets per minute peaks of the night. More here: http://t.co/7hVLxTzr,110,179
2012-08-30 19:36:00,Twitter,Talking Twitter at the #GOP2012 convention. Here's @BuzzFeedBen on using Twitter to cover the election: http://t.co/uTwTwPip,83,112
2012-08-30 21:51:00,Twitter,"More Talking Twitter at #GOP2012 convention, now with @BretBaier on using Twitter to cover the campaign: http://t.co/uG6BrzCw",103,128
2012-08-31 04:10:00,Twitter,It's the end of the road in Tampa. @MittRomney's speech had the biggest Twitter spikes of the #GOP2012 convention. http://t.co/qD5OyWXC,132,228
2012-08-31 23:39:00,Twitter,We remember the first man on the moon: http://t.co/Xndp8zxs Our video tribute: http://t.co/AOK85fZ4,392,686
2012-09-01 18:12:00,Twitter,Last night @TimTebow lead the @Denver_Broncos to an overtime playoff win and a new sports Tweets per second record: 9420,534,6843
2012-09-02 21:07:00,Twitter,Twitter SMS: Now available for satellite providers http://t.co/yInwtiir,143,308
2012-09-07 14:30:00,Twitter,"If working for Twitter in Europe is an appealing idea, follow @JoinTheFlockEU for news &amp; updates on our European openings. #jointheflock",220,280
2012-09-08 21:36:00,Twitter,"Record alert! @usainbolt sets a new Olympic Games conversation record with over 80,000 TPM for his 200m victory. #Olympics",297,2077
2012-09-11 16:16:00,Twitter,Here's our new cartoon video on how to dress up your profile with photos and images: http://t.co/myCE73mK Give it a go!,470,585
2012-09-14 22:22:00,Twitter,#OnlyOnTwitter: Experience life in the tents at Fashion Week http://t.co/6PFpQE6Y #NYFW,115,138
2012-09-18 11:45:00,Twitter,Good morning! @dickc is getting ready to talk Twitter on the @todayshow in the next few minutes. Time to change the channel to NBC.,115,168
2012-09-18 12:29:00,Twitter,"New Twitter profiles, because you have more to show http://t.co/IOvgCQzY",589,2574
2012-09-18 12:30:00,Twitter,Picture what’s happening with updated apps for iPhone and Android http://t.co/6JVzb4R2,214,460
2012-09-18 12:30:00,Twitter,Expand your experience with the all new Twitter for iPad http://t.co/lLpr8jAP,195,484
2012-09-18 12:35:00,Twitter,"Picture this: new profiles and photo streams in updated apps for iPad, iPhone, Android. https://t.co/qy3WxNmG",239,722
2012-09-21 20:37:00,Twitter,Check out our one-stop-shop for everything Emmys + Twitter! http://t.co/uBhqiP2j,99,116
2012-09-21 23:09:00,Twitter,Our Tokyo team launched Lifeline to help Japanese users find critical information during moments of crisis http://t.co/VkMFQ455,200,308
2012-09-25 18:43:00,Twitter,"You know how last night's @NFL game ended. Now, here's how it played out on Twitter... http://t.co/kg3KakTD",130,261
2012-09-25 20:50:00,Twitter,Check your inbox for a new weekly email that makes it easier to connect with people you may know on Twitter http://t.co/ZNUaR0zp,165,184
2012-09-26 22:37:00,Twitter,Guest post today by @essraabbas on her @TechWomen mentoring experience with us. We love @TechWomen and Essraa!,134,142
2012-09-28 17:12:00,Twitter,More Tweets to discover... in the Discover tab on http://t.co/coKFdEQL. http://t.co/6OfRxQeW,153,228
2012-10-07 18:45:00,Twitter,"Expansive experiences in updated iPhone, Android apps http://t.co/b0n4ffHX Featuring expanded Tweets, events, improved notifications, more",251,448
2012-10-07 18:47:00,Twitter,"You can download the latest Twitter mobile apps for iPhone, Android today https://t.co/qy3WxNmG",277,765
2012-10-09 21:54:00,Twitter,One fan tweets her way to TV on CBS' Late Late Show http://t.co/CBoCep4U,173,190
2012-10-10 15:54:00,Twitter,"TweetDeck has a new look! Try out the light theme and more in our updated web, Chrome, Mac and Windows apps http://t.co/fCAsIcTw",151,333
2012-10-10 18:02:00,Twitter,"Want to hang out with TV's funniest family? Stars, producers &amp; crew from @ModernFam will be live-tweeting tonight! http://t.co/ARIqRXqx",94,122
2012-10-10 20:58:00,Twitter,You can upgrade to the new Twitter for BlackBerry to see expanded Tweets with photos and article summaries http://t.co/Eg0SMvQj,116,254
2012-10-12 18:58:00,Twitter,New profiles for all! Everyone will be switched to the new profiles on December 12. Make yours awesome today. http://t.co/EtGpBTDs,403,1179
2012-10-12 23:16:00,Twitter,"Twitter for iPhone and Android let you filter and edit photos right from the app. ""Twitter photos: Put a filter on it"" http://t.co/iNkIkZBD.",471,1608
2012-10-16 15:18:00,Twitter,Tune in to tonight's presidential town hall debate; tune in to Twitter every day to get closer to the candidates http://t.co/uOl7hqV0,146,214
2012-10-18 18:15:00,Twitter,Twitter + the Human Face of Big Data: http://t.co/HlpWw7rV @faceofbigdata #HFOBD / #BigDataChat 11am PT/2pm ET Friday 10/19 w/@isaach,111,151
2012-10-18 20:30:00,Twitter,Announcing the Twitter Fiction Festival: http://t.co/uYYJy64v http://t.co/t8owygQx,681,726
2012-10-22 21:43:00,Twitter,What's happening this week on Twitter? Find out here: http://t.co/1rWqqQcR.,115,162
2012-10-23 03:30:00,Twitter,The final debate generated 6.5 million Tweets tonight. More stats on the Twitter Blog here: http://t.co/U5nBsV4U #debates,172,628
2012-10-24 20:26:00,Twitter,"From A-Rod to #RallyZito, 15 million @MLB #postseason Tweets. Who's the most-discussed player? Read more: http://t.co/XrCUGniK",96,124
2012-10-25 20:02:00,Twitter,"More interactive Tweets, in more than 2000 ways -- including examples from @Amazon, @Fandango, @Crowdmap and more http://t.co/3fc3wkyG",199,230
2012-10-29 17:43:00,Twitter,Live tweet with your fav TV casts and more this week on Twitter. Check it out: http://t.co/KYPSMhed,96,123
2012-10-29 20:10:00,Twitter,Here's our roundup of Twitter resources for coping with Hurricane #Sandy: http://t.co/pBwzA5xk,171,497
2012-10-30 20:20:00,Twitter,#NBA is back! Did you know 90% of players are on Twitter? Find &amp; follow them here: http://t.co/peZ1ng5S. Read more: http://t.co/RNlLwWnR,141,308
2012-11-06 16:02:00,Twitter,Our new nest. http://t.co/6Ugo6xbA,179,282
2012-11-07 19:45:00,Twitter,Overhauling http://t.co/yQZMxUDC from the ground up http://t.co/odFsVNBz,291,349
2012-11-09 18:51:00,Twitter,RT @Colin_Crowell Here's @FCC Chairman Julius Genachowski with @DickC here at #Twitter HQ. #AskJulius cc @gov http://t.co/IsnQ0h7C,96,113
2012-11-09 23:52:00,Twitter,Check out Twitter stats and more from #NFL Week 1: http://t.co/o8UX3kNp,134,179
2012-11-12 13:12:00,Twitter,Introducing the Year on Twitter: explore the moments and people who made this year on Twitter unique http://t.co/bUOrkoic,338,596
2012-11-12 14:00:00,Twitter,Want to see what your own Year on Twitter looked like? @Vizify will show you: https://t.co/vhbOHtcG,526,544
2012-11-12 15:20:00,Twitter,Hey West Coast Americans! Tune into @GMA at 8 a.m. PT to see them discuss the Year on Twitter: http://t.co/xkOgh4yN,110,188
2012-11-12 19:19:00,Twitter,Our end of the year surprise for you—see the best of http://t.co/BQAvqnKF and your personal year of Tweets visualized http://t.co/2zS6x1gw,378,542
2012-11-15 22:46:00,Twitter,Sharing Tweets just got easier! http://t.co/xrENLANl Starting today you can email Tweets to anyone from http://t.co/coKFdEQL,212,413
2012-11-15 22:56:00,Twitter,Sharing Tweets just got easier - now you can email a Tweet directly from http://t.co/coKFdEQL:  http://t.co/xrENLANl,287,497
2012-11-15 23:25:00,Twitter,"See even more on iPhone and Android with photo, video, and article previews in search and Discover http://t.co/YnEE2JVW.",118,210
2012-11-15 23:28:00,Twitter,See more when you search: photos and videos are front and center in results on http://t.co/coKFdEQL and mobile apps http://t.co/LRI89JS9.,138,202
2012-11-15 23:37:00,Twitter,"A deeper dive into the Discover changes, via our @twittereng blog http://t.co/yOg88fQC",140,174
2012-11-16 01:32:00,Twitter,"Welcome, @PeterChernin, to Twitter's board.",190,289
2012-11-21 15:23:00,Twitter,Giving and receiving thanks: Twitter is a useful tool for discovering more ways to give back. http://t.co/cs0K44O7,235,428
2012-11-27 19:08:00,Twitter,The Twitter Fiction Festival begins tomorrow: http://t.co/uA8t42fm. Everyone can participate! Tell your story with #twitterfiction.,252,686
2012-12-06 16:49:00,Twitter,Tailored Trends bring you closer http://t.co/ppv0hqF2,169,279
2012-12-07 16:14:00,Twitter,Introducing Twitter for Nokia http://t.co/nKDjHHGr,357,607
2012-12-10 04:41:00,Twitter,Recapping tonight's VP debate: http://t.co/GG8tOa6j,177,249
2012-12-11 01:37:00,Twitter,Celebrate the Festival of Lights! Share your pictures using #Diwali and #MyLights: http://t.co/qnp1D70X,223,571
2012-12-12 19:39:00,Twitter,#OnlyOnTwitter: A Q&amp;A with @Pontifex http://t.co/iHzE3HmB,149,234
2012-12-13 17:32:00,Twitter,Several @twittereng folks teamed up with @UCBerkeley for a course about analyzing big data: @UCBTweeter. http://t.co/5SUkxQJr,177,256
2012-12-17 17:34:00,Twitter,"Coming soon: The Nielsen Twitter TV Rating, an industry-standard metric based  on Twitter data. http://t.co/q3FTvNx2",242,620
2012-12-18 15:01:00,Twitter,There are now more than 200M monthly active @twitter users. You are the pulse of the planet. We're grateful for your ongoing support!,1107,3769
2012-12-18 17:16:00,Twitter,BlackBerry users! Now see all the interactions in your network with the Twitter for BlackBerry 4.0 update. Get it: http://t.co/uu8wfJ2P,213,551
2012-12-18 18:53:00,Twitter,"When the biggest names in music tweet each other, #TheWorldIsListening. Artist Q&amp;As brought to you by @TheGrammys:  http://t.co/AkSIRR2x",144,251
2012-12-19 15:29:00,Twitter,Your Twitter archive is being gradually rolled out to users. Learn more about how to revisit your old Tweets here: http://t.co/ONhrS4ix,1682,2420
2012-12-26 00:22:00,Twitter,Classic #onlyontwitter: Lucky flag football players in OKC found a surprise addition to the team. https://t.co/RqsUgncc,205,1187
2012-12-31 18:51:00,Twitter,What are your New Year's resolutions? Here are a few suggestions. Your job: sticking to them. http://t.co/1FggYZzR,195,324
2012-12-31 22:20:00,Twitter,"We review the year of Twitter news &amp; info, and what you were most interested in hearing from us in 2012. http://t.co/WKzle6nx",250,373
2013-01-02 23:57:00,Twitter,Keeping our users secure: http://t.co/sbeefn0V,687,2537
2013-01-04 04:15:00,Twitter,Trd th nw Twttr yt? Mr tm fr mr twts! http://t.co/p1T0m97bnI #nvwls https://t.co/D4bU6kfz8G,508,1763
2013-01-04 22:56:00,Twitter,"It's Hack Week at Twitter. Learn more about what this week, which takes place each quarter, is all about: http://t.co/3jEGRrHCob",221,429
2013-01-05 17:56:00,Twitter,Updates to iOS &amp; Android apps: See Trends from all over the world or choose to have Trends tailored to your interests.,455,785
2013-01-08 17:56:00,Twitter,"The latest Twitter for Windows 8 now supports multiple accounts, lists + more. Get the update: http://t.co/CHZQdBACgu",240,570
2013-01-08 19:32:00,Twitter,Search update on http://t.co/eNvqKTup1d: See photos &amp; accounts in results + recent searches &amp; social context as you type your query.,297,628
2013-01-11 17:37:00,Twitter,"Thanks, @Bing! We think it's great that people can tap directly into @twitter from @Bing to get up-to-the-minute information.",280,424
2013-01-15 17:00:00,Twitter,Already getting excited for the Oscars? Check out the new Twitter Oscars Index at http://t.co/AukSvgdL. Read more:  http://t.co/PhGWIwh6,220,364
2013-01-22 17:57:00,Twitter,"An update to embedded Tweets: See more content and context; Tweets load faster; and, you can embed more easily. http://t.co/Wl5OpH98",252,414
2013-01-24 16:13:00,Twitter,Announcing Vine: A new way to share video. http://t.co/As4ol0Jb,626,1951
2013-01-28 15:37:00,Twitter,Just launched http://t.co/Wz1FiuLw with new data about government requests. Read more: http://t.co/31pBFB6a. #TTR #DataPrivacyDay,410,1891
2013-01-30 20:16:00,Twitter,Check out our newest update to photos and videos http://t.co/ZU5h3aK4,235,399
2013-02-01 01:39:00,Twitter,Happy New Year! See the spikes in Tweets per second as people celebrated around the world: http://t.co/h1xvisAP,441,772
2013-02-08 23:38:00,Twitter,"What time is it? Why, it's time to dive into #SharkWeek! https://t.co/xDSGQhpV4i",259,456
2013-02-19 23:18:00,Twitter,A friendly reminder about password security. http://t.co/ubqk3JD2,363,880
2013-02-21 17:07:00,Twitter,Giving you more confidence that email from http://t.co/SlNTFacp9A is real: http://t.co/n6ZTV4VGQE,226,394
2013-02-26 01:39:00,Twitter,Twitter will be available in the Firefox Marketplace when Firefox OS devices ship. http://t.co/KZ0xXTREB0,212,518
2013-02-26 16:58:00,Twitter,"An update to Twitter for Windows Phone -- now with the Home, Discover, Connect and Me tabs, Live tiles, and more. http://t.co/VvD3wKN2GE",272,758
2013-02-28 18:09:00,Twitter,Want to help make a fan-made Rockumentary? @FeedTheBeat has you covered. Check it out! - http://t.co/jEEdPWrUSi,199,292
2013-03-04 18:35:00,Twitter,"Twitter for Android has a new design. Plus, see more content in expanded Tweets on mobile and http://t.co/mIbPaWDIYL. http://t.co/m5LB3e375h",523,1451
2013-03-07 17:06:00,Twitter,We're testing ways to make ads more useful for you. Check our short Privacy Policy update (https://t.co/ER2YmKhhmS &gt; Third Parties).,225,481
2013-03-10 14:50:00,Twitter,We tested live-tweeting with @MLB to see if teams could boost follower engagement and their Twitter audience: https://t.co/XPhHmVDNxJ,305,527
2013-03-10 21:05:00,Twitter,Our S-1 will be filed publicly with the SEC momentarily. This Tweet does not constitute an offer of any securities for sale.,802,2147
2013-03-13 18:12:00,Twitter,"Guess what you can do
View line breaks on Twitter web
Let the fun begin.",464,1320
2013-03-13 19:45:00,Twitter,We've revamped our Ads Center: http://t.co/YhOWR4ldnW Better reporting tools and real-time management. via @TwitterAds,143,260
2013-03-14 18:47:00,Twitter,Yesterday we introduced a new app: Twitter for Windows 8. See it in action: http://t.co/Bjlrak7Zjz,305,643
2013-03-21 18:24:00,Twitter,"We're happy to celebrate #Twitter7 with you, and because of you. http://t.co/1O7iq0FMz8 #thankyou",628,1817
2013-03-21 23:07:00,Twitter,"Twitter archive adds Danish, Filipino, Indonesian, Italian, Japanese, Portuguese, Russian, Simplified Chinese, Swedish, Thai, Turkish, Urdu",510,1387
2013-04-02 06:02:00,Twitter,24.1 million Tweets during #SB47; 5.5 million of that during @Beyonce's show. Read all about the highlights:  http://t.co/VjWDxDeM,617,2051
2013-04-03 17:22:00,Twitter,"Reading @dkroy in @HarvardBiz: ""Television's Future has a Social Soundtrack"" http://t.co/yb3SEQNKPp",162,285
2013-04-07 04:08:00,Twitter,"Celebrating the Fourth, as we hope you are. https://t.co/9F1JAJmNEC - enjoy the holiday!",295,580
2013-04-17 17:17:00,Twitter,"A warm welcome to the President of Indonesia, @SBYudhoyono, to Twitter. Thank you for your participation in citizen conversations.",952,4313
2013-04-25 17:27:00,Twitter,"We've updated Twitter for Mac with an easier way to share photos, retina display support, and more languages: http://t.co/mn4RkcpaPf",412,992
2013-05-06 23:22:00,Twitter,We're honored to be named to the @otalliance Honor Roll for online trustworthiness. http://t.co/Mxo75DjA7W,246,431
